journal_id,asset,analysis_timestamp,signal,mode,probability,model_probability,realtime_confidence,leverage,entry_price,stop_loss,take_profit_1,take_profit_2,risk_reward,initial_risk_abs,spot_price,spot_timestamp,spot_latency_seconds,precision_score,anchor_bias,probability_source,notes,validation_outcome,validation_rr,max_favorable_excursion,max_adverse_excursion,time_to_outcome_minutes,slippage,execution_latency_ms
ca58df8e-599a-4135-a501-15b6528d0904,XAGUSD,2026-03-13T03:46:22Z,no entry,core,16,,0.9999999999999999,20.0,,,,,,,84.56504,2026-03-13T03:45:56Z,26,,,rule,"Intraday bias gate feltételek hiányosak — Micro BOS long  ATR (ezüst): 1m micro BOS long | Micro BOS short  ATR (ezüst): 1m micro BOS short; Bias neutrálsávban; Regime filter inaktív; ATR erősség 1.06× küszöb (+11.4); Fib zóna konfluencia (0.618–0.886) (+18.0); Order flow neutrális (−4.2); P-Score reduced by 4.0 due to regime CHOPPY; XAGUSD: visszafogott ATR — RR cél 1:1.7-re emelve; XAGUSD breakout-védelem: gyors BE + 20% giveback limit expanziós szakaszban; XAGUSD: ATR-alapú pozícióskálázás ×0.70; Regime kapu: CHOPPY miatt −10 P-score, pozícióskálázás csökkentve; Strukturális soft gate: 1/3 jel + ATR/spread OK (−6 P-score, size ×0.70); Strukturális kapu lazítva: momentum erős, BOS hiány engedve; Liquidity gate skipped (no volume proxy available); missing: P_score>=28",,,,,,,
dc49b6ce-01aa-4972-9334-c63c24fd0260,EURUSD,2026-03-13T03:46:22Z,no entry,core,23,,0.9999999999999999,30.0,,,,,,,1.1508,2026-03-13T03:45:56Z,26,,,rule,"Mean reversion bias override (+19.5); Regime filter inaktív; 5M BOS trendirányba (+16.0); ATR nincs rendben (relatív vagy abszolút küszöb); Alacsony realised vol → magasabb RR igény; Ár az intraday range alsó zónájában (+4.0); Range expanzió támogatja a momentumot (+3.0); Order flow neutrális (−3.6); P-Score reduced by 4.0 due to regime CHOPPY; EURUSD: ATR(1h) alacsony — P-score küszöb +6 pontra emelve; EURUSD: Visszafogott ATR — célok szűkítve, kockázat kontroll alatt; EURUSD BOS aktív, de VWAP alatt — türelem; OFI z-score 1.52 támogatja az irányt; ATR-floor override: rel_atr 0.0002 < 0.0006 → adaptív RR/TP küszöb; Regime kapu: CHOPPY miatt −10 P-score, pozícióskálázás csökkentve; ATR soft gate: alacsony volatilitás −5 P-score, méret felezve; Strukturális kapu lazítva: momentum erős, BOS hiány engedve; Liquidity gate skipped (no volume proxy available); missing: P_score>=44, precision_score>=55",,,,,,,
d34662c7-e474-47c0-a5ff-508f6b8c6b0e,GOLD_CFD,2026-03-13T03:46:22Z,no entry,core,0,,0.9999999999999999,20.0,5109.21988,5114.012615714285,5099.634408571428,5094.841672857143,2.0000000000001896,,5111.33082,2026-03-13T03:45:56Z,26,,,rule,"Intraday bias gate feltételek hiányosak — 5m retest long  ATR: 5m retest long, ATR gate | 5m retest short  ATR: 5m retest short, ATR gate; Bias neutrálsávban; Regime filter inaktív; ATR nincs rendben (relatív vagy abszolút küszöb); Alacsony realised vol → magasabb RR igény; Range expanzió támogatja a momentumot (+3.0); Fib zóna konfluencia (0.618–0.886) (+18.0); Order flow neutrális (−4.6); P-Score reduced by 4.0 due to regime CHOPPY; ATR-floor override: rel_atr 0.0008 < 0.0025 → adaptív RR/TP küszöb; Regime kapu: CHOPPY miatt −10 P-score, pozícióskálázás csökkentve; ATR soft gate: alacsony volatilitás −5 P-score, méret felezve; Strukturális kapu lazítva: momentum erős, BOS hiány engedve; Liquidity gate skipped (no volume proxy available); missing: P_score>=30; Pozíciómenedzsment: aktív short pozíció (opened_at: 2026-03-13T03:41:13Z, Entry: 5109.21988, SL: 5114.012615714285, TP2: 5094.841672857143)",,,,,,,
240abde9-05b8-446f-9f40-794aa5c12d14,BTCUSD,2026-03-13T03:46:22Z,precision_arming,core,61,,0.9999999999999999,2.0,71249.98,71429.09028571428,70891.75942857143,70712.64914285713,2.0,,71152.6,2026-03-13T03:45:56Z,26,,,rule,"Bias override: Intraday 5m BOS short  ATR (+19.5); Regime filter inaktív; HTF sweep ok (+10.0); 5M BOS trendirányba (+16.0); ATR erősség 1.22× küszöb (+12.3); Range expanzió támogatja a momentumot (+3.0); Fib zóna konfluencia (0.618–0.886) (+18.0); Order flow neutrális (−4.6); Order flow ellentétes irányba tolódik (−4); OFI toxikus short irányra (−6.2); P-Score reduced by 4.0 due to regime CHOPPY; Mesterlövész mód: P-score minimum 35 érvényesítve; Regime kapu: CHOPPY miatt −10 P-score, pozícióskálázás csökkentve; Strukturális kapu lazítva: momentum erős, BOS hiány engedve; BTC ATR1h stop igazítás: kockázat ×1.15; Precision trigger kész → limit figyelés; Precision limit belépő parkolva 20 percig; Pozíciómenedzsment: aktív short pozíció (opened_at: 2026-03-13T02:51:01Z, Entry: 71249.98, SL: 71429.09028571428, TP2: 70712.64914285713)",,,,,,,
8905f380-d5f7-4d7b-843c-ca218c9dace8,USOIL,2026-03-13T03:46:23Z,no entry,core_only,37,,1.0,20.0,93.33592,91.74998774285714,98.09371677142856,98.09371677142856,2.4,,95.30299,2026-03-13T03:45:56Z,27,,,rule,"Bias(4H→1H)=long (+15.0); EMA21 slope 1.51× küszöb (+15.0); ATR nincs rendben (relatív vagy abszolút küszöb); Fib zóna konfluencia (0.618–0.886) (+18.0); Order flow neutrális (−4.8); OFI toxikus long irányra (−8.0); USOIL: parabolikus lendület — RR cél 1:1.4 környékére szűkítve; USOIL: ázsiai sáv — pozícióméret ×0.70; ATR soft gate: alacsony volatilitás −5 P-score, méret felezve; USOIL stop lazítás: ATR1h alapú kockázat ×0.92; Diagnosztika: k1m: utolsó zárt gyertya 11 perc késésben van; Diagnosztika: k1m: jelzés korlátozva 11 perc késés miatt; Diagnosztika: k5m: utolsó zárt gyertya 11 perc késésben van; Pozíciómenedzsment: aktív long pozíció (opened_at: 2026-03-12T13:51:36Z, Entry: 93.33592, SL: 91.74998774285714, TP2: 98.09371677142856)",,,,,,,
