journal_id,asset,analysis_timestamp,signal,mode,probability,model_probability,realtime_confidence,leverage,entry_price,stop_loss,take_profit_1,take_profit_2,risk_reward,initial_risk_abs,spot_price,spot_timestamp,spot_latency_seconds,precision_score,anchor_bias,probability_source,notes,validation_outcome,validation_rr,max_favorable_excursion,max_adverse_excursion,time_to_outcome_minutes,slippage,execution_latency_ms
713d6731-c070-4321-b591-3439336bae3f,XAGUSD,2026-01-15T17:41:46Z,precision_arming,core,45,,1.0,20.0,,,,,,,91.64898,2026-01-15T17:41:21Z,24,,,rule,"Bias(4H→1H)=long (+15.0); Regime filter inaktív; 5M BOS trendirányba (+16.0); ATR erősség 1.24× küszöb (+12.4); Intraday range felső harmada telített (−7.0); Range expanzió támogatja a momentumot (+3.0); XAG momentum override — stop tágítva erős trendnél; XAGUSD: momentum override — stop távolság 1.3×ATR-re tágítva; Fib zóna konfluencia (0.618–0.886) (+18.0); Order flow neutrális (−3.7); P-Score reduced by 4.0 due to regime CHOPPY; XAGUSD: momentum kitörés — RR cél 1:1.45-re szűkítve; XAG momentum override — pozícióméret csökkentve; XAGUSD: ATR-alapú pozícióskálázás ×0.55; XAG: VWAP alatt — long setup türelmet igényel; Regime kapu: CHOPPY miatt −10 P-score, pozícióskálázás csökkentve; Strukturális soft gate: 1/3 jel + ATR/spread OK (−6 P-score, size ×0.70); Strukturális kapu lazítva: momentum erős, BOS hiány engedve; Liquidity gate skipped (no volume proxy available); Precision trigger kész → limit figyelés; Precision limit belépő parkolva 20 percig",,,,,,,
f0a559be-e24d-40c1-8907-9df43b0f2601,NVDA,2026-01-15T17:41:45Z,no entry,core,45,,1.0,5.0,188.38,190.2638,184.98915999999997,183.29373999999999,2.7,,188.38,2026-01-15T17:41:21Z,24,,,rule,"Bias override: Intraday 5m BOS short  ATR (momentum nélkül) (+19.5); Regime filter inaktív; 5M BOS trendirányba (+16.0); ATR erősség 0.97× küszöb (+10.8); Ár az intraday range felső zónájában (+4.0); Range expanzió támogatja a momentumot (+3.0); Order flow neutrális (−3.8); P-Score reduced by 4.0 due to regime CHOPPY; P-Score reduced by 1.2 due to ATR Soft Gate tolerance; NVDA: magas napi ATR + momentum — P-score küszöb lazítva; NVDA momentum override — napi ATR támogatja a likviditási lazítást; Regime kapu: CHOPPY miatt −10 P-score, pozícióskálázás csökkentve; Likviditási kapu lazítva erős momentum miatt; NVDA stop igazítás: kockázat ×0.90 ATR; missing: precision_flow_alignment",,,,,,,
917ae256-d445-4f31-88ee-2a25f2e2a333,EURUSD,2026-01-15T17:41:46Z,no entry,core,52,,1.0,30.0,1.16118,1.1727918000000002,1.1379564,1.1263446,3.0,,1.16118,2026-01-15T17:41:21Z,24,,,rule,"Bias(4H→1H)=short (+15.0); Regime filter inaktív; 5M BOS trendirányba (+16.0); ATR erősség 1.30× küszöb (+12.8); Alacsony realised vol → magasabb RR igény; Range expanzió támogatja a momentumot (+3.0); Fib zóna konfluencia (0.618–0.886) (+18.0); Order flow neutrális (−4.2); P-Score reduced by 4.0 due to regime CHOPPY; EURUSD: ATR(1h) alacsony — P-score küszöb +6 pontra emelve; EURUSD: Visszafogott ATR — célok szűkítve, kockázat kontroll alatt; EURUSD BOS aktív, de VWAP felett — várakozás; ATR-floor override: rel_atr 0.0002 < 0.0006 → adaptív RR/TP küszöb; Regime kapu: CHOPPY miatt −10 P-score, pozícióskálázás csökkentve; Strukturális soft gate: 1/3 jel + ATR/spread OK (−6 P-score, size ×0.70); Strukturális kapu lazítva: momentum erős, BOS hiány engedve; Liquidity gate skipped (no volume proxy available); missing: precision_flow_alignment",,,,,,,
d6f2ecbf-f562-4a42-bf78-0abe855f327d,GOLD_CFD,2026-01-15T17:41:46Z,precision_arming,core,32,,1.0,20.0,,,,,,,4615.67319,2026-01-15T17:41:21Z,24,,,rule,"Bias(4H→1H)=long (+15.0); Regime filter inaktív; 5M BOS trendirányba (+16.0); ATR nincs rendben (relatív vagy abszolút küszöb); Alacsony realised vol → magasabb RR igény; Range expanzió támogatja a momentumot (+3.0); Fib zóna konfluencia (0.618–0.886) (+18.0); Order flow neutrális (−4.4); P-Score reduced by 4.0 due to regime CHOPPY; ATR-floor override: rel_atr 0.0006 < 0.0025 → adaptív RR/TP küszöb; Regime kapu: CHOPPY miatt −10 P-score, pozícióskálázás csökkentve; ATR soft gate: alacsony volatilitás −5 P-score, méret felezve; Strukturális kapu lazítva: momentum erős, BOS hiány engedve; Liquidity gate skipped (no volume proxy available); GOLD stop lazítás: ATR alapú kockázat ×2.00; Precision trigger kész → limit figyelés; Precision limit belépő parkolva 20 percig",,,,,,,
2d5034e5-f338-4f9a-9563-f09a447fb44c,USOIL,2026-01-15T17:41:46Z,no entry,core,18,,1.0,20.0,,,,,,,58.96,2026-01-15T17:41:21Z,25,,,rule,"Bias(4H→1H)=long (+15.0); Regime filter inaktív; 5M BOS trendirányba (+16.0); ATR nincs rendben (relatív vagy abszolút küszöb); Ár az intraday range alsó zónájában (+4.0); Range expanzió támogatja a momentumot (+3.0); USOIL: erős momentum — invalid zóna 2.5×ATR(1h)-re tágítva; Order flow neutrális (−4.3); P-Score reduced by 4.0 due to regime CHOPPY; USOIL: 1h ATR <1 USD — P-score küszöb emelve a zajos sáv miatt; USOIL: csökkenő volatilitás — RR cél 1:1.5-re igazítva; USOIL: US nyitás — pozícióméret ×0.75; USOIL: oldalazó szerkezet — 1h BOS nélkül nincs belépő; Regime kapu: CHOPPY miatt −10 P-score, pozícióskálázás csökkentve; ATR soft gate: alacsony volatilitás −5 P-score, méret felezve; Strukturális kapu lazítva: momentum erős, BOS hiány engedve; Liquidity gate skipped (no volume proxy available); missing: P_score>=27, precision_flow_alignment",,,,,,,
00071127-51db-4358-b11e-e596e0f44000,BTCUSD,2026-01-15T17:41:46Z,precision_arming,core,61,,1.0,2.0,,,,,,,96817.46,2026-01-15T17:41:21Z,25,,,rule,"Bias(4H→1H)=long (+15.0); Regime filter inaktív; 5M BOS trendirányba (+16.0); ATR erősség 1.00× küszöb (+11.0); Range expanzió támogatja a momentumot (+3.0); Fib zóna konfluencia (0.618–0.886) (+18.0); Order flow neutrális (−3.5); Buy pressure támogatja a setupot (+5); P-Score reduced by 4.0 due to regime CHOPPY; Regime kapu: CHOPPY miatt −10 P-score, pozícióskálázás csökkentve; Strukturális kapu lazítva: momentum erős, BOS hiány engedve; TP1 nettó profit ≈ 0.60%; Precision belépő: trigger ablak aktív; Precision limit belépő parkolva 20 percig; missing: tp1_net>=+0.6%",,,,,,,
