journal_id,asset,analysis_timestamp,signal,mode,probability,model_probability,realtime_confidence,leverage,entry_price,stop_loss,take_profit_1,take_profit_2,risk_reward,initial_risk_abs,spot_price,spot_timestamp,spot_latency_seconds,precision_score,anchor_bias,probability_source,notes,validation_outcome,validation_rr,max_favorable_excursion,max_adverse_excursion,time_to_outcome_minutes,slippage,execution_latency_ms
1aa86fa8-d500-49ee-94f1-4d427bdc82f0,GOLD_CFD,2026-01-20T21:11:17Z,precision_arming,core,22,,1.0,20.0,,,,,,,4759.26114,2026-01-20T21:10:50Z,27,,,rule,"Bias(4H→1H)=long (+15.0); Regime filter inaktív; 5M BOS trendirányba (+16.0); ATR nincs rendben (relatív vagy abszolút küszöb); Alacsony realised vol → magasabb RR igény; Intraday range felső harmada telített (−7.0); Range expanzió támogatja a momentumot (+3.0); Fib zóna konfluencia (0.618–0.886) (+18.0); Order flow neutrális (−4.9); P-Score reduced by 4.0 due to regime CHOPPY; P-Score reduced by 2.5 due to ATR Soft Gate tolerance; VWAP alatt — GOLD long breakout késleltetve; ATR-floor override: rel_atr 0.0008 < 0.0025 → adaptív RR/TP küszöb; Regime kapu: CHOPPY miatt −10 P-score, pozícióskálázás csökkentve; ATR soft gate: alacsony volatilitás −5 P-score, méret felezve; Strukturális kapu lazítva: momentum erős, BOS hiány engedve; Liquidity gate skipped (no volume proxy available); GOLD stop lazítás: ATR alapú kockázat ×2.00; Precision trigger kész → limit figyelés; Precision limit belépő parkolva 12 percig",,,,,,,
4f9c56be-bdc0-4f48-865f-608e812a3950,EURUSD,2026-01-20T21:11:17Z,no entry,core,38,,1.0,30.0,1.1723,1.1840229999999998,1.148854,1.1371310000000001,3.0,,1.1723,2026-01-20T21:10:50Z,27,,,rule,"Mean reversion bias override (+19.5); Regime filter inaktív; ATR erősség 2.35× küszöb (+19.1); Alacsony realised vol → magasabb RR igény; Fib zóna konfluencia (0.618–0.886) (+18.0); Order flow neutrális (−4.8); OFI toxikus short irányra (−5.2); P-Score reduced by 4.0 due to regime CHOPPY; EURUSD: ATR-alapú pozícióskálázás ×0.79 — volatilitás kontroll; EURUSD BOS aktív, de VWAP felett — várakozás; ATR-floor override: rel_atr 0.0003 < 0.0006 → adaptív RR/TP küszöb; Regime kapu: CHOPPY miatt −10 P-score, pozícióskálázás csökkentve; Strukturális soft gate: 1/3 jel + ATR/spread OK (−6 P-score, size ×0.70); Strukturális kapu lazítva: momentum erős, BOS hiány engedve; Liquidity gate skipped (no volume proxy available); missing: precision_score>=55",,,,,,,
ddf03af8-741f-460a-9a7c-bc60d33a11ff,XAGUSD,2026-01-20T21:11:17Z,precision_arming,core,56,,1.0,20.0,,,,,,,94.40479,2026-01-20T21:10:50Z,27,,,rule,"Bias(4H→1H)=long (+15.0); Regime filter inaktív; 5M BOS trendirányba (+16.0); ATR erősség 2.15× küszöb (+17.9); Range expanzió támogatja a momentumot (+3.0); XAG momentum override — stop tágítva erős trendnél; XAGUSD: momentum override — stop távolság 1.3×ATR-re tágítva; Fib zóna konfluencia (0.618–0.886) (+18.0); Order flow neutrális (−4.9); P-Score reduced by 4.0 due to regime CHOPPY; XAGUSD: momentum kitörés — RR cél 1:1.45-re szűkítve; XAG momentum override — pozícióméret csökkentve; XAGUSD: ATR-alapú pozícióskálázás ×0.55; XAG: VWAP alatt — long setup türelmet igényel; Regime kapu: CHOPPY miatt −10 P-score, pozícióskálázás csökkentve; Strukturális soft gate: 1/3 jel + ATR/spread OK (−6 P-score, size ×0.70); Strukturális kapu lazítva: momentum erős, BOS hiány engedve; Liquidity gate skipped (no volume proxy available); Precision trigger kész → limit figyelés; Precision limit belépő parkolva 12 percig",,,,,,,
f24aa10e-efb1-45cc-a770-cf3e2f20d201,BTCUSD,2026-01-20T21:11:17Z,precision_arming,core,88,,1.0,2.0,,,,,,,89669.26,2026-01-20T21:10:50Z,27,,,rule,"Bias override: 1h trend short + momentum támogatás (+19.5); EMA21 slope 1.05× küszöb (+12.3); 5M BOS trendirányba (+16.0); ATR erősség 2.33× küszöb (+19.0); Range expanzió támogatja a momentumot (+3.0); ema9x21+ofi_z=-999.00; Fib zóna konfluencia (0.618–0.886) (+18.0); Order flow neutrális (−4.7); Order flow ellentétes irányba tolódik (−4); OFI toxikus short irányra (−5.9); BTC momentum override — pozícióméret csökkentve; Strukturális kapu lazítva: momentum erős, BOS hiány engedve; BTC ATR stop igazítás: kockázat ×0.90; Precision trigger kész → limit figyelés; Precision limit belépő parkolva 20 percig",,,,,,,
37da60ee-be6d-432a-a143-39eb21e86b4b,USOIL,2026-01-20T21:11:18Z,no entry,core_only,31,,1.0,20.0,59.47943,58.884635700000004,60.84745688999999,61.62068947999999,3.6,,59.47943,2026-01-20T21:10:50Z,27,,,rule,"Bias(4H→1H)=long (+15.0); Regime filter inaktív; ATR erősség 1.83× küszöb (+16.0); Ár az intraday range alsó zónájában (+4.0); Ár 1h EMA21 zónában (+10.0); Order flow neutrális (−4.5); P-Score reduced by 4.0 due to regime CHOPPY; USOIL: 1h ATR <1 USD — P-score küszöb emelve a zajos sáv miatt; USOIL: csökkenő volatilitás — RR cél 1:1.5-re igazítva; USOIL: nyitás előtti sáv — pozícióméret ×0.75; USOIL: oldalazó szerkezet — 1h BOS nélkül nincs belépő; Regime kapu: CHOPPY miatt −10 P-score, pozícióskálázás csökkentve; Strukturális soft gate: 1/3 jel + ATR/spread OK (−6 P-score, size ×0.70); Strukturális kapu lazítva: momentum erős, BOS hiány engedve; Diagnosztika: k1m: utolsó zárt gyertya 7 perc késésben van; Diagnosztika: k1m: jelzés korlátozva 7 perc késés miatt; Diagnosztika: k5m: utolsó zárt gyertya 11 perc késésben van",,,,,,,
