journal_id,asset,analysis_timestamp,signal,mode,probability,model_probability,realtime_confidence,leverage,entry_price,stop_loss,take_profit_1,take_profit_2,risk_reward,initial_risk_abs,spot_price,spot_timestamp,spot_latency_seconds,precision_score,anchor_bias,probability_source,notes,validation_outcome,validation_rr,max_favorable_excursion,max_adverse_excursion,time_to_outcome_minutes,slippage,execution_latency_ms
0e140584-d181-45c3-9845-c8ab51ef3003,XAGUSD,2026-04-12T22:19:35Z,market closed,session_closed,0,,1.0,20.0,,,,,,,73.4446,2026-04-12T22:19:16Z,19,,,rule,"Piac zárva (vasárnapi nyitás 23:00 UTC / 01:00 Budapest után); Mean reversion bias override (+19.5); Regime filter inaktív; HTF sweep ok (+10.0); ATR erősség 2.68× küszöb (+21.1); Ár az intraday range alsó zónájában (+4.0); Order flow neutrális (−4.6); P-Score reduced by 4.0 due to regime CHOPPY; XAGUSD breakout-védelem: gyors BE + 20% giveback limit expanziós szakaszban; XAGUSD: ATR-alapú pozícióskálázás ×0.55; XAG: VWAP alatt — long setup türelmet igényel; OFI z-score 1.08 támogatja az irányt; Fém irány guard: 5m trend ellentétes a belépési biasszal; Regime kapu: CHOPPY miatt −10 P-score, pozícióskálázás csökkentve; Liquidity gate skipped (no volume proxy available); missing: session, metal_bias_5m_alignment",,,,,,,
b5cabab7-6f8e-496f-b01c-b28432f6f4b9,EURUSD,2026-04-12T22:19:35Z,no entry,core,12,,1.0,30.0,,,,,,,1.16752,2026-04-12T22:19:16Z,19,,,rule,"Intraday bias gate feltételek hiányosak — Micro BOS long  ATR rendben: 1m micro BOS long | Micro BOS short  ATR rendben: 1m micro BOS short; Bias neutrálsávban; Regime filter inaktív; ATR erősség 1.83× küszöb (+16.0); Alacsony realised vol → magasabb RR igény; Order flow neutrális (−4.9); ATR-floor override: rel_atr 0.0004 < 0.0006 → adaptív RR/TP küszöb; Regime kapu: CHOPPY miatt −10 P-score, pozícióskálázás csökkentve; Liquidity gate skipped (no volume proxy available); missing: P_score>=38",,,,,,,
41ce3449-31a8-4813-b91d-a9838a736748,BTCUSD,2026-04-12T22:19:35Z,precision_arming,core,72,,1.0,2.0,,,,,,,70856.86,2026-04-12T22:19:16Z,19,,,rule,"Bias override: Intraday 5m BOS short  ATR (+19.5); Regime filter inaktív; 5M BOS trendirányba (+16.0); ATR erősség 2.10× küszöb (+17.6); Range expanzió támogatja a momentumot (+3.0); ema9x21+ofi_z=-999.00; Fib zóna konfluencia (0.618–0.886) (+18.0); Order flow neutrális (−4.2); Sell pressure támogatja a setupot (+5); P-Score reduced by 4.0 due to regime CHOPPY; Mesterlövész mód: P-score minimum 35 érvényesítve; BTC momentum override — pozícióméret csökkentve; Regime kapu: CHOPPY miatt −10 P-score, pozícióskálázás csökkentve; Strukturális kapu lazítva: momentum erős, BOS hiány engedve; BTC ATR1h stop igazítás: kockázat ×1.03; Precision trigger kész → limit figyelés; Precision limit belépő parkolva 20 percig",,,,,,,
7ad5c384-98b9-4e20-a7e9-dcaed37f6eaa,GOLD_CFD,2026-04-12T22:19:35Z,market closed,session_closed,0,,1.0,20.0,,,,,,,4680.07787,2026-04-12T22:19:16Z,19,,,rule,"Piac zárva (vasárnapi nyitás 23:00 UTC / 01:00 Budapest után); Bias(4H→1H)=short (+15.0); Regime filter inaktív; 5M BOS trendirányba (+16.0); ATR nincs rendben (relatív vagy abszolút küszöb); Range expanzió támogatja a momentumot (+3.0); Order flow neutrális (−4.2); P-Score reduced by 4.0 due to regime CHOPPY; VWAP felett — GOLD short breakout várakozik; OFI z-score -1.08 támogatja az irányt; ATR-floor override: rel_atr 0.0020 < 0.0025 → adaptív RR/TP küszöb; Regime kapu: CHOPPY miatt −10 P-score, pozícióskálázás csökkentve; ATR soft gate: alacsony volatilitás −5 P-score, méret felezve; Strukturális kapu lazítva: momentum erős, BOS hiány engedve; Liquidity gate skipped (no volume proxy available); missing: session, P_score>=30",,,,,,,
c0530199-22d0-48f0-9042-f585ee9826e7,USOIL,2026-04-12T22:19:35Z,market closed,session_closed,0,,1.0,20.0,,,,,,,104.093801,2026-04-12T22:19:16Z,19,,,rule,"Piac zárva (vasárnapi nyitás 23:00 UTC / 01:00 Budapest után); Mean reversion bias override (+19.5); Regime filter inaktív; 5M BOS trendirányba (+16.0); ATR erősség 2.32× küszöb (+18.9); Range expanzió támogatja a momentumot (+3.0); USOIL: erős momentum — invalid zóna 2.5×ATR(1h)-re tágítva; Order flow neutrális (−4.8); P-Score reduced by 4.0 due to regime CHOPPY; USOIL: 1h ATR ≥1.5 USD — RR cél 1:2-re emelve; USOIL: nyitás előtti sáv — pozícióméret ×0.75; USOIL: oldalazó szerkezet — H1/M5 BOS nélkül nincs belépő; OFI z-score -1.41 támogatja az irányt; Regime kapu: CHOPPY miatt −10 P-score, pozícióskálázás csökkentve; Likviditási kapu lazítva erős momentum miatt; Liquidity gate skipped (no volume proxy available); missing: session",,,,,,,
