journal_id,asset,analysis_timestamp,signal,mode,probability,model_probability,realtime_confidence,leverage,entry_price,stop_loss,take_profit_1,take_profit_2,risk_reward,initial_risk_abs,spot_price,spot_timestamp,spot_latency_seconds,precision_score,anchor_bias,probability_source,notes,validation_outcome,validation_rr,max_favorable_excursion,max_adverse_excursion,time_to_outcome_minutes,slippage,execution_latency_ms
eec14fe9-40f9-4e75-adc7-0e5e63b6c6d9,XAGUSD,2026-01-12T03:01:07Z,no entry,core,43,,1.0,20.0,83.25929,82.4266971,85.17425366999998,86.25662443999997,3.6,,83.25929,2026-01-12T03:00:48Z,19,,,rule,"Bias(4H→1H)=long (+15.0); Regime filter inaktív; 5M BOS trendirányba (+16.0); ATR erősség 67.81× küszöb (+23.0); Intraday range felső harmada telített (−7.0); Range expanzió támogatja a momentumot (+3.0); XAG momentum override — stop tágítva erős trendnél; XAGUSD: momentum override — stop távolság 1.3×ATR-re tágítva; Order flow neutrális (−4.2); P-Score reduced by 4.0 due to regime CHOPPY; XAGUSD: momentum kitörés — RR cél 1:1.45-re szűkítve; XAG momentum override — pozícióméret csökkentve; XAGUSD: ATR-alapú pozícióskálázás ×0.55; XAG: VWAP alatt — long setup türelmet igényel; OFI z-score 1.45 támogatja az irányt; Regime kapu: CHOPPY miatt −10 P-score, pozícióskálázás csökkentve; Likviditási kapu lazítva erős momentum miatt; Liquidity gate skipped (no volume proxy available); missing: precision_flow_alignment, precision_trigger_sync",,,,,,,
80988694-d86b-458a-9196-eeb646165d4c,EURUSD,2026-01-12T03:01:07Z,no entry,core,16,,1.0,30.0,,,,,,,1.16559,2026-01-12T03:00:48Z,19,,,rule,"Intraday bias gate feltételek hiányosak — Micro BOS long  ATR rendben: 1m micro BOS long | Micro BOS short  ATR rendben: 1m micro BOS short; Bias neutrálsávban; Regime filter inaktív; ATR erősség 4.80× küszöb (+23.0); Alacsony realised vol → magasabb RR igény; Order flow neutrális (−4.1); P-Score reduced by 4.0 due to regime CHOPPY; EURUSD: ATR(1h) alacsony — P-score küszöb +6 pontra emelve; EURUSD: Visszafogott ATR — célok szűkítve, kockázat kontroll alatt; ATR-floor override: rel_atr 0.0002 < 0.0006 → adaptív RR/TP küszöb; Regime kapu: CHOPPY miatt −10 P-score, pozícióskálázás csökkentve; Liquidity gate skipped (no volume proxy available); missing: P_score>=27",,,,,,,
7042270f-7c47-4ef5-8fdd-0c499bf03bd5,GOLD_CFD,2026-01-12T03:01:07Z,no entry,core,38,,1.0,20.0,4577.21612,4531.4439588000005,4676.083988191999,4733.756911303999,3.42,,4577.21612,2026-01-12T03:00:48Z,19,,,rule,"Bias(4H→1H)=long (+15.0); Regime filter inaktív; 5M BOS trendirányba (+16.0); ATR erősség 1.09× küszöb (+11.5); Alacsony realised vol → magasabb RR igény; Range expanzió támogatja a momentumot (+3.0); Order flow neutrális (−4.5); P-Score reduced by 4.0 due to regime CHOPPY; VWAP alatt — GOLD long breakout késleltetve; ATR-floor override: rel_atr 0.0009 < 0.0025 → adaptív RR/TP küszöb; Regime kapu: CHOPPY miatt −10 P-score, pozícióskálázás csökkentve; Strukturális kapu lazítva: momentum erős, BOS hiány engedve; Liquidity gate skipped (no volume proxy available); GOLD stop lazítás: ATR alapú kockázat ×2.00; missing: precision_flow_alignment",,,,,,,
2169bba0-6d9e-41e1-be03-b3783493e86c,BTCUSD,2026-01-12T03:01:07Z,no entry,core,38,,1.0,2.0,92084.01,93004.8501,89966.07776999999,88768.98563999998,3.6,,92084.01,2026-01-12T03:00:48Z,19,,,rule,"Mean reversion bias override (+19.5); Regime filter inaktív; ATR erősség 2.78× küszöb (+21.7); Ár az intraday range felső zónájában (+4.0); Order flow neutrális (−4.2); P-Score reduced by 4.0 due to regime CHOPPY; Regime kapu: CHOPPY miatt −10 P-score, pozícióskálázás csökkentve; BTC ATR stop igazítás: kockázat ×1.00; Precision limit belépő parkolva 15 percig; missing: precision_flow_alignment, precision_trigger_sync",,,,,,,
63dc7058-dd61-451d-8efa-b33968750a98,USOIL,2026-01-12T03:01:07Z,no entry,core,2,,1.0,20.0,,,,,,,59.02,2026-01-12T03:00:48Z,19,,,rule,"Intraday bias gate feltételek hiányosak — USOIL retest long  ATR: 5m retest long, ATR gate | USOIL retest short  ATR: 5m retest short, ATR gate; Bias neutrálsávban; Regime filter inaktív; ATR nincs rendben (relatív vagy abszolút küszöb); Range expanzió támogatja a momentumot (+3.0); USOIL: erős momentum — invalid zóna 2.5×ATR(1h)-re tágítva; Fib zóna konfluencia (0.618–0.886) (+18.0); Order flow neutrális (−4.6); P-Score reduced by 2.0 due to ATR Soft Gate tolerance; USOIL: 1h ATR <1 USD — P-score küszöb emelve a zajos sáv miatt; USOIL: csökkenő volatilitás — RR cél 1:1.5-re igazítva; Regime kapu: CHOPPY miatt −10 P-score, pozícióskálázás csökkentve; ATR soft gate: alacsony volatilitás −5 P-score, méret felezve; Strukturális kapu lazítva: momentum erős, BOS hiány engedve; Liquidity gate skipped (no volume proxy available); missing: P_score>=29",,,,,,,
