journal_id,asset,analysis_timestamp,signal,mode,probability,model_probability,realtime_confidence,leverage,entry_price,stop_loss,take_profit_1,take_profit_2,risk_reward,initial_risk_abs,spot_price,spot_timestamp,spot_latency_seconds,precision_score,anchor_bias,probability_source,notes,validation_outcome,validation_rr,max_favorable_excursion,max_adverse_excursion,time_to_outcome_minutes,slippage,execution_latency_ms
aa6029f9-a5e0-4671-8bd6-3de114ef7946,XAGUSD,2026-04-15T05:56:51Z,precision_arming,core,60,,1.0,20.0,,,,,,,79.44688,2026-04-15T05:56:23Z,27,,,rule,"Bias(4H→1H)=long (+15.0); Regime filter inaktív; 5M BOS trendirányba (+16.0); ATR erősség 1.09× küszöb (+11.5); Ár az intraday range alsó zónájában (+4.0); Range expanzió támogatja a momentumot (+3.0); XAG momentum override — stop tágítva erős trendnél; XAGUSD: momentum override — stop távolság 1.3×ATR-re tágítva; Fib zóna konfluencia (0.618–0.886) (+18.0); Order flow neutrális (−4.6); P-Score reduced by 4.0 due to regime CHOPPY; XAGUSD: momentum kitörés — RR cél 1:1.45-re szűkítve; XAGUSD breakout-védelem: gyors BE + 20% giveback limit expanziós szakaszban; XAG momentum override — pozícióméret csökkentve; XAGUSD: ATR-alapú pozícióskálázás ×0.55; XAG: VWAP alatt — long setup türelmet igényel; OFI z-score 1.37 támogatja az irányt; Regime kapu: CHOPPY miatt −10 P-score, pozícióskálázás csökkentve; Liquidity gate skipped (no volume proxy available); XAG stop lazítás: ATR1h alapú kockázat ×1.09; Precision trigger kész → limit figyelés; Precision limit belépő parkolva 12 percig",,,,,,,
7a27c483-d6cd-47ce-8609-0f2f9115a34b,EURUSD,2026-04-15T05:56:51Z,no entry,core,7,,1.0,30.0,,,,,,,1.17918,2026-04-15T05:56:23Z,27,,,rule,"Bias(4H→1H)=long (+15.0); Regime filter inaktív; ATR nincs rendben (relatív vagy abszolút küszöb); Alacsony realised vol → magasabb RR igény; Fib zóna konfluencia (0.618–0.886) (+18.0); Order flow neutrális (−4.2); P-Score reduced by 4.0 due to regime CHOPPY; P-Score reduced by 5.4 due to ATR Soft Gate tolerance; EURUSD: ATR(1h) alacsony — P-score küszöb +6 pontra emelve; EURUSD: Visszafogott ATR — célok szűkítve, kockázat kontroll alatt; EURUSD BOS aktív, de VWAP alatt — türelem; OFI z-score 1.11 támogatja az irányt; ATR-floor override: rel_atr 0.0002 < 0.0006 → adaptív RR/TP küszöb; Regime kapu: CHOPPY miatt −10 P-score, pozícióskálázás csökkentve; ATR soft gate: alacsony volatilitás −5 P-score, méret felezve; Liquidity gate skipped (no volume proxy available); missing: P_score>=44",,,,,,,
e40b5c37-cf22-4393-9793-da7dd682f455,GOLD_CFD,2026-04-15T05:56:50Z,precision_arming,core,35,,1.0,20.0,,,,,,,4821.1908,2026-04-15T05:56:23Z,27,,,rule,"Bias(4H→1H)=long (+15.0); Regime filter inaktív; 5M BOS trendirányba (+16.0); ATR nincs rendben (relatív vagy abszolút küszöb); Alacsony realised vol → magasabb RR igény; Ár az intraday range alsó zónájában (+4.0); Range expanzió támogatja a momentumot (+3.0); Fib zóna konfluencia (0.618–0.886) (+18.0); Order flow neutrális (−4.9); P-Score reduced by 4.0 due to regime CHOPPY; VWAP alatt — GOLD long breakout késleltetve; ATR-floor override: rel_atr 0.0008 < 0.0025 → adaptív RR/TP küszöb; Regime kapu: CHOPPY miatt −10 P-score, pozícióskálázás csökkentve; ATR soft gate: alacsony volatilitás −5 P-score, méret felezve; Strukturális kapu lazítva: momentum erős, BOS hiány engedve; Liquidity gate skipped (no volume proxy available); GOLD stop lazítás: ATR1h alapú kockázat ×1.09; Precision trigger kész → limit figyelés; Precision limit belépő parkolva 12 percig",,,,,,,
9aa69c82-fd42-4913-9767-5a04fae2dee8,BTCUSD,2026-04-15T05:56:51Z,precision_arming,core,66,,1.0,2.0,,,,,,,74006.01,2026-04-15T05:56:23Z,27,,,rule,"Bias(4H→1H)=long (+15.0); Regime filter inaktív; 5M BOS trendirányba (+16.0); ATR erősség 1.15× küszöb (+11.9); Alacsony realised vol → magasabb RR igény; Ár az intraday range alsó zónájában (+4.0); Range expanzió támogatja a momentumot (+3.0); Fib zóna konfluencia (0.618–0.886) (+18.0); Order flow neutrális (−4.2); Buy pressure támogatja a setupot (+5); P-Score reduced by 4.0 due to regime CHOPPY; Mesterlövész mód: P-score minimum 35 érvényesítve; Regime kapu: CHOPPY miatt −10 P-score, pozícióskálázás csökkentve; Strukturális kapu lazítva: momentum erős, BOS hiány engedve; BTC ATR1h stop igazítás: kockázat ×1.15; Precision trigger kész → limit figyelés; Precision limit belépő parkolva 20 percig",,,,,,,
c5d3d85f-5b19-4548-8104-081a52b55d49,USOIL,2026-04-15T05:56:51Z,no entry,core_only,76,,1.0,20.0,91.66799,93.030274181,89.48833531040002,88.39850796560002,2.4,,91.66799,2026-04-15T05:56:23Z,28,,,rule,"Bias override: 1h trend short + momentum támogatás (+19.5); EMA21 slope 1.98× küszöb (+17.9); 5M BOS trendirányba (+16.0); ATR nincs rendben (relatív vagy abszolút küszöb); Ár az intraday range felső zónájában (+4.0); Range expanzió támogatja a momentumot (+3.0); USOIL: erős momentum — invalid zóna 2.5×ATR(1h)-re tágítva; Fib zóna konfluencia (0.618–0.886) (+18.0); Order flow neutrális (−4.5); USOIL: csökkenő volatilitás — RR cél 1:1.5-re igazítva; USOIL: ázsiai sáv — pozícióméret ×0.70; USOIL: oldalazó szerkezet — H1/M5 BOS nélkül nincs belépő; ATR soft gate: alacsony volatilitás −5 P-score, méret felezve; Strukturális kapu lazítva: momentum erős, BOS hiány engedve; USOIL stop lazítás: ATR1h alapú kockázat ×0.97; Diagnosztika: k1m: utolsó zárt gyertya 10 perc késésben van; Diagnosztika: k1m: jelzés korlátozva 10 perc késés miatt; Diagnosztika: k5m: utolsó zárt gyertya 11 perc késésben van",,,,,,,
