journal_id,asset,analysis_timestamp,signal,mode,probability,model_probability,realtime_confidence,leverage,entry_price,stop_loss,take_profit_1,take_profit_2,risk_reward,initial_risk_abs,spot_price,spot_timestamp,spot_latency_seconds,precision_score,anchor_bias,probability_source,notes,validation_outcome,validation_rr,max_favorable_excursion,max_adverse_excursion,time_to_outcome_minutes,slippage,execution_latency_ms
2e5c90f0-7dc5-4553-9cbb-7c514a6287a1,XAGUSD,2026-01-08T13:34:38Z,market closed,session_closed,0,,1.0,20.0,,,,,,,74.8828,2026-01-08T13:33:40Z,58,,,rule,"Piac nyitva; Intraday bias gate feltételek hiányosak — Micro BOS long  ATR (ezüst): 1m micro BOS long | Micro BOS short  ATR (ezüst): 1m micro BOS short; Bias neutrálsávban; EMA21 slope 1.09× küszöb (+12.5); London–NY overlap profil (-1.0); ATR erősség 1.27× küszöb (+12.6); Order flow neutrális (−4.8); XAGUSD: ATR-alapú pozícióskálázás ×0.70; Bias eltérés: H1 trend ütközik az M5 belépéssel (−15 P-score); Liquidity gate skipped (no volume proxy available); missing: session, P_score>=28",,,,,,,
8a6445d3-320b-474f-8a08-156e8f73454e,GOLD_CFD,2026-01-08T13:34:38Z,market closed,session_closed,0,,1.0,20.0,,,,,,,4428.22404,2026-01-08T13:34:22Z,16,,,rule,"Piac nyitva; Bias(4H→1H)=long (+15.0); Regime filter inaktív; 5M BOS trendirányba (+16.0); London–NY overlap profil (-1.0); ATR nincs rendben (relatív vagy abszolút küszöb); Alacsony realised vol → magasabb RR igény; Range expanzió támogatja a momentumot (+3.0); Fib zóna konfluencia (0.618–0.886) (+18.0); Order flow neutrális (−4.2); OFI toxikus long irányra (−3.8); P-Score reduced by 4.0 due to regime CHOPPY; VWAP alatt — GOLD long breakout késleltetve; ATR-floor override: rel_atr 0.0010 < 0.0025 → adaptív RR/TP küszöb; Regime kapu: CHOPPY miatt −10 P-score, pozícióskálázás csökkentve; ATR soft gate: alacsony volatilitás −5 P-score, méret felezve; Strukturális kapu lazítva: momentum erős, BOS hiány engedve; Liquidity gate skipped (no volume proxy available); missing: session, P_score>=28",,,,,,,
d3a08f22-6648-49a8-9f69-1046a00b115d,EURUSD,2026-01-08T13:34:38Z,market closed,session_closed,0,,1.0,30.0,,,,,,,1.16722,2026-01-08T13:34:11Z,27,,,rule,"Piac nyitva; Intraday bias gate feltételek hiányosak — Micro BOS long  ATR rendben: 1m micro BOS long | Micro BOS short  ATR rendben: 1m micro BOS short; Bias neutrálsávban; Regime filter inaktív; London–NY overlap profil (-1.0); ATR erősség 1.53× küszöb (+14.2); Alacsony realised vol → magasabb RR igény; Range expanzió támogatja a momentumot (+3.0); Ár 1h EMA21 zónában (+10.0); Order flow neutrális (−4.4); P-Score reduced by 4.0 due to regime CHOPPY; EURUSD: ATR(1h) alacsony — P-score küszöb +6 pontra emelve; EURUSD: Visszafogott ATR — célok szűkítve, kockázat kontroll alatt; ATR-floor override: rel_atr 0.0002 < 0.0006 → adaptív RR/TP küszöb; Regime kapu: CHOPPY miatt −10 P-score, pozícióskálázás csökkentve; Bias eltérés: H1 trend ütközik az M5 belépéssel (−15 P-score); Strukturális kapu lazítva: momentum erős, BOS hiány engedve; Liquidity gate skipped (no volume proxy available); missing: session, P_score>=32",,,,,,,
343e256a-11f6-43f4-b50a-4369d8a76dcc,BTCUSD,2026-01-08T13:34:39Z,no entry,core,0,,1.0,2.0,,,,,,,89820.22,2026-01-08T13:34:19Z,19,,,rule,"Intraday bias gate feltételek hiányosak — Crypto momentum long: 1m micro BOS long, Momentum volume ráta, ATR gate | Crypto momentum short: 1m micro BOS short, Momentum volume ráta, ATR gate | 5m BOS long  ATR: ATR gate | 5m BOS short  ATR: 5m BOS short, ATR gate | Micro BOS short  ATR (momentum nélkül): 1m micro BOS short, ATR gate; Bias neutrálsávban; Regime filter inaktív; London–NY overlap profil (-1.0); ATR nincs rendben (relatív vagy abszolút küszöb); Fib zóna konfluencia (0.618–0.886) (+18.0); Order flow neutrális (−4.8); Regime kapu: CHOPPY miatt −10 P-score, pozícióskálázás csökkentve; ATR soft gate: alacsony volatilitás −5 P-score, méret felezve; Bias eltérés: H1 trend ütközik az M5 belépéssel (−15 P-score); missing: P_score>=34",,,,,,,
ea52cd8d-0258-4efb-9ffa-c91507c12737,USOIL,2026-01-08T13:34:39Z,market closed,session_closed,0,,1.0,20.0,,,,,,,56.94,2026-01-08T13:33:41Z,58,,,rule,"Piac nyitva; Bias(4H→1H)=short (+15.0); Regime filter inaktív; London–NY overlap profil (-1.0); ATR nincs rendben (relatív vagy abszolút küszöb); Ár az intraday range felső zónájában (+4.0); Order flow neutrális (−3.8); OFI toxikus short irányra (−7.8); P-Score reduced by 4.0 due to regime CHOPPY; USOIL: 1h ATR <1 USD — P-score küszöb emelve a zajos sáv miatt; USOIL: csökkenő volatilitás — RR cél 1:1.5-re igazítva; USOIL: US nyitás — pozícióméret ×0.75; USOIL: oldalazó szerkezet — 1h BOS nélkül nincs belépő; Regime kapu: CHOPPY miatt −10 P-score, pozícióskálázás csökkentve; ATR soft gate: alacsony volatilitás −5 P-score, méret felezve; Liquidity gate skipped (no volume proxy available); missing: session, P_score>=34, precision_flow_alignment",,,,,,,
