journal_id,asset,analysis_timestamp,signal,mode,probability,model_probability,realtime_confidence,leverage,entry_price,stop_loss,take_profit_1,take_profit_2,risk_reward,initial_risk_abs,spot_price,spot_timestamp,spot_latency_seconds,precision_score,anchor_bias,probability_source,notes,validation_outcome,validation_rr,max_favorable_excursion,max_adverse_excursion,time_to_outcome_minutes,slippage,execution_latency_ms
12119bf3-4c59-4e12-8fd3-703fec52c7c3,GOLD_CFD,2026-04-29T16:17:02Z,precision_arming,core,46,,1.0,20.0,,,,,,,4559.73545,2026-04-29T16:16:30Z,32,,,rule,"Bias(4H→1H)=short (+15.0); Regime filter inaktív; HTF sweep ok (+10.0); 5M BOS trendirányba (+16.0); ATR nincs rendben (relatív vagy abszolút küszöb); Alacsony realised vol → magasabb RR igény; Ár az intraday range felső zónájában (+4.0); Range expanzió támogatja a momentumot (+3.0); Fib zóna konfluencia (0.618–0.886) (+18.0); Order flow neutrális (−4.4); P-Score reduced by 4.0 due to regime CHOPPY; VWAP felett — GOLD short breakout várakozik; ATR-floor override: rel_atr 0.0015 < 0.0025 → adaptív RR/TP küszöb; Regime kapu: CHOPPY miatt −10 P-score, pozícióskálázás csökkentve; ATR soft gate: alacsony volatilitás −5 P-score, méret felezve; Strukturális kapu lazítva: momentum erős, BOS hiány engedve; Liquidity gate skipped (no volume proxy available); GOLD stop lazítás: ATR1h alapú kockázat ×1.09; Precision trigger kész → limit figyelés; Precision limit belépő parkolva 12 percig",,,,,,,
3e38f83c-0c2b-4ba2-9cd6-d29692816344,EURUSD,2026-04-29T16:17:02Z,no entry,core,22,,1.0,30.0,,,,,,,1.16926,2026-04-29T16:16:30Z,32,,,rule,"Intraday bias gate feltételek hiányosak — Micro BOS long  ATR rendben: 1m micro BOS long | Micro BOS short  ATR rendben: 1m micro BOS short; Bias neutrálsávban; Regime filter inaktív; ATR erősség 1.69× küszöb (+15.1); Alacsony realised vol → magasabb RR igény; Range expanzió támogatja a momentumot (+3.0); Fib zóna konfluencia (0.618–0.886) (+18.0); Order flow neutrális (−4.8); P-Score reduced by 4.0 due to regime CHOPPY; EURUSD: ATR(1h) alacsony — P-score küszöb +6 pontra emelve; EURUSD: Visszafogott ATR — célok szűkítve, kockázat kontroll alatt; ATR-floor override: rel_atr 0.0003 < 0.0006 → adaptív RR/TP küszöb; Regime kapu: CHOPPY miatt −10 P-score, pozícióskálázás csökkentve; Strukturális soft gate: 1/3 jel + ATR/spread OK (−6 P-score, size ×0.70); Strukturális kapu lazítva: momentum erős, BOS hiány engedve; Liquidity gate skipped (no volume proxy available); missing: P_score>=44",,,,,,,
1cda0c3d-1e47-446a-ae69-6e61bd64b76d,NVDA,2026-04-29T16:17:02Z,no entry,core,16,,1.0,5.0,,,,,,,210.54,2026-04-29T16:16:30Z,32,,,rule,"Bias(4H→1H)=long (+15.0); Regime filter inaktív; ATR nincs rendben (relatív vagy abszolút küszöb); WARNING: No Liquidity Structure (Nearest: 197.113756, Dist: 26.59ATR); Ár az intraday range alsó zónájában (+4.0); Fib zóna konfluencia (0.618–0.886) (+18.0); Order flow neutrális (−4.5); OFI toxikus long irányra (−4.3); Regime kapu: CHOPPY miatt −10 P-score, pozícióskálázás csökkentve; ATR soft gate: alacsony volatilitás −5 P-score, méret felezve; missing: P_score>=38",,,,,,,
eac963fd-3902-47b2-bf8c-03bbbf596139,XAGUSD,2026-04-29T16:17:02Z,precision_arming,core,43,,1.0,20.0,,,,,,,71.67644,2026-04-29T16:16:30Z,32,,,rule,"Bias(4H→1H)=short (+15.0); Regime filter inaktív; 5M BOS trendirányba (+16.0); ATR erősség 1.27× küszöb (+12.6); Range expanzió támogatja a momentumot (+3.0); XAG momentum override — stop tágítva erős trendnél; XAGUSD: momentum override — stop távolság 1.3×ATR-re tágítva; Order flow neutrális (−4.5); XAGUSD: momentum kitörés — RR cél 1:1.45-re szűkítve; XAGUSD breakout-védelem: gyors BE + 20% giveback limit expanziós szakaszban; XAG momentum override — pozícióméret csökkentve; XAG: VWAP felett — short setup türelmet igényel; Regime kapu: CHOPPY miatt −10 P-score, pozícióskálázás csökkentve; Strukturális kapu lazítva: momentum erős, BOS hiány engedve; Liquidity gate skipped (no volume proxy available); XAG stop lazítás: ATR1h alapú kockázat ×1.09; Precision trigger kész → limit figyelés; Precision limit belépő parkolva 12 percig",,,,,,,
512cb62a-7a9e-4292-8a5e-f8c7bfc8a456,USOIL,2026-04-29T16:17:02Z,precision_arming,core,56,,1.0,20.0,,,,,,,108.99166,2026-04-29T16:16:30Z,32,,,rule,"Bias(4H→1H)=long (+15.0); EMA21 slope 1.51× küszöb (+15.1); 5M BOS trendirányba (+16.0); ATR erősség 0.96× küszöb (+10.8); Intraday range felső harmada telített (−7.0); Range expanzió támogatja a momentumot (+3.0); USOIL: erős momentum — invalid zóna 2.5×ATR(1h)-re tágítva; Order flow neutrális (−4.5); P-Score reduced by 1.7 due to ATR Soft Gate tolerance; USOIL: parabolikus lendület — RR cél 1:1.4 környékére szűkítve; Strukturális soft gate: 1/3 jel + ATR/spread OK (−6 P-score, size ×0.70); Strukturális kapu lazítva: momentum erős, BOS hiány engedve; Liquidity gate skipped (no volume proxy available); USOIL stop lazítás: ATR1h alapú kockázat ×0.97; Precision trigger kész → limit figyelés; Precision limit belépő parkolva 12 percig",,,,,,,
4797ebaa-7613-49fe-b744-1b65c1cec084,BTCUSD,2026-04-29T16:17:02Z,precision_arming,core,50,,1.0,2.0,,,,,,,76027.07,2026-04-29T16:16:30Z,32,,,rule,"Bias override: Intraday 5m BOS long  ATR (+19.5); Regime filter inaktív; 5M BOS trendirányba (+16.0); ATR erősség 2.25× küszöb (+18.5); Ár az intraday range alsó zónájában (+4.0); Range expanzió támogatja a momentumot (+3.0); Order flow neutrális (−4.4); Order flow ellentétes irányba tolódik (−4); P-Score reduced by 4.0 due to regime CHOPPY; Mesterlövész mód: P-score minimum 35 érvényesítve; Regime kapu: CHOPPY miatt −10 P-score, pozícióskálázás csökkentve; Strukturális kapu lazítva: momentum erős, BOS hiány engedve; Likviditási kapu lazítva erős momentum miatt; BTC ATR1h stop igazítás: kockázat ×1.15; Precision trigger kész → limit figyelés; Precision limit belépő parkolva 20 percig",,,,,,,
