journal_id,asset,analysis_timestamp,signal,mode,probability,model_probability,realtime_confidence,leverage,entry_price,stop_loss,take_profit_1,take_profit_2,risk_reward,initial_risk_abs,spot_price,spot_timestamp,spot_latency_seconds,precision_score,anchor_bias,probability_source,notes,validation_outcome,validation_rr,max_favorable_excursion,max_adverse_excursion,time_to_outcome_minutes,slippage,execution_latency_ms
06b3a01d-01cd-4eb8-97cf-cc6b7951a9c6,GOLD_CFD,2026-04-17T15:26:35Z,no entry,core,0,,1.0,20.0,,,,,,,4870.54256,2026-04-17T15:26:03Z,32,,,rule,"Bias(4H→1H)=long (+15.0); Regime filter inaktív; London–NY overlap profil (-1.0); ATR nincs rendben (relatív vagy abszolút küszöb); Intraday range felső harmada telített (−7.0); Order flow neutrális (−4.1); P-Score reduced by 4.0 due to regime CHOPPY; Range guard lazítva: napi sáv teteje, de mikro-range visszahúzódott.; VWAP alatt — GOLD long breakout késleltetve; OFI z-score 1.42 támogatja az irányt; ATR-floor override: rel_atr 0.0014 < 0.0025 → adaptív RR/TP küszöb; Regime kapu: CHOPPY miatt −10 P-score, pozícióskálázás csökkentve; ATR soft gate: alacsony volatilitás −5 P-score, méret felezve; Liquidity gate skipped (no volume proxy available); missing: P_score>=30",,,,,,,
5574cfef-1d16-48b9-80cb-fd08e5f01eee,EURUSD,2026-04-17T15:26:35Z,precision_arming,core,76,,1.0,30.0,,,,,,,1.18061,2026-04-17T15:26:03Z,32,,,rule,"Micro bias override: gyors struktúra dominál (+19.5); Regime filter inaktív; HTF sweep ok (+10.0); 5M BOS trendirányba (+16.0); London–NY overlap profil (-1.0); ATR erősség 2.15× küszöb (+17.9); Alacsony realised vol → magasabb RR igény; Range expanzió támogatja a momentumot (+3.0); Fib zóna konfluencia (0.618–0.886) (+18.0); Order flow neutrális (−4.1); P-Score reduced by 4.0 due to regime CHOPPY; EURUSD: ATR(1h) alacsony — P-score küszöb +6 pontra emelve; Intraday P-score lazítás: micro-bias short elsőbbséget kap (−2.2); EURUSD: Visszafogott ATR — célok szűkítve, kockázat kontroll alatt; EURUSD BOS aktív, de VWAP felett — várakozás; OFI z-score -1.77 támogatja az irányt; ATR-floor override: rel_atr 0.0004 < 0.0006 → adaptív RR/TP küszöb; Regime kapu: CHOPPY miatt −10 P-score, pozícióskálázás csökkentve; Liquidity gate skipped (no volume proxy available); EURUSD stop lazítás: ATR1h alapú kockázat ×1.19; Precision trigger kész → limit figyelés; Precision limit belépő parkolva 12 percig",,,,,,,
01deccc5-c6c3-4ee5-89e1-8b7f90b2d08d,XAGUSD,2026-04-17T15:26:35Z,no entry,core,13,,1.0,20.0,,,,,,,82.45015,2026-04-17T15:26:03Z,32,,,rule,"Bias(4H→1H)=long (+15.0); Regime filter inaktív; London–NY overlap profil (-1.0); ATR erősség 1.42× küszöb (+13.5); Intraday range felső harmada telített (−7.0); Order flow neutrális (−4.5); P-Score reduced by 4.0 due to regime CHOPPY; Range guard lazítva: napi sáv teteje, de mikro-range visszahúzódott.; XAGUSD breakout-védelem: gyors BE + 20% giveback limit expanziós szakaszban; XAGUSD: ATR-alapú pozícióskálázás ×0.62; XAG: VWAP alatt — long setup türelmet igényel; Regime kapu: CHOPPY miatt −10 P-score, pozícióskálázás csökkentve; Liquidity gate skipped (no volume proxy available); missing: P_score>=28",,,,,,,
06bec02b-51ea-4151-ad80-02880530ee58,NVDA,2026-04-17T15:26:35Z,no entry,core,0,,1.0,5.0,,,,,,,200.66,2026-04-17T15:26:03Z,32,,,rule,"Bias(4H→1H)=long (+15.0); Regime filter inaktív; London–NY overlap profil (-1.0); ATR nincs rendben (relatív vagy abszolút küszöb); WARNING: No Liquidity Structure (Nearest: 197.003751, Dist: 7.57ATR); Order flow neutrális (−2.9); Regime kapu: CHOPPY miatt −10 P-score, pozícióskálázás csökkentve; ATR soft gate: alacsony volatilitás −5 P-score, méret felezve; missing: P_score>=38, precision_flow_alignment",,,,,,,
372f1681-d6b4-40b4-ad2f-c64bc468e476,USOIL,2026-04-17T15:26:35Z,no entry,core_only,46,,1.0,20.0,,,,,,,80.63771,2026-04-17T15:26:03Z,32,,,rule,Intraday bias gate feltételek hiányosak — USOIL retest long  ATR: 5m retest long | USOIL retest short  ATR: 5m retest short; Bias neutrálsávban; EMA21 slope 2.28× küszöb (+19.7); London–NY overlap profil (-1.0); ATR erősség 2.10× küszöb (+17.6); Order flow neutrális (−4.9); USOIL: parabolikus lendület — RR cél 1:1.4 környékére szűkítve; Diagnosztika: k1m: utolsó zárt gyertya 11 perc késésben van; Diagnosztika: k1m: jelzés korlátozva 11 perc késés miatt; Diagnosztika: k5m: utolsó zárt gyertya 11 perc késésben van,,,,,,,
49d6655b-c70c-4310-a8b6-d269318e93c1,BTCUSD,2026-04-17T15:26:35Z,precision_arming,core,36,,1.0,2.0,,,,,,,77921.99,2026-04-17T15:26:03Z,32,,,rule,"Mean reversion bias override (+19.5); Regime filter inaktív; London–NY overlap profil (-1.0); ATR erősség 2.50× küszöb (+20.0); Ár az intraday range felső zónájában (+4.0); Order flow neutrális (−3.9); P-Score reduced by 4.0 due to regime CHOPPY; Mesterlövész mód: P-score minimum 35 érvényesítve; Regime kapu: CHOPPY miatt −10 P-score, pozícióskálázás csökkentve; BTC ATR1h stop igazítás: kockázat ×1.15; Precision trigger kész → limit figyelés; Precision limit belépő parkolva 20 percig",,,,,,,
