journal_id,asset,analysis_timestamp,signal,mode,probability,model_probability,realtime_confidence,leverage,entry_price,stop_loss,take_profit_1,take_profit_2,risk_reward,initial_risk_abs,spot_price,spot_timestamp,spot_latency_seconds,precision_score,anchor_bias,probability_source,notes,validation_outcome,validation_rr,max_favorable_excursion,max_adverse_excursion,time_to_outcome_minutes,slippage,execution_latency_ms
3c594160-c1ce-4759-b716-4008c6743be0,EURUSD,2026-06-10T14:56:24Z,no entry,core,24,,1.0,30.0,,,,,,,1.15553,2026-06-10T14:55:51Z,32,,,rule,"Intraday bias gate feltételek hiányosak — Micro BOS long  ATR rendben: 1m micro BOS long | Micro BOS short  ATR rendben: 1m micro BOS short; Bias neutrálsávban; Regime filter inaktív; London–NY overlap profil (-1.0); ATR erősség 1.76× küszöb (+15.6); Alacsony realised vol → magasabb RR igény; Fib zóna konfluencia (0.618–0.886) (+18.0); Order flow neutrális (−3.9); EURUSD: ATR(1h) alacsony — P-score küszöb +6 pontra emelve; EURUSD: Visszafogott ATR — célok szűkítve, kockázat kontroll alatt; ATR-floor override: rel_atr 0.0004 < 0.0006 → adaptív RR/TP küszöb; Regime kapu: CHOPPY miatt −10 P-score, pozícióskálázás csökkentve; Strukturális soft gate: 1/3 jel + ATR/spread OK (−6 P-score, size ×0.70); Strukturális kapu lazítva: momentum erős, BOS hiány engedve; Liquidity gate skipped (no volume proxy available); missing: P_score>=44",,,,,,,
ff6e7cf2-2dfc-4eb3-bf12-0655796dbbf1,GOLD_CFD,2026-06-10T14:56:24Z,no entry,core,15,,1.0,20.0,,,,,,,4139.53335,2026-06-10T14:55:51Z,32,,,rule,"Bias(4H→1H)=short (+15.0); Regime filter inaktív; HTF sweep ok (+10.0); 5M BOS trendirányba (+16.0); London–NY overlap profil (-1.0); ATR nincs rendben (relatív vagy abszolút küszöb); Intraday range alsó harmada telített (−7.0); Range expanzió támogatja a momentumot (+3.0); Order flow neutrális (−4.6); P-Score reduced by 4.0 due to regime CHOPPY; VWAP felett — GOLD short breakout várakozik; ATR-floor override: rel_atr 0.0020 < 0.0025 → adaptív RR/TP küszöb; Regime kapu: CHOPPY miatt −10 P-score, pozícióskálázás csökkentve; ATR soft gate: alacsony volatilitás −5 P-score, méret felezve; Strukturális kapu lazítva: momentum erős, BOS hiány engedve; Liquidity gate skipped (no volume proxy available); missing: P_score>=30",,,,,,,
b4b150fd-db97-40ab-af77-14ddfd156c35,XAGUSD,2026-06-10T14:56:24Z,no entry,core,55,,1.0,20.0,,,,,,,64.81902,2026-06-10T14:55:51Z,32,,,rule,"Bias(4H→1H)=short (+15.0); Regime filter inaktív; 5M BOS trendirányba (+16.0); London–NY overlap profil (-1.0); ATR erősség 1.46× küszöb (+13.8); Ár az intraday range felső zónájában (+4.0); Range expanzió támogatja a momentumot (+3.0); XAG momentum override — stop tágítva erős trendnél; XAGUSD: momentum override — stop távolság 1.3×ATR-re tágítva; Fib zóna konfluencia (0.618–0.886) (+18.0); Order flow neutrális (−4.8); P-Score reduced by 4.0 due to regime CHOPPY; XAGUSD: momentum kitörés — RR cél 1:1.45-re szűkítve; XAGUSD breakout-védelem: gyors BE + 20% giveback limit expanziós szakaszban; XAG momentum override — pozícióméret csökkentve; XAGUSD: ATR-alapú pozícióskálázás ×0.55; XAG: VWAP felett — short setup türelmet igényel; Fém irány guard: 5m trend ellentétes a belépési biasszal; Regime kapu: CHOPPY miatt −10 P-score, pozícióskálázás csökkentve; Strukturális soft gate: 1/3 jel + ATR/spread OK (−6 P-score, size ×0.70); Strukturális kapu lazítva: momentum erős, BOS hiány engedve; Liquidity gate skipped (no volume proxy available); missing: metal_bias_5m_alignment",,,,,,,
16a755c4-8fe7-4aa6-9738-44700f8f82de,NVDA,2026-06-10T14:56:24Z,no entry,core,25,,1.0,5.0,,,,,,,205.37,2026-06-10T14:55:51Z,32,,,rule,"Intraday bias gate: ellentétes long/short jelek → várakozás; Bias neutrálsávban; Regime filter inaktív; London–NY overlap profil (-1.0); ATR erősség 1.27× küszöb (+12.6); WARNING: No Liquidity Structure (Nearest: 182.698853, Dist: 19.83ATR); Range expanzió támogatja a momentumot (+3.0); Fib zóna konfluencia (0.618–0.886) (+18.0); Order flow neutrális (−2.4); NVDA: magas napi ATR + momentum — P-score küszöb lazítva; Mesterlövész mód: P-score minimum 35 érvényesítve; Regime kapu: CHOPPY miatt −10 P-score, pozícióskálázás csökkentve; Strukturális soft gate: 1/3 jel + ATR/spread OK (−6 P-score, size ×0.70); Strukturális kapu lazítva: momentum erős, BOS hiány engedve; missing: P_score>=35",,,,,,,
aa27869e-c32f-4527-8f93-3e0a790b1434,USOIL,2026-06-10T14:56:24Z,no entry,core,34,,1.0,20.0,,,,,,,91.6106,2026-06-10T14:55:51Z,33,,,rule,"Bias(4H→1H)=short (+15.0); Regime filter inaktív; London–NY overlap profil (-1.0); ATR erősség 3.18× küszöb (+23.0); Ár az intraday range felső zónájában (+4.0); Order flow neutrális (−4.2); P-Score reduced by 4.0 due to regime CHOPPY; USOIL: 1h ATR ≥1.5 USD — RR cél 1:2-re emelve; USOIL: oldalazó szerkezet — H1/M5 BOS nélkül nincs belépő; Regime kapu: CHOPPY miatt −10 P-score, pozícióskálázás csökkentve; Liquidity gate skipped (no volume proxy available); missing: P_score>=36",,,,,,,
83745c05-fe68-4651-9e03-0bec03d31cf6,BTCUSD,2026-06-10T14:56:24Z,precision_arming,core,54,,1.0,2.0,,,,,,,61858.09,2026-06-10T14:55:51Z,33,,,rule,"Bias(4H→1H)=short (+15.0); Regime filter inaktív; 5M BOS trendirányba (+16.0); London–NY overlap profil (-1.0); ATR erősség 1.71× küszöb (+15.3); Ár az intraday range felső zónájában (+4.0); Range expanzió támogatja a momentumot (+3.0); Ár 1h EMA21 zónában (+10.0); Order flow neutrális (−4.8); P-Score reduced by 4.0 due to regime CHOPPY; Mesterlövész mód: P-score minimum 35 érvényesítve; Regime kapu: CHOPPY miatt −10 P-score, pozícióskálázás csökkentve; Strukturális kapu lazítva: momentum erős, BOS hiány engedve; Likviditási kapu lazítva erős momentum miatt; BTC ATR1h stop igazítás: kockázat ×1.15; Precision trigger kész → limit figyelés; Precision limit belépő parkolva 20 percig",,,,,,,
