journal_id,asset,analysis_timestamp,signal,mode,probability,model_probability,realtime_confidence,leverage,entry_price,stop_loss,take_profit_1,take_profit_2,risk_reward,initial_risk_abs,spot_price,spot_timestamp,spot_latency_seconds,precision_score,anchor_bias,probability_source,notes,validation_outcome,validation_rr,max_favorable_excursion,max_adverse_excursion,time_to_outcome_minutes,slippage,execution_latency_ms
6a712756-6971-4db2-874e-ed6c4e92af6d,XAGUSD,2026-04-23T06:54:35Z,no entry,core,13,,1.0,20.0,,,,,,,76.24475,2026-04-23T06:54:08Z,27,,,rule,"Intraday bias gate feltételek hiányosak — Micro BOS long  ATR (ezüst): 1m micro BOS long | Micro BOS short  ATR (ezüst): 1m micro BOS short; Bias neutrálsávban; Regime filter inaktív; ATR erősség 0.95× küszöb (+10.7); Fib zóna konfluencia (0.618–0.886) (+18.0); Order flow neutrális (−4.9); P-Score reduced by 4.0 due to regime CHOPPY; P-Score reduced by 2.0 due to ATR Soft Gate tolerance; XAGUSD: visszafogott ATR — RR cél 1:1.7-re emelve; XAGUSD breakout-védelem: gyors BE + 20% giveback limit expanziós szakaszban; XAGUSD: ATR-alapú pozícióskálázás ×0.70; ATR-floor override: rel_atr 0.0017 < 0.0018 → adaptív RR/TP küszöb; Regime kapu: CHOPPY miatt −10 P-score, pozícióskálázás csökkentve; Strukturális soft gate: 1/3 jel + ATR/spread OK (−6 P-score, size ×0.70); Strukturális kapu lazítva: momentum erős, BOS hiány engedve; Liquidity gate skipped (no volume proxy available); missing: P_score>=28",,,,,,,
7937b45b-e4b5-4354-8135-e1aefb6af9d6,GOLD_CFD,2026-04-23T06:54:35Z,no entry,core,17,,1.0,20.0,,,,,,,4717.1673,2026-04-23T06:54:08Z,27,,,rule,"Mean reversion bias override (+19.5); Regime filter inaktív; ATR nincs rendben (relatív vagy abszolút küszöb); Alacsony realised vol → magasabb RR igény; Fib zóna konfluencia (0.618–0.886) (+18.0); Order flow neutrális (−4.2); P-Score reduced by 4.0 due to regime CHOPPY; ATR-floor override: rel_atr 0.0009 < 0.0025 → adaptív RR/TP küszöb; Regime kapu: CHOPPY miatt −10 P-score, pozícióskálázás csökkentve; ATR soft gate: alacsony volatilitás −5 P-score, méret felezve; Liquidity gate skipped (no volume proxy available); missing: P_score>=30",,,,,,,
9bd55ad1-811a-4ae3-83eb-df1f2143a74c,EURUSD,2026-04-23T06:54:35Z,no entry,core,0,,1.0,30.0,,,,,,,1.17079,2026-04-23T06:54:08Z,27,,,rule,"Intraday bias gate feltételek hiányosak — Micro BOS long  ATR rendben: 1m micro BOS long, ATR gate | Micro BOS short  ATR rendben: 1m micro BOS short, ATR gate; Bias neutrálsávban; Regime filter inaktív; ATR nincs rendben (relatív vagy abszolút küszöb); Alacsony realised vol → magasabb RR igény; Range expanzió támogatja a momentumot (+3.0); Ár 1h EMA21 zónában (+10.0); Order flow neutrális (−4.2); P-Score reduced by 4.0 due to regime CHOPPY; EURUSD: ATR(1h) alacsony — P-score küszöb +6 pontra emelve; EURUSD: Visszafogott ATR — célok szűkítve, kockázat kontroll alatt; ATR-floor override: rel_atr 0.0002 < 0.0006 → adaptív RR/TP küszöb; Regime kapu: CHOPPY miatt −10 P-score, pozícióskálázás csökkentve; ATR soft gate: alacsony volatilitás −5 P-score, méret felezve; Strukturális kapu lazítva: momentum erős, BOS hiány engedve; Liquidity gate skipped (no volume proxy available); missing: P_score>=44",,,,,,,
e597752e-55c3-4b5b-9dee-115a60d5e2ac,BTCUSD,2026-04-23T06:54:35Z,no entry,core,28,,1.0,2.0,,,,,,,78255.09,2026-04-23T06:54:08Z,27,,,rule,"Mean reversion bias override (+19.5); Regime filter inaktív; 5M BOS trendirányba (+16.0); ATR nincs rendben (relatív vagy abszolút küszöb); Alacsony realised vol → magasabb RR igény; Range expanzió támogatja a momentumot (+3.0); Fib zóna konfluencia (0.618–0.886) (+18.0); Order flow neutrális (−4.5); Order flow ellentétes irányba tolódik (−4); P-Score reduced by 4.0 due to regime CHOPPY; P-Score reduced by 3.6 due to ATR Soft Gate tolerance; Mesterlövész mód: P-score minimum 35 érvényesítve; Regime kapu: CHOPPY miatt −10 P-score, pozícióskálázás csökkentve; ATR soft gate: alacsony volatilitás −5 P-score, méret felezve; Strukturális kapu lazítva: momentum erős, BOS hiány engedve; Precision limit belépő parkolva 20 percig; missing: P_score>=35",,,,,,,
c1007ffa-8cb1-4d03-9939-545faf410023,USOIL,2026-04-23T06:54:36Z,no entry,core_only,86,,1.0,20.0,94.42928,90.18131397500001,102.92521205,107.173178075,3.0,,94.42928,2026-04-23T06:54:08Z,27,,,rule,Bias(4H→1H)=long (+15.0); EMA21 slope 1.10× küszöb (+12.6); 5M BOS trendirányba (+16.0); ATR erősség 0.91× küszöb (+10.5); Ár az intraday range alsó zónájában (+4.0); Range expanzió támogatja a momentumot (+3.0); USOIL: erős momentum — invalid zóna 2.5×ATR(1h)-re tágítva; Fib zóna konfluencia (0.618–0.886) (+18.0); Order flow neutrális (−4.4); P-Score reduced by 3.7 due to ATR Soft Gate tolerance; USOIL: parabolikus lendület — RR cél 1:1.4 környékére szűkítve; USOIL: európai délelőtt — pozícióméret ×0.85; USOIL: oldalazó szerkezet — H1/M5 BOS nélkül nincs belépő; OFI z-score 1.68 támogatja az irányt; USOIL stop lazítás: ATR1h alapú kockázat ×0.97; Diagnosztika: k1m: utolsó zárt gyertya 10 perc késésben van; Diagnosztika: k1m: jelzés korlátozva 10 perc késés miatt; Diagnosztika: k5m: utolsó zárt gyertya 14 perc késésben van,,,,,,,
