journal_id,asset,analysis_timestamp,signal,mode,probability,model_probability,realtime_confidence,leverage,entry_price,stop_loss,take_profit_1,take_profit_2,risk_reward,initial_risk_abs,spot_price,spot_timestamp,spot_latency_seconds,precision_score,anchor_bias,probability_source,notes,validation_outcome,validation_rr,max_favorable_excursion,max_adverse_excursion,time_to_outcome_minutes,slippage,execution_latency_ms
f6a07844-fc5f-4698-9824-36aada140c83,EURUSD,2026-01-20T17:26:33Z,no entry,core,19,,1.0,30.0,,,,,,,1.17363,2026-01-20T17:25:59Z,34,,,rule,"Intraday bias gate feltételek hiányosak — Micro BOS long  ATR rendben: 1m micro BOS long | Micro BOS short  ATR rendben: 1m micro BOS short; Bias neutrálsávban; Regime filter inaktív; ATR erősség 1.47× küszöb (+13.8); Alacsony realised vol → magasabb RR igény; Fib zóna konfluencia (0.618–0.886) (+18.0); Order flow neutrális (−4.2); P-Score reduced by 4.0 due to regime CHOPPY; EURUSD: ATR-alapú pozícióskálázás ×0.73 — volatilitás kontroll; ATR-floor override: rel_atr 0.0003 < 0.0006 → adaptív RR/TP küszöb; Regime kapu: CHOPPY miatt −10 P-score, pozícióskálázás csökkentve; Strukturális soft gate: 1/3 jel + ATR/spread OK (−6 P-score, size ×0.70); Strukturális kapu lazítva: momentum erős, BOS hiány engedve; P-score soft gate: −1.4 pont tolerancia (size ×0.65, RR +0.15); Liquidity gate skipped (no volume proxy available)",,,,,,,
0c434919-a353-4b88-8226-adc4391d009f,XAGUSD,2026-01-20T17:26:33Z,precision_arming,core,56,,1.0,20.0,,,,,,,94.31939,2026-01-20T17:26:00Z,33,,,rule,"Bias(4H→1H)=long (+15.0); Regime filter inaktív; 5M BOS trendirányba (+16.0); ATR erősség 1.86× küszöb (+16.2); Range expanzió támogatja a momentumot (+3.0); XAG momentum override — stop tágítva erős trendnél; XAGUSD: momentum override — stop távolság 1.3×ATR-re tágítva; Ár 1h EMA21 zónában (+10.0); Order flow neutrális (−4.8); XAGUSD: momentum kitörés — RR cél 1:1.45-re szűkítve; XAG momentum override — pozícióméret csökkentve; XAG: VWAP alatt — long setup türelmet igényel; OFI z-score 1.33 támogatja az irányt; Regime kapu: CHOPPY miatt −10 P-score, pozícióskálázás csökkentve; Liquidity gate skipped (no volume proxy available); Precision trigger kész → limit figyelés; Precision limit belépő parkolva 12 percig",,,,,,,
7d8504d1-a921-4f03-80c6-357da512e17e,NVDA,2026-01-20T17:26:33Z,precision_arming,core,39,,1.0,5.0,,,,,,,179.985,2026-01-20T17:25:59Z,34,,,rule,"Bias override: Intraday 5m BOS short  ATR (momentum nélkül) (+19.5); Regime filter inaktív; HTF sweep ok (+10.0); 5M BOS trendirányba (+16.0); ATR erősség 1.08× küszöb (+11.5); WARNING: No Liquidity Structure (Nearest: 180.423176, Dist: 0.99ATR); Intraday range alsó harmada telített (−7.0); Range expanzió támogatja a momentumot (+3.0); Order flow neutrális (−4.6); OFI toxikus short irányra (−5.1); P-Score reduced by 4.0 due to regime CHOPPY; NVDA: magas napi ATR + momentum — P-score küszöb lazítva; NVDA momentum override — napi ATR támogatja a likviditási lazítást; Regime kapu: CHOPPY miatt −10 P-score, pozícióskálázás csökkentve; Likviditási kapu lazítva erős momentum miatt; NVDA stop igazítás: kockázat ×0.90 ATR; Precision trigger kész → limit figyelés; Precision limit belépő parkolva 12 percig",,,,,,,
a46ef4f1-e06c-4900-abec-00f4aadcdc14,USOIL,2026-01-20T17:26:33Z,no entry,core,0,,1.0,20.0,,,,,,,60.36893,2026-01-20T17:26:00Z,33,,,rule,"Bias(4H→1H)=long (+15.0); Regime filter inaktív; ATR nincs rendben (relatív vagy abszolút küszöb); Intraday range felső harmada telített (−7.0); Order flow neutrális (−4.8); P-Score reduced by 4.0 due to regime CHOPPY; Range guard lazítva: napi sáv teteje, de mikro-range visszahúzódott.; USOIL: 1h ATR <1 USD — P-score küszöb emelve a zajos sáv miatt; USOIL: csökkenő volatilitás — RR cél 1:1.5-re igazítva; USOIL: US nyitás — pozícióméret ×0.75; Regime kapu: CHOPPY miatt −10 P-score, pozícióskálázás csökkentve; ATR soft gate: alacsony volatilitás −5 P-score, méret felezve; Liquidity gate skipped (no volume proxy available); missing: P_score>=27",,,,,,,
8648af3f-b929-42c4-afd4-f76796825e54,BTCUSD,2026-01-20T17:26:33Z,precision_arming,core,87,,1.0,2.0,,,,,,,90180.32,2026-01-20T17:26:00Z,33,,,rule,"Bias override: 1h trend short + momentum támogatás (+19.5); EMA21 slope 1.02× küszöb (+12.1); 5M BOS trendirányba (+16.0); ATR erősség 2.52× küszöb (+20.1); Range expanzió támogatja a momentumot (+3.0); ema9x21+ofi_z=-999.00; Order flow neutrális (−4.2); Sell pressure támogatja a setupot (+5); BTC momentum override — pozícióméret csökkentve; Strukturális kapu lazítva: momentum erős, BOS hiány engedve; Likviditási kapu lazítva erős momentum miatt; BTC ATR stop igazítás: kockázat ×0.90; Precision trigger kész → limit figyelés; Precision limit belépő parkolva 20 percig",,,,,,,
