journal_id,asset,analysis_timestamp,signal,mode,probability,model_probability,realtime_confidence,leverage,entry_price,stop_loss,take_profit_1,take_profit_2,risk_reward,initial_risk_abs,spot_price,spot_timestamp,spot_latency_seconds,precision_score,anchor_bias,probability_source,notes,validation_outcome,validation_rr,max_favorable_excursion,max_adverse_excursion,time_to_outcome_minutes,slippage,execution_latency_ms
5386b1c5-cceb-4df2-b029-d88ac6347d90,NVDA,2026-01-09T14:51:49Z,no entry,core,20,,1.0,5.0,,,,,,,184.7,2026-01-09T14:51:10Z,38,,,rule,"Intraday bias gate feltételek hiányosak — EMA9×21 long  magas ATR: EMA9×21 long | EMA9×21 short  magas ATR: EMA9×21 short | 5m BOS short  ATR (momentum nélkül): 5m BOS short; Bias neutrálsávban; Regime filter inaktív; HTF sweep ok (+10.0); London–NY overlap profil (-1.0); ATR erősség 1.12× küszöb (+11.7); Fib zóna konfluencia (0.618–0.886) (+18.0); Order flow imbalance -0.65 (+5.2); P-Score reduced by 4.0 due to regime CHOPPY; Regime kapu: CHOPPY miatt −10 P-score, pozícióskálázás csökkentve; Bias eltérés: H1 trend ütközik az M5 belépéssel (−15 P-score); Strukturális soft gate: 1/3 jel + ATR/spread OK (−6 P-score, size ×0.70); Strukturális kapu lazítva: momentum erős, BOS hiány engedve; missing: P_score>=26",,,,,,,
b215e14e-c6b7-4b67-92e5-90d37b4e8627,GOLD_CFD,2026-01-09T14:51:49Z,no entry,core,0,,1.0,20.0,,,,,,,4485.58955,2026-01-09T14:51:36Z,12,,,rule,"Bias(4H→1H)=long (+15.0); Regime filter inaktív; HTF sweep ok (+10.0); London–NY overlap profil (-1.0); ATR nincs rendben (relatív vagy abszolút küszöb); Order flow neutrális (−4.9); OFI toxikus long irányra (−4.5); P-Score reduced by 4.0 due to regime CHOPPY; VWAP alatt — GOLD long breakout késleltetve; ATR-floor override: rel_atr 0.0014 < 0.0025 → adaptív RR/TP küszöb; Regime kapu: CHOPPY miatt −10 P-score, pozícióskálázás csökkentve; ATR soft gate: alacsony volatilitás −5 P-score, méret felezve; Liquidity gate skipped (no volume proxy available); missing: P_score>=26, precision_flow_alignment",,,,,,,
bf9aebb8-9d01-4d3f-b75d-c60a3e5dc451,XAGUSD,2026-01-09T14:51:49Z,precision_arming,core,30,,1.0,20.0,,,,,,,78.89846,2026-01-09T14:51:09Z,39,,,rule,"Bias(4H→1H)=long (+15.0); Regime filter inaktív; 5M BOS trendirányba (+16.0); London–NY overlap profil (-1.0); ATR erősség 2.00× küszöb (+17.0); Intraday range felső harmada telített (−7.0); Range expanzió támogatja a momentumot (+3.0); XAG momentum override — stop tágítva erős trendnél; XAGUSD: momentum override — stop távolság 1.3×ATR-re tágítva; Order flow neutrális (−4.1); P-Score reduced by 4.0 due to regime CHOPPY; XAGUSD: momentum kitörés — RR cél 1:1.45-re szűkítve; XAG momentum override — pozícióméret csökkentve; XAGUSD: ATR-alapú pozícióskálázás ×0.55; XAG: VWAP alatt — long setup türelmet igényel; Regime kapu: CHOPPY miatt −10 P-score, pozícióskálázás csökkentve; Strukturális soft gate: 1/3 jel + ATR/spread OK (−6 P-score, size ×0.70); Strukturális kapu lazítva: momentum erős, BOS hiány engedve; Likviditási kapu lazítva erős momentum miatt; Liquidity gate skipped (no volume proxy available); Precision trigger kész → limit figyelés; Precision limit belépő parkolva 20 percig",,,,,,,
4b2e061b-25f0-4aa7-aa32-1530fa3e73e3,EURUSD,2026-01-09T14:51:49Z,no entry,core,30,,1.0,30.0,1.16319,1.1515581,1.18994337,1.2050648400000001,3.6,,1.16319,2026-01-09T14:51:29Z,19,,,rule,"Mean reversion bias override (+19.5); Regime filter inaktív; London–NY overlap profil (-1.0); ATR erősség 2.56× küszöb (+20.4); Alacsony realised vol → magasabb RR igény; Ár az intraday range alsó zónájában (+4.0); Order flow neutrális (−4.5); OFI toxikus long irányra (−5.0); P-Score reduced by 4.0 due to regime CHOPPY; EURUSD: ATR(1h) alacsony — P-score küszöb +6 pontra emelve; EURUSD: Visszafogott ATR — célok szűkítve, kockázat kontroll alatt; EURUSD BOS aktív, de VWAP alatt — türelem; ATR-floor override: rel_atr 0.0004 < 0.0006 → adaptív RR/TP küszöb; Regime kapu: CHOPPY miatt −10 P-score, pozícióskálázás csökkentve; Liquidity gate skipped (no volume proxy available); missing: precision_score>=55",,,,,,,
7008d811-374e-4f2a-a6b6-7e35004492ea,USOIL,2026-01-09T14:51:49Z,no entry,core,31,,1.0,20.0,59.02,59.610200000000006,57.66253999999999,56.89527999999999,3.6,,59.02,2026-01-09T14:51:12Z,37,,,rule,"Mean reversion bias override (+19.5); Regime filter inaktív; London–NY overlap profil (-1.0); ATR erősség 1.65× küszöb (+14.9); Ár az intraday range felső zónájában (+4.0); Order flow neutrális (−3.8); P-Score reduced by 4.0 due to regime CHOPPY; USOIL: 1h ATR <1 USD — P-score küszöb emelve a zajos sáv miatt; USOIL: csökkenő volatilitás — RR cél 1:1.5-re igazítva; USOIL: US nyitás — pozícióméret ×0.75; USOIL: oldalazó szerkezet — 1h BOS nélkül nincs belépő; Regime kapu: CHOPPY miatt −10 P-score, pozícióskálázás csökkentve; P-score soft gate: −1.4 pont tolerancia (size ×0.65, RR +0.15); Liquidity gate skipped (no volume proxy available); missing: precision_flow_alignment",,,,,,,
54f0af99-4386-4286-8091-54fd6d103030,BTCUSD,2026-01-09T14:51:49Z,precision_arming,core,46,,1.0,2.0,,,,,,,89914.12,2026-01-09T14:51:30Z,19,,,rule,"Bias override: Intraday 5m BOS short  ATR (+19.5); Regime filter inaktív; 5M BOS trendirányba (+16.0); London–NY overlap profil (-1.0); ATR erősség 2.21× küszöb (+18.3); Intraday range alsó harmada telített (−7.0); Range expanzió támogatja a momentumot (+3.0); ema9x21+ofi_z=-999.00; Order flow neutrális (−4.8); Sell pressure támogatja a setupot (+5); P-Score reduced by 4.0 due to regime CHOPPY; BTC momentum override — pozícióméret csökkentve; Regime kapu: CHOPPY miatt −10 P-score, pozícióskálázás csökkentve; Strukturális kapu lazítva: momentum erős, BOS hiány engedve; Likviditási kapu lazítva erős momentum miatt; BTC ATR stop igazítás: kockázat ×1.60; Precision trigger kész → limit figyelés; Precision limit belépő parkolva 20 percig",,,,,,,
