journal_id,asset,analysis_timestamp,signal,mode,probability,model_probability,realtime_confidence,leverage,entry_price,stop_loss,take_profit_1,take_profit_2,risk_reward,initial_risk_abs,spot_price,spot_timestamp,spot_latency_seconds,precision_score,anchor_bias,probability_source,notes,validation_outcome,validation_rr,max_favorable_excursion,max_adverse_excursion,time_to_outcome_minutes,slippage,execution_latency_ms
2c1ffb03-5b18-442e-a6aa-3e24cd8e52a5,XAGUSD,2026-04-06T00:21:47Z,precision_arming,core,39,,1.0,20.0,,,,,,,72.15056,2026-04-06T00:21:18Z,29,,,rule,"Bias(4H→1H)=short (+15.0); Regime filter inaktív; 5M BOS trendirányba (+16.0); Nyitási illikviditás hatás (-2.0); ATR erősség 1.58× küszöb (+14.5); Range expanzió támogatja a momentumot (+3.0); XAG momentum override — stop tágítva erős trendnél; XAGUSD: momentum override — stop távolság 1.3×ATR-re tágítva; Order flow neutrális (−4.5); P-Score reduced by 4.0 due to regime CHOPPY; XAGUSD: momentum kitörés — RR cél 1:1.45-re szűkítve; XAGUSD breakout-védelem: gyors BE + 20% giveback limit expanziós szakaszban; XAG momentum override — pozícióméret csökkentve; XAGUSD: ATR-alapú pozícióskálázás ×0.55; XAG: VWAP felett — short setup türelmet igényel; OFI z-score -1.11 támogatja az irányt; Regime kapu: CHOPPY miatt −10 P-score, pozícióskálázás csökkentve; Likviditási kapu lazítva erős momentum miatt; Liquidity gate skipped (no volume proxy available); XAG stop lazítás: ATR1h alapú kockázat ×1.09; Precision trigger kész → limit figyelés; Precision limit belépő parkolva 12 percig",,,,,,,
5191bcfa-100b-41fc-87e3-36fa0a7d2c9e,EURUSD,2026-04-06T00:21:47Z,no entry,core,10,,1.0,30.0,,,,,,,1.15156,2026-04-06T00:21:18Z,29,,,rule,"Bias(4H→1H)=short (+15.0); Regime filter inaktív; Nyitási illikviditás hatás (-2.0); ATR nincs rendben (relatív vagy abszolút küszöb); Alacsony realised vol → magasabb RR igény; Fib zóna konfluencia (0.618–0.886) (+18.0); Order flow neutrális (−4.6); P-Score reduced by 4.0 due to regime CHOPPY; EURUSD: ATR(1h) alacsony — P-score küszöb +6 pontra emelve; EURUSD: Visszafogott ATR — célok szűkítve, kockázat kontroll alatt; EURUSD BOS aktív, de VWAP felett — várakozás; ATR-floor override: rel_atr 0.0002 < 0.0006 → adaptív RR/TP küszöb; Regime kapu: CHOPPY miatt −10 P-score, pozícióskálázás csökkentve; ATR soft gate: alacsony volatilitás −5 P-score, méret felezve; Liquidity gate skipped (no volume proxy available); missing: P_score>=44",,,,,,,
20b20af1-4c37-43d1-91c2-e6e618a835ad,GOLD_CFD,2026-04-06T00:21:47Z,no entry,core,12,,1.0,20.0,,,,,,,4619.35393,2026-04-06T00:21:18Z,29,,,rule,"Bias(4H→1H)=short (+15.0); Regime filter inaktív; 5M BOS trendirányba (+16.0); Nyitási illikviditás hatás (-2.0); ATR nincs rendben (relatív vagy abszolút küszöb); Range expanzió támogatja a momentumot (+3.0); Order flow neutrális (−4.2); P-Score reduced by 4.0 due to regime CHOPPY; VWAP felett — GOLD short breakout várakozik; OFI z-score -1.85 támogatja az irányt; ATR-floor override: rel_atr 0.0016 < 0.0025 → adaptív RR/TP küszöb; Regime kapu: CHOPPY miatt −10 P-score, pozícióskálázás csökkentve; ATR soft gate: alacsony volatilitás −5 P-score, méret felezve; Strukturális kapu lazítva: momentum erős, BOS hiány engedve; Liquidity gate skipped (no volume proxy available); missing: P_score>=30",,,,,,,
ce080151-0ab1-4089-9f87-5e866435c86e,BTCUSD,2026-04-06T00:21:47Z,precision_arming,core,57,,1.0,2.0,,,,,,,69191.65,2026-04-06T00:21:18Z,29,,,rule,"Mean reversion bias override (+19.5); Regime filter inaktív; 5M BOS trendirányba (+16.0); Nyitási illikviditás hatás (-2.0); ATR erősség 3.21× küszöb (+23.0); Ár az intraday range felső zónájában (+4.0); Range expanzió támogatja a momentumot (+3.0); Order flow neutrális (−3.5); P-Score reduced by 4.0 due to regime CHOPPY; Mesterlövész mód: P-score minimum 35 érvényesítve; Regime kapu: CHOPPY miatt −10 P-score, pozícióskálázás csökkentve; Strukturális kapu lazítva: momentum erős, BOS hiány engedve; Likviditási kapu lazítva erős momentum miatt; BTC ATR1h stop igazítás: kockázat ×1.15; Precision trigger kész → limit figyelés; Precision limit belépő parkolva 20 percig",,,,,,,
6755554c-ce3b-4ece-b3dc-94d388d8d09c,USOIL,2026-04-06T00:21:47Z,no entry,core_only,63,,1.0,20.0,113.052438,110.67765330285714,116.85209351542856,118.75192127314286,2.4,,113.052438,2026-04-06T00:21:18Z,29,,,rule,"Bias(4H→1H)=long (+15.0); EMA21 slope 2.45× küszöb (+20.7); HTF sweep ok (+10.0); Nyitási illikviditás hatás (-2.0); ATR nincs rendben (relatív vagy abszolút küszöb); Ár az intraday range alsó zónájában (+4.0); Fib zóna konfluencia (0.618–0.886) (+18.0); Order flow neutrális (−4.6); USOIL: parabolikus lendület — RR cél 1:1.4 környékére szűkítve; USOIL: ázsiai sáv — pozícióméret ×0.70; ATR soft gate: alacsony volatilitás −5 P-score, méret felezve; USOIL stop lazítás: ATR1h alapú kockázat ×0.92; Diagnosztika: k1m: utolsó zárt gyertya 10 perc késésben van; Diagnosztika: k1m: jelzés korlátozva 10 perc késés miatt; Diagnosztika: k5m: utolsó zárt gyertya 11 perc késésben van",,,,,,,
