journal_id,asset,analysis_timestamp,signal,mode,probability,model_probability,realtime_confidence,leverage,entry_price,stop_loss,take_profit_1,take_profit_2,risk_reward,initial_risk_abs,spot_price,spot_timestamp,spot_latency_seconds,precision_score,anchor_bias,probability_source,notes,validation_outcome,validation_rr,max_favorable_excursion,max_adverse_excursion,time_to_outcome_minutes,slippage,execution_latency_ms
fe5b0075-48e8-47ce-a408-f8a4ffb3e31e,GOLD_CFD,2026-01-22T20:56:41Z,no entry,core,0,,1.0,20.0,,,,,,,4920.32038,2026-01-22T20:56:22Z,19,,,rule,"Bias(4H→1H)=long (+15.0); Regime filter inaktív; HTF sweep ok (+10.0); ATR nincs rendben (relatív vagy abszolút küszöb); Alacsony realised vol → magasabb RR igény; Intraday range felső harmada telített (−7.0); Order flow neutrális (−4.6); OFI toxikus long irányra (−3.8); P-Score reduced by 4.0 due to regime CHOPPY; Range guard lazítva: napi sáv teteje, de mikro-range visszahúzódott.; VWAP alatt — GOLD long breakout késleltetve; ATR-floor override: rel_atr 0.0008 < 0.0025 → adaptív RR/TP küszöb; Regime kapu: CHOPPY miatt −10 P-score, pozícióskálázás csökkentve; ATR soft gate: alacsony volatilitás −5 P-score, méret felezve; Liquidity gate skipped (no volume proxy available); missing: P_score>=32",,,,,,,
8026ea45-9e43-4894-8fc2-121844e72e57,EURUSD,2026-01-22T20:56:41Z,no entry,core,10,,1.0,30.0,,,,,,,1.17498,2026-01-22T20:56:23Z,18,,,rule,"Bias(4H→1H)=long (+15.0); Regime filter inaktív; HTF sweep ok (+10.0); 5M BOS trendirányba (+16.0); ATR nincs rendben (relatív vagy abszolút küszöb); Alacsony realised vol → magasabb RR igény; Intraday range felső harmada telített (−7.0); Range expanzió támogatja a momentumot (+3.0); Order flow neutrális (−4.8); OFI toxikus long irányra (−5.0); P-Score reduced by 4.0 due to regime CHOPPY; P-Score reduced by 1.6 due to ATR Soft Gate tolerance; EURUSD: ATR(1h) alacsony — P-score küszöb +6 pontra emelve; EURUSD: Visszafogott ATR — célok szűkítve, kockázat kontroll alatt; EURUSD BOS aktív, de VWAP alatt — türelem; ATR-floor override: rel_atr 0.0002 < 0.0006 → adaptív RR/TP küszöb; Regime kapu: CHOPPY miatt −10 P-score, pozícióskálázás csökkentve; ATR soft gate: alacsony volatilitás −5 P-score, méret felezve; Strukturális kapu lazítva: momentum erős, BOS hiány engedve; Liquidity gate skipped (no volume proxy available); missing: P_score>=37",,,,,,,
d601c1d0-8fc1-4c4d-8d7c-66767d8f0ad6,XAGUSD,2026-01-22T20:56:41Z,precision_arming,core,40,,1.0,20.0,,,,,,,96.12904,2026-01-22T20:56:22Z,19,,,rule,"Bias(4H→1H)=long (+15.0); Regime filter inaktív; 5M BOS trendirányba (+16.0); ATR erősség 0.95× küszöb (+10.7); Intraday range felső harmada telített (−7.0); Range expanzió támogatja a momentumot (+3.0); XAG momentum override — stop tágítva erős trendnél; XAGUSD: momentum override — stop távolság 1.3×ATR-re tágítva; Fib zóna konfluencia (0.618–0.886) (+18.0); Order flow neutrális (−4.8); P-Score reduced by 4.0 due to regime CHOPPY; P-Score reduced by 2.0 due to ATR Soft Gate tolerance; XAGUSD: momentum kitörés — RR cél 1:1.45-re szűkítve; XAG momentum override — pozícióméret csökkentve; XAGUSD: ATR-alapú pozícióskálázás ×0.55; XAG: VWAP alatt — long setup türelmet igényel; Regime kapu: CHOPPY miatt −10 P-score, pozícióskálázás csökkentve; Strukturális soft gate: 1/3 jel + ATR/spread OK (−6 P-score, size ×0.70); Strukturális kapu lazítva: momentum erős, BOS hiány engedve; Liquidity gate skipped (no volume proxy available); Precision trigger kész → limit figyelés; Precision limit belépő parkolva 12 percig",,,,,,,
2e55acf1-ecf5-4848-aace-112222c986bb,BTCUSD,2026-01-22T20:56:41Z,no entry,core,0,,1.0,2.0,,,,,,,89340.3,2026-01-22T20:56:22Z,19,,,rule,"Intraday bias gate feltételek hiányosak — Crypto momentum long: 1m micro BOS long, Momentum volume ráta, ATR gate | Crypto momentum short: 1m micro BOS short, ATR gate | 5m BOS long  ATR: 5m BOS long, ATR gate | 5m BOS short  ATR: ATR gate | Micro BOS short  ATR (momentum nélkül): 1m micro BOS short, ATR gate; Bias neutrálsávban; Regime filter inaktív; ATR nincs rendben (relatív vagy abszolút küszöb); Range expanzió támogatja a momentumot (+3.0); Fib zóna konfluencia (0.618–0.886) (+18.0); Order flow neutrális (−4.6); P-Score reduced by 4.0 due to regime CHOPPY; Regime kapu: CHOPPY miatt −10 P-score, pozícióskálázás csökkentve; ATR soft gate: alacsony volatilitás −5 P-score, méret felezve; Strukturális kapu lazítva: momentum erős, BOS hiány engedve; Position size scale 0.0387 below floor 0.04 — entry blocked; missing: position_sizing_floor, P_score>=25",,,,,,,
3cc6a393-a888-4e0d-ae75-495dce5355cc,USOIL,2026-01-22T20:56:42Z,no entry,core,0,,1.0,20.0,,,,,,,59.30868,2026-01-22T20:56:23Z,18,,,rule,"Intraday bias gate feltételek hiányosak — USOIL retest long  ATR: 5m retest long, ATR gate | USOIL retest short  ATR: 5m retest short, ATR gate; Bias neutrálsávban; Regime filter inaktív; ATR nincs rendben (relatív vagy abszolút küszöb); Fib zóna konfluencia (0.618–0.886) (+18.0); Order flow neutrális (−4.9); P-Score reduced by 4.0 due to regime CHOPPY; USOIL: 1h ATR <1 USD — P-score küszöb emelve a zajos sáv miatt; USOIL: csökkenő volatilitás — RR cél 1:1.5-re igazítva; USOIL: US nyitás — pozícióméret ×0.75; Regime kapu: CHOPPY miatt −10 P-score, pozícióskálázás csökkentve; ATR soft gate: alacsony volatilitás −5 P-score, méret felezve; Liquidity gate skipped (no volume proxy available); missing: P_score>=38",,,,,,,
