journal_id,asset,analysis_timestamp,signal,mode,probability,model_probability,realtime_confidence,leverage,entry_price,stop_loss,take_profit_1,take_profit_2,risk_reward,initial_risk_abs,spot_price,spot_timestamp,spot_latency_seconds,precision_score,anchor_bias,probability_source,notes,validation_outcome,validation_rr,max_favorable_excursion,max_adverse_excursion,time_to_outcome_minutes,slippage,execution_latency_ms
65363208-41f6-4dbc-bd4f-9e6ea4302786,EURUSD,2026-04-01T15:46:23Z,no entry,core,20,,1.0,30.0,,,,,,,1.16113,2026-04-01T15:45:58Z,25,,,rule,"Intraday bias gate feltételek hiányosak — Micro BOS long  ATR rendben: 1m micro BOS long | Micro BOS short  ATR rendben: 1m micro BOS short; Bias neutrálsávban; Regime filter inaktív; HTF sweep ok (+10.0); London–NY overlap profil (-1.0); ATR erősség 1.82× küszöb (+15.9); Alacsony realised vol → magasabb RR igény; Range expanzió támogatja a momentumot (+3.0); Order flow neutrális (−4.8); P-Score reduced by 4.0 due to regime CHOPPY; EURUSD: ATR-alapú pozícióskálázás ×0.72 — volatilitás kontroll; ATR-floor override: rel_atr 0.0004 < 0.0006 → adaptív RR/TP küszöb; Regime kapu: CHOPPY miatt −10 P-score, pozícióskálázás csökkentve; Strukturális kapu lazítva: momentum erős, BOS hiány engedve; Liquidity gate skipped (no volume proxy available); missing: P_score>=38",,,,,,,
bbbf7125-8a97-43cf-86a0-7ae3fcc398bf,GOLD_CFD,2026-04-01T15:46:23Z,no entry,core,11,,1.0,20.0,,,,,,,4784.41489,2026-04-01T15:45:58Z,25,,,rule,"Intraday bias gate feltételek hiányosak — 5m retest long  ATR: ATR gate | 5m retest short  ATR: 5m retest short, ATR gate; Micro bias override: neutral -> micro irány (+19.5); Regime filter inaktív; 5M BOS trendirányba (+16.0); London–NY overlap profil (-1.0); ATR nincs rendben (relatív vagy abszolút küszöb); Intraday range felső harmada telített (−7.0); Range expanzió támogatja a momentumot (+3.0); Order flow neutrális (−3.7); P-Score reduced by 4.0 due to regime CHOPPY; Intraday P-score lazítás: micro-bias long elsőbbséget kap (−1.5); Mesterlövész mód: P-score minimum 30 érvényesítve; VWAP alatt — GOLD long breakout késleltetve; OFI z-score 1.82 támogatja az irányt; ATR-floor override: rel_atr 0.0015 < 0.0025 → adaptív RR/TP küszöb; Regime kapu: CHOPPY miatt −10 P-score, pozícióskálázás csökkentve; ATR soft gate: alacsony volatilitás −5 P-score, méret felezve; Liquidity gate skipped (no volume proxy available); missing: P_score>=30",,,,,,,
b393118e-3ea9-47fe-8bcb-e5ae282f4754,NVDA,2026-04-01T15:46:23Z,no entry,core,21,,1.0,5.0,,,,,,,176.855,2026-04-01T15:45:58Z,25,,,rule,"Mean reversion bias override (+19.5); Regime filter inaktív; 5M BOS trendirányba (+16.0); London–NY overlap profil (-1.0); ATR nincs rendben (relatív vagy abszolút küszöb); WARNING: No Liquidity Structure (Nearest: 178.568830, Dist: 4.49ATR); Ár az intraday range felső zónájában (+4.0); Range expanzió támogatja a momentumot (+3.0); Order flow neutrális (−4.1); P-Score reduced by 4.0 due to regime CHOPPY; NVDA: magas napi ATR + momentum — P-score küszöb lazítva; Mesterlövész mód: P-score minimum 35 érvényesítve; Mean-revert setup: méret ×0.70, RR +0.20; VWAP túlnyúlás → mean reversion setup; NVDA momentum override — napi ATR támogatja a likviditási lazítást; OFI z-score -1.29 támogatja az irányt; Regime kapu: CHOPPY miatt −10 P-score, pozícióskálázás csökkentve; ATR soft gate: alacsony volatilitás −5 P-score, méret felezve; Position size scale 0.0437 below floor 0.05 — entry blocked; Likviditási kapu lazítva erős momentum miatt; missing: position_sizing_floor, P_score>=35, precision_flow_alignment",,,,,,,
242ce777-8bb1-4552-b500-2dfb5919c5cc,XAGUSD,2026-04-01T15:46:23Z,precision_arming,core,35,,1.0,20.0,,,,,,,75.77047,2026-04-01T15:45:58Z,25,,,rule,"Bias override: Intraday Micro BOS long  ATR (ezüst) (+19.5); Regime filter inaktív; 5M BOS trendirányba (+16.0); London–NY overlap profil (-1.0); ATR erősség 1.17× küszöb (+12.0); Intraday range felső harmada telített (−7.0); Range expanzió támogatja a momentumot (+3.0); XAG momentum override — stop tágítva erős trendnél; XAGUSD: momentum override — stop távolság 1.3×ATR-re tágítva; Order flow neutrális (−4.1); P-Score reduced by 4.0 due to regime CHOPPY; Intraday P-score lazítás: micro-bias long elsőbbséget kap (−1.5); Mesterlövész mód: P-score minimum 28 érvényesítve; XAGUSD: momentum kitörés — RR cél 1:1.45-re szűkítve; XAGUSD breakout-védelem: gyors BE + 20% giveback limit expanziós szakaszban; XAG momentum override — pozícióméret csökkentve; XAGUSD: ATR-alapú pozícióskálázás ×0.55; XAG: VWAP alatt — long setup türelmet igényel; OFI z-score 1.99 támogatja az irányt; Regime kapu: CHOPPY miatt −10 P-score, pozícióskálázás csökkentve; Liquidity gate skipped (no volume proxy available); XAG stop lazítás: ATR1h alapú kockázat ×1.09; Precision trigger kész → limit figyelés; Precision limit belépő parkolva 12 percig",,,,,,,
d81a3fd1-ccf1-41bf-81b2-5d030b45f818,USOIL,2026-04-01T15:46:23Z,precision_arming,core,88,,1.0,20.0,,,,,,,100.28717,2026-04-01T15:45:58Z,25,,,rule,Bias(4H→1H)=long (+15.0); EMA21 slope 1.14× küszöb (+12.9); 5M BOS trendirányba (+16.0); London–NY overlap profil (-1.0); ATR erősség 1.44× küszöb (+13.7); Range expanzió támogatja a momentumot (+3.0); USOIL: erős momentum — invalid zóna 2.5×ATR(1h)-re tágítva; Fib zóna konfluencia (0.618–0.886) (+18.0); Order flow neutrális (−4.1); USOIL: 1h ATR ≥1.5 USD — RR cél 1:2-re emelve; Liquidity gate skipped (no volume proxy available); USOIL stop lazítás: ATR1h alapú kockázat ×0.97; Precision trigger kész → limit figyelés; Precision limit belépő parkolva 12 percig,,,,,,,
7f4a165d-df2e-4e5e-b630-478b2ab1772a,BTCUSD,2026-04-01T15:46:23Z,precision_arming,core,36,,1.0,2.0,,,,,,,68741.03,2026-04-01T15:45:58Z,25,,,rule,"Mean reversion bias override (+19.5); Regime filter inaktív; London–NY overlap profil (-1.0); ATR erősség 1.22× küszöb (+12.3); Ár az intraday range felső zónájában (+4.0); Fib zóna konfluencia (0.618–0.886) (+18.0); Order flow neutrális (−4.4); Order flow ellentétes irányba tolódik (−4); OFI toxikus short irányra (−5.5); P-Score reduced by 4.0 due to regime CHOPPY; Mesterlövész mód: P-score minimum 35 érvényesítve; Regime kapu: CHOPPY miatt −10 P-score, pozícióskálázás csökkentve; BTC ATR1h stop igazítás: kockázat ×1.15; Precision trigger kész → limit figyelés; Precision limit belépő parkolva 20 percig",,,,,,,
