journal_id,asset,analysis_timestamp,signal,mode,probability,model_probability,realtime_confidence,leverage,entry_price,stop_loss,take_profit_1,take_profit_2,risk_reward,initial_risk_abs,spot_price,spot_timestamp,spot_latency_seconds,precision_score,anchor_bias,probability_source,notes,validation_outcome,validation_rr,max_favorable_excursion,max_adverse_excursion,time_to_outcome_minutes,slippage,execution_latency_ms
a62f8f6c-4336-4ffd-91f1-0c645c48120e,GOLD_CFD,2026-01-02T15:58:46Z,no entry,core,44,,1.0,20.0,4338.57891,4295.1931209,4442.70480384,4503.44490858,3.8,,4338.57891,2026-01-02T15:58:16Z,29,,,rule,"Mean reversion bias override (+19.5); Regime filter inaktív; 5M BOS trendirányba (+16.0); London–NY overlap profil (-1.0); ATR nincs rendben (relatív vagy abszolút küszöb); Ár az intraday range alsó zónájában (+4.0); Range expanzió támogatja a momentumot (+3.0); Fib zóna konfluencia (0.618–0.886) (+18.0); P-Score reduced by 4.0 due to regime CHOPPY; VWAP alatt — GOLD long breakout késleltetve; ATR-floor override: rel_atr 0.0015 < 0.0025 → adaptív RR/TP küszöb; Regime kapu: CHOPPY miatt −10 P-score, pozícióskálázás csökkentve; ATR soft gate: alacsony volatilitás −5 P-score, méret felezve; Strukturális kapu lazítva: momentum erős, BOS hiány engedve; Liquidity gate skipped (no volume proxy available); Order-flow gates skipped (no tick/imbalance data); GOLD stop lazítás: ATR alapú kockázat ×2.00",,,,,,,
3dddf8b6-5e29-4504-a584-0504e9346f00,XAGUSD,2026-01-02T15:58:46Z,no entry,core,72,,1.0,20.0,72.8994,72.170406,74.5760862,75.5237784,3.6,,72.8994,2026-01-02T15:58:00Z,45,,,rule,"Mean reversion bias override (+19.5); Regime filter inaktív; 5M BOS trendirányba (+16.0); London–NY overlap profil (-1.0); ATR erősség 3.91× küszöb (+23.0); Ár az intraday range alsó zónájában (+4.0); Range expanzió támogatja a momentumot (+3.0); XAG momentum override — stop tágítva erős trendnél; XAGUSD: momentum override — stop távolság 1.3×ATR-re tágítva; Ár 1h EMA21 zónában (+10.0); P-Score reduced by 4.0 due to regime CHOPPY; XAGUSD: momentum kitörés — RR cél 1:1.45-re szűkítve; XAG momentum override — pozícióméret csökkentve; XAGUSD: ATR-alapú pozícióskálázás ×0.55; XAG: VWAP alatt — long setup türelmet igényel; Regime kapu: CHOPPY miatt −10 P-score, pozícióskálázás csökkentve; Strukturális kapu lazítva: momentum erős, BOS hiány engedve; Liquidity gate skipped (no volume proxy available); Order-flow gates skipped (no tick/imbalance data)",,,,,,,
47215bb2-b586-4947-b1d9-e5fd9d64d3f4,NVDA,2026-01-02T15:58:46Z,no entry,core,62,,0.9999999999999998,5.0,189.77,187.87230000000002,194.13470999999998,196.60171999999997,3.6,,189.77,2026-01-02T15:58:03Z,42,,,rule,"Bias(4H→1H)=long (+15.0); Regime filter inaktív; HTF sweep ok (+10.0); London–NY overlap profil (-1.0); ATR erősség 2.65× küszöb (+20.9); Ár az intraday range alsó zónájában (+4.0); Fib zóna konfluencia (0.618–0.886) (+18.0); Order flow neutrális (−1.7); P-Score reduced by 4.0 due to regime CHOPPY; Regime kapu: CHOPPY miatt −10 P-score, pozícióskálázás csökkentve; NVDA stop igazítás: kockázat ×0.90 ATR; missing: precision_flow_alignment",,,,,,,
f79ab598-6fb4-44de-bde6-6b301fd4e000,BTCUSD,2026-01-02T15:58:46Z,no entry,core,35,,1.0,2.0,,,,,,,89377.99,2026-01-02T15:58:38Z,8,,,rule,"Intraday bias gate feltételek hiányosak — Crypto momentum long: 1m micro BOS long, Momentum volume ráta | Crypto momentum short: 1m micro BOS short, Momentum volume ráta | 5m BOS long  ATR: 5m BOS long | 5m BOS short  ATR: 5m BOS short | Micro BOS short  ATR (momentum nélkül): 1m micro BOS short; Bias neutrálsávban; Regime filter inaktív; HTF sweep ok (+10.0); London–NY overlap profil (-1.0); ATR erősség 3.65× küszöb (+23.0); Range expanzió támogatja a momentumot (+3.0); Fib zóna konfluencia (0.618–0.886) (+18.0); P-Score reduced by 4.0 due to regime CHOPPY; Regime kapu: CHOPPY miatt −10 P-score, pozícióskálázás csökkentve; Bias eltérés: H1 trend ütközik az M5 belépéssel (−15 P-score); Strukturális kapu lazítva: momentum erős, BOS hiány engedve",,,,,,,
e867d667-32b7-4748-9d48-41c22c042ddc,USOIL,2026-01-02T15:58:46Z,no entry,core,28,,1.0,20.0,,,,,,,56.64,2026-01-02T15:58:02Z,44,,,rule,"Bias(4H→1H)=short (+15.0); Regime filter inaktív; HTF sweep ok (+10.0); London–NY overlap profil (-1.0); ATR erősség 1.48× küszöb (+13.9); Intraday range alsó harmada telített (−7.0); P-Score reduced by 4.0 due to regime CHOPPY; Range guard lazítva: napi sáv alja, de mikro-range visszapattant.; USOIL: 1h ATR <1 USD — P-score küszöb emelve a zajos sáv miatt; USOIL: csökkenő volatilitás — RR cél 1:1.5-re igazítva; USOIL: US nyitás — pozícióméret ×0.75; Regime kapu: CHOPPY miatt −10 P-score, pozícióskálázás csökkentve; Liquidity gate skipped (no volume proxy available); Order-flow gates skipped (no tick/imbalance data); missing: P_score>=36, precision_trigger_sync",,,,,,,
