journal_id,asset,analysis_timestamp,signal,mode,probability,model_probability,realtime_confidence,leverage,entry_price,stop_loss,take_profit_1,take_profit_2,risk_reward,initial_risk_abs,spot_price,spot_timestamp,spot_latency_seconds,precision_score,anchor_bias,probability_source,notes,validation_outcome,validation_rr,max_favorable_excursion,max_adverse_excursion,time_to_outcome_minutes,slippage,execution_latency_ms
269e842d-375a-49ba-a765-bbc5bc2bb102,GOLD_CFD,2026-03-04T19:11:46Z,no entry,core,0,,1.0,20.0,,,,,,,5133.07733,2026-03-04T19:11:13Z,33,,,rule,"Intraday bias gate feltételek hiányosak — 5m retest long  ATR: 5m retest long, ATR gate | 5m retest short  ATR: 5m retest short, ATR gate; Bias neutrálsávban; Regime filter inaktív; ATR nincs rendben (relatív vagy abszolút küszöb); Ár 1h EMA21 zónában (+10.0); Order flow neutrális (−4.5); ATR-floor override: rel_atr 0.0013 < 0.0025 → adaptív RR/TP küszöb; Regime kapu: CHOPPY miatt −10 P-score, pozícióskálázás csökkentve; ATR soft gate: alacsony volatilitás −5 P-score, méret felezve; Liquidity gate skipped (no volume proxy available); missing: P_score>=30",,,,,,,
8b6b31da-e93f-447f-9f0a-f184a7f1f971,EURUSD,2026-03-04T19:11:46Z,no entry,core,0,,1.0,30.0,,,,,,,1.16273,2026-03-04T19:11:13Z,33,,,rule,"Intraday bias gate feltételek hiányosak — Micro BOS long  ATR rendben: 1m micro BOS long, ATR gate | Micro BOS short  ATR rendben: 1m micro BOS short, ATR gate; Bias neutrálsávban; Regime filter inaktív; ATR nincs rendben (relatív vagy abszolút küszöb); Alacsony realised vol → magasabb RR igény; Fib zóna konfluencia (0.618–0.886) (+18.0); Order flow neutrális (−4.9); P-Score reduced by 4.0 due to regime CHOPPY; P-Score reduced by 0.4 due to ATR Soft Gate tolerance; EURUSD: Magas volatilitás → RR célok 1:2 környékére szélesítve; EURUSD: ATR-alapú pozícióskálázás ×0.63 — volatilitás kontroll; ATR-floor override: rel_atr 0.0002 < 0.0006 → adaptív RR/TP küszöb; Regime kapu: CHOPPY miatt −10 P-score, pozícióskálázás csökkentve; ATR soft gate: alacsony volatilitás −5 P-score, méret felezve; Position size scale 0.0393 below floor 0.05 — entry blocked; Liquidity gate skipped (no volume proxy available); missing: position_sizing_floor, P_score>=38",,,,,,,
c5dabea6-43b4-42d9-9a52-2f1e7c80f056,XAGUSD,2026-03-04T19:11:46Z,no entry,core,20,,1.0,20.0,,,,,,,83.30307,2026-03-04T19:11:13Z,33,,,rule,"Intraday bias gate feltételek hiányosak — Micro BOS long  ATR (ezüst): 1m micro BOS long | Micro BOS short  ATR (ezüst): 1m micro BOS short; Bias neutrálsávban; Regime filter inaktív; ATR erősség 1.18× küszöb (+12.1); Range expanzió támogatja a momentumot (+3.0); XAG momentum override — stop tágítva erős trendnél; XAGUSD: momentum override — stop távolság 1.3×ATR-re tágítva; Fib zóna konfluencia (0.618–0.886) (+18.0); Order flow neutrális (−4.5); P-Score reduced by 4.0 due to regime CHOPPY; XAGUSD: momentum kitörés — RR cél 1:1.45-re szűkítve; XAGUSD breakout-védelem: gyors BE + 20% giveback limit expanziós szakaszban; XAG momentum override — pozícióméret csökkentve; XAGUSD: ATR-alapú pozícióskálázás ×0.55; Regime kapu: CHOPPY miatt −10 P-score, pozícióskálázás csökkentve; Strukturális soft gate: 1/3 jel + ATR/spread OK (−6 P-score, size ×0.70); Strukturális kapu lazítva: momentum erős, BOS hiány engedve; Liquidity gate skipped (no volume proxy available); missing: P_score>=28",,,,,,,
7f2a1b82-6ea7-4930-956e-efd9622badca,NVDA,2026-03-04T19:11:46Z,no entry,core,21,,1.0,5.0,,,,,,,184.19,2026-03-04T19:11:13Z,33,,,rule,"Mean reversion bias override (+19.5); Regime filter inaktív; 5M BOS trendirányba (+16.0); ATR nincs rendben (relatív vagy abszolút küszöb); WARNING: No Liquidity Structure (Nearest: 184.866880, Dist: 1.56ATR); Ár az intraday range felső zónájában (+4.0); Range expanzió támogatja a momentumot (+3.0); Order flow neutrális (−4.7); P-Score reduced by 4.0 due to regime CHOPPY; NVDA: magas napi ATR + momentum — P-score küszöb lazítva; Mesterlövész mód: P-score minimum 35 érvényesítve; Mean-revert setup: méret ×0.70, RR +0.20; VWAP túlnyúlás → mean reversion setup; NVDA momentum override — napi ATR támogatja a likviditási lazítást; Regime kapu: CHOPPY miatt −10 P-score, pozícióskálázás csökkentve; ATR soft gate: alacsony volatilitás −5 P-score, méret felezve; Position size scale 0.0437 below floor 0.05 — entry blocked; Likviditási kapu lazítva erős momentum miatt; missing: position_sizing_floor, P_score>=35, precision_flow_alignment",,,,,,,
6358105f-4379-4f84-ae4e-ddfd6247afa0,USOIL,2026-03-04T19:11:46Z,no entry,core_only,35,,1.0,20.0,74.74365,73.3363858,77.5581784,78.9654426,3.0,,74.74365,2026-03-04T19:11:13Z,33,,,rule,"Bias(4H→1H)=long (+15.0); Regime filter inaktív; ATR erősség 1.12× küszöb (+11.7); Fib zóna konfluencia (0.618–0.886) (+18.0); Order flow neutrális (−4.8); USOIL: 1h ATR ≥1.5 USD — RR cél 1:2-re emelve; USOIL: oldalazó szerkezet — H1/M5 BOS nélkül nincs belépő; Regime kapu: CHOPPY miatt −10 P-score, pozícióskálázás csökkentve; Strukturális soft gate: 1/3 jel + ATR/spread OK (−6 P-score, size ×0.70); Strukturális kapu lazítva: momentum erős, BOS hiány engedve; P-score soft gate: −1.1 pont tolerancia (size ×0.65, RR +0.15); USOIL stop lazítás: ATR1h alapú kockázat ×0.92; Diagnosztika: k1m: utolsó zárt gyertya 10 perc késésben van; Diagnosztika: k1m: jelzés korlátozva 10 perc késés miatt; Diagnosztika: k5m: utolsó zárt gyertya 11 perc késésben van",,,,,,,
09a2d208-37dc-46aa-b01b-0b5d23d1d8b8,BTCUSD,2026-03-04T19:11:46Z,precision_arming,core,90,,1.0,2.0,,,,,,,73713.0,2026-03-04T19:11:13Z,33,,,rule,"Bias override: 1h trend long + momentum támogatás (+19.5); EMA21 slope 2.70× küszöb (+21.0); HTF sweep ok (+10.0); 5M BOS trendirányba (+16.0); ATR erősség 1.02× küszöb (+11.1); Intraday range felső harmada telített (−7.0); Range expanzió támogatja a momentumot (+3.0); Order flow neutrális (−3.8); Buy pressure támogatja a setupot (+5); Mesterlövész mód: P-score minimum 35 érvényesítve; Strukturális kapu lazítva: momentum erős, BOS hiány engedve; BTC ATR1h stop igazítás: kockázat ×1.15; Precision trigger kész → limit figyelés; Precision limit belépő parkolva 20 percig",,,,,,,
