journal_id,asset,analysis_timestamp,signal,mode,probability,model_probability,realtime_confidence,leverage,entry_price,stop_loss,take_profit_1,take_profit_2,risk_reward,initial_risk_abs,spot_price,spot_timestamp,spot_latency_seconds,precision_score,anchor_bias,probability_source,notes,validation_outcome,validation_rr,max_favorable_excursion,max_adverse_excursion,time_to_outcome_minutes,slippage,execution_latency_ms
83008549-51c9-44a1-b6d9-b6efbbf302aa,GOLD_CFD,2026-04-14T18:26:58Z,no entry,core,0,,1.0,20.0,,,,,,,4835.23808,2026-04-14T18:26:25Z,33,,,rule,"Intraday bias gate feltételek hiányosak — 5m retest long  ATR: 5m retest long, ATR gate | 5m retest short  ATR: 5m retest short, ATR gate; Bias neutrálsávban; Regime filter inaktív; ATR nincs rendben (relatív vagy abszolút küszöb); Alacsony realised vol → magasabb RR igény; Order flow neutrális (−4.2); P-Score reduced by 4.0 due to regime CHOPPY; ATR-floor override: rel_atr 0.0009 < 0.0025 → adaptív RR/TP küszöb; Regime kapu: CHOPPY miatt −10 P-score, pozícióskálázás csökkentve; ATR soft gate: alacsony volatilitás −5 P-score, méret felezve; Liquidity gate skipped (no volume proxy available); missing: P_score>=30",,,,,,,
a9e93c9b-94eb-4bb2-932c-7051e8f9aad5,XAGUSD,2026-04-14T18:26:58Z,no entry,core,38,,1.0,20.0,,,,,,,78.98214,2026-04-14T18:26:25Z,33,,,rule,"Intraday bias gate feltételek hiányosak — Micro BOS long  ATR (ezüst): 1m micro BOS long, ATR gate | Micro BOS short  ATR (ezüst): 1m micro BOS short, ATR gate; Bias neutrálsávban; EMA21 slope 1.03× küszöb (+12.2); HTF sweep ok (+10.0); ATR nincs rendben (relatív vagy abszolút küszöb); Fib zóna konfluencia (0.618–0.886) (+18.0); Order flow neutrális (−4.4); XAGUSD: visszafogott ATR — RR cél 1:1.7-re emelve; XAGUSD breakout-védelem: gyors BE + 20% giveback limit expanziós szakaszban; XAGUSD: ATR-alapú pozícióskálázás ×0.70; ATR-floor override: rel_atr 0.0013 < 0.0018 → adaptív RR/TP küszöb; ATR soft gate: alacsony volatilitás −5 P-score, méret felezve; Liquidity gate skipped (no volume proxy available)",,,,,,,
9de31df7-fa00-4829-a993-09fe17a5050f,EURUSD,2026-04-14T18:26:58Z,no entry,core,13,,1.0,30.0,,,,,,,1.17937,2026-04-14T18:26:25Z,33,,,rule,"Bias(4H→1H)=long (+15.0); Regime filter inaktív; ATR nincs rendben (relatív vagy abszolút küszöb); Alacsony realised vol → magasabb RR igény; Ár az intraday range alsó zónájában (+4.0); Fib zóna konfluencia (0.618–0.886) (+18.0); Order flow neutrális (−4.3); OFI toxikus long irányra (−3.4); P-Score reduced by 4.0 due to regime CHOPPY; EURUSD: ATR(1h) alacsony — P-score küszöb +6 pontra emelve; EURUSD: Visszafogott ATR — célok szűkítve, kockázat kontroll alatt; EURUSD BOS aktív, de VWAP alatt — türelem; ATR-floor override: rel_atr 0.0002 < 0.0006 → adaptív RR/TP küszöb; Regime kapu: CHOPPY miatt −10 P-score, pozícióskálázás csökkentve; ATR soft gate: alacsony volatilitás −5 P-score, méret felezve; Liquidity gate skipped (no volume proxy available); missing: P_score>=44",,,,,,,
4bf55910-193d-4777-b757-f3ad849198db,USOIL,2026-04-14T18:26:58Z,precision_arming,core,81,,1.0,20.0,,,,,,,91.88746,2026-04-14T18:26:25Z,33,,,rule,Bias override: 1h trend short + momentum támogatás (+19.5); EMA21 slope 1.76× küszöb (+16.6); HTF sweep ok (+10.0); 5M BOS trendirányba (+16.0); ATR erősség 1.23× küszöb (+12.4); Intraday range alsó harmada telített (−7.0); Range expanzió támogatja a momentumot (+3.0); USOIL: erős momentum — invalid zóna 2.5×ATR(1h)-re tágítva; Order flow neutrális (−4.9); USOIL: 1h ATR ≥1.5 USD — RR cél 1:2-re emelve; Liquidity gate skipped (no volume proxy available); USOIL stop lazítás: ATR1h alapú kockázat ×0.97; Precision trigger kész → limit figyelés; Precision limit belépő parkolva 12 percig,,,,,,,
95ac6b7f-bb73-4db4-9d05-abb1f028c225,BTCUSD,2026-04-14T18:26:58Z,no entry,core,25,,1.0,2.0,,,,,,,74549.26,2026-04-14T18:26:25Z,33,,,rule,"Bias(4H→1H)=long (+15.0); Regime filter inaktív; ATR erősség 1.02× küszöb (+11.1); Ár az intraday range alsó zónájában (+4.0); Ár 1h EMA21 zónában (+10.0); Order flow neutrális (−4.9); Order flow ellentétes irányba tolódik (−4); OFI toxikus long irányra (−3.7); P-Score reduced by 4.0 due to regime CHOPPY; Mesterlövész mód: P-score minimum 35 érvényesítve; Regime kapu: CHOPPY miatt −10 P-score, pozícióskálázás csökkentve; Precision limit belépő parkolva 20 percig; missing: P_score>=35",,,,,,,
