journal_id,asset,analysis_timestamp,signal,mode,probability,model_probability,realtime_confidence,leverage,entry_price,stop_loss,take_profit_1,take_profit_2,risk_reward,initial_risk_abs,spot_price,spot_timestamp,spot_latency_seconds,precision_score,anchor_bias,probability_source,notes,validation_outcome,validation_rr,max_favorable_excursion,max_adverse_excursion,time_to_outcome_minutes,slippage,execution_latency_ms
1374f51a-e32b-44c0-b224-588cea55c8de,GOLD_CFD,2026-04-28T09:31:39Z,no entry,core,6,,1.0,20.0,,,,,,,4616.86891,2026-04-28T09:31:12Z,27,,,rule,"Bias(4H→1H)=short (+15.0); Regime filter inaktív; 5M BOS trendirányba (+16.0); ATR nincs rendben (relatív vagy abszolút küszöb); Alacsony realised vol → magasabb RR igény; Intraday range alsó harmada telített (−7.0); Range expanzió támogatja a momentumot (+3.0); Order flow neutrális (−4.8); P-Score reduced by 4.0 due to regime CHOPPY; VWAP felett — GOLD short breakout várakozik; ATR-floor override: rel_atr 0.0010 < 0.0025 → adaptív RR/TP küszöb; Regime kapu: CHOPPY miatt −10 P-score, pozícióskálázás csökkentve; ATR soft gate: alacsony volatilitás −5 P-score, méret felezve; Strukturális kapu lazítva: momentum erős, BOS hiány engedve; Liquidity gate skipped (no volume proxy available); missing: P_score>=30",,,,,,,
8538f064-3608-4464-bc15-c60e04112785,XAGUSD,2026-04-28T09:31:39Z,precision_arming,core,30,,1.0,20.0,,,,,,,73.21114,2026-04-28T09:31:12Z,27,,,rule,"Bias(4H→1H)=short (+15.0); Regime filter inaktív; 5M BOS trendirányba (+16.0); ATR erősség 1.00× küszöb (+11.0); Intraday range alsó harmada telített (−7.0); Range expanzió támogatja a momentumot (+3.0); XAG momentum override — stop tágítva erős trendnél; XAGUSD: momentum override — stop távolság 1.3×ATR-re tágítva; Order flow neutrális (−4.4); P-Score reduced by 4.0 due to regime CHOPPY; P-Score reduced by 0.2 due to ATR Soft Gate tolerance; XAGUSD: momentum kitörés — RR cél 1:1.45-re szűkítve; XAGUSD breakout-védelem: gyors BE + 20% giveback limit expanziós szakaszban; XAG momentum override — pozícióméret csökkentve; XAGUSD: ATR-alapú pozícióskálázás ×0.55; XAG: VWAP felett — short setup türelmet igényel; Regime kapu: CHOPPY miatt −10 P-score, pozícióskálázás csökkentve; Strukturális kapu lazítva: momentum erős, BOS hiány engedve; Liquidity gate skipped (no volume proxy available); XAG stop lazítás: ATR1h alapú kockázat ×1.09; Precision trigger kész → limit figyelés; Precision limit belépő parkolva 12 percig",,,,,,,
e28bc252-70ff-4db2-8665-0546c8524ea3,EURUSD,2026-04-28T09:31:39Z,no entry,core,4,,1.0,30.0,,,,,,,1.16957,2026-04-28T09:31:12Z,27,,,rule,"Mean reversion bias override (+19.5); Regime filter inaktív; ATR nincs rendben (relatív vagy abszolút küszöb); Alacsony realised vol → magasabb RR igény; Ár az intraday range alsó zónájában (+4.0); Order flow neutrális (−4.0); P-Score reduced by 4.0 due to regime CHOPPY; EURUSD: ATR(1h) alacsony — P-score küszöb +6 pontra emelve; EURUSD: Visszafogott ATR — célok szűkítve, kockázat kontroll alatt; EURUSD BOS aktív, de VWAP alatt — türelem; ATR-floor override: rel_atr 0.0002 < 0.0006 → adaptív RR/TP küszöb; Regime kapu: CHOPPY miatt −10 P-score, pozícióskálázás csökkentve; ATR soft gate: alacsony volatilitás −5 P-score, méret felezve; Liquidity gate skipped (no volume proxy available); missing: P_score>=44",,,,,,,
7718b530-e6fe-4937-bc87-64c5557c48a5,BTCUSD,2026-04-28T09:31:39Z,no entry,core,0,,1.0,2.0,,,,,,,76786.0,2026-04-28T09:31:12Z,27,,,rule,"Intraday bias gate feltételek hiányosak — Crypto momentum long: 1m micro BOS long, Momentum volume ráta, ATR gate | Crypto momentum short: 1m micro BOS short, Momentum volume ráta, ATR gate | 5m BOS long  ATR: 5m BOS long, ATR gate | 5m BOS short  ATR: ATR gate | Micro BOS short  ATR (momentum nélkül): 1m micro BOS short, ATR gate; Bias neutrálsávban; Regime filter inaktív; ATR nincs rendben (relatív vagy abszolút küszöb); Alacsony realised vol → magasabb RR igény; Fib zóna konfluencia (0.618–0.886) (+18.0); Order flow neutrális (−4.4); P-Score reduced by 1.7 due to ATR Soft Gate tolerance; Mesterlövész mód: P-score minimum 35 érvényesítve; ATR-floor override: rel_atr 0.0010 < 0.0012 → adaptív RR/TP küszöb; Regime kapu: CHOPPY miatt −10 P-score, pozícióskálázás csökkentve; ATR soft gate: alacsony volatilitás −5 P-score, méret felezve; missing: P_score>=35",,,,,,,
b6d20964-274b-403a-a89c-b23efb5e1473,USOIL,2026-04-28T09:31:39Z,no entry,core_only,65,,1.0,20.0,99.55329,96.289692051,106.080485898,109.34408384700001,3.0,,99.55329,2026-04-28T09:31:12Z,27,,,rule,"Bias(4H→1H)=long (+15.0); Regime filter inaktív; HTF sweep ok (+10.0); 5M BOS trendirányba (+16.0); ATR erősség 1.03× küszöb (+11.2); Range expanzió támogatja a momentumot (+3.0); USOIL: erős momentum — invalid zóna 2.5×ATR(1h)-re tágítva; Fib zóna konfluencia (0.618–0.886) (+18.0); Order flow neutrális (−4.8); P-Score reduced by 4.0 due to regime CHOPPY; USOIL: parabolikus lendület — RR cél 1:1.4 környékére szűkítve; USOIL: európai délelőtt — pozícióméret ×0.85; Regime kapu: CHOPPY miatt −10 P-score, pozícióskálázás csökkentve; USOIL stop lazítás: ATR1h alapú kockázat ×0.97; Diagnosztika: k1m: utolsó zárt gyertya 11 perc késésben van; Diagnosztika: k1m: jelzés korlátozva 11 perc késés miatt; Diagnosztika: k5m: utolsó zárt gyertya 11 perc késésben van",,,,,,,
