journal_id,asset,analysis_timestamp,signal,mode,probability,model_probability,realtime_confidence,leverage,entry_price,stop_loss,take_profit_1,take_profit_2,risk_reward,initial_risk_abs,spot_price,spot_timestamp,spot_latency_seconds,precision_score,anchor_bias,probability_source,notes,validation_outcome,validation_rr,max_favorable_excursion,max_adverse_excursion,time_to_outcome_minutes,slippage,execution_latency_ms
d77efe21-d94a-4192-9a1b-c0d8c05c0b4a,NVDA,2026-02-18T19:32:01Z,no entry,core,26,,1.0,5.0,,,,,,,188.56,2026-02-18T19:31:29Z,32,,,rule,"Bias(4H→1H)=long (+15.0); Regime filter inaktív; 5M BOS trendirányba (+16.0); ATR nincs rendben (relatív vagy abszolút küszöb); WARNING: No Liquidity Structure (Nearest: 188.017503, Dist: 1.62ATR); Range expanzió támogatja a momentumot (+3.0); Fib zóna konfluencia (0.618–0.886) (+18.0); Order flow neutrális (−3.5); OFI toxikus long irányra (−5.6); P-Score reduced by 4.0 due to regime CHOPPY; NVDA: magas napi ATR + momentum — P-score küszöb lazítva; Mesterlövész mód: P-score minimum 35 érvényesítve; NVDA: zárási VWAP felett stabilizáció — long likviditás; Regime kapu: CHOPPY miatt −10 P-score, pozícióskálázás csökkentve; ATR soft gate: alacsony volatilitás −5 P-score, méret felezve; missing: P_score>=35, precision_score>=55",,,,,,,
ec5c47ed-a1d1-488b-91ab-16a1e230db38,GOLD_CFD,2026-02-18T19:32:01Z,no entry,core,14,,1.0,20.0,,,,,,,4980.43255,2026-02-18T19:31:29Z,32,,,rule,"Mean reversion bias override (+19.5); Regime filter inaktív; ATR nincs rendben (relatív vagy abszolút küszöb); Alacsony realised vol → magasabb RR igény; Fib zóna konfluencia (0.618–0.886) (+18.0); Order flow neutrális (−4.5); OFI toxikus long irányra (−3.3); P-Score reduced by 4.0 due to regime CHOPPY; Mesterlövész mód: P-score minimum 35 érvényesítve; VWAP alatt — GOLD long breakout késleltetve; ATR-floor override: rel_atr 0.0011 < 0.0025 → adaptív RR/TP küszöb; Regime kapu: CHOPPY miatt −10 P-score, pozícióskálázás csökkentve; ATR soft gate: alacsony volatilitás −5 P-score, méret felezve; Liquidity gate skipped (no volume proxy available); missing: P_score>=35, precision_score>=55",,,,,,,
33c4eeb3-bfbc-48c8-9474-e7f26732fea0,EURUSD,2026-02-18T19:32:01Z,precision_arming,core,50,,1.0,30.0,,,,,,,1.17855,2026-02-18T19:31:29Z,32,,,rule,"Mean reversion bias override (+19.5); Regime filter inaktív; 5M BOS trendirányba (+16.0); ATR erősség 1.46× küszöb (+13.8); Alacsony realised vol → magasabb RR igény; Ár az intraday range alsó zónájában (+4.0); Range expanzió támogatja a momentumot (+3.0); Order flow neutrális (−3.2); P-Score reduced by 4.0 due to regime CHOPPY; EURUSD: ATR(1h) alacsony — P-score küszöb +6 pontra emelve; EURUSD: Visszafogott ATR — célok szűkítve, kockázat kontroll alatt; EURUSD BOS aktív, de VWAP alatt — türelem; ATR-floor override: rel_atr 0.0003 < 0.0006 → adaptív RR/TP küszöb; Regime kapu: CHOPPY miatt −10 P-score, pozícióskálázás csökkentve; Strukturális kapu lazítva: momentum erős, BOS hiány engedve; Liquidity gate skipped (no volume proxy available); EURUSD stop lazítás: ATR1h alapú kockázat ×0.72; Precision trigger kész → limit figyelés; Precision limit belépő parkolva 12 percig",,,,,,,
e668336e-374e-419b-8213-989db1903dec,XAGUSD,2026-02-18T19:32:01Z,precision_arming,core,97,,1.0,20.0,,,,,,,76.9387,2026-02-18T19:31:29Z,32,,,rule,Bias(4H→1H)=short (+15.0); EMA21 slope 1.01× küszöb (+12.1); HTF sweep ok (+10.0); 5M BOS trendirányba (+16.0); ATR erősség 1.25× küszöb (+12.5); Range expanzió támogatja a momentumot (+3.0); XAG momentum override — stop tágítva erős trendnél; XAGUSD: momentum override — stop távolság 1.3×ATR-re tágítva; Fib zóna konfluencia (0.618–0.886) (+18.0); Order flow neutrális (−4.9); Intraday P-score lazítás: micro-bias short elsőbbséget kap (−2.2); Mesterlövész mód: P-score minimum 35 érvényesítve; XAGUSD: momentum kitörés — RR cél 1:1.45-re szűkítve; XAG momentum override — pozícióméret csökkentve; XAGUSD: ATR-alapú pozícióskálázás ×0.55; XAG: VWAP felett — short setup türelmet igényel; OFI z-score -1.59 támogatja az irányt; Liquidity gate skipped (no volume proxy available); XAG stop lazítás: ATR1h alapú kockázat ×1.09; Precision trigger kész → limit figyelés; Precision limit belépő parkolva 12 percig,,,,,,,
32cd561a-8d2c-4fda-a907-916bcfd5930c,USOIL,2026-02-18T19:32:01Z,no entry,core_only,30,,1.0,20.0,,,,,,,65.21694,2026-02-18T19:31:29Z,32,,,rule,"Bias(4H→1H)=long (+15.0); Regime filter inaktív; 5M BOS trendirányba (+16.0); ATR erősség 0.99× küszöb (+10.9); Intraday range felső harmada telített (−7.0); Range expanzió támogatja a momentumot (+3.0); USOIL: erős momentum — invalid zóna 2.5×ATR(1h)-re tágítva; Order flow neutrális (−4.4); P-Score reduced by 4.0 due to regime CHOPPY; P-Score reduced by 0.5 due to ATR Soft Gate tolerance; USOIL: 1h ATR <1 USD — P-score küszöb emelve a zajos sáv miatt; USOIL: csökkenő volatilitás — RR cél 1:1.5-re igazítva; USOIL: US nyitás — pozícióméret ×0.75; OFI z-score 1.39 támogatja az irányt; Regime kapu: CHOPPY miatt −10 P-score, pozícióskálázás csökkentve; Diagnosztika: k1m: utolsó zárt gyertya 11 perc késésben van; Diagnosztika: k1m: jelzés korlátozva 11 perc késés miatt; Diagnosztika: k5m: utolsó zárt gyertya 12 perc késésben van; missing: P_score>=42",,,,,,,
32e8eae2-56cb-42ae-a55c-471c2b974b18,BTCUSD,2026-02-18T19:32:01Z,precision_arming,core,41,,1.0,2.0,,,,,,,66168.0,2026-02-18T19:31:29Z,32,,,rule,"Mean reversion bias override (+19.5); Regime filter inaktív; HTF sweep ok (+10.0); ATR erősség 1.54× küszöb (+14.3); Ár az intraday range alsó zónájában (+4.0); Order flow neutrális (−3.7); P-Score reduced by 4.0 due to regime CHOPPY; Mesterlövész mód: P-score minimum 35 érvényesítve; Regime kapu: CHOPPY miatt −10 P-score, pozícióskálázás csökkentve; BTC ATR1h stop igazítás: kockázat ×1.15; Precision trigger kész → limit figyelés; Precision limit belépő parkolva 20 percig",,,,,,,
