journal_id,asset,analysis_timestamp,signal,mode,probability,model_probability,realtime_confidence,leverage,entry_price,stop_loss,take_profit_1,take_profit_2,risk_reward,initial_risk_abs,spot_price,spot_timestamp,spot_latency_seconds,precision_score,anchor_bias,probability_source,notes,validation_outcome,validation_rr,max_favorable_excursion,max_adverse_excursion,time_to_outcome_minutes,slippage,execution_latency_ms
d657ea10-dbcd-4d09-8ffa-31ae87aae703,GOLD_CFD,2026-03-18T09:01:55Z,no entry,core,17,,1.0,20.0,,,,,,,4987.67071,2026-03-18T09:01:36Z,19,,,rule,"Bias(4H→1H)=short (+15.0); Regime filter inaktív; 5M BOS trendirányba (+16.0); ATR nincs rendben (relatív vagy abszolút küszöb); Alacsony realised vol → magasabb RR igény; Intraday range alsó harmada telített (−7.0); Range expanzió támogatja a momentumot (+3.0); Ár 1h EMA21 zónában (+10.0); Order flow neutrális (−4.1); P-Score reduced by 4.0 due to regime CHOPPY; VWAP felett — GOLD short breakout várakozik; ATR-floor override: rel_atr 0.0008 < 0.0025 → adaptív RR/TP küszöb; Regime kapu: CHOPPY miatt −10 P-score, pozícióskálázás csökkentve; ATR soft gate: alacsony volatilitás −5 P-score, méret felezve; Strukturális kapu lazítva: momentum erős, BOS hiány engedve; Liquidity gate skipped (no volume proxy available); missing: P_score>=30",,,,,,,
e501dc1a-98be-472f-a444-7763462da8b5,XAGUSD,2026-03-18T09:01:55Z,precision_arming,core,27,,1.0,20.0,,,,,,,79.42055,2026-03-18T09:01:36Z,19,,,rule,"Bias(4H→1H)=short (+15.0); Regime filter inaktív; ATR erősség 1.09× küszöb (+11.5); Fib zóna konfluencia (0.618–0.886) (+18.0); Order flow neutrális (−4.8); OFI toxikus short irányra (−3.8); P-Score reduced by 4.0 due to regime CHOPPY; XAGUSD: visszafogott ATR — RR cél 1:1.7-re emelve; XAGUSD breakout-védelem: gyors BE + 20% giveback limit expanziós szakaszban; XAGUSD: ATR-alapú pozícióskálázás ×0.70; XAG: VWAP felett — short setup türelmet igényel; Regime kapu: CHOPPY miatt −10 P-score, pozícióskálázás csökkentve; Strukturális soft gate: 1/3 jel + ATR/spread OK (−6 P-score, size ×0.70); Strukturális kapu lazítva: momentum erős, BOS hiány engedve; P-score soft gate: −1.0 pont tolerancia (size ×0.65, RR +0.15); Liquidity gate skipped (no volume proxy available); XAG stop lazítás: ATR1h alapú kockázat ×1.03; Precision trigger kész → limit figyelés; Precision limit belépő parkolva 12 percig",,,,,,,
081ccb0b-13cc-46bf-8065-be37d006b806,EURUSD,2026-03-18T09:01:55Z,no entry,core,18,,1.0,30.0,,,,,,,1.15327,2026-03-18T09:01:36Z,19,,,rule,"Intraday bias gate feltételek hiányosak — Micro BOS long  ATR rendben: 1m micro BOS long | Micro BOS short  ATR rendben: 1m micro BOS short; Bias neutrálsávban; Regime filter inaktív; ATR erősség 1.45× küszöb (+13.7); Alacsony realised vol → magasabb RR igény; Fib zóna konfluencia (0.618–0.886) (+18.0); Order flow neutrális (−4.5); P-Score reduced by 4.0 due to regime CHOPPY; EURUSD: ATR(1h) alacsony — P-score küszöb +6 pontra emelve; EURUSD: Visszafogott ATR — célok szűkítve, kockázat kontroll alatt; ATR-floor override: rel_atr 0.0003 < 0.0006 → adaptív RR/TP küszöb; Regime kapu: CHOPPY miatt −10 P-score, pozícióskálázás csökkentve; Strukturális soft gate: 1/3 jel + ATR/spread OK (−6 P-score, size ×0.70); Strukturális kapu lazítva: momentum erős, BOS hiány engedve; Liquidity gate skipped (no volume proxy available); missing: P_score>=44",,,,,,,
a461a94f-a40a-4746-82a2-84ebc81f4b69,BTCUSD,2026-03-18T09:01:55Z,no entry,core,0,,1.0,2.0,,,,,,,74078.98,2026-03-18T09:01:36Z,19,,,rule,"Intraday bias gate feltételek hiányosak — Crypto momentum long: 1m micro BOS long, Momentum volume ráta, ATR gate | Crypto momentum short: 1m micro BOS short, Momentum volume ráta, ATR gate | 5m BOS long  ATR: ATR gate | 5m BOS short  ATR: 5m BOS short, ATR gate | Micro BOS short  ATR (momentum nélkül): 1m micro BOS short, ATR gate; Bias neutrálsávban; Regime filter inaktív; ATR nincs rendben (relatív vagy abszolút küszöb); Alacsony realised vol → magasabb RR igény; Fib zóna konfluencia (0.618–0.886) (+18.0); Order flow neutrális (−4.2); P-Score reduced by 4.0 due to regime CHOPPY; Mesterlövész mód: P-score minimum 35 érvényesítve; ATR-floor override: rel_atr 0.0011 < 0.0012 → adaptív RR/TP küszöb; Regime kapu: CHOPPY miatt −10 P-score, pozícióskálázás csökkentve; ATR soft gate: alacsony volatilitás −5 P-score, méret felezve; missing: P_score>=35",,,,,,,
c75ccfff-e900-46c6-8257-c61dc94a1971,USOIL,2026-03-18T09:01:55Z,no entry,core,12,,1.0,20.0,,,,,,,93.71834,2026-03-18T09:01:36Z,19,,,rule,"Intraday bias gate feltételek hiányosak — USOIL retest long  ATR: 5m retest long | USOIL retest short  ATR: 5m retest short; Bias neutrálsávban; Regime filter inaktív; ATR erősség 0.91× küszöb (+10.5); Fib zóna konfluencia (0.618–0.886) (+18.0); Order flow neutrális (−4.2); P-Score reduced by 4.0 due to regime CHOPPY; P-Score reduced by 3.6 due to ATR Soft Gate tolerance; USOIL: csökkenő volatilitás — RR cél 1:1.5-re igazítva; USOIL: európai délelőtt — pozícióméret ×0.85; Regime kapu: CHOPPY miatt −10 P-score, pozícióskálázás csökkentve; Strukturális soft gate: 1/3 jel + ATR/spread OK (−6 P-score, size ×0.70); Strukturális kapu lazítva: momentum erős, BOS hiány engedve; Liquidity gate skipped (no volume proxy available); missing: P_score>=36",,,,,,,
