journal_id,asset,analysis_timestamp,signal,mode,probability,model_probability,realtime_confidence,leverage,entry_price,stop_loss,take_profit_1,take_profit_2,risk_reward,initial_risk_abs,spot_price,spot_timestamp,spot_latency_seconds,precision_score,anchor_bias,probability_source,notes,validation_outcome,validation_rr,max_favorable_excursion,max_adverse_excursion,time_to_outcome_minutes,slippage,execution_latency_ms
a52dff1c-dffc-4025-a452-ca47e875cf2e,XAGUSD,2026-04-08T02:16:38Z,market closed,session_closed,0,,1.0,20.0,,,,,,,76.57188,2026-04-08T02:16:13Z,25,,,rule,"Piac nyitva; Intraday bias gate feltételek hiányosak — Micro BOS long  ATR (ezüst): 1m micro BOS long | Micro BOS short  ATR (ezüst): 1m micro BOS short; Bias neutrálsávban; Regime filter inaktív; ATR erősség 1.24× küszöb (+12.4); Order flow neutrális (−4.2); P-Score reduced by 4.0 due to regime CHOPPY; XAGUSD breakout-védelem: gyors BE + 20% giveback limit expanziós szakaszban; XAGUSD: ATR-alapú pozícióskálázás ×0.70; Regime kapu: CHOPPY miatt −10 P-score, pozícióskálázás csökkentve; Liquidity gate skipped (no volume proxy available); missing: session, P_score>=28",,,,,,,
d9395ba6-29bb-4a95-b865-6cccf58b5ce9,GOLD_CFD,2026-04-08T02:16:38Z,market closed,session_closed,0,,1.0,20.0,,,,,,,4815.40597,2026-04-08T02:16:13Z,25,,,rule,"Piac nyitva; Intraday bias gate feltételek hiányosak — 5m retest long  ATR: 5m retest long, ATR gate | 5m retest short  ATR: 5m retest short, ATR gate; Bias neutrálsávban; Regime filter inaktív; ATR nincs rendben (relatív vagy abszolút küszöb); Range expanzió támogatja a momentumot (+3.0); Fib zóna konfluencia (0.618–0.886) (+18.0); Order flow neutrális (−4.2); P-Score reduced by 4.0 due to regime CHOPPY; ATR-floor override: rel_atr 0.0016 < 0.0025 → adaptív RR/TP küszöb; Regime kapu: CHOPPY miatt −10 P-score, pozícióskálázás csökkentve; ATR soft gate: alacsony volatilitás −5 P-score, méret felezve; Strukturális kapu lazítva: momentum erős, BOS hiány engedve; Liquidity gate skipped (no volume proxy available); missing: session, P_score>=30",,,,,,,
6dcb9276-32c9-43c3-908e-2d74e9ce8abb,EURUSD,2026-04-08T02:16:38Z,market closed,session_closed,0,,1.0,30.0,,,,,,,1.16776,2026-04-08T02:16:13Z,25,,,rule,"Piac nyitva; Intraday bias gate feltételek hiányosak — Micro BOS long  ATR rendben: 1m micro BOS long | Micro BOS short  ATR rendben: 1m micro BOS short; Bias neutrálsávban; Regime filter inaktív; ATR erősség 1.84× küszöb (+16.1); Alacsony realised vol → magasabb RR igény; Order flow neutrális (−4.9); ATR-floor override: rel_atr 0.0004 < 0.0006 → adaptív RR/TP küszöb; Regime kapu: CHOPPY miatt −10 P-score, pozícióskálázás csökkentve; Liquidity gate skipped (no volume proxy available); missing: session, P_score>=38",,,,,,,
f6f0067c-310e-4d4d-afe9-967243c7808b,BTCUSD,2026-04-08T02:16:38Z,precision_arming,core,93,,1.0,2.0,,,,,,,71713.11,2026-04-08T02:16:13Z,25,,,rule,"Bias override: 1h trend long + momentum támogatás (+19.5); EMA21 slope 1.13× küszöb (+12.8); 5M BOS trendirányba (+16.0); ATR erősség 1.49× küszöb (+13.9); Range expanzió támogatja a momentumot (+3.0); Fib zóna konfluencia (0.618–0.886) (+18.0); Order flow neutrális (−4.9); Mesterlövész mód: P-score minimum 35 érvényesítve; Strukturális kapu lazítva: momentum erős, BOS hiány engedve; BTC ATR1h stop igazítás: kockázat ×1.15; Precision trigger kész → limit figyelés; Precision limit belépő parkolva 20 percig",,,,,,,
4d4c929e-dfb3-407e-915e-c76d31d77255,USOIL,2026-04-08T02:16:39Z,no entry,core_only,43,,0.9999999999999999,20.0,,,,,,,96.54458,2026-04-08T02:16:13Z,26,,,rule,Intraday bias gate feltételek hiányosak — USOIL retest long  ATR: 5m retest long | USOIL retest short  ATR: 5m retest short; Bias neutrálsávban; EMA21 slope 3.61× küszöb (+21.0); ATR erősség 1.13× küszöb (+11.8); Order flow neutrális (−4.8); USOIL: parabolikus lendület — RR cél 1:1.4 környékére szűkítve; Diagnosztika: k1m: utolsó zárt gyertya 10 perc késésben van; Diagnosztika: k1m: jelzés korlátozva 10 perc késés miatt; Diagnosztika: k5m: utolsó zárt gyertya 11 perc késésben van,,,,,,,
