journal_id,asset,analysis_timestamp,signal,mode,probability,model_probability,realtime_confidence,leverage,entry_price,stop_loss,take_profit_1,take_profit_2,risk_reward,initial_risk_abs,spot_price,spot_timestamp,spot_latency_seconds,precision_score,anchor_bias,probability_source,notes,validation_outcome,validation_rr,max_favorable_excursion,max_adverse_excursion,time_to_outcome_minutes,slippage,execution_latency_ms
8e86138f-452b-4912-91b4-8804e22789cb,EURUSD,2026-04-19T23:06:22Z,no entry,core,30,,1.0,30.0,,,,,,,1.17423,2026-04-19T23:06:03Z,19,,,rule,"Intraday bias gate feltételek hiányosak — Micro BOS long  ATR rendben: 1m micro BOS long | Micro BOS short  ATR rendben: 1m micro BOS short; Bias neutrálsávban; Regime filter inaktív; HTF sweep ok (+10.0); Zárási sáv likviditás büntetés (-2.0); ATR erősség 1.34× küszöb (+13.1); Alacsony realised vol → magasabb RR igény; Fib zóna konfluencia (0.618–0.886) (+18.0); Order flow neutrális (−4.5); ATR-floor override: rel_atr 0.0003 < 0.0006 → adaptív RR/TP küszöb; Regime kapu: CHOPPY miatt −10 P-score, pozícióskálázás csökkentve; Strukturális soft gate: 1/3 jel + ATR/spread OK (−6 P-score, size ×0.70); Strukturális kapu lazítva: momentum erős, BOS hiány engedve; Liquidity gate skipped (no volume proxy available); missing: P_score>=38",,,,,,,
59782c44-83a2-4ff5-87cd-dd1e0b324578,XAGUSD,2026-04-19T23:06:22Z,no entry,core,24,,1.0,20.0,,,,,,,79.54601,2026-04-19T23:06:03Z,19,,,rule,"Bias(4H→1H)=long (+15.0); Regime filter inaktív; Zárási sáv likviditás büntetés (-2.0); ATR erősség 1.67× küszöb (+15.0); Ár az intraday range alsó zónájában (+4.0); Order flow neutrális (−4.5); P-Score reduced by 4.0 due to regime CHOPPY; XAGUSD breakout-védelem: gyors BE + 20% giveback limit expanziós szakaszban; XAGUSD: ATR-alapú pozícióskálázás ×0.62; XAG: VWAP alatt — long setup türelmet igényel; Fém irány guard: 5m trend ellentétes a belépési biasszal; Regime kapu: CHOPPY miatt −10 P-score, pozícióskálázás csökkentve; Liquidity gate skipped (no volume proxy available); missing: metal_bias_5m_alignment, P_score>=28",,,,,,,
ef82b018-ab12-4d25-a518-3ae4c355ebcc,GOLD_CFD,2026-04-19T23:06:22Z,no entry,core,19,,1.0,20.0,,,,,,,4776.73394,2026-04-19T23:06:03Z,19,,,rule,"Micro bias override: gyors struktúra dominál (+19.5); Regime filter inaktív; HTF sweep ok (+10.0); 5M BOS trendirányba (+16.0); Zárási sáv likviditás büntetés (-2.0); ATR nincs rendben (relatív vagy abszolút küszöb); Intraday range alsó harmada telített (−7.0); Range expanzió támogatja a momentumot (+3.0); Order flow neutrális (−4.4); P-Score reduced by 4.0 due to regime CHOPPY; Intraday P-score lazítás: micro-bias short elsőbbséget kap (−2.2); Mesterlövész mód: P-score minimum 30 érvényesítve; VWAP felett — GOLD short breakout várakozik; ATR-floor override: rel_atr 0.0018 < 0.0025 → adaptív RR/TP küszöb; Regime kapu: CHOPPY miatt −10 P-score, pozícióskálázás csökkentve; ATR soft gate: alacsony volatilitás −5 P-score, méret felezve; Strukturális kapu lazítva: momentum erős, BOS hiány engedve; Liquidity gate skipped (no volume proxy available); missing: P_score>=30",,,,,,,
b831000a-61c1-4614-8f96-6b05450ef7da,BTCUSD,2026-04-19T23:06:22Z,no entry,core,11,,1.0,2.0,,,,,,,73950.85,2026-04-19T23:06:03Z,19,,,rule,"Intraday bias gate feltételek hiányosak — Crypto momentum long: 1m micro BOS long, Momentum volume ráta | Crypto momentum short: 1m micro BOS short, Momentum volume ráta | 5m BOS long  ATR: 5m BOS long | 5m BOS short  ATR: 5m BOS short | Micro BOS short  ATR (momentum nélkül): 1m micro BOS short; Bias neutrálsávban; Regime filter inaktív; Zárási sáv likviditás büntetés (-2.0); ATR erősség 2.63× küszöb (+20.8); Order flow neutrális (−4.8); P-Score reduced by 4.0 due to regime CHOPPY; Mesterlövész mód: P-score minimum 35 érvényesítve; Regime kapu: CHOPPY miatt −10 P-score, pozícióskálázás csökkentve; missing: P_score>=35",,,,,,,
a09a926f-212c-4089-8acc-b03f828ab890,USOIL,2026-04-19T23:06:23Z,market closed,session_closed,0,,1.0,20.0,,,,,,,91.50923,2026-04-19T23:06:03Z,20,,,rule,Piac zárva (nyitáson kívül); Intraday bias gate feltételek hiányosak — USOIL retest long  ATR: 5m retest long | USOIL retest short  ATR: 5m retest short; Bias neutrálsávban; EMA21 slope 1.83× küszöb (+17.0); Zárási sáv likviditás büntetés (-2.0); ATR erősség 2.22× küszöb (+18.3); Order flow neutrális (−4.8); USOIL: parabolikus lendület — RR cél 1:1.4 környékére szűkítve; USOIL: nyitás előtti sáv — pozícióméret ×0.75; Liquidity gate skipped (no volume proxy available); missing: session,,,,,,,
