journal_id,asset,analysis_timestamp,signal,mode,probability,model_probability,realtime_confidence,leverage,entry_price,stop_loss,take_profit_1,take_profit_2,risk_reward,initial_risk_abs,spot_price,spot_timestamp,spot_latency_seconds,precision_score,anchor_bias,probability_source,notes,validation_outcome,validation_rr,max_favorable_excursion,max_adverse_excursion,time_to_outcome_minutes,slippage,execution_latency_ms,fill_timestamp,exit_timestamp,entry_kind,validation_source
9203b533-3bbd-4dfa-8fde-906f63d8dd1f,EURUSD,2026-03-19T12:36:04Z,market closed,session_closed,0,,1.0,30.0,,,,,,,1.14733,2026-03-19T12:35:37Z,27,,,rule,"Piac nyitva; Bias(4H→1H)=short (+15.0); Regime filter inaktív; 5M BOS trendirányba (+16.0); ATR erősség 1.91× küszöb (+16.5); Alacsony realised vol → magasabb RR igény; Ár az intraday range felső zónájában (+4.0); Range expanzió támogatja a momentumot (+3.0); Fib zóna konfluencia (0.618–0.886) (+18.0); Order flow neutrális (−4.7); P-Score reduced by 4.0 due to regime CHOPPY; EURUSD BOS aktív, de VWAP felett — várakozás; ATR-floor override: rel_atr 0.0004 < 0.0006 → adaptív RR/TP küszöb; Regime kapu: CHOPPY miatt −10 P-score, pozícióskálázás csökkentve; Strukturális soft gate: 1/3 jel + ATR/spread OK (−6 P-score, size ×0.70); Strukturális kapu lazítva: momentum erős, BOS hiány engedve; Liquidity gate skipped (no volume proxy available); missing: session",,,,,,,,,,,
82e889f8-b5b6-497e-9bd0-736bf9f5f28d,XAGUSD,2026-03-19T12:36:04Z,market closed,session_closed,0,,1.0,20.0,,,,,,,68.57066,2026-03-19T12:35:37Z,27,,,rule,"Piac nyitva; Bias(4H→1H)=short (+15.0); EMA21 slope 2.25× küszöb (+19.5); 5M BOS trendirányba (+16.0); ATR erősség 2.37× küszöb (+19.2); Intraday range alsó harmada telített (−7.0); Range expanzió támogatja a momentumot (+3.0); XAG momentum override — stop tágítva erős trendnél; XAGUSD: momentum override — stop távolság 1.3×ATR-re tágítva; Order flow neutrális (−4.2); OFI toxikus short irányra (−3.8); Intraday P-score lazítás: micro-bias short elsőbbséget kap (−2.2); Mesterlövész mód: P-score minimum 28 érvényesítve; XAGUSD: momentum kitörés — RR cél 1:1.45-re szűkítve; XAGUSD breakout-védelem: gyors BE + 20% giveback limit expanziós szakaszban; XAG momentum override — pozícióméret csökkentve; XAGUSD: ATR-alapú pozícióskálázás ×0.55; XAG: VWAP felett — short setup türelmet igényel; Strukturális soft gate: 1/3 jel + ATR/spread OK (−6 P-score, size ×0.70); Strukturális kapu lazítva: momentum erős, BOS hiány engedve; Liquidity gate skipped (no volume proxy available); missing: session",,,,,,,,,,,
721e5455-3ff2-4e6a-a5ab-ca1ddc58f5a0,GOLD_CFD,2026-03-19T12:36:04Z,market closed,session_closed,0,,1.0,20.0,,,,,,,4612.65948,2026-03-19T12:35:37Z,27,,,rule,"Piac nyitva; Bias(4H→1H)=short (+15.0); EMA21 slope 1.06× küszöb (+12.4); 5M BOS trendirányba (+16.0); ATR nincs rendben (relatív vagy abszolút küszöb); Intraday range alsó harmada telített (−7.0); Range expanzió támogatja a momentumot (+3.0); Order flow neutrális (−3.8); OFI toxikus short irányra (−5.6); Intraday P-score lazítás: micro-bias short elsőbbséget kap (−2.2); Mesterlövész mód: P-score minimum 30 érvényesítve; VWAP felett — GOLD short breakout várakozik; ATR soft gate: alacsony volatilitás −5 P-score, méret felezve; Strukturális kapu lazítva: momentum erős, BOS hiány engedve; Liquidity gate skipped (no volume proxy available); missing: session",,,,,,,,,,,
749c5000-0400-4b6f-b325-7ea2a23eb751,BTCUSD,2026-03-19T12:36:04Z,sell,core,67,,1.0,2.0,69579.8,70275.598,68188.20400000001,67492.40600000002,3.0,,69579.8,2026-03-19T12:35:37Z,27,,,rule,"Bias override: Intraday 5m BOS short  ATR (+19.5); EMA21 slope 1.14× küszöb (+12.8); 5M BOS trendirányba (+16.0); ATR erősség 1.23× küszöb (+12.4); Intraday range alsó harmada telített (−7.0); Range expanzió támogatja a momentumot (+3.0); Order flow neutrális (−4.2); Mesterlövész mód: P-score minimum 35 érvényesítve; Strukturális kapu lazítva: momentum erős, BOS hiány engedve; BTC ATR1h stop igazítás: kockázat ×1.15; TP1 nettó profit ≈ 0.60%; Precision plan: entry 69561.7–69647.3, SL 69733.0; Precision confidence medium (62.0); Precision limit belépő parkolva 20 percig; missing: tp1_net>=+0.6%",insufficient_data,,,,,,,,,market,auto
d02b0add-9dee-4918-91c0-6669451215e1,USOIL,2026-03-19T12:36:05Z,market closed,session_closed,0,,1.0,20.0,,,,,,,96.29133,2026-03-19T12:35:37Z,27,,,rule,"Piac nyitva; Bias(4H→1H)=long (+15.0); Regime filter inaktív; ATR erősség 1.61× küszöb (+14.6); Fib zóna konfluencia (0.618–0.886) (+18.0); Order flow neutrális (−4.2); P-Score reduced by 4.0 due to regime CHOPPY; USOIL: 1h ATR ≥1.5 USD — RR cél 1:2-re emelve; Regime kapu: CHOPPY miatt −10 P-score, pozícióskálázás csökkentve; Diagnosztika: k1m: utolsó zárt gyertya 10 perc késésben van; Diagnosztika: k1m: jelzés korlátozva 10 perc késés miatt; Diagnosztika: k5m: utolsó zárt gyertya 11 perc késésben van; missing: session",,,,,,,,,,,
