journal_id,asset,analysis_timestamp,signal,mode,probability,model_probability,realtime_confidence,leverage,entry_price,stop_loss,take_profit_1,take_profit_2,risk_reward,initial_risk_abs,spot_price,spot_timestamp,spot_latency_seconds,precision_score,anchor_bias,probability_source,notes,validation_outcome,validation_rr,max_favorable_excursion,max_adverse_excursion,time_to_outcome_minutes,slippage,execution_latency_ms
5e23b074-6998-4f9c-9929-dad0927505bc,GOLD_CFD,2026-03-25T02:56:22Z,no entry,core,27,,1.0,20.0,,,,,,,4586.44429,2026-03-25T02:55:57Z,25,,,rule,"Bias(4H→1H)=short (+15.0); Regime filter inaktív; HTF sweep ok (+10.0); 5M BOS trendirányba (+16.0); ATR nincs rendben (relatív vagy abszolút küszöb); Ár az intraday range felső zónájában (+4.0); Range expanzió támogatja a momentumot (+3.0); Order flow neutrális (−4.9); P-Score reduced by 4.0 due to regime CHOPPY; OFI z-score -1.58 támogatja az irányt; ATR-floor override: rel_atr 0.0014 < 0.0025 → adaptív RR/TP küszöb; Fém irány guard: 5m trend ellentétes a belépési biasszal; Regime kapu: CHOPPY miatt −10 P-score, pozícióskálázás csökkentve; ATR soft gate: alacsony volatilitás −5 P-score, méret felezve; Liquidity gate skipped (no volume proxy available); missing: metal_bias_5m_alignment, P_score>=30",,,,,,,
6129bdd0-a640-4509-bd71-a6743fc7e9e6,XAGUSD,2026-03-25T02:56:22Z,no entry,core,29,,1.0,20.0,,,,,,,73.68193,2026-03-25T02:55:57Z,25,,,rule,Intraday bias gate feltételek hiányosak — Micro BOS long  ATR (ezüst): 1m micro BOS long | Micro BOS short  ATR (ezüst): 1m micro BOS short; Bias neutrálsávban; EMA21 slope 1.31× küszöb (+13.8); ATR erősség 0.86× küszöb (+10.2); Order flow neutrális (−4.2); P-Score reduced by 5.4 due to ATR Soft Gate tolerance; XAGUSD: visszafogott ATR — RR cél 1:1.7-re emelve; XAGUSD breakout-védelem: gyors BE + 20% giveback limit expanziós szakaszban; XAGUSD: ATR-alapú pozícióskálázás ×0.70; Liquidity gate skipped (no volume proxy available),,,,,,,
15e9b816-3855-4586-ab33-d4035f0daeaa,EURUSD,2026-03-25T02:56:22Z,no entry,core,31,,1.0,30.0,,,,,,,1.16028,2026-03-25T02:55:57Z,25,,,rule,"Micro bias override: gyors struktúra dominál (+19.5); Regime filter inaktív; 5M BOS trendirányba (+16.0); ATR nincs rendben (relatív vagy abszolút küszöb); Alacsony realised vol → magasabb RR igény; Intraday range alsó harmada telített (−7.0); Range expanzió támogatja a momentumot (+3.0); Fib zóna konfluencia (0.618–0.886) (+18.0); Order flow neutrális (−2.9); P-Score reduced by 4.0 due to regime CHOPPY; Intraday P-score lazítás: micro-bias short elsőbbséget kap (−2.2); EURUSD: ATR-alapú pozícióskálázás ×0.69 — volatilitás kontroll; EURUSD BOS aktív, de VWAP felett — várakozás; ATR-floor override: rel_atr 0.0003 < 0.0006 → adaptív RR/TP küszöb; Regime kapu: CHOPPY miatt −10 P-score, pozícióskálázás csökkentve; ATR soft gate: alacsony volatilitás −5 P-score, méret felezve; Strukturális kapu lazítva: momentum erős, BOS hiány engedve; Position size scale 0.0431 below floor 0.05 — entry blocked; Liquidity gate skipped (no volume proxy available); missing: position_sizing_floor, P_score>=35.8",,,,,,,
1fe4e79f-4d14-4818-9cf2-9593e5eba514,BTCUSD,2026-03-25T02:56:23Z,no entry,core,17,,1.0,2.0,,,,,,,70550.6,2026-03-25T02:55:57Z,25,,,rule,"Intraday bias gate feltételek hiányosak — Crypto momentum long: 1m micro BOS long, Momentum volume ráta | Crypto momentum short: 1m micro BOS short | 5m BOS long  ATR: 5m BOS long | 5m BOS short  ATR: 5m BOS short | Micro BOS short  ATR (momentum nélkül): 1m micro BOS short; Bias neutrálsávban; Regime filter inaktív; ATR erősség 0.90× küszöb (+10.4); Fib zóna konfluencia (0.618–0.886) (+18.0); Order flow neutrális (−4.3); P-Score reduced by 4.0 due to regime CHOPPY; P-Score reduced by 4.2 due to ATR Soft Gate tolerance; Mesterlövész mód: P-score minimum 35 érvényesítve; Regime kapu: CHOPPY miatt −10 P-score, pozícióskálázás csökkentve; missing: P_score>=35",,,,,,,
e276accd-ecbd-432d-90b4-30189a96978e,USOIL,2026-03-25T02:56:23Z,no entry,core_only,17,,0.9999999999999999,20.0,,,,,,,87.7494,2026-03-25T02:55:57Z,26,,,rule,"Intraday bias gate feltételek hiányosak — USOIL retest long  ATR: 5m retest long | USOIL retest short  ATR: 5m retest short; Bias neutrálsávban; Regime filter inaktív; ATR erősség 1.29× küszöb (+12.7); Fib zóna konfluencia (0.618–0.886) (+18.0); Order flow neutrális (−4.5); P-Score reduced by 4.0 due to regime CHOPPY; USOIL: parabolikus lendület — RR cél 1:1.4 környékére szűkítve; USOIL: ázsiai sáv — pozícióméret ×0.70; Regime kapu: CHOPPY miatt −10 P-score, pozícióskálázás csökkentve; Strukturális soft gate: 1/3 jel + ATR/spread OK (−6 P-score, size ×0.70); Strukturális kapu lazítva: momentum erős, BOS hiány engedve; Diagnosztika: k1m: utolsó zárt gyertya 9 perc késésben van; Diagnosztika: k1m: jelzés korlátozva 9 perc késés miatt; Diagnosztika: k5m: utolsó zárt gyertya 11 perc késésben van; missing: P_score>=36",,,,,,,
