journal_id,asset,analysis_timestamp,signal,mode,probability,model_probability,realtime_confidence,leverage,entry_price,stop_loss,take_profit_1,take_profit_2,risk_reward,initial_risk_abs,spot_price,spot_timestamp,spot_latency_seconds,precision_score,anchor_bias,probability_source,notes,validation_outcome,validation_rr,max_favorable_excursion,max_adverse_excursion,time_to_outcome_minutes,slippage,execution_latency_ms
8fd8115c-0486-47df-89cb-0a29125fd300,EURUSD,2026-05-27T05:46:45Z,no entry,core,0,,1.0,30.0,,,,,,,1.1641,2026-05-27T05:46:18Z,27,,,rule,"Intraday bias gate feltételek hiányosak — Micro BOS long  ATR rendben: 1m micro BOS long, ATR gate | Micro BOS short  ATR rendben: 1m micro BOS short, ATR gate; Bias neutrálsávban; Regime filter inaktív; ATR nincs rendben (relatív vagy abszolút küszöb); Alacsony realised vol → magasabb RR igény; Ár 1h EMA21 zónában (+10.0); Order flow neutrális (−4.2); P-Score reduced by 4.0 due to regime CHOPPY; EURUSD: ATR(1h) alacsony — P-score küszöb +6 pontra emelve; EURUSD: Visszafogott ATR — célok szűkítve, kockázat kontroll alatt; ATR-floor override: rel_atr 0.0001 < 0.0006 → adaptív RR/TP küszöb; Regime kapu: CHOPPY miatt −10 P-score, pozícióskálázás csökkentve; ATR soft gate: alacsony volatilitás −5 P-score, méret felezve; Liquidity gate skipped (no volume proxy available); missing: P_score>=44",,,,,,,
ba1fd9cd-ff0f-4157-a5d6-341cfd469d79,XAGUSD,2026-05-27T05:46:45Z,precision_arming,momentum,13,,1.0,20.0,,,,,,,75.68941,2026-05-27T05:46:18Z,27,,,rule,"Mean reversion bias override (+19.5); Regime filter inaktív; ATR erősség 1.55× küszöb (+14.3); Ár az intraday range alsó zónájában (+4.0); Order flow neutrális (−4.1); OFI toxikus long irányra (−4.1); P-Score reduced by 4.0 due to regime CHOPPY; XAGUSD breakout-védelem: gyors BE + 20% giveback limit expanziós szakaszban; XAGUSD: ATR-alapú pozícióskálázás ×0.62; XAG: VWAP alatt — long setup türelmet igényel; Fém irány guard: 5m trend ellentétes a belépési biasszal; Regime kapu: CHOPPY miatt −10 P-score, pozícióskálázás csökkentve; Liquidity gate skipped (no volume proxy available); Momentum soft gate: regime, liquidity, order_flow, order_flow_pressure, ofi (−14.0 P, size ×0.58); XAG stop lazítás: ATR1h alapú kockázat ×1.03; Precision trigger kész → limit figyelés; Precision limit belépő parkolva 12 percig",,,,,,,
745b0838-02d5-4ab0-abb2-9f2391e49a52,GOLD_CFD,2026-05-27T05:46:45Z,no entry,core,6,,1.0,20.0,,,,,,,4493.64587,2026-05-27T05:46:18Z,27,,,rule,"Bias(4H→1H)=short (+15.0); Regime filter inaktív; 5M BOS trendirányba (+16.0); ATR nincs rendben (relatív vagy abszolút küszöb); Alacsony realised vol → magasabb RR igény; Intraday range alsó harmada telített (−7.0); Range expanzió támogatja a momentumot (+3.0); Order flow neutrális (−4.6); P-Score reduced by 4.0 due to regime CHOPPY; VWAP felett — GOLD short breakout várakozik; OFI z-score -1.15 támogatja az irányt; ATR-floor override: rel_atr 0.0012 < 0.0025 → adaptív RR/TP küszöb; Regime kapu: CHOPPY miatt −10 P-score, pozícióskálázás csökkentve; ATR soft gate: alacsony volatilitás −5 P-score, méret felezve; Strukturális kapu lazítva: momentum erős, BOS hiány engedve; Liquidity gate skipped (no volume proxy available); missing: P_score>=30",,,,,,,
aabab9e1-4470-49d9-bfaf-a435354373f0,BTCUSD,2026-05-27T05:46:45Z,no entry,core,21,,1.0,2.0,,,,,,,75512.92,2026-05-27T05:46:18Z,27,,,rule,"Bias(4H→1H)=short (+15.0); Regime filter inaktív; ATR nincs rendben (relatív vagy abszolút küszöb); Alacsony realised vol → magasabb RR igény; Fib zóna konfluencia (0.618–0.886) (+18.0); Order flow neutrális (−4.7); Sell pressure támogatja a setupot (+5); P-Score reduced by 0.5 due to ATR Soft Gate tolerance; Mesterlövész mód: P-score minimum 35 érvényesítve; ATR-floor override: rel_atr 0.0009 < 0.0012 → adaptív RR/TP küszöb; Regime kapu: CHOPPY miatt −10 P-score, pozícióskálázás csökkentve; ATR soft gate: alacsony volatilitás −5 P-score, méret felezve; Precision limit belépő parkolva 20 percig; missing: P_score>=35",,,,,,,
15e5ec97-49dc-418e-9f3e-5b2eb1a9ca93,USOIL,2026-05-27T05:46:45Z,no entry,core_only,41,,1.0,20.0,92.2044,95.81228303428571,83.90626902114289,79.21602107657147,3.6,,92.2044,2026-05-27T05:46:18Z,27,,,rule,"Bias(4H→1H)=short (+15.0); Regime filter inaktív; ATR erősség 6.22× küszöb (+23.0); Intraday range alsó harmada telített (−7.0); Fib zóna konfluencia (0.618–0.886) (+18.0); Order flow neutrális (−4.6); P-Score reduced by 4.0 due to regime CHOPPY; Intraday range alsó része telített — visszapattanásra várunk.; USOIL: parabolikus lendület — RR cél 1:1.4 környékére szűkítve; USOIL: ázsiai sáv — pozícióméret ×0.70; Regime kapu: CHOPPY miatt −10 P-score, pozícióskálázás csökkentve; Diagnosztika: k1m: utolsó zárt gyertya 10 perc késésben van; Diagnosztika: k1m: jelzés korlátozva 10 perc késés miatt; Diagnosztika: k5m: utolsó zárt gyertya 11 perc késésben van",,,,,,,
