journal_id,asset,analysis_timestamp,signal,mode,probability,model_probability,realtime_confidence,leverage,entry_price,stop_loss,take_profit_1,take_profit_2,risk_reward,initial_risk_abs,spot_price,spot_timestamp,spot_latency_seconds,precision_score,anchor_bias,probability_source,notes,validation_outcome,validation_rr,max_favorable_excursion,max_adverse_excursion,time_to_outcome_minutes,slippage,execution_latency_ms
f8913779-a143-4a49-b21f-4e3f1ad40fc1,NVDA,2026-05-12T16:56:13Z,no entry,core,18,,1.0,5.0,,,,,,,216.48,2026-05-12T16:55:40Z,32,,,rule,"Bias(4H→1H)=long (+15.0); Regime filter inaktív; HTF sweep ok (+10.0); ATR nincs rendben (relatív vagy abszolút küszöb); WARNING: No Liquidity Structure (Nearest: 184.787153, Dist: 41.92ATR); Ár az intraday range alsó zónájában (+4.0); Ár 1h EMA21 zónában (+10.0); Order flow neutrális (−4.5); P-Score reduced by 4.0 due to regime CHOPPY; Mean-revert setup: méret ×0.70, RR +0.20; VWAP túlnyúlás → mean reversion setup; Regime kapu: CHOPPY miatt −10 P-score, pozícióskálázás csökkentve; ATR soft gate: alacsony volatilitás −5 P-score, méret felezve; Position size scale 0.0437 below floor 0.05 — entry blocked; missing: position_sizing_floor, P_score>=38, precision_flow_alignment",,,,,,,
577cbeab-52ca-469a-82e3-45f45cf611d6,XAGUSD,2026-05-12T16:56:13Z,no entry,core,12,,1.0,20.0,,,,,,,84.32469,2026-05-12T16:55:40Z,32,,,rule,"Bias(4H→1H)=long (+15.0); Regime filter inaktív; ATR nincs rendben (relatív vagy abszolút küszöb); Fib zóna konfluencia (0.618–0.886) (+18.0); Order flow neutrális (−4.6); P-Score reduced by 4.0 due to regime CHOPPY; XAGUSD: visszafogott ATR — RR cél 1:1.7-re emelve; XAGUSD breakout-védelem: gyors BE + 20% giveback limit expanziós szakaszban; XAGUSD: ATR-alapú pozícióskálázás ×0.70; XAG: VWAP alatt — long setup türelmet igényel; OFI z-score 1.34 támogatja az irányt; ATR-floor override: rel_atr 0.0017 < 0.0018 → adaptív RR/TP küszöb; Regime kapu: CHOPPY miatt −10 P-score, pozícióskálázás csökkentve; ATR soft gate: alacsony volatilitás −5 P-score, méret felezve; Liquidity gate skipped (no volume proxy available); missing: P_score>=28",,,,,,,
c6453950-9c8e-4505-b08d-add42a1840b7,GOLD_CFD,2026-05-12T16:56:12Z,no entry,core,20,,1.0,20.0,,,,,,,4669.83739,2026-05-12T16:55:40Z,32,,,rule,"Bias(4H→1H)=short (+15.0); Regime filter inaktív; HTF sweep ok (+10.0); 5M BOS trendirányba (+16.0); ATR nincs rendben (relatív vagy abszolút küszöb); Range expanzió támogatja a momentumot (+3.0); Order flow neutrális (−4.5); OFI toxikus short irányra (−3.5); P-Score reduced by 4.0 due to regime CHOPPY; VWAP felett — GOLD short breakout várakozik; ATR-floor override: rel_atr 0.0008 < 0.0025 → adaptív RR/TP küszöb; Regime kapu: CHOPPY miatt −10 P-score, pozícióskálázás csökkentve; ATR soft gate: alacsony volatilitás −5 P-score, méret felezve; Strukturális kapu lazítva: momentum erős, BOS hiány engedve; Liquidity gate skipped (no volume proxy available); missing: P_score>=30",,,,,,,
0f8ccb88-b5e8-4b9d-a719-98617e485d65,EURUSD,2026-05-12T16:56:12Z,no entry,core,4,,1.0,30.0,,,,,,,1.17292,2026-05-12T16:55:40Z,32,,,rule,"Intraday bias gate feltételek hiányosak — Micro BOS long  ATR rendben: 1m micro BOS long | Micro BOS short  ATR rendben: 1m micro BOS short; Bias neutrálsávban; Regime filter inaktív; ATR erősség 1.12× küszöb (+11.7); Alacsony realised vol → magasabb RR igény; Order flow neutrális (−4.9); P-Score reduced by 4.0 due to regime CHOPPY; EURUSD: ATR(1h) alacsony — P-score küszöb +6 pontra emelve; EURUSD: Visszafogott ATR — célok szűkítve, kockázat kontroll alatt; ATR-floor override: rel_atr 0.0002 < 0.0006 → adaptív RR/TP küszöb; Regime kapu: CHOPPY miatt −10 P-score, pozícióskálázás csökkentve; Liquidity gate skipped (no volume proxy available); missing: P_score>=44",,,,,,,
a06efbc8-70ef-47b4-908c-f3b65ba314bf,USOIL,2026-05-12T16:56:13Z,no entry,core_only,41,,1.0,20.0,102.70669,101.065272115,105.98952576999999,107.63094365499998,3.0,,102.70669,2026-05-12T16:55:40Z,33,,,rule,"Bias(4H→1H)=long (+15.0); Regime filter inaktív; HTF sweep ok (+10.0); 5M BOS trendirányba (+16.0); ATR erősség 1.10× küszöb (+11.6); Intraday range felső harmada telített (−7.0); Range expanzió támogatja a momentumot (+3.0); USOIL: erős momentum — invalid zóna 2.5×ATR(1h)-re tágítva; Order flow neutrális (−4.5); P-Score reduced by 4.0 due to regime CHOPPY; USOIL: 1h ATR ≥1.5 USD — RR cél 1:2-re emelve; Regime kapu: CHOPPY miatt −10 P-score, pozícióskálázás csökkentve; USOIL stop lazítás: ATR1h alapú kockázat ×0.97; Diagnosztika: k1m: utolsó zárt gyertya 8 perc késésben van; Diagnosztika: k1m: jelzés korlátozva 8 perc késés miatt; Diagnosztika: k5m: utolsó zárt gyertya 11 perc késésben van",,,,,,,
541544fa-eb49-4f85-8bff-09a36ba07f85,BTCUSD,2026-05-12T16:56:13Z,no entry,core,32,,1.0,2.0,,,,,,,79941.05,2026-05-12T16:55:40Z,33,,,rule,"Micro bias override: gyors struktúra dominál (+19.5); Regime filter inaktív; 5M BOS trendirányba (+16.0); ATR erősség 1.54× küszöb (+14.2); Intraday range alsó harmada telített (−7.0); Range expanzió támogatja a momentumot (+3.0); Order flow neutrális (−4.8); P-Score reduced by 4.0 due to regime CHOPPY; Intraday P-score lazítás: micro-bias short elsőbbséget kap (−2.2); Mesterlövész mód: P-score minimum 35 érvényesítve; BTC mikro BOS short aktív; Regime kapu: CHOPPY miatt −10 P-score, pozícióskálázás csökkentve; Strukturális soft gate: 1/3 jel + ATR/spread OK (−6 P-score, size ×0.70); Likviditási kapu lazítva erős momentum miatt; Precision limit belépő parkolva 20 percig; missing: P_score>=35",,,,,,,
