journal_id,asset,analysis_timestamp,signal,mode,probability,model_probability,realtime_confidence,leverage,entry_price,stop_loss,take_profit_1,take_profit_2,risk_reward,initial_risk_abs,spot_price,spot_timestamp,spot_latency_seconds,precision_score,anchor_bias,probability_source,notes,validation_outcome,validation_rr,max_favorable_excursion,max_adverse_excursion,time_to_outcome_minutes,slippage,execution_latency_ms
6a62b821-fdeb-4a43-a1fc-9a900b0b4663,EURUSD,2026-01-22T01:26:32Z,no entry,core,17,,1.0,30.0,,,,,,,1.16845,2026-01-22T01:26:12Z,20,,,rule,"Intraday bias gate feltételek hiányosak — Micro BOS long  ATR rendben: 1m micro BOS long | Micro BOS short  ATR rendben: 1m micro BOS short; Bias neutrálsávban; Regime filter inaktív; ATR erősség 1.30× küszöb (+12.8); Alacsony realised vol → magasabb RR igény; Fib zóna konfluencia (0.618–0.886) (+18.0); Order flow neutrális (−5.0); P-Score reduced by 4.0 due to regime CHOPPY; ATR-floor override: rel_atr 0.0002 < 0.0006 → adaptív RR/TP küszöb; Regime kapu: CHOPPY miatt −10 P-score, pozícióskálázás csökkentve; Strukturális soft gate: 1/3 jel + ATR/spread OK (−6 P-score, size ×0.70); Strukturális kapu lazítva: momentum erős, BOS hiány engedve; Liquidity gate skipped (no volume proxy available); missing: P_score>=20",,,,,,,
470d91d8-b743-4b62-a154-f1cfe19ddb6e,GOLD_CFD,2026-01-22T01:26:32Z,precision_arming,core,62,,1.0,20.0,,,,,,,4807.90878,2026-01-22T01:26:12Z,20,,,rule,"Bias(4H→1H)=long (+15.0); Regime filter inaktív; 5M BOS trendirányba (+16.0); ATR erősség 1.98× küszöb (+16.9); Range expanzió támogatja a momentumot (+3.0); Fib zóna konfluencia (0.618–0.886) (+18.0); Order flow neutrális (−3.9); P-Score reduced by 4.0 due to regime CHOPPY; OFI z-score 1.23 támogatja az irányt; ATR-floor override: rel_atr 0.0016 < 0.0025 → adaptív RR/TP küszöb; Regime kapu: CHOPPY miatt −10 P-score, pozícióskálázás csökkentve; Liquidity gate skipped (no volume proxy available); GOLD stop lazítás: ATR alapú kockázat ×3.00; Precision trigger kész → limit figyelés; Precision limit belépő parkolva 12 percig",,,,,,,
5a1aa96a-454c-43ce-bc7f-fb0fd3b5f1a9,XAGUSD,2026-01-22T01:26:32Z,precision_arming,core,58,,1.0,20.0,,,,,,,92.31986,2026-01-22T01:26:12Z,20,,,rule,"Bias(4H→1H)=long (+15.0); Regime filter inaktív; 5M BOS trendirányba (+16.0); ATR erősség 2.31× küszöb (+18.9); Range expanzió támogatja a momentumot (+3.0); XAG momentum override — stop tágítva erős trendnél; XAGUSD: momentum override — stop távolság 1.3×ATR-re tágítva; Fib zóna konfluencia (0.618–0.886) (+18.0); Order flow neutrális (−4.2); P-Score reduced by 4.0 due to regime CHOPPY; XAGUSD: momentum kitörés — RR cél 1:1.45-re szűkítve; XAG momentum override — pozícióméret csökkentve; XAGUSD: ATR-alapú pozícióskálázás ×0.55; XAG: VWAP alatt — long setup türelmet igényel; Regime kapu: CHOPPY miatt −10 P-score, pozícióskálázás csökkentve; Strukturális soft gate: 1/3 jel + ATR/spread OK (−6 P-score, size ×0.70); Strukturális kapu lazítva: momentum erős, BOS hiány engedve; Liquidity gate skipped (no volume proxy available); Precision trigger kész → limit figyelés; Precision limit belépő parkolva 12 percig",,,,,,,
05928487-e162-4014-8869-604c717876b6,BTCUSD,2026-01-22T01:26:32Z,precision_arming,core,46,,1.0,2.0,,,,,,,90049.86,2026-01-22T01:26:12Z,20,,,rule,"Mean reversion bias override (+19.5); Regime filter inaktív; ATR erősség 1.20× küszöb (+12.2); Ár az intraday range felső zónájában (+4.0); Fib zóna konfluencia (0.618–0.886) (+18.0); Order flow neutrális (−4.9); P-Score reduced by 4.0 due to regime CHOPPY; Regime kapu: CHOPPY miatt −10 P-score, pozícióskálázás csökkentve; BTC ATR stop igazítás: kockázat ×1.00; Precision trigger kész → limit figyelés; Precision limit belépő parkolva 20 percig",,,,,,,
0c208e72-d9e3-4eee-920c-3fba9601c40b,USOIL,2026-01-22T01:26:33Z,no entry,core,24,,1.0,20.0,,,,,,,60.69574,2026-01-22T01:26:12Z,20,,,rule,"Bias(4H→1H)=long (+15.0); Regime filter inaktív; 5M BOS trendirányba (+16.0); ATR nincs rendben (relatív vagy abszolút küszöb); Intraday range felső harmada telített (−7.0); Range expanzió támogatja a momentumot (+3.0); USOIL: erős momentum — invalid zóna 2.5×ATR(1h)-re tágítva; Fib zóna konfluencia (0.618–0.886) (+18.0); Order flow neutrális (−4.5); P-Score reduced by 4.0 due to regime CHOPPY; USOIL: 1h ATR <1 USD — P-score küszöb emelve a zajos sáv miatt; USOIL: csökkenő volatilitás — RR cél 1:1.5-re igazítva; USOIL: ázsiai sáv — pozícióméret ×0.70; Regime kapu: CHOPPY miatt −10 P-score, pozícióskálázás csökkentve; ATR soft gate: alacsony volatilitás −5 P-score, méret felezve; Liquidity gate skipped (no volume proxy available); missing: P_score>=27",,,,,,,
