journal_id,asset,analysis_timestamp,signal,mode,probability,model_probability,realtime_confidence,leverage,entry_price,stop_loss,take_profit_1,take_profit_2,risk_reward,initial_risk_abs,spot_price,spot_timestamp,spot_latency_seconds,precision_score,anchor_bias,probability_source,notes,validation_outcome,validation_rr,max_favorable_excursion,max_adverse_excursion,time_to_outcome_minutes,slippage,execution_latency_ms,fill_timestamp,exit_timestamp,entry_kind,validation_source
4b126e1f-cf13-4301-88ba-d54ea8c5d0af,GOLD_CFD,2026-05-08T18:50:53Z,no entry,core,1,,1.0,20.0,,,,,,,4723.31904,2026-05-08T18:50:28Z,25,,,rule,"Intraday bias gate feltételek hiányosak — 5m retest long  ATR: 5m retest long, ATR gate | 5m retest short  ATR: 5m retest short, ATR gate; Bias neutrálsávban; Regime filter inaktív; ATR nincs rendben (relatív vagy abszolút küszöb); Alacsony realised vol → magasabb RR igény; Range expanzió támogatja a momentumot (+3.0); Fib zóna konfluencia (0.618–0.886) (+18.0); Order flow neutrális (−4.4); P-Score reduced by 4.0 due to regime CHOPPY; ATR-floor override: rel_atr 0.0004 < 0.0025 → adaptív RR/TP küszöb; Regime kapu: CHOPPY miatt −10 P-score, pozícióskálázás csökkentve; ATR soft gate: alacsony volatilitás −5 P-score, méret felezve; Strukturális kapu lazítva: momentum erős, BOS hiány engedve; Liquidity gate skipped (no volume proxy available); missing: P_score>=30",,,,,,,,,,,
1b42daff-acbb-41f9-b0bd-f36a5ffc6d97,EURUSD,2026-05-08T18:50:53Z,no entry,core,7,,1.0,30.0,,,,,,,1.17784,2026-05-08T18:50:28Z,25,,,rule,"Bias(4H→1H)=long (+15.0); Regime filter inaktív; ATR nincs rendben (relatív vagy abszolút küszöb); Alacsony realised vol → magasabb RR igény; Fib zóna konfluencia (0.618–0.886) (+18.0); Order flow neutrális (−4.8); P-Score reduced by 4.0 due to regime CHOPPY; P-Score reduced by 5.4 due to ATR Soft Gate tolerance; EURUSD: ATR(1h) alacsony — P-score küszöb +6 pontra emelve; EURUSD: Visszafogott ATR — célok szűkítve, kockázat kontroll alatt; EURUSD BOS aktív, de VWAP alatt — türelem; ATR-floor override: rel_atr 0.0002 < 0.0006 → adaptív RR/TP küszöb; Regime kapu: CHOPPY miatt −10 P-score, pozícióskálázás csökkentve; ATR soft gate: alacsony volatilitás −5 P-score, méret felezve; Liquidity gate skipped (no volume proxy available); missing: P_score>=44",,,,,,,,,,,
82c23add-d430-4ca3-a401-f9fe79eae6cd,NVDA,2026-05-08T18:50:53Z,no entry,core,44,,1.0,5.0,215.11,212.3683582632143,219.05796410097145,221.03194615145716,2.16,,215.11,2026-05-08T18:50:28Z,25,,,rule,"Bias(4H→1H)=long (+15.0); EMA21 slope 1.16× küszöb (+13.0); ATR nincs rendben (relatív vagy abszolút küszöb); WARNING: No Liquidity Structure (Nearest: 197.190952, Dist: 55.87ATR); Fib zóna konfluencia (0.618–0.886) (+18.0); Order flow neutrális (−3.5); ATR soft gate: alacsony volatilitás −5 P-score, méret felezve; NVDA ATR1h stop igazítás: kockázat ×1.04; missing: precision_flow_alignment",,,,,,,,,,,
29ea904b-3286-4e00-8ff4-48152e09f5ad,XAGUSD,2026-05-08T18:50:53Z,no entry,core,12,,1.0,20.0,,,,,,,80.53313,2026-05-08T18:50:28Z,25,,,rule,"Bias(4H→1H)=long (+15.0); Regime filter inaktív; ATR nincs rendben (relatív vagy abszolút küszöb); Fib zóna konfluencia (0.618–0.886) (+18.0); Order flow neutrális (−4.6); P-Score reduced by 4.0 due to regime CHOPPY; XAGUSD: visszafogott ATR — RR cél 1:1.7-re emelve; XAGUSD breakout-védelem: gyors BE + 20% giveback limit expanziós szakaszban; XAGUSD: ATR-alapú pozícióskálázás ×0.70; XAG: VWAP alatt — long setup türelmet igényel; ATR-floor override: rel_atr 0.0015 < 0.0018 → adaptív RR/TP küszöb; Regime kapu: CHOPPY miatt −10 P-score, pozícióskálázás csökkentve; ATR soft gate: alacsony volatilitás −5 P-score, méret felezve; Liquidity gate skipped (no volume proxy available); missing: P_score>=28",,,,,,,,,,,
b639c0dc-d4ef-4fc1-a5a5-862167788ee9,USOIL,2026-05-08T18:50:54Z,no entry,core,0,,1.0,20.0,,,,,,,96.68485,2026-05-08T18:50:28Z,26,,,rule,"Intraday bias gate feltételek hiányosak — USOIL retest long  ATR: 5m retest long, ATR gate | USOIL retest short  ATR: 5m retest short, ATR gate; Bias neutrálsávban; Regime filter inaktív; ATR nincs rendben (relatív vagy abszolút küszöb); Fib zóna konfluencia (0.618–0.886) (+18.0); Order flow neutrális (−4.9); P-Score reduced by 4.0 due to regime CHOPPY; USOIL: parabolikus lendület — RR cél 1:1.4 környékére szűkítve; Regime kapu: CHOPPY miatt −10 P-score, pozícióskálázás csökkentve; ATR soft gate: alacsony volatilitás −5 P-score, méret felezve; Liquidity gate skipped (no volume proxy available); missing: P_score>=36",,,,,,,,,,,
2a52556f-135a-4562-8d66-8b7fe9d8f85b,BTCUSD,2026-05-08T18:50:54Z,sell,core,61,,1.0,2.0,80128.98,80930.2698,78526.4004,77725.1106,3.0,,80128.98,2026-05-08T18:50:28Z,26,,,rule,"Bias override: Intraday 5m BOS short  ATR (+19.5); Regime filter inaktív; 5M BOS trendirányba (+16.0); ATR erősség 1.05× küszöb (+11.3); Range expanzió támogatja a momentumot (+3.0); Fib zóna konfluencia (0.618–0.886) (+18.0); Order flow neutrális (−4.2); P-Score reduced by 4.0 due to regime CHOPPY; Mesterlövész mód: P-score minimum 35 érvényesítve; Regime kapu: CHOPPY miatt −10 P-score, pozícióskálázás csökkentve; Strukturális kapu lazítva: momentum erős, BOS hiány engedve; BTC ATR1h stop igazítás: kockázat ×1.15; TP1 nettó profit ≈ 0.60%; Precision plan: entry 80115.7–80192.6, SL 80269.6; Precision confidence medium (62.0); Precision limit belépő parkolva 20 percig; missing: tp1_net>=+0.6%",insufficient_data,,,,,,,,,market,auto
