journal_id,asset,analysis_timestamp,signal,mode,probability,model_probability,realtime_confidence,leverage,entry_price,stop_loss,take_profit_1,take_profit_2,risk_reward,initial_risk_abs,spot_price,spot_timestamp,spot_latency_seconds,precision_score,anchor_bias,probability_source,notes,validation_outcome,validation_rr,max_favorable_excursion,max_adverse_excursion,time_to_outcome_minutes,slippage,execution_latency_ms
1ca2fc39-3505-4912-a025-33e6bc653e8e,XAGUSD,2026-04-22T16:07:07Z,no entry,core,15,,1.0,20.0,,,,,,,77.93076,2026-04-22T16:06:42Z,25,,,rule,"Intraday bias gate feltételek hiányosak — Micro BOS long  ATR (ezüst): 1m micro BOS long | Micro BOS short  ATR (ezüst): 1m micro BOS short; Bias neutrálsávban; Regime filter inaktív; ATR erősség 0.92× küszöb (+10.5); Fib zóna konfluencia (0.618–0.886) (+18.0); Order flow neutrális (−4.9); P-Score reduced by 3.2 due to ATR Soft Gate tolerance; XAGUSD: visszafogott ATR — RR cél 1:1.7-re emelve; XAGUSD breakout-védelem: gyors BE + 20% giveback limit expanziós szakaszban; ATR-floor override: rel_atr 0.0017 < 0.0018 → adaptív RR/TP küszöb; Regime kapu: CHOPPY miatt −10 P-score, pozícióskálázás csökkentve; Strukturális soft gate: 1/3 jel + ATR/spread OK (−6 P-score, size ×0.70); Strukturális kapu lazítva: momentum erős, BOS hiány engedve; Liquidity gate skipped (no volume proxy available); missing: P_score>=28",,,,,,,
fc06c203-35aa-440e-b971-346833c6a22d,GOLD_CFD,2026-04-22T16:07:07Z,no entry,core,0,,1.0,20.0,,,,,,,4732.21054,2026-04-22T16:06:42Z,25,,,rule,"Intraday bias gate feltételek hiányosak — 5m retest long  ATR: 5m retest long, ATR gate | 5m retest short  ATR: 5m retest short, ATR gate; Bias neutrálsávban; Regime filter inaktív; ATR nincs rendben (relatív vagy abszolút küszöb); Alacsony realised vol → magasabb RR igény; Order flow neutrális (−4.6); P-Score reduced by 4.0 due to regime CHOPPY; ATR-floor override: rel_atr 0.0008 < 0.0025 → adaptív RR/TP küszöb; Regime kapu: CHOPPY miatt −10 P-score, pozícióskálázás csökkentve; ATR soft gate: alacsony volatilitás −5 P-score, méret felezve; Liquidity gate skipped (no volume proxy available); missing: P_score>=30",,,,,,,
7372f2b0-2c92-4c7c-a5bc-681cb1195bbb,EURUSD,2026-04-22T16:07:07Z,no entry,core,19,,1.0,30.0,,,,,,,1.17146,2026-04-22T16:06:42Z,25,,,rule,"Intraday bias gate feltételek hiányosak — Micro BOS long  ATR rendben: 1m micro BOS long | Micro BOS short  ATR rendben: 1m micro BOS short; Bias neutrálsávban; Regime filter inaktív; HTF sweep ok (+10.0); ATR erősség 1.25× küszöb (+12.5); Alacsony realised vol → magasabb RR igény; Range expanzió támogatja a momentumot (+3.0); Order flow neutrális (−3.5); P-Score reduced by 4.0 due to regime CHOPPY; EURUSD: ATR(1h) alacsony — P-score küszöb +6 pontra emelve; EURUSD: Visszafogott ATR — célok szűkítve, kockázat kontroll alatt; ATR-floor override: rel_atr 0.0002 < 0.0006 → adaptív RR/TP küszöb; Regime kapu: CHOPPY miatt −10 P-score, pozícióskálázás csökkentve; Strukturális kapu lazítva: momentum erős, BOS hiány engedve; Liquidity gate skipped (no volume proxy available); missing: P_score>=44",,,,,,,
e3d1f7ca-9753-431a-a3a0-3c3ae45fbfb2,NVDA,2026-04-22T16:07:07Z,no entry,core,4,,1.0,5.0,,,,,,,201.385,2026-04-22T16:06:42Z,25,,,rule,"Bias(4H→1H)=long (+15.0); Regime filter inaktív; ATR nincs rendben (relatív vagy abszolút küszöb); WARNING: No Liquidity Structure (Nearest: 184.856802, Dist: 55.83ATR); Ár 1h EMA21 zónában (+10.0); Order flow neutrális (−4.4); P-Score reduced by 4.0 due to regime CHOPPY; OFI z-score 1.71 támogatja az irányt; Regime kapu: CHOPPY miatt −10 P-score, pozícióskálázás csökkentve; ATR soft gate: alacsony volatilitás −5 P-score, méret felezve; missing: P_score>=38",,,,,,,
d3ffb81e-e6d0-4d02-bda7-28dc86d8d26c,BTCUSD,2026-04-22T16:07:07Z,precision_arming,core,74,,1.0,2.0,,,,,,,79424.0,2026-04-22T16:06:42Z,25,,,rule,"Bias(4H→1H)=long (+15.0); EMA21 slope 1.32× küszöb (+13.9); HTF sweep ok (+10.0); 5M BOS trendirányba (+16.0); ATR erősség 1.41× küszöb (+13.4); Intraday range felső harmada telített (−7.0); Range expanzió támogatja a momentumot (+3.0); Order flow neutrális (−4.1); Buy pressure támogatja a setupot (+5); Intraday P-score lazítás: micro-bias long elsőbbséget kap (−1.5); Mesterlövész mód: P-score minimum 35 érvényesítve; BTC mikro BOS long aktív; Strukturális soft gate: 1/3 jel + ATR/spread OK (−6 P-score, size ×0.70); Likviditási kapu lazítva erős momentum miatt; BTC ATR1h stop igazítás: kockázat ×1.15; Precision trigger kész → limit figyelés; Precision limit belépő parkolva 20 percig",,,,,,,
1c040602-acac-4b79-802a-da4ebfd3dd39,USOIL,2026-04-22T16:07:07Z,no entry,core,11,,1.0,20.0,,,,,,,96.4221,2026-04-22T16:06:42Z,25,,,rule,"Bias(4H→1H)=long (+15.0); Regime filter inaktív; 5M BOS trendirányba (+16.0); ATR nincs rendben (relatív vagy abszolút küszöb); Intraday range felső harmada telített (−7.0); Range expanzió támogatja a momentumot (+3.0); USOIL: erős momentum — invalid zóna 2.5×ATR(1h)-re tágítva; Ár 1h EMA21 zónában (+10.0); Order flow neutrális (−4.4); OFI toxikus long irányra (−5.4); P-Score reduced by 4.0 due to regime CHOPPY; USOIL: parabolikus lendület — RR cél 1:1.4 környékére szűkítve; Regime kapu: CHOPPY miatt −10 P-score, pozícióskálázás csökkentve; ATR soft gate: alacsony volatilitás −5 P-score, méret felezve; Liquidity gate skipped (no volume proxy available); missing: P_score>=36",,,,,,,
