journal_id,asset,analysis_timestamp,signal,mode,probability,model_probability,realtime_confidence,leverage,entry_price,stop_loss,take_profit_1,take_profit_2,risk_reward,initial_risk_abs,spot_price,spot_timestamp,spot_latency_seconds,precision_score,anchor_bias,probability_source,notes,validation_outcome,validation_rr,max_favorable_excursion,max_adverse_excursion,time_to_outcome_minutes,slippage,execution_latency_ms
a19073da-7d6b-44bd-bc1a-4d1c4bd38e66,XAGUSD,2026-05-06T11:16:57Z,no entry,core,36,,1.0,20.0,,,,,,,77.59507,2026-05-06T11:16:30Z,27,,,rule,Intraday bias gate feltételek hiányosak — Micro BOS long  ATR (ezüst): 1m micro BOS long | Micro BOS short  ATR (ezüst): 1m micro BOS short; Bias neutrálsávban; EMA21 slope 1.25× küszöb (+13.5); ATR erősség 1.16× küszöb (+11.9); Order flow neutrális (−4.9); XAGUSD breakout-védelem: gyors BE + 20% giveback limit expanziós szakaszban; XAGUSD: ATR-alapú pozícióskálázás ×0.70; Liquidity gate skipped (no volume proxy available),,,,,,,
6e02b5bb-deb4-4560-95ce-ebe7dd270cd0,GOLD_CFD,2026-05-06T11:16:57Z,no entry,core,0,,1.0,20.0,,,,,,,4713.78493,2026-05-06T11:16:30Z,27,,,rule,"Intraday bias gate feltételek hiányosak — 5m retest long  ATR: 5m retest long, ATR gate | 5m retest short  ATR: 5m retest short, ATR gate; Bias neutrálsávban; Regime filter inaktív; HTF sweep ok (+10.0); ATR nincs rendben (relatív vagy abszolút küszöb); Order flow neutrális (−4.8); P-Score reduced by 4.0 due to regime CHOPPY; ATR-floor override: rel_atr 0.0014 < 0.0025 → adaptív RR/TP küszöb; Regime kapu: CHOPPY miatt −10 P-score, pozícióskálázás csökkentve; ATR soft gate: alacsony volatilitás −5 P-score, méret felezve; Liquidity gate skipped (no volume proxy available); missing: P_score>=30",,,,,,,
c7348267-42b9-459a-bd99-49d612f95f33,EURUSD,2026-05-06T11:16:57Z,no entry,core,15,,1.0,30.0,,,,,,,1.17857,2026-05-06T11:16:30Z,27,,,rule,"Bias(4H→1H)=long (+15.0); Regime filter inaktív; ATR erősség 2.07× küszöb (+17.4); Alacsony realised vol → magasabb RR igény; Intraday range felső harmada telített (−7.0); Order flow neutrális (−4.1); OFI toxikus long irányra (−3.6); P-Score reduced by 4.0 due to regime CHOPPY; Range guard lazítva: napi sáv teteje, de mikro-range visszahúzódott.; EURUSD BOS aktív, de VWAP alatt — türelem; ATR-floor override: rel_atr 0.0005 < 0.0006 → adaptív RR/TP küszöb; Regime kapu: CHOPPY miatt −10 P-score, pozícióskálázás csökkentve; Liquidity gate skipped (no volume proxy available); missing: P_score>=38",,,,,,,
aeef21e0-3e1f-470e-8a4f-32cc05fcc4e3,BTCUSD,2026-05-06T11:16:57Z,no entry,core,32,,1.0,2.0,,,,,,,82468.98,2026-05-06T11:16:30Z,27,,,rule,"Micro bias override: gyors struktúra dominál (+19.5); Regime filter inaktív; 5M BOS trendirányba (+16.0); ATR erősség 1.39× küszöb (+13.3); Intraday range felső harmada telített (−7.0); Range expanzió támogatja a momentumot (+3.0); Order flow neutrális (−3.4); P-Score reduced by 4.0 due to regime CHOPPY; Intraday P-score lazítás: micro-bias long elsőbbséget kap (−1.5); Mesterlövész mód: P-score minimum 35 érvényesítve; BTC mikro BOS long aktív; Regime kapu: CHOPPY miatt −10 P-score, pozícióskálázás csökkentve; Strukturális soft gate: 1/3 jel + ATR/spread OK (−6 P-score, size ×0.70); Likviditási kapu lazítva erős momentum miatt; Precision limit belépő parkolva 20 percig; missing: P_score>=35",,,,,,,
be6d9eb6-3ec5-4caa-b5bf-2385d63f92df,USOIL,2026-05-06T11:16:57Z,no entry,core_only,93,,1.0,20.0,89.64844,92.93451414699999,82.09046946190001,77.81857307080001,3.6,,89.64844,2026-05-06T11:16:30Z,27,,,rule,Bias override: 1h trend short + momentum támogatás (+19.5); EMA21 slope 2.80× küszöb (+21.0); HTF sweep ok (+10.0); 5M BOS trendirányba (+16.0); ATR erősség 2.33× küszöb (+19.0); Intraday range alsó harmada telített (−7.0); Range expanzió támogatja a momentumot (+3.0); USOIL: erős momentum — invalid zóna 2.5×ATR(1h)-re tágítva; Order flow neutrális (−3.9); USOIL: parabolikus lendület — RR cél 1:1.4 környékére szűkítve; USOIL: európai délelőtt — pozícióméret ×0.85; USOIL stop lazítás: ATR1h alapú kockázat ×0.97; Diagnosztika: k1m: utolsó zárt gyertya 10 perc késésben van; Diagnosztika: k1m: jelzés korlátozva 10 perc késés miatt; Diagnosztika: k5m: utolsó zárt gyertya 11 perc késésben van,,,,,,,
