journal_id,asset,analysis_timestamp,signal,mode,probability,model_probability,realtime_confidence,leverage,entry_price,stop_loss,take_profit_1,take_profit_2,risk_reward,initial_risk_abs,spot_price,spot_timestamp,spot_latency_seconds,precision_score,anchor_bias,probability_source,notes,validation_outcome,validation_rr,max_favorable_excursion,max_adverse_excursion,time_to_outcome_minutes,slippage,execution_latency_ms,fill_timestamp,exit_timestamp,entry_kind,validation_source
b88d3556-eae6-410e-ab2b-15966fdff89c,EURUSD,2025-12-23T03:16:18Z,no entry,core,0,,1.0,30.0,,,,,,,1.17766,2025-12-23T03:16:00Z,18,,,rule,"Bias(4H→1H)=long (+15.0); Regime filter inaktív; ATR nincs rendben (relatív vagy abszolút küszöb); Alacsony realised vol → magasabb RR igény; P-Score reduced by 4.0 due to regime CHOPPY; P-Score reduced by 2.2 due to ATR Soft Gate tolerance; EURUSD: ATR(1h) alacsony — P-score küszöb +6 pontra emelve; EURUSD: Visszafogott ATR — célok szűkítve, kockázat kontroll alatt; EURUSD BOS aktív, de VWAP alatt — türelem; ATR-floor override: rel_atr 0.0001 < 0.0006 → adaptív RR/TP küszöb; Regime kapu: CHOPPY miatt −10 P-score, pozícióskálázás csökkentve; ATR soft gate: alacsony volatilitás −5 P-score, méret felezve; Liquidity gate skipped (no volume proxy available); Order-flow gates skipped (no tick/imbalance data); missing: P_score>=34, precision_score>=55",,,,,,,,,,,
59cf27eb-c3ca-4742-9af5-3d6059734463,XAGUSD,2025-12-23T03:16:18Z,precision_arming,core,56,,1.0,20.0,,,,,,,69.73997,2025-12-23T03:15:44Z,34,,,rule,"Bias(4H→1H)=long (+15.0); Regime filter inaktív; HTF sweep ok (+10.0); 5M BOS trendirányba (+16.0); ATR erősség 1.63× küszöb (+14.8); Range expanzió támogatja a momentumot (+3.0); XAG momentum override — stop tágítva erős trendnél; XAGUSD: momentum override — stop távolság 1.3×ATR-re tágítva; P-Score reduced by 4.0 due to regime CHOPPY; XAGUSD: momentum kitörés — RR cél 1:1.45-re szűkítve; XAG momentum override — pozícióméret csökkentve; XAGUSD: ATR-alapú pozícióskálázás ×0.55; XAG: VWAP alatt — long setup türelmet igényel; Regime kapu: CHOPPY miatt −10 P-score, pozícióskálázás csökkentve; Strukturális kapu lazítva: momentum erős, BOS hiány engedve; Liquidity gate skipped (no volume proxy available); Order-flow gates skipped (no tick/imbalance data); TP1 nettó profit ≈ 1.90%; Precision belépő: trigger ablak aktív; Precision limit belépő parkolva 20 percig",,,,,,,,,,,
4f3b801f-13a4-473a-a602-857aed372d45,GOLD_CFD,2025-12-23T03:16:18Z,no entry,core,0,,1.0,20.0,,,,,,,4487.02966,2025-12-23T03:16:12Z,6,,,rule,"Bias(4H→1H)=long (+15.0); Regime filter inaktív; ATR nincs rendben (relatív vagy abszolút küszöb); Alacsony realised vol → magasabb RR igény; P-Score reduced by 4.0 due to regime CHOPPY; VWAP alatt — GOLD long breakout késleltetve; ATR-floor override: rel_atr 0.0009 < 0.0025 → adaptív RR/TP küszöb; Regime kapu: CHOPPY miatt −10 P-score, pozícióskálázás csökkentve; ATR soft gate: alacsony volatilitás −5 P-score, méret felezve; Liquidity gate skipped (no volume proxy available); Order-flow gates skipped (no tick/imbalance data); missing: P_score>=30",,,,,,,,,,,
ae47d1cd-9fdb-409b-8d30-1dbeb17734a0,BTCUSD,2025-12-23T03:16:18Z,sell,core,78,,1.0,2.0,88070.11,88950.8111,86308.70779999999,85428.00669999998,3.0,,88070.11,2025-12-23T03:15:54Z,24,,,rule,"Bias override: Intraday 5m BOS short + ATR (+19.5); Regime filter inaktív; HTF sweep ok (+10.0); 5M BOS trendirányba (+16.0); ATR erősség 1.65× küszöb (+14.9); Range expanzió támogatja a momentumot (+3.0); ema9x21+ofi_z=-999.00; Fib zóna konfluencia (0.618–0.886) (+18.0); P-Score reduced by 4.0 due to regime CHOPPY; BTC momentum override — pozícióméret csökkentve; Regime kapu: CHOPPY miatt −10 P-score, pozícióskálázás csökkentve; Strukturális kapu lazítva: momentum erős, BOS hiány engedve; TP1 nettó profit ≈ 0.60%; Order-flow gates skipped (no tick/imbalance data); Precision plan: entry 88028.0–88154.3, SL 88280.5; Precision confidence medium (62.0); Precision limit belépő parkolva 16 percig; Pozíciómenedzsment: aktív short pozíció (opened_at: 2025-12-23T03:16:18Z, Entry: 88070.11, SL: 88950.8111, TP2: 85428.00669999998)",insufficient_data,,,,,,,,,market,auto
7304b719-6e40-4eb4-ae40-bdac86830019,USOIL,2025-12-23T03:16:18Z,no entry,core,0,,1.0,20.0,,,,,,,57.93,2025-12-23T03:15:42Z,36,,,rule,"Intraday bias gate feltételek hiányosak — USOIL retest long + ATR: 5m retest long, ATR gate | USOIL retest short + ATR: 5m retest short, ATR gate; Bias neutrálsávban; Regime filter inaktív; ATR nincs rendben (relatív vagy abszolút küszöb); Alacsony realised vol → magasabb RR igény; Range expanzió támogatja a momentumot (+3.0); USOIL: erős momentum — invalid zóna 2.5×ATR(1h)-re tágítva; Fib zóna konfluencia (0.618–0.886) (+18.0); P-Score reduced by 4.0 due to regime CHOPPY; P-Score reduced by 4.0 due to ATR Soft Gate tolerance; USOIL: 1h ATR <1 USD — P-score küszöb emelve a zajos sáv miatt; USOIL: csökkenő volatilitás — RR cél 1:1.5-re igazítva; USOIL: ázsiai sáv — pozícióméret ×0.70; Regime kapu: CHOPPY miatt −10 P-score, pozícióskálázás csökkentve; ATR soft gate: alacsony volatilitás −5 P-score, méret felezve; Bias eltérés: H1 trend ütközik az M5 belépéssel (−15 P-score); Strukturális kapu lazítva: momentum erős, BOS hiány engedve; Liquidity gate skipped (no volume proxy available); Order-flow gates skipped (no tick/imbalance data); missing: P_score>=36",,,,,,,,,,,
