journal_id,asset,analysis_timestamp,signal,mode,probability,model_probability,realtime_confidence,leverage,entry_price,stop_loss,take_profit_1,take_profit_2,risk_reward,initial_risk_abs,spot_price,spot_timestamp,spot_latency_seconds,precision_score,anchor_bias,probability_source,notes,validation_outcome,validation_rr,max_favorable_excursion,max_adverse_excursion,time_to_outcome_minutes,slippage,execution_latency_ms
5b690dfc-b327-4498-8475-ae01cd957422,GOLD_CFD,2025-12-29T10:56:13Z,no entry,core,3,,1.0,20.0,,,,,,,4460.54092,2025-12-29T10:56:06Z,7,,,rule,"Bias(4H→1H)=long (+15.0); Regime filter inaktív; ATR nincs rendben (relatív vagy abszolút küszöb); Alacsony realised vol → magasabb RR igény; Ár az intraday range alsó zónájában (+4.0); P-Score reduced by 4.0 due to regime CHOPPY; ATR-floor override: rel_atr 0.0008 < 0.0025 → adaptív RR/TP küszöb; Regime kapu: CHOPPY miatt −10 P-score, pozícióskálázás csökkentve; ATR soft gate: alacsony volatilitás −5 P-score, méret felezve; Liquidity gate skipped (no volume proxy available); Order-flow gates skipped (no tick/imbalance data); missing: P_score>=30",,,,,,,
0d4f7e07-acaa-4180-9585-76eff53b8e6c,XAGUSD,2025-12-29T10:56:13Z,no entry,core,61,,1.0,20.0,75.43355,74.6792145,76.94222099999999,77.69655649999999,3.0,,75.43355,2025-12-29T10:55:45Z,28,,,rule,"Bias(4H→1H)=long (+15.0); Regime filter inaktív; ATR erősség 59.80× küszöb (+23.0); Ár az intraday range alsó zónájában (+4.0); Fib zóna konfluencia (0.618–0.886) (+18.0); XAG: VWAP alatt — long setup türelmet igényel; Regime kapu: CHOPPY miatt −10 P-score, pozícióskálázás csökkentve; Liquidity gate skipped (no volume proxy available); Order-flow gates skipped (no tick/imbalance data)",,,,,,,
461f8a71-6fca-42ee-9970-8724a8efe78e,EURUSD,2025-12-29T10:56:13Z,no entry,core,14,,1.0,30.0,,,,,,,1.17743,2025-12-29T10:55:55Z,18,,,rule,"Intraday bias gate feltételek hiányosak — Micro BOS long  ATR rendben: 1m micro BOS long | Micro BOS short  ATR rendben: 1m micro BOS short; Bias neutrálsávban; Regime filter inaktív; ATR erősség 1.45× küszöb (+13.7); Alacsony realised vol → magasabb RR igény; Fib zóna konfluencia (0.618–0.886) (+18.0); P-Score reduced by 4.0 due to regime CHOPPY; EURUSD: ATR(1h) alacsony — P-score küszöb +6 pontra emelve; EURUSD: Visszafogott ATR — célok szűkítve, kockázat kontroll alatt; ATR-floor override: rel_atr 0.0003 < 0.0006 → adaptív RR/TP küszöb; Regime kapu: CHOPPY miatt −10 P-score, pozícióskálázás csökkentve; Bias eltérés: H1 trend ütközik az M5 belépéssel (−15 P-score); Liquidity gate skipped (no volume proxy available); Order-flow gates skipped (no tick/imbalance data); missing: P_score>=34",,,,,,,
41bb5754-b2b7-4f38-aa7c-737af28060cb,BTCUSD,2025-12-29T10:56:13Z,no entry,core,50,,1.0,2.0,87789.29,88667.1829,85770.13632999998,84628.87555999997,3.6,,87789.29,2025-12-29T10:55:56Z,17,,,rule,"Bias override: Intraday 5m BOS short  ATR (+19.5); Regime filter inaktív; 5M BOS trendirányba (+16.0); ATR erősség 2.76× küszöb (+21.6); Intraday range alsó harmada telített (−7.0); Range expanzió támogatja a momentumot (+3.0); P-Score reduced by 4.0 due to regime CHOPPY; Regime kapu: CHOPPY miatt −10 P-score, pozícióskálázás csökkentve; Strukturális kapu lazítva: momentum erős, BOS hiány engedve; Likviditási kapu lazítva erős momentum miatt; BTC ATR stop igazítás: kockázat ×1.00; Order-flow gates skipped (no tick/imbalance data); Precision limit belépő parkolva 16 percig",,,,,,,
852c964d-b4e0-4eec-afa0-d859d2121601,USOIL,2025-12-29T10:56:13Z,no entry,core,0,,1.0,20.0,,,,,,,57.83,2025-12-29T10:55:38Z,35,,,rule,"Intraday bias gate feltételek hiányosak — USOIL retest long  ATR: 5m retest long, ATR gate | USOIL retest short  ATR: 5m retest short, ATR gate; Bias neutrálsávban; Regime filter inaktív; ATR nincs rendben (relatív vagy abszolút küszöb); Range expanzió támogatja a momentumot (+3.0); USOIL: erős momentum — invalid zóna 2.5×ATR(1h)-re tágítva; P-Score reduced by 4.0 due to regime CHOPPY; USOIL: 1h ATR <1 USD — P-score küszöb emelve a zajos sáv miatt; USOIL: csökkenő volatilitás — RR cél 1:1.5-re igazítva; USOIL: európai délelőtt — pozícióméret ×0.75; Regime kapu: CHOPPY miatt −10 P-score, pozícióskálázás csökkentve; ATR soft gate: alacsony volatilitás −5 P-score, méret felezve; Bias eltérés: H1 trend ütközik az M5 belépéssel (−15 P-score); Strukturális kapu lazítva: momentum erős, BOS hiány engedve; Liquidity gate skipped (no volume proxy available); Order-flow gates skipped (no tick/imbalance data); missing: P_score>=36",,,,,,,
