journal_id,asset,analysis_timestamp,signal,mode,probability,model_probability,realtime_confidence,leverage,entry_price,stop_loss,take_profit_1,take_profit_2,risk_reward,initial_risk_abs,spot_price,spot_timestamp,spot_latency_seconds,precision_score,anchor_bias,probability_source,notes,validation_outcome,validation_rr,max_favorable_excursion,max_adverse_excursion,time_to_outcome_minutes,slippage,execution_latency_ms
ec83f4df-30d8-4ec5-9e8d-c766a57713d6,GOLD_CFD,2026-06-10T14:41:17Z,precision_arming,core,40,,1.0,20.0,,,,,,,4155.37455,2026-06-10T14:40:44Z,33,,,rule,"Bias(4H→1H)=short (+15.0); Regime filter inaktív; HTF sweep ok (+10.0); 5M BOS trendirányba (+16.0); London–NY overlap profil (-1.0); ATR nincs rendben (relatív vagy abszolút küszöb); Range expanzió támogatja a momentumot (+3.0); Fib zóna konfluencia (0.618–0.886) (+18.0); Order flow neutrális (−4.8); P-Score reduced by 4.0 due to regime CHOPPY; VWAP felett — GOLD short breakout várakozik; ATR-floor override: rel_atr 0.0021 < 0.0025 → adaptív RR/TP küszöb; Regime kapu: CHOPPY miatt −10 P-score, pozícióskálázás csökkentve; ATR soft gate: alacsony volatilitás −5 P-score, méret felezve; Strukturális kapu lazítva: momentum erős, BOS hiány engedve; Liquidity gate skipped (no volume proxy available); GOLD stop lazítás: ATR1h alapú kockázat ×1.09; Precision trigger kész → limit figyelés; Precision limit belépő parkolva 12 percig",,,,,,,
44d5e486-d923-449f-be2c-c8262eca50bf,NVDA,2026-06-10T14:41:17Z,no entry,core,26,,1.0,5.0,,,,,,,205.87,2026-06-10T14:40:44Z,33,,,rule,"Intraday bias gate: ellentétes long/short jelek → várakozás; Bias neutrálsávban; Regime filter inaktív; London–NY overlap profil (-1.0); ATR erősség 1.60× küszöb (+14.6); WARNING: No Liquidity Structure (Nearest: 182.698853, Dist: 16.03ATR); Range expanzió támogatja a momentumot (+3.0); Fib zóna konfluencia (0.618–0.886) (+18.0); Order flow neutrális (−3.1); NVDA: magas napi ATR + momentum — P-score küszöb lazítva; Mesterlövész mód: P-score minimum 35 érvényesítve; Regime kapu: CHOPPY miatt −10 P-score, pozícióskálázás csökkentve; Strukturális soft gate: 1/3 jel + ATR/spread OK (−6 P-score, size ×0.70); Strukturális kapu lazítva: momentum erős, BOS hiány engedve; missing: P_score>=35",,,,,,,
88b8329b-2c0c-47af-94c7-e9032ab76fae,EURUSD,2026-06-10T14:41:17Z,no entry,core,19,,1.0,30.0,,,,,,,1.15563,2026-06-10T14:40:44Z,33,,,rule,"Intraday bias gate feltételek hiányosak — Micro BOS long  ATR rendben: 1m micro BOS long | Micro BOS short  ATR rendben: 1m micro BOS short; Bias neutrálsávban; Regime filter inaktív; London–NY overlap profil (-1.0); ATR erősség 1.97× küszöb (+16.8); Alacsony realised vol → magasabb RR igény; Ár 1h EMA21 zónában (+10.0); Order flow neutrális (−4.1); P-Score reduced by 4.0 due to regime CHOPPY; EURUSD: ATR(1h) alacsony — P-score küszöb +6 pontra emelve; EURUSD: Visszafogott ATR — célok szűkítve, kockázat kontroll alatt; ATR-floor override: rel_atr 0.0004 < 0.0006 → adaptív RR/TP küszöb; Regime kapu: CHOPPY miatt −10 P-score, pozícióskálázás csökkentve; Liquidity gate skipped (no volume proxy available); missing: P_score>=44",,,,,,,
2b88e0aa-e953-45c2-a041-5c186c4cc3f2,XAGUSD,2026-06-10T14:41:17Z,precision_arming,core,49,,1.0,20.0,,,,,,,65.17588,2026-06-10T14:40:44Z,33,,,rule,"Bias(4H→1H)=short (+15.0); Regime filter inaktív; 5M BOS trendirányba (+16.0); London–NY overlap profil (-1.0); ATR erősség 1.74× küszöb (+15.4); Ár az intraday range felső zónájában (+4.0); Range expanzió támogatja a momentumot (+3.0); XAG momentum override — stop tágítva erős trendnél; XAGUSD: momentum override — stop távolság 1.3×ATR-re tágítva; Ár 1h EMA21 zónában (+10.0); Order flow neutrális (−4.6); P-Score reduced by 4.0 due to regime CHOPPY; XAGUSD: momentum kitörés — RR cél 1:1.45-re szűkítve; XAGUSD breakout-védelem: gyors BE + 20% giveback limit expanziós szakaszban; XAG momentum override — pozícióméret csökkentve; XAGUSD: ATR-alapú pozícióskálázás ×0.55; XAG: VWAP felett — short setup türelmet igényel; Regime kapu: CHOPPY miatt −10 P-score, pozícióskálázás csökkentve; Strukturális soft gate: 1/3 jel + ATR/spread OK (−6 P-score, size ×0.70); Strukturális kapu lazítva: momentum erős, BOS hiány engedve; Liquidity gate skipped (no volume proxy available); XAG stop lazítás: ATR1h alapú kockázat ×1.09; Precision trigger kész → limit figyelés; Precision limit belépő parkolva 12 percig",,,,,,,
5288657b-70eb-42a3-9064-2dd4263cea12,USOIL,2026-06-10T14:41:17Z,no entry,core_only,56,,1.0,20.0,89.91125,91.69858970599999,86.336570588,84.549230882,3.0,,89.91125,2026-06-10T14:40:44Z,33,,,rule,"Bias(4H→1H)=short (+15.0); Regime filter inaktív; 5M BOS trendirányba (+16.0); London–NY overlap profil (-1.0); ATR erősség 2.32× küszöb (+18.9); Range expanzió támogatja a momentumot (+3.0); USOIL: erős momentum — invalid zóna 2.5×ATR(1h)-re tágítva; Fib zóna konfluencia (0.618–0.886) (+18.0); Order flow neutrális (−4.9); P-Score reduced by 4.0 due to regime CHOPPY; USOIL: 1h ATR ≥1.5 USD — RR cél 1:2-re emelve; USOIL: oldalazó szerkezet — H1/M5 BOS nélkül nincs belépő; Regime kapu: CHOPPY miatt −10 P-score, pozícióskálázás csökkentve; Strukturális soft gate: 1/3 jel + ATR/spread OK (−6 P-score, size ×0.70); Strukturális kapu lazítva: momentum erős, BOS hiány engedve; USOIL stop lazítás: ATR1h alapú kockázat ×0.97; Diagnosztika: k1m: utolsó zárt gyertya 11 perc késésben van; Diagnosztika: k1m: jelzés korlátozva 11 perc késés miatt; Diagnosztika: k5m: utolsó zárt gyertya 11 perc késésben van",,,,,,,
6df97c41-60fc-4159-a3a1-d55a86713ee3,BTCUSD,2026-06-10T14:41:17Z,precision_arming,core,55,,1.0,2.0,,,,,,,61858.69,2026-06-10T14:40:44Z,33,,,rule,"Bias(4H→1H)=short (+15.0); Regime filter inaktív; 5M BOS trendirányba (+16.0); London–NY overlap profil (-1.0); ATR erősség 2.06× küszöb (+17.4); Ár az intraday range felső zónájában (+4.0); Range expanzió támogatja a momentumot (+3.0); Ár 1h EMA21 zónában (+10.0); Order flow neutrális (−4.9); Sell pressure támogatja a setupot (+5); P-Score reduced by 4.0 due to regime CHOPPY; Mesterlövész mód: P-score minimum 35 érvényesítve; OFI z-score -1.49 támogatja az irányt; Regime kapu: CHOPPY miatt −10 P-score, pozícióskálázás csökkentve; Strukturális soft gate: 1/3 jel + ATR/spread OK (−6 P-score, size ×0.70); Likviditási kapu lazítva erős momentum miatt; BTC ATR1h stop igazítás: kockázat ×1.15; Precision trigger kész → limit figyelés; Precision limit belépő parkolva 20 percig",,,,,,,
