journal_id,asset,analysis_timestamp,signal,mode,probability,model_probability,realtime_confidence,leverage,entry_price,stop_loss,take_profit_1,take_profit_2,risk_reward,initial_risk_abs,spot_price,spot_timestamp,spot_latency_seconds,precision_score,anchor_bias,probability_source,notes,validation_outcome,validation_rr,max_favorable_excursion,max_adverse_excursion,time_to_outcome_minutes,slippage,execution_latency_ms
7a62f906-e759-49a9-9a67-1cd46b9114e8,GOLD_CFD,2026-03-30T17:41:14Z,no entry,core,22,,1.0,20.0,,,,,,,4517.36536,2026-03-30T17:40:49Z,25,,,rule,"Mean reversion bias override (+19.5); Regime filter inaktív; ATR nincs rendben (relatív vagy abszolút küszöb); Alacsony realised vol → magasabb RR igény; Ár az intraday range alsó zónájában (+4.0); Fib zóna konfluencia (0.618–0.886) (+18.0); Order flow neutrális (−3.9); P-Score reduced by 4.0 due to regime CHOPPY; ATR-floor override: rel_atr 0.0013 < 0.0025 → adaptív RR/TP küszöb; Regime kapu: CHOPPY miatt −10 P-score, pozícióskálázás csökkentve; ATR soft gate: alacsony volatilitás −5 P-score, méret felezve; Liquidity gate skipped (no volume proxy available); missing: P_score>=30",,,,,,,
16927588-f82e-4320-b73f-0207f3bedeb0,XAGUSD,2026-03-30T17:41:14Z,no entry,core,16,,1.0,20.0,,,,,,,70.42927,2026-03-30T17:40:49Z,25,,,rule,"Intraday bias gate feltételek hiányosak — Micro BOS long  ATR (ezüst): 1m micro BOS long | Micro BOS short  ATR (ezüst): 1m micro BOS short; Bias neutrálsávban; Regime filter inaktív; ATR erősség 1.20× küszöb (+12.2); Fib zóna konfluencia (0.618–0.886) (+18.0); Order flow neutrális (−4.9); P-Score reduced by 4.0 due to regime CHOPPY; XAGUSD breakout-védelem: gyors BE + 20% giveback limit expanziós szakaszban; XAGUSD: ATR-alapú pozícióskálázás ×0.70; Regime kapu: CHOPPY miatt −10 P-score, pozícióskálázás csökkentve; Strukturális soft gate: 1/3 jel + ATR/spread OK (−6 P-score, size ×0.70); Strukturális kapu lazítva: momentum erős, BOS hiány engedve; Liquidity gate skipped (no volume proxy available); missing: P_score>=28",,,,,,,
1062810c-f5cf-4599-bd27-cd6c5854e4e6,EURUSD,2026-03-30T17:41:14Z,no entry,core,25,,1.0,30.0,,,,,,,1.14604,2026-03-30T17:40:49Z,25,,,rule,"Bias(4H→1H)=short (+15.0); Regime filter inaktív; ATR erősség 1.44× küszöb (+13.6); Alacsony realised vol → magasabb RR igény; Order flow neutrális (−4.1); EURUSD: ATR(1h) alacsony — P-score küszöb +6 pontra emelve; EURUSD: Visszafogott ATR — célok szűkítve, kockázat kontroll alatt; EURUSD BOS aktív, de VWAP felett — várakozás; ATR-floor override: rel_atr 0.0003 < 0.0006 → adaptív RR/TP küszöb; Regime kapu: CHOPPY miatt −10 P-score, pozícióskálázás csökkentve; Liquidity gate skipped (no volume proxy available); missing: P_score>=44",,,,,,,
591c4c9d-8db5-4764-b99c-0e505846d893,NVDA,2026-03-30T17:41:14Z,precision_arming,core,42,,1.0,5.0,,,,,,,166.02,2026-03-30T17:40:49Z,25,,,rule,"Bias(4H→1H)=short (+15.0); EMA21 slope 1.11× küszöb (+12.7); HTF sweep ok (+10.0); 5M BOS trendirányba (+16.0); ATR nincs rendben (relatív vagy abszolút küszöb); WARNING: No Liquidity Structure (Nearest: 178.678327, Dist: 38.69ATR); Intraday range alsó harmada telített (−7.0); Range expanzió támogatja a momentumot (+3.0); Order flow neutrális (−3.9); OFI toxikus short irányra (−4.6); NVDA: magas napi ATR + momentum — P-score küszöb lazítva; Mesterlövész mód: P-score minimum 35 érvényesítve; NVDA momentum override — napi ATR támogatja a likviditási lazítást; ATR soft gate: alacsony volatilitás −5 P-score, méret felezve; Likviditási kapu lazítva erős momentum miatt; NVDA ATR1h stop igazítás: kockázat ×1.03; Precision trigger kész → limit figyelés; Precision limit belépő parkolva 12 percig",,,,,,,
0722bf12-dbe4-4ce5-946f-3d327eb7f212,USOIL,2026-03-30T17:41:15Z,precision_arming,core,34,,1.0,20.0,,,,,,,103.91003,2026-03-30T17:40:49Z,25,,,rule,"Bias(4H→1H)=long (+15.0); Regime filter inaktív; 5M BOS trendirányba (+16.0); ATR erősség 1.67× küszöb (+15.0); Intraday range felső harmada telített (−7.0); Range expanzió támogatja a momentumot (+3.0); USOIL: erős momentum — invalid zóna 2.5×ATR(1h)-re tágítva; Order flow neutrális (−4.2); OFI toxikus long irányra (−4.4); USOIL: 1h ATR ≥1.5 USD — RR cél 1:2-re emelve; Regime kapu: CHOPPY miatt −10 P-score, pozícióskálázás csökkentve; P-score soft gate: −1.7 pont tolerancia (size ×0.65, RR +0.15); Likviditási kapu lazítva erős momentum miatt; Liquidity gate skipped (no volume proxy available); USOIL stop lazítás: ATR1h alapú kockázat ×0.97; Precision trigger kész → limit figyelés; Precision limit belépő parkolva 12 percig",,,,,,,
160e3d8a-5f2a-4e8b-b421-cc26fbaffe2c,BTCUSD,2026-03-30T17:41:15Z,precision_arming,core,68,,1.0,2.0,,,,,,,66854.78,2026-03-30T17:40:49Z,25,,,rule,"Mean reversion bias override (+19.5); Regime filter inaktív; 5M BOS trendirányba (+16.0); ATR erősség 2.05× küszöb (+17.3); Ár az intraday range alsó zónájában (+4.0); Range expanzió támogatja a momentumot (+3.0); Ár 1h EMA21 zónában (+10.0); Order flow neutrális (−4.2); Buy pressure támogatja a setupot (+5); P-Score reduced by 4.0 due to regime CHOPPY; Mesterlövész mód: P-score minimum 35 érvényesítve; Regime kapu: CHOPPY miatt −10 P-score, pozícióskálázás csökkentve; Strukturális kapu lazítva: momentum erős, BOS hiány engedve; Likviditási kapu lazítva erős momentum miatt; BTC ATR1h stop igazítás: kockázat ×1.15; Precision trigger kész → limit figyelés; Precision limit belépő parkolva 20 percig",,,,,,,
