journal_id,asset,analysis_timestamp,signal,mode,probability,model_probability,realtime_confidence,leverage,entry_price,stop_loss,take_profit_1,take_profit_2,risk_reward,initial_risk_abs,spot_price,spot_timestamp,spot_latency_seconds,precision_score,anchor_bias,probability_source,notes,validation_outcome,validation_rr,max_favorable_excursion,max_adverse_excursion,time_to_outcome_minutes,slippage,execution_latency_ms
fa5e815f-8627-4278-9a7b-56400d148c56,XAGUSD,2026-04-29T20:46:53Z,no entry,core,26,,1.0,20.0,,,,,,,71.38639,2026-04-29T20:46:26Z,27,,,rule,"Bias(4H→1H)=short (+15.0); Regime filter inaktív; HTF sweep ok (+10.0); ATR nincs rendben (relatív vagy abszolút küszöb); Ár az intraday range felső zónájában (+4.0); Fib zóna konfluencia (0.618–0.886) (+18.0); Order flow neutrális (−4.8); P-Score reduced by 4.0 due to regime CHOPPY; XAGUSD: visszafogott ATR — RR cél 1:1.7-re emelve; XAGUSD breakout-védelem: gyors BE + 20% giveback limit expanziós szakaszban; XAGUSD: ATR-alapú pozícióskálázás ×0.70; XAG: VWAP felett — short setup türelmet igényel; OFI z-score -2.02 támogatja az irányt; ATR-floor override: rel_atr 0.0014 < 0.0018 → adaptív RR/TP küszöb; Regime kapu: CHOPPY miatt −10 P-score, pozícióskálázás csökkentve; ATR soft gate: alacsony volatilitás −5 P-score, méret felezve; P-score soft gate: −1.8 pont tolerancia (size ×0.65, RR +0.15); Position size scale 0.0284 below floor 0.03 — entry blocked; Liquidity gate skipped (no volume proxy available); missing: position_sizing_floor",,,,,,,
9c1d040e-3f9e-420f-9753-86d71e3f48f7,GOLD_CFD,2026-04-29T20:46:53Z,no entry,core,27,,1.0,20.0,,,,,,,4544.59772,2026-04-29T20:46:26Z,27,,,rule,"Bias(4H→1H)=short (+15.0); Regime filter inaktív; HTF sweep ok (+10.0); ATR nincs rendben (relatív vagy abszolút küszöb); Alacsony realised vol → magasabb RR igény; Ár az intraday range felső zónájában (+4.0); Fib zóna konfluencia (0.618–0.886) (+18.0); Order flow neutrális (−3.8); P-Score reduced by 4.0 due to regime CHOPPY; OFI z-score -2.14 támogatja az irányt; ATR-floor override: rel_atr 0.0009 < 0.0025 → adaptív RR/TP küszöb; Regime kapu: CHOPPY miatt −10 P-score, pozícióskálázás csökkentve; ATR soft gate: alacsony volatilitás −5 P-score, méret felezve; Liquidity gate skipped (no volume proxy available); missing: P_score>=30",,,,,,,
0a663d12-d1a9-4c55-a1a6-3ddeefeb1de1,EURUSD,2026-04-29T20:46:54Z,no entry,core,0,,1.0,30.0,,,,,,,1.16747,2026-04-29T20:46:26Z,27,,,rule,"Intraday bias gate feltételek hiányosak — Micro BOS long  ATR rendben: 1m micro BOS long, ATR gate | Micro BOS short  ATR rendben: 1m micro BOS short, ATR gate; Bias neutrálsávban; Regime filter inaktív; ATR nincs rendben (relatív vagy abszolút küszöb); Alacsony realised vol → magasabb RR igény; Fib zóna konfluencia (0.618–0.886) (+18.0); Order flow neutrális (−4.8); P-Score reduced by 4.0 due to regime CHOPPY; P-Score reduced by 4.0 due to ATR Soft Gate tolerance; EURUSD: Magas volatilitás → RR célok 1:2 környékére szélesítve; EURUSD: ATR-alapú pozícióskálázás ×0.40 — volatilitás kontroll; ATR-floor override: rel_atr 0.0002 < 0.0006 → adaptív RR/TP küszöb; Regime kapu: CHOPPY miatt −10 P-score, pozícióskálázás csökkentve; ATR soft gate: alacsony volatilitás −5 P-score, méret felezve; Position size scale 0.0250 below floor 0.05 — entry blocked; Liquidity gate skipped (no volume proxy available); missing: position_sizing_floor, P_score>=38",,,,,,,
6ceed806-ca41-47b1-bc9e-f982248f772c,BTCUSD,2026-04-29T20:46:54Z,no entry,core,23,,1.0,2.0,,,,,,,75769.98,2026-04-29T20:46:26Z,27,,,rule,"Mean reversion bias override (+19.5); Regime filter inaktív; ATR erősség 1.59× küszöb (+14.5); Order flow neutrális (−4.4); Order flow ellentétes irányba tolódik (−4); P-Score reduced by 4.0 due to regime CHOPPY; Mesterlövész mód: P-score minimum 35 érvényesítve; Regime kapu: CHOPPY miatt −10 P-score, pozícióskálázás csökkentve; Precision limit belépő parkolva 20 percig; missing: P_score>=35",,,,,,,
9780e0b2-3485-4841-a872-71ebf9afcae0,USOIL,2026-04-29T20:46:54Z,no entry,core_only,81,,1.0,20.0,108.11006,104.56911938,115.19194124,118.73288186,3.0,,108.11006,2026-04-29T20:46:26Z,28,,,rule,Bias(4H→1H)=long (+15.0); EMA21 slope 1.87× küszöb (+17.2); HTF sweep ok (+10.0); ATR erősség 1.02× küszöb (+11.1); Fib zóna konfluencia (0.618–0.886) (+18.0); Order flow neutrális (−4.9); USOIL: parabolikus lendület — RR cél 1:1.4 környékére szűkítve; USOIL stop lazítás: ATR1h alapú kockázat ×0.92; Diagnosztika: k1m: utolsó zárt gyertya 10 perc késésben van; Diagnosztika: k1m: jelzés korlátozva 10 perc késés miatt; Diagnosztika: k5m: utolsó zárt gyertya 11 perc késésben van,,,,,,,
