journal_id,asset,analysis_timestamp,signal,mode,probability,model_probability,realtime_confidence,leverage,entry_price,stop_loss,take_profit_1,take_profit_2,risk_reward,initial_risk_abs,spot_price,spot_timestamp,spot_latency_seconds,precision_score,anchor_bias,probability_source,notes,validation_outcome,validation_rr,max_favorable_excursion,max_adverse_excursion,time_to_outcome_minutes,slippage,execution_latency_ms
6325b1c9-681b-4e06-a522-83ddf6651947,XAGUSD,2026-01-22T21:55:38Z,no entry,core,28,,1.0,20.0,,,,,,,96.22422,2026-01-22T21:55:18Z,19,,,rule,"Bias(4H→1H)=long (+15.0); Regime filter inaktív; 5M BOS trendirányba (+16.0); ATR nincs rendben (relatív vagy abszolút küszöb); Intraday range felső harmada telített (−7.0); Range expanzió támogatja a momentumot (+3.0); XAG momentum override — stop tágítva erős trendnél; XAGUSD: momentum override — stop távolság 1.3×ATR-re tágítva; Fib zóna konfluencia (0.618–0.886) (+18.0); Order flow neutrális (−4.6); XAGUSD: momentum kitörés — RR cél 1:1.45-re szűkítve; XAG momentum override — pozícióméret csökkentve; XAG: VWAP alatt — long setup türelmet igényel; ATR-floor override: rel_atr 0.0012 < 0.0018 → adaptív RR/TP küszöb; Regime kapu: CHOPPY miatt −10 P-score, pozícióskálázás csökkentve; ATR soft gate: alacsony volatilitás −5 P-score, méret felezve; Strukturális kapu lazítva: momentum erős, BOS hiány engedve; Liquidity gate skipped (no volume proxy available); missing: P_score>=34",,,,,,,
18855d3d-35a2-406c-ae3d-2744cd9bed14,GOLD_CFD,2026-01-22T21:55:37Z,no entry,core,7,,1.0,20.0,,,,,,,4937.49074,2026-01-22T21:55:18Z,19,,,rule,"Bias(4H→1H)=long (+15.0); Regime filter inaktív; 5M BOS trendirányba (+16.0); ATR nincs rendben (relatív vagy abszolút küszöb); Alacsony realised vol → magasabb RR igény; Intraday range felső harmada telített (−7.0); Range expanzió támogatja a momentumot (+3.0); Order flow neutrális (−4.4); P-Score reduced by 4.0 due to regime CHOPPY; VWAP alatt — GOLD long breakout késleltetve; ATR-floor override: rel_atr 0.0008 < 0.0025 → adaptív RR/TP küszöb; Regime kapu: CHOPPY miatt −10 P-score, pozícióskálázás csökkentve; ATR soft gate: alacsony volatilitás −5 P-score, méret felezve; Strukturális kapu lazítva: momentum erős, BOS hiány engedve; Liquidity gate skipped (no volume proxy available); missing: P_score>=32",,,,,,,
4f3b3173-bc1c-45f2-b6d5-a18e317633bd,EURUSD,2026-01-22T21:55:38Z,no entry,core,0,,1.0,30.0,,,,,,,1.17542,2026-01-22T21:55:18Z,19,,,rule,"Bias(4H→1H)=long (+15.0); Regime filter inaktív; ATR nincs rendben (relatív vagy abszolút küszöb); Alacsony realised vol → magasabb RR igény; Intraday range felső harmada telített (−7.0); Order flow neutrális (−4.5); P-Score reduced by 4.0 due to regime CHOPPY; P-Score reduced by 3.1 due to ATR Soft Gate tolerance; Range guard lazítva: napi sáv teteje, de mikro-range visszahúzódott.; EURUSD: ATR(1h) alacsony — P-score küszöb +6 pontra emelve; EURUSD: Visszafogott ATR — célok szűkítve, kockázat kontroll alatt; EURUSD BOS aktív, de VWAP alatt — türelem; ATR-floor override: rel_atr 0.0001 < 0.0006 → adaptív RR/TP küszöb; Regime kapu: CHOPPY miatt −10 P-score, pozícióskálázás csökkentve; ATR soft gate: alacsony volatilitás −5 P-score, méret felezve; Liquidity gate skipped (no volume proxy available); missing: P_score>=37",,,,,,,
da755c7d-5fca-41bc-af2a-70cb9db868ca,BTCUSD,2026-01-22T21:55:38Z,no entry,core,0,,1.0,2.0,,,,,,,89270.29,2026-01-22T21:55:18Z,19,,,rule,"Intraday bias gate feltételek hiányosak — Crypto momentum long: 1m micro BOS long, Momentum volume ráta, ATR gate | Crypto momentum short: 1m micro BOS short, Momentum volume ráta, ATR gate | 5m BOS long  ATR: 5m BOS long, ATR gate | 5m BOS short  ATR: ATR gate | Micro BOS short  ATR (momentum nélkül): 1m micro BOS short, ATR gate; Bias neutrálsávban; Regime filter inaktív; ATR nincs rendben (relatív vagy abszolút küszöb); Range expanzió támogatja a momentumot (+3.0); Fib zóna konfluencia (0.618–0.886) (+18.0); Order flow neutrális (−4.6); P-Score reduced by 4.0 due to regime CHOPPY; Regime kapu: CHOPPY miatt −10 P-score, pozícióskálázás csökkentve; ATR soft gate: alacsony volatilitás −5 P-score, méret felezve; Strukturális kapu lazítva: momentum erős, BOS hiány engedve; Position size scale 0.0387 below floor 0.04 — entry blocked; missing: position_sizing_floor, P_score>=25",,,,,,,
1e2daeaf-d3b4-4f17-8c54-99c266a966f5,USOIL,2026-01-22T21:55:38Z,no entry,core,31,,1.0,20.0,,,,,,,59.52092,2026-01-22T21:55:18Z,20,,,rule,"Bias(4H→1H)=long (+15.0); Regime filter inaktív; 5M BOS trendirányba (+16.0); ATR nincs rendben (relatív vagy abszolút küszöb); Range expanzió támogatja a momentumot (+3.0); USOIL: erős momentum — invalid zóna 2.5×ATR(1h)-re tágítva; Fib zóna konfluencia (0.618–0.886) (+18.0); Order flow neutrális (−4.8); P-Score reduced by 4.0 due to regime CHOPPY; USOIL: 1h ATR <1 USD — P-score küszöb emelve a zajos sáv miatt; USOIL: csökkenő volatilitás — RR cél 1:1.5-re igazítva; USOIL: nyitás előtti sáv — pozícióméret ×0.75; Regime kapu: CHOPPY miatt −10 P-score, pozícióskálázás csökkentve; ATR soft gate: alacsony volatilitás −5 P-score, méret felezve; Liquidity gate skipped (no volume proxy available); missing: P_score>=38",,,,,,,
