journal_id,asset,analysis_timestamp,signal,mode,probability,model_probability,realtime_confidence,leverage,entry_price,stop_loss,take_profit_1,take_profit_2,risk_reward,initial_risk_abs,spot_price,spot_timestamp,spot_latency_seconds,precision_score,anchor_bias,probability_source,notes,validation_outcome,validation_rr,max_favorable_excursion,max_adverse_excursion,time_to_outcome_minutes,slippage,execution_latency_ms
605e62cd-abb4-4c72-a41a-e64a644f9883,GOLD_CFD,2026-05-11T03:11:04Z,no entry,core,0,,1.0,20.0,,,,,,,4683.55364,2026-05-11T03:10:44Z,19,,,rule,"Intraday bias gate feltételek hiányosak — 5m retest long  ATR: 5m retest long, ATR gate | 5m retest short  ATR: 5m retest short, ATR gate; Bias neutrálsávban; Regime filter inaktív; ATR nincs rendben (relatív vagy abszolút küszöb); Order flow neutrális (−4.2); P-Score reduced by 4.0 due to regime CHOPPY; ATR-floor override: rel_atr 0.0016 < 0.0025 → adaptív RR/TP küszöb; Regime kapu: CHOPPY miatt −10 P-score, pozícióskálázás csökkentve; ATR soft gate: alacsony volatilitás −5 P-score, méret felezve; Liquidity gate skipped (no volume proxy available); missing: P_score>=30",,,,,,,
4448fffd-b844-490a-9565-ce8f863c3463,XAGUSD,2026-05-11T03:11:04Z,no entry,core,24,,1.0,20.0,,,,,,,80.92052,2026-05-11T03:10:44Z,19,,,rule,"Bias(4H→1H)=long (+15.0); Regime filter inaktív; ATR erősség 1.80× küszöb (+15.8); Order flow neutrális (−3.8); P-Score reduced by 4.0 due to regime CHOPPY; XAGUSD breakout-védelem: gyors BE + 20% giveback limit expanziós szakaszban; XAGUSD: ATR-alapú pozícióskálázás ×0.55; XAG: VWAP alatt — long setup türelmet igényel; Regime kapu: CHOPPY miatt −10 P-score, pozícióskálázás csökkentve; Liquidity gate skipped (no volume proxy available); missing: P_score>=28",,,,,,,
304c72fa-dc4b-401e-b6fe-6524473e5fba,EURUSD,2026-05-11T03:11:04Z,no entry,core,0,,1.0,30.0,,,,,,,1.1759,2026-05-11T03:10:44Z,19,,,rule,"Intraday bias gate feltételek hiányosak — Micro BOS long  ATR rendben: 1m micro BOS long, ATR gate | Micro BOS short  ATR rendben: 1m micro BOS short, ATR gate; Bias neutrálsávban; Regime filter inaktív; ATR nincs rendben (relatív vagy abszolút küszöb); Alacsony realised vol → magasabb RR igény; Fib zóna konfluencia (0.618–0.886) (+18.0); Order flow neutrális (−4.0); P-Score reduced by 4.0 due to regime CHOPPY; EURUSD: ATR-alapú pozícióskálázás ×0.76 — volatilitás kontroll; ATR-floor override: rel_atr 0.0002 < 0.0006 → adaptív RR/TP küszöb; Regime kapu: CHOPPY miatt −10 P-score, pozícióskálázás csökkentve; ATR soft gate: alacsony volatilitás −5 P-score, méret felezve; Position size scale 0.0475 below floor 0.05 — entry blocked; Liquidity gate skipped (no volume proxy available); missing: position_sizing_floor, P_score>=38",,,,,,,
ea4a87c3-31c9-4632-95b1-ca934057bcaa,BTCUSD,2026-05-11T03:11:04Z,precision_arming,core,68,,1.0,2.0,,,,,,,81018.99,2026-05-11T03:10:44Z,20,,,rule,"Micro bias override: gyors struktúra dominál (+19.5); Regime filter inaktív; 5M BOS trendirányba (+16.0); ATR erősség 1.52× küszöb (+14.1); Range expanzió támogatja a momentumot (+3.0); Fib zóna konfluencia (0.618–0.886) (+18.0); Order flow neutrális (−4.8); Sell pressure támogatja a setupot (+5); P-Score reduced by 4.0 due to regime CHOPPY; Intraday P-score lazítás: micro-bias short elsőbbséget kap (−2.2); Mesterlövész mód: P-score minimum 35 érvényesítve; BTC mikro BOS short aktív; OFI z-score -1.31 támogatja az irányt; Regime kapu: CHOPPY miatt −10 P-score, pozícióskálázás csökkentve; BTC ATR1h stop igazítás: kockázat ×1.15; Precision trigger kész → limit figyelés; Precision limit belépő parkolva 20 percig",,,,,,,
3b0ca83b-5a60-4d0d-bca9-b8a119b14f8e,USOIL,2026-05-11T03:11:04Z,no entry,core,0,,1.0,20.0,,,,,,,100.93548,2026-05-11T03:10:44Z,20,,,rule,"Intraday bias gate feltételek hiányosak — USOIL retest long  ATR: 5m retest long, ATR gate | USOIL retest short  ATR: 5m retest short, ATR gate; Bias neutrálsávban; Regime filter inaktív; ATR nincs rendben (relatív vagy abszolút küszöb); Order flow neutrális (−4.6); P-Score reduced by 4.0 due to regime CHOPPY; USOIL: parabolikus lendület — RR cél 1:1.4 környékére szűkítve; USOIL: ázsiai sáv — pozícióméret ×0.70; Regime kapu: CHOPPY miatt −10 P-score, pozícióskálázás csökkentve; ATR soft gate: alacsony volatilitás −5 P-score, méret felezve; Liquidity gate skipped (no volume proxy available); missing: P_score>=36",,,,,,,
