journal_id,asset,analysis_timestamp,signal,mode,probability,model_probability,realtime_confidence,leverage,entry_price,stop_loss,take_profit_1,take_profit_2,risk_reward,initial_risk_abs,spot_price,spot_timestamp,spot_latency_seconds,precision_score,anchor_bias,probability_source,notes,validation_outcome,validation_rr,max_favorable_excursion,max_adverse_excursion,time_to_outcome_minutes,slippage,execution_latency_ms
407fdbd0-4a3a-4590-adf4-bd5854829e64,EURUSD,2026-05-20T10:31:14Z,no entry,core,33,,1.0,30.0,,,,,,,1.15956,2026-05-20T10:30:47Z,27,,,rule,"Micro bias override: gyors struktúra dominál (+19.5); Regime filter inaktív; 5M BOS trendirányba (+16.0); ATR nincs rendben (relatív vagy abszolút küszöb); Alacsony realised vol → magasabb RR igény; Range expanzió támogatja a momentumot (+3.0); Fib zóna konfluencia (0.618–0.886) (+18.0); Order flow neutrális (−3.2); P-Score reduced by 4.0 due to regime CHOPPY; P-Score reduced by 4.1 due to ATR Soft Gate tolerance; EURUSD: ATR(1h) alacsony — P-score küszöb +6 pontra emelve; Intraday P-score lazítás: micro-bias long elsőbbséget kap (−1.5); EURUSD: Visszafogott ATR — célok szűkítve, kockázat kontroll alatt; EURUSD BOS aktív, de VWAP alatt — türelem; OFI z-score 1.39 támogatja az irányt; ATR-floor override: rel_atr 0.0002 < 0.0006 → adaptív RR/TP küszöb; Regime kapu: CHOPPY miatt −10 P-score, pozícióskálázás csökkentve; ATR soft gate: alacsony volatilitás −5 P-score, méret felezve; Liquidity gate skipped (no volume proxy available); missing: P_score>=42.5",,,,,,,
4aa7ba49-c5ad-4e09-a5d2-721a774889cb,GOLD_CFD,2026-05-20T10:31:14Z,no entry,core,8,,1.0,20.0,,,,,,,4490.47172,2026-05-20T10:30:47Z,27,,,rule,"Bias(4H→1H)=short (+15.0); Regime filter inaktív; ATR nincs rendben (relatív vagy abszolút küszöb); Alacsony realised vol → magasabb RR igény; Ár az intraday range felső zónájában (+4.0); Ár 1h EMA21 zónában (+10.0); Order flow neutrális (−4.8); P-Score reduced by 4.0 due to regime CHOPPY; ATR-floor override: rel_atr 0.0010 < 0.0025 → adaptív RR/TP küszöb; Regime kapu: CHOPPY miatt −10 P-score, pozícióskálázás csökkentve; ATR soft gate: alacsony volatilitás −5 P-score, méret felezve; Liquidity gate skipped (no volume proxy available); missing: P_score>=30",,,,,,,
5a6aa76a-8401-4936-9735-3ddb72d3ce1b,XAGUSD,2026-05-20T10:31:14Z,no entry,core,27,,1.0,20.0,,,,,,,75.44873,2026-05-20T10:30:47Z,27,,,rule,"Bias(4H→1H)=short (+15.0); Regime filter inaktív; 5M BOS trendirányba (+16.0); ATR nincs rendben (relatív vagy abszolút küszöb); Ár az intraday range felső zónájában (+4.0); Range expanzió támogatja a momentumot (+3.0); XAG momentum override — stop tágítva erős trendnél; XAGUSD: momentum override — stop távolság 1.3×ATR-re tágítva; Ár 1h EMA21 zónában (+10.0); Order flow neutrális (−4.8); P-Score reduced by 4.0 due to regime CHOPPY; XAGUSD: momentum kitörés — RR cél 1:1.45-re szűkítve; XAGUSD breakout-védelem: gyors BE + 20% giveback limit expanziós szakaszban; XAG momentum override — pozícióméret csökkentve; XAGUSD: ATR-alapú pozícióskálázás ×0.55; XAG: VWAP felett — short setup türelmet igényel; ATR-floor override: rel_atr 0.0017 < 0.0018 → adaptív RR/TP küszöb; Fém irány guard: 5m trend ellentétes a belépési biasszal; Regime kapu: CHOPPY miatt −10 P-score, pozícióskálázás csökkentve; ATR soft gate: alacsony volatilitás −5 P-score, méret felezve; Strukturális kapu lazítva: momentum erős, BOS hiány engedve; Liquidity gate skipped (no volume proxy available); missing: metal_bias_5m_alignment, P_score>=28",,,,,,,
bf7ecd7d-50a2-433b-8b20-0bab6bb30480,BTCUSD,2026-05-20T10:31:15Z,no entry,core,32,,1.0,2.0,,,,,,,77546.0,2026-05-20T10:30:47Z,27,,,rule,"Mean reversion bias override (+19.5); Regime filter inaktív; HTF sweep ok (+10.0); 5M BOS trendirányba (+16.0); ATR nincs rendben (relatív vagy abszolút küszöb); Alacsony realised vol → magasabb RR igény; Ár az intraday range felső zónájában (+4.0); Range expanzió támogatja a momentumot (+3.0); Order flow neutrális (−4.2); P-Score reduced by 4.0 due to regime CHOPPY; Mesterlövész mód: P-score minimum 35 érvényesítve; ATR-floor override: rel_atr 0.0008 < 0.0012 → adaptív RR/TP küszöb; Regime kapu: CHOPPY miatt −10 P-score, pozícióskálázás csökkentve; ATR soft gate: alacsony volatilitás −5 P-score, méret felezve; Strukturális kapu lazítva: momentum erős, BOS hiány engedve; Precision limit belépő parkolva 20 percig; missing: P_score>=35",,,,,,,
a9723e6e-04d6-42a7-b89d-09b634b21e4c,USOIL,2026-05-20T10:31:15Z,no entry,core_only,43,,1.0,20.0,102.30333,97.81716915714286,111.2756516857143,115.76181252857144,3.0,,102.30333,2026-05-20T10:30:47Z,28,,,rule,"Bias(4H→1H)=long (+15.0); Regime filter inaktív; ATR erősség 1.56× küszöb (+14.4); Ár az intraday range alsó zónájában (+4.0); Fib zóna konfluencia (0.618–0.886) (+18.0); Order flow neutrális (−4.9); P-Score reduced by 4.0 due to regime CHOPPY; USOIL: parabolikus lendület — RR cél 1:1.4 környékére szűkítve; USOIL: európai délelőtt — pozícióméret ×0.85; USOIL: oldalazó szerkezet — H1/M5 BOS nélkül nincs belépő; OFI z-score 1.59 támogatja az irányt; Regime kapu: CHOPPY miatt −10 P-score, pozícióskálázás csökkentve; USOIL stop lazítás: ATR1h alapú kockázat ×0.92; Diagnosztika: k1m: utolsó zárt gyertya 11 perc késésben van; Diagnosztika: k1m: jelzés korlátozva 11 perc késés miatt; Diagnosztika: k5m: utolsó zárt gyertya 11 perc késésben van",,,,,,,
