journal_id,asset,analysis_timestamp,signal,mode,probability,model_probability,realtime_confidence,leverage,entry_price,stop_loss,take_profit_1,take_profit_2,risk_reward,initial_risk_abs,spot_price,spot_timestamp,spot_latency_seconds,precision_score,anchor_bias,probability_source,notes,validation_outcome,validation_rr,max_favorable_excursion,max_adverse_excursion,time_to_outcome_minutes,slippage,execution_latency_ms
50019aa7-78af-4499-aa96-a6606e6092f6,EURUSD,2026-05-11T08:27:03Z,no entry,core,19,,1.0,30.0,,,,,,,1.17805,2026-05-11T08:26:36Z,27,,,rule,"Intraday bias gate feltételek hiányosak — Micro BOS long  ATR rendben: 1m micro BOS long | Micro BOS short  ATR rendben: 1m micro BOS short; Bias neutrálsávban; Regime filter inaktív; ATR erősség 1.52× küszöb (+14.1); Alacsony realised vol → magasabb RR igény; Ár 1h EMA21 zónában (+10.0); Order flow neutrális (−2.4); P-Score reduced by 4.0 due to regime CHOPPY; EURUSD: ATR(1h) alacsony — P-score küszöb +6 pontra emelve; EURUSD: Visszafogott ATR — célok szűkítve, kockázat kontroll alatt; ATR-floor override: rel_atr 0.0003 < 0.0006 → adaptív RR/TP küszöb; Regime kapu: CHOPPY miatt −10 P-score, pozícióskálázás csökkentve; Liquidity gate skipped (no volume proxy available); missing: P_score>=44",,,,,,,
8220ca92-bd48-4cef-93b2-dd30a86e4ce3,GOLD_CFD,2026-05-11T08:27:03Z,no entry,core,19,,1.0,20.0,,,,,,,4677.45233,2026-05-11T08:26:36Z,27,,,rule,"Bias(4H→1H)=short (+15.0); Regime filter inaktív; HTF sweep ok (+10.0); ATR nincs rendben (relatív vagy abszolút küszöb); Alacsony realised vol → magasabb RR igény; Fib zóna konfluencia (0.618–0.886) (+18.0); Order flow neutrális (−4.6); OFI toxikus short irányra (−3.8); P-Score reduced by 4.0 due to regime CHOPPY; VWAP felett — GOLD short breakout várakozik; ATR-floor override: rel_atr 0.0009 < 0.0025 → adaptív RR/TP küszöb; Regime kapu: CHOPPY miatt −10 P-score, pozícióskálázás csökkentve; ATR soft gate: alacsony volatilitás −5 P-score, méret felezve; Liquidity gate skipped (no volume proxy available); missing: P_score>=30, precision_score>=55",,,,,,,
264f59a8-6cc6-4b9f-a23b-690c27b3baca,XAGUSD,2026-05-11T08:27:03Z,precision_arming,core,51,,1.0,20.0,,,,,,,80.56771,2026-05-11T08:26:36Z,27,,,rule,"Bias(4H→1H)=long (+15.0); Regime filter inaktív; 5M BOS trendirányba (+16.0); ATR erősség 0.93× küszöb (+10.6); Range expanzió támogatja a momentumot (+3.0); XAG momentum override — stop tágítva erős trendnél; XAGUSD: momentum override — stop távolság 1.3×ATR-re tágítva; Fib zóna konfluencia (0.618–0.886) (+18.0); Order flow neutrális (−4.1); P-Score reduced by 2.7 due to ATR Soft Gate tolerance; XAGUSD: momentum kitörés — RR cél 1:1.45-re szűkítve; XAGUSD breakout-védelem: gyors BE + 20% giveback limit expanziós szakaszban; XAG momentum override — pozícióméret csökkentve; XAG: VWAP alatt — long setup türelmet igényel; ATR-floor override: rel_atr 0.0017 < 0.0018 → adaptív RR/TP küszöb; Regime kapu: CHOPPY miatt −10 P-score, pozícióskálázás csökkentve; Strukturális soft gate: 1/3 jel + ATR/spread OK (−6 P-score, size ×0.70); Strukturális kapu lazítva: momentum erős, BOS hiány engedve; Liquidity gate skipped (no volume proxy available); XAG stop lazítás: ATR1h alapú kockázat ×1.09; Precision trigger kész → limit figyelés; Precision limit belépő parkolva 12 percig",,,,,,,
c769d343-e5a6-4c9c-b054-5425b68e2346,BTCUSD,2026-05-11T08:27:04Z,no entry,core,0,,1.0,2.0,,,,,,,80758.03,2026-05-11T08:26:36Z,27,,,rule,"Intraday bias gate feltételek hiányosak — Crypto momentum long: 1m micro BOS long, Momentum volume ráta, ATR gate | Crypto momentum short: 1m micro BOS short, Momentum volume ráta, ATR gate | 5m BOS long  ATR: ATR gate | 5m BOS short  ATR: 5m BOS short, ATR gate | Micro BOS short  ATR (momentum nélkül): 1m micro BOS short, ATR gate; Bias neutrálsávban; Regime filter inaktív; ATR nincs rendben (relatív vagy abszolút küszöb); Alacsony realised vol → magasabb RR igény; Fib zóna konfluencia (0.618–0.886) (+18.0); Order flow neutrális (−4.6); P-Score reduced by 4.0 due to regime CHOPPY; P-Score reduced by 0.1 due to ATR Soft Gate tolerance; Mesterlövész mód: P-score minimum 35 érvényesítve; ATR-floor override: rel_atr 0.0010 < 0.0012 → adaptív RR/TP küszöb; Regime kapu: CHOPPY miatt −10 P-score, pozícióskálázás csökkentve; ATR soft gate: alacsony volatilitás −5 P-score, méret felezve; missing: P_score>=35",,,,,,,
4d420d63-096a-4068-9bdb-23aae52af9ee,USOIL,2026-05-11T08:27:04Z,no entry,core_only,29,,1.0,20.0,,,,,,,98.59452,2026-05-11T08:26:36Z,28,,,rule,"Intraday bias gate feltételek hiányosak — USOIL retest long  ATR: 5m retest long, ATR gate | USOIL retest short  ATR: 5m retest short, ATR gate; Bias neutrálsávban; EMA21 slope 1.08× küszöb (+12.5); ATR nincs rendben (relatív vagy abszolút küszöb); Fib zóna konfluencia (0.618–0.886) (+18.0); Order flow neutrális (−3.5); USOIL: parabolikus lendület — RR cél 1:1.4 környékére szűkítve; USOIL: európai délelőtt — pozícióméret ×0.85; ATR soft gate: alacsony volatilitás −5 P-score, méret felezve; Diagnosztika: k1m: utolsó zárt gyertya 7 perc késésben van; Diagnosztika: k1m: jelzés korlátozva 7 perc késés miatt; missing: P_score>=36",,,,,,,
