journal_id,asset,analysis_timestamp,signal,mode,probability,model_probability,realtime_confidence,leverage,entry_price,stop_loss,take_profit_1,take_profit_2,risk_reward,initial_risk_abs,spot_price,spot_timestamp,spot_latency_seconds,precision_score,anchor_bias,probability_source,notes,validation_outcome,validation_rr,max_favorable_excursion,max_adverse_excursion,time_to_outcome_minutes,slippage,execution_latency_ms
1e053bc7-857b-4d22-9e12-8f14b03a4a95,GOLD_CFD,2026-03-03T13:11:29Z,no entry,core,0,,1.0,20.0,,,,,,,5154.32282,2026-03-03T13:11:09Z,20,,,rule,"Intraday bias gate feltételek hiányosak — 5m retest long  ATR: 5m retest long, ATR gate | 5m retest short  ATR: 5m retest short, ATR gate; Bias neutrálsávban; Regime filter inaktív; London–NY overlap profil (-1.0); ATR nincs rendben (relatív vagy abszolút küszöb); Order flow neutrális (−4.6); P-Score reduced by 4.0 due to regime CHOPPY; Regime kapu: CHOPPY miatt −10 P-score, pozícióskálázás csökkentve; ATR soft gate: alacsony volatilitás −5 P-score, méret felezve; Liquidity gate skipped (no volume proxy available); missing: P_score>=30",,,,,,,
15aafbbf-d164-4388-b36b-191d263bf89c,XAGUSD,2026-03-03T13:11:29Z,precision_arming,core,100,,1.0,20.0,,,,,,,81.62997,2026-03-03T13:11:09Z,20,,,rule,Bias override: 1h trend short + momentum támogatás (+19.5); EMA21 slope 2.40× küszöb (+20.4); 5M BOS trendirányba (+16.0); London–NY overlap profil (-1.0); ATR erősség 2.75× küszöb (+21.5); Range expanzió támogatja a momentumot (+3.0); XAG momentum override — stop tágítva erős trendnél; XAGUSD: momentum override — stop távolság 1.3×ATR-re tágítva; Fib zóna konfluencia (0.618–0.886) (+18.0); Order flow neutrális (−4.1); XAGUSD: momentum kitörés — RR cél 1:1.45-re szűkítve; XAGUSD breakout-védelem: gyors BE + 20% giveback limit expanziós szakaszban; XAG momentum override — pozícióméret csökkentve; XAGUSD: ATR-alapú pozícióskálázás ×0.55; XAG: VWAP felett — short setup türelmet igényel; OFI z-score -1.68 támogatja az irányt; Liquidity gate skipped (no volume proxy available); XAG stop lazítás: ATR1h alapú kockázat ×1.09; Precision trigger kész → limit figyelés; Precision limit belépő parkolva 12 percig,,,,,,,
2c982331-60a1-4a84-ac96-2f92c53a5dbf,EURUSD,2026-03-03T13:11:29Z,precision_arming,core,52,,1.0,30.0,,,,,,,1.16082,2026-03-03T13:11:09Z,20,,,rule,"Bias(4H→1H)=short (+15.0); Regime filter inaktív; 5M BOS trendirányba (+16.0); London–NY overlap profil (-1.0); ATR erősség 1.65× küszöb (+14.9); Alacsony realised vol → magasabb RR igény; Range expanzió támogatja a momentumot (+3.0); Fib zóna konfluencia (0.618–0.886) (+18.0); Order flow neutrális (−4.9); P-Score reduced by 4.0 due to regime CHOPPY; EURUSD: ATR-alapú pozícióskálázás ×0.74 — volatilitás kontroll; EURUSD BOS aktív, de VWAP felett — várakozás; ATR-floor override: rel_atr 0.0005 < 0.0006 → adaptív RR/TP küszöb; Regime kapu: CHOPPY miatt −10 P-score, pozícióskálázás csökkentve; Strukturális soft gate: 1/3 jel + ATR/spread OK (−6 P-score, size ×0.70); Strukturális kapu lazítva: momentum erős, BOS hiány engedve; Liquidity gate skipped (no volume proxy available); EURUSD stop lazítás: ATR1h alapú kockázat ×0.72; Precision trigger kész → limit figyelés; Precision limit belépő parkolva 12 percig",,,,,,,
a02b5076-09b1-4941-86c0-54f308852c98,BTCUSD,2026-03-03T13:11:30Z,precision_arming,core,56,,1.0,2.0,,,,,,,67178.01,2026-03-03T13:11:09Z,20,,,rule,"Bias override: Intraday 5m BOS short  ATR (+19.5); Regime filter inaktív; 5M BOS trendirányba (+16.0); London–NY overlap profil (-1.0); ATR erősség 1.27× küszöb (+12.6); Range expanzió támogatja a momentumot (+3.0); Fib zóna konfluencia (0.618–0.886) (+18.0); Order flow neutrális (−4.8); Order flow ellentétes irányba tolódik (−4); P-Score reduced by 4.0 due to regime CHOPPY; Mesterlövész mód: P-score minimum 35 érvényesítve; Regime kapu: CHOPPY miatt −10 P-score, pozícióskálázás csökkentve; Strukturális kapu lazítva: momentum erős, BOS hiány engedve; BTC ATR1h stop igazítás: kockázat ×1.15; Precision trigger kész → limit figyelés; Precision limit belépő parkolva 20 percig",,,,,,,
90389e8b-c5c6-4664-bd69-86415e2713ee,USOIL,2026-03-03T13:11:30Z,precision_arming,core,87,,0.9999999999999998,20.0,,,,,,,75.17454,2026-03-03T13:11:09Z,21,,,rule,Bias(4H→1H)=long (+15.0); EMA21 slope 1.75× küszöb (+16.5); HTF sweep ok (+10.0); London–NY overlap profil (-1.0); ATR erősség 2.29× küszöb (+18.7); Fib zóna konfluencia (0.618–0.886) (+18.0); Order flow neutrális (−4.9); USOIL: csökkenő volatilitás — RR cél 1:1.5-re igazítva; Liquidity gate skipped (no volume proxy available); USOIL stop lazítás: ATR1h alapú kockázat ×0.92; Precision trigger kész → limit figyelés; Precision limit belépő parkolva 12 percig,,,,,,,
