journal_id,asset,analysis_timestamp,signal,mode,probability,model_probability,realtime_confidence,leverage,entry_price,stop_loss,take_profit_1,take_profit_2,risk_reward,initial_risk_abs,spot_price,spot_timestamp,spot_latency_seconds,precision_score,anchor_bias,probability_source,notes,validation_outcome,validation_rr,max_favorable_excursion,max_adverse_excursion,time_to_outcome_minutes,slippage,execution_latency_ms
4156453d-3185-4d78-a8ed-e9cf239e4e40,EURUSD,2026-01-13T23:29:42Z,no entry,core,10,,1.0,30.0,,,,,,,1.16451,2026-01-13T23:29:17Z,25,,,rule,"Bias(4H→1H)=short (+15.0); Regime filter inaktív; Zárási sáv likviditás büntetés (-2.0); ATR nincs rendben (relatív vagy abszolút küszöb); Alacsony realised vol → magasabb RR igény; Fib zóna konfluencia (0.618–0.886) (+18.0); Order flow neutrális (−4.9); P-Score reduced by 4.0 due to regime CHOPPY; EURUSD: ATR(1h) alacsony — P-score küszöb +6 pontra emelve; EURUSD: Visszafogott ATR — célok szűkítve, kockázat kontroll alatt; EURUSD BOS aktív, de VWAP felett — várakozás; ATR-floor override: rel_atr 0.0001 < 0.0006 → adaptív RR/TP küszöb; Regime kapu: CHOPPY miatt −10 P-score, pozícióskálázás csökkentve; ATR soft gate: alacsony volatilitás −5 P-score, méret felezve; Liquidity gate skipped (no volume proxy available); missing: P_score>=27, precision_flow_alignment",,,,,,,
a2480028-24ff-4d34-a0d8-d28173bcc6cb,GOLD_CFD,2026-01-13T23:29:42Z,no entry,core,14,,1.0,20.0,,,,,,,4597.57765,2026-01-13T23:29:17Z,25,,,rule,"Mean reversion bias override (+19.5); Regime filter inaktív; Zárási sáv likviditás büntetés (-2.0); ATR nincs rendben (relatív vagy abszolút küszöb); Alacsony realised vol → magasabb RR igény; Ár az intraday range felső zónájában (+4.0); Fib zóna konfluencia (0.618–0.886) (+18.0); Order flow neutrális (−4.8); OFI toxikus short irányra (−5.1); P-Score reduced by 4.0 due to regime CHOPPY; VWAP felett — GOLD short breakout várakozik; ATR-floor override: rel_atr 0.0004 < 0.0025 → adaptív RR/TP küszöb; Regime kapu: CHOPPY miatt −10 P-score, pozícióskálázás csökkentve; ATR soft gate: alacsony volatilitás −5 P-score, méret felezve; Liquidity gate skipped (no volume proxy available); missing: P_score>=23, precision_flow_alignment",,,,,,,
e4a29436-e442-4db9-b59d-c20c70bce086,XAGUSD,2026-01-13T23:29:42Z,precision_arming,core,58,,1.0,20.0,,,,,,,87.67505,2026-01-13T23:29:17Z,25,,,rule,"Micro bias override: gyors struktúra dominál (+19.5); Regime filter inaktív; 5M BOS trendirányba (+16.0); Zárási sáv likviditás büntetés (-2.0); ATR erősség 1.00× küszöb (+11.0); Range expanzió támogatja a momentumot (+3.0); XAG momentum override — stop tágítva erős trendnél; XAGUSD: momentum override — stop távolság 1.3×ATR-re tágítva; Fib zóna konfluencia (0.618–0.886) (+18.0); Order flow neutrális (−4.2); P-Score reduced by 4.0 due to regime CHOPPY; Intraday P-score lazítás: micro-bias long elsőbbséget kap (−1.5); XAGUSD: momentum kitörés — RR cél 1:1.45-re szűkítve; XAG momentum override — pozícióméret csökkentve; XAGUSD: ATR-alapú pozícióskálázás ×0.55; XAG: VWAP alatt — long setup türelmet igényel; OFI z-score 1.15 támogatja az irányt; ATR-floor override: rel_atr 0.0011 < 0.0018 → adaptív RR/TP küszöb; Regime kapu: CHOPPY miatt −10 P-score, pozícióskálázás csökkentve; Liquidity gate skipped (no volume proxy available); Precision trigger kész → limit figyelés; Precision limit belépő parkolva 20 percig",,,,,,,
3efca0b0-2c4b-4bd0-a5d0-fd1c35d82162,BTCUSD,2026-01-13T23:29:42Z,no entry,core,49,,1.0,2.0,95369.04,94415.34959999999,97562.52792000001,98802.32544000002,3.6,,95369.04,2026-01-13T23:29:17Z,25,,,rule,Bias(4H→1H)=long (+15.0); EMA21 slope 1.15× küszöb (+12.9); Zárási sáv likviditás büntetés (-2.0); ATR erősség 1.33× küszöb (+13.0); Ár az intraday range alsó zónájában (+4.0); Order flow neutrális (−4.5); Order flow ellentétes irányba tolódik (−4); BTC ATR stop igazítás: kockázat ×1.00; Precision limit belépő parkolva 20 percig; missing: precision_flow_alignment,,,,,,,
be581a15-5702-4e84-9096-1257a7ab90d3,USOIL,2026-01-13T23:29:42Z,market closed,session_closed,0,,1.0,20.0,,,,,,,60.87,2026-01-13T23:29:17Z,25,,,rule,"Piac zárva (nyitáson kívül); Bias(4H→1H)=long (+15.0); Regime filter inaktív; Zárási sáv likviditás büntetés (-2.0); ATR erősség 1.58× küszöb (+14.5); Ár az intraday range alsó zónájában (+4.0); Fib zóna konfluencia (0.618–0.886) (+18.0); Order flow neutrális (−4.9); P-Score reduced by 4.0 due to regime CHOPPY; USOIL: 1h ATR <1 USD — P-score küszöb emelve a zajos sáv miatt; USOIL: csökkenő volatilitás — RR cél 1:1.5-re igazítva; USOIL: nyitás előtti sáv — pozícióméret ×0.75; USOIL: oldalazó szerkezet — 1h BOS nélkül nincs belépő; Regime kapu: CHOPPY miatt −10 P-score, pozícióskálázás csökkentve; Strukturális soft gate: 1/3 jel + ATR/spread OK (−6 P-score, size ×0.70); Strukturális kapu lazítva: momentum erős, BOS hiány engedve; Liquidity gate skipped (no volume proxy available); Diagnosztika: k1m: utolsó zárt gyertya 10 perc késésben van; Diagnosztika: k1m: jelzés korlátozva 10 perc késés miatt; Diagnosztika: k5m: utolsó zárt gyertya 14 perc késésben van; missing: session",,,,,,,
