journal_id,asset,analysis_timestamp,signal,mode,probability,model_probability,realtime_confidence,leverage,entry_price,stop_loss,take_profit_1,take_profit_2,risk_reward,initial_risk_abs,spot_price,spot_timestamp,spot_latency_seconds,precision_score,anchor_bias,probability_source,notes,validation_outcome,validation_rr,max_favorable_excursion,max_adverse_excursion,time_to_outcome_minutes,slippage,execution_latency_ms,fill_timestamp,exit_timestamp,entry_kind,validation_source
eded1566-8d80-4ed1-bcf9-9f08a43d90f9,GOLD_CFD,2026-03-12T04:46:40Z,no entry,core,0,,1.0,20.0,,,,,,,5145.04157,2026-03-12T04:46:13Z,27,,,rule,"Intraday bias gate feltételek hiányosak — 5m retest long  ATR: 5m retest long, ATR gate | 5m retest short  ATR: 5m retest short, ATR gate; Bias neutrálsávban; Regime filter inaktív; ATR nincs rendben (relatív vagy abszolút küszöb); Alacsony realised vol → magasabb RR igény; Fib zóna konfluencia (0.618–0.886) (+18.0); Order flow neutrális (−4.1); P-Score reduced by 4.0 due to regime CHOPPY; ATR-floor override: rel_atr 0.0004 < 0.0025 → adaptív RR/TP küszöb; Regime kapu: CHOPPY miatt −10 P-score, pozícióskálázás csökkentve; ATR soft gate: alacsony volatilitás −5 P-score, méret felezve; Liquidity gate skipped (no volume proxy available); missing: P_score>=30",,,,,,,,,,,
ccb1dd75-3a43-4689-ae98-061ad8bdb684,XAGUSD,2026-03-12T04:46:40Z,no entry,core,0,,1.0,20.0,,,,,,,84.51937,2026-03-12T04:46:13Z,27,,,rule,"Intraday bias gate feltételek hiányosak — Micro BOS long  ATR (ezüst): 1m micro BOS long, ATR gate | Micro BOS short  ATR (ezüst): 1m micro BOS short, ATR gate; Bias neutrálsávban; Regime filter inaktív; ATR nincs rendben (relatív vagy abszolút küszöb); Fib zóna konfluencia (0.618–0.886) (+18.0); Order flow neutrális (−4.8); P-Score reduced by 4.0 due to regime CHOPPY; XAGUSD: visszafogott ATR — RR cél 1:1.7-re emelve; XAGUSD breakout-védelem: gyors BE + 20% giveback limit expanziós szakaszban; XAGUSD: ATR-alapú pozícióskálázás ×0.70; ATR-floor override: rel_atr 0.0014 < 0.0018 → adaptív RR/TP küszöb; Regime kapu: CHOPPY miatt −10 P-score, pozícióskálázás csökkentve; ATR soft gate: alacsony volatilitás −5 P-score, méret felezve; Liquidity gate skipped (no volume proxy available); missing: P_score>=28",,,,,,,,,,,
73699aa4-8430-4218-89e0-b6cf148204ac,EURUSD,2026-03-12T04:46:40Z,no entry,core,25,,1.0,30.0,,,,,,,1.15333,2026-03-12T04:46:13Z,27,,,rule,"Bias(4H→1H)=short (+15.0); Regime filter inaktív; 5M BOS trendirányba (+16.0); ATR nincs rendben (relatív vagy abszolút küszöb); Alacsony realised vol → magasabb RR igény; Intraday range alsó harmada telített (−7.0); Range expanzió támogatja a momentumot (+3.0); Fib zóna konfluencia (0.618–0.886) (+18.0); Order flow neutrális (−4.0); P-Score reduced by 4.0 due to regime CHOPPY; EURUSD: ATR(1h) alacsony — P-score küszöb +6 pontra emelve; Intraday P-score lazítás: micro-bias short elsőbbséget kap (−2.2); EURUSD: Visszafogott ATR — célok szűkítve, kockázat kontroll alatt; EURUSD BOS aktív, de VWAP felett — várakozás; OFI z-score -1.70 támogatja az irányt; ATR-floor override: rel_atr 0.0002 < 0.0006 → adaptív RR/TP küszöb; Regime kapu: CHOPPY miatt −10 P-score, pozícióskálázás csökkentve; ATR soft gate: alacsony volatilitás −5 P-score, méret felezve; Liquidity gate skipped (no volume proxy available); missing: P_score>=41.8",,,,,,,,,,,
9c526f5c-d025-4771-95a0-b44baf54f399,BTCUSD,2026-03-12T04:46:41Z,sell,core,38,,1.0,2.0,69433.98,69581.33742857142,68991.9077142857,68991.9077142857,2.4,,69389.99,2026-03-12T04:46:13Z,27,,,rule,"Bias override: Intraday 5m BOS short  ATR (+19.5); Regime filter inaktív; 5M BOS trendirányba (+16.0); ATR erősség 0.96× küszöb (+10.7); Intraday range alsó harmada telített (−7.0); Range expanzió támogatja a momentumot (+3.0); Order flow neutrális (−4.9); Sell pressure támogatja a setupot (+5); P-Score reduced by 4.0 due to regime CHOPPY; P-Score reduced by 1.7 due to ATR Soft Gate tolerance; Mesterlövész mód: P-score minimum 35 érvényesítve; Regime kapu: CHOPPY miatt −10 P-score, pozícióskálázás csökkentve; Strukturális kapu lazítva: momentum erős, BOS hiány engedve; BTC ATR1h stop igazítás: kockázat ×1.15; TP1 nettó profit ≈ 0.20%; Precision plan: entry 69372.4–69453.3, SL 69534.1; Precision confidence medium (72.0); Precision limit belépő parkolva 20 percig; missing: rr_min, tp1_net>=+0.6%; Pozíciómenedzsment: aktív short pozíció (opened_at: 2026-03-12T04:41:35Z, Entry: 69433.98, SL: 69581.33742857142, TP2: 68991.9077142857)",insufficient_data,,,,,,,,,limit,auto
a3e14ba1-0ba9-4e39-927c-c5fd4d164aa9,USOIL,2026-03-12T04:46:41Z,no entry,core,32,,1.0,20.0,92.088932,90.49378125714286,96.87438422857142,96.87438422857142,2.999999999999991,,93.73534,2026-03-12T04:46:13Z,28,,,rule,"Bias(4H→1H)=long (+15.0); EMA21 slope 2.22× küszöb (+19.3); ATR nincs rendben (relatív vagy abszolút küszöb); Order flow neutrális (−4.5); USOIL: parabolikus lendület — RR cél 1:1.4 környékére szűkítve; USOIL: ázsiai sáv — pozícióméret ×0.70; OFI z-score 1.67 támogatja az irányt; ATR soft gate: alacsony volatilitás −5 P-score, méret felezve; Liquidity gate skipped (no volume proxy available); missing: P_score>=36; Pozíciómenedzsment: aktív long pozíció (opened_at: 2026-03-12T00:01:41Z, Entry: 92.088932, SL: 90.49378125714286, TP2: 96.87438422857142)",,,,,,,,,,,
