journal_id,asset,analysis_timestamp,signal,mode,probability,model_probability,realtime_confidence,leverage,entry_price,stop_loss,take_profit_1,take_profit_2,risk_reward,initial_risk_abs,spot_price,spot_timestamp,spot_latency_seconds,precision_score,anchor_bias,probability_source,notes,validation_outcome,validation_rr,max_favorable_excursion,max_adverse_excursion,time_to_outcome_minutes,slippage,execution_latency_ms
ea55777b-299a-4e6b-a8cc-87f2dcb9433f,XAGUSD,2026-06-02T07:36:52Z,no entry,core,0,,1.0,20.0,,,,,,,76.68018,2026-06-02T07:36:24Z,28,,,rule,"Intraday bias gate feltételek hiányosak — Micro BOS long  ATR (ezüst): 1m micro BOS long | Micro BOS short  ATR (ezüst): 1m micro BOS short; Bias neutrálsávban; Regime filter inaktív; ATR erősség 0.86× küszöb (+10.2); Order flow neutrális (−4.8); P-Score reduced by 4.0 due to regime CHOPPY; P-Score reduced by 5.6 due to ATR Soft Gate tolerance; XAGUSD: visszafogott ATR — RR cél 1:1.7-re emelve; XAGUSD breakout-védelem: gyors BE + 20% giveback limit expanziós szakaszban; XAGUSD: ATR-alapú pozícióskálázás ×0.70; ATR-floor override: rel_atr 0.0016 < 0.0018 → adaptív RR/TP küszöb; Regime kapu: CHOPPY miatt −10 P-score, pozícióskálázás csökkentve; Liquidity gate skipped (no volume proxy available); missing: P_score>=28",,,,,,,
77701de0-32b6-4fff-9701-bfacbcd5d79e,EURUSD,2026-06-02T07:36:52Z,no entry,core,0,,1.0,30.0,,,,,,,1.16469,2026-06-02T07:36:24Z,28,,,rule,"Intraday bias gate feltételek hiányosak — Micro BOS long  ATR rendben: 1m micro BOS long, ATR gate | Micro BOS short  ATR rendben: 1m micro BOS short, ATR gate; Bias neutrálsávban; Regime filter inaktív; ATR nincs rendben (relatív vagy abszolút küszöb); Alacsony realised vol → magasabb RR igény; Range expanzió támogatja a momentumot (+3.0); Ár 1h EMA21 zónában (+10.0); Order flow neutrális (−3.7); P-Score reduced by 4.0 due to regime CHOPPY; EURUSD: ATR(1h) alacsony — P-score küszöb +6 pontra emelve; EURUSD: Visszafogott ATR — célok szűkítve, kockázat kontroll alatt; ATR-floor override: rel_atr 0.0002 < 0.0006 → adaptív RR/TP küszöb; Regime kapu: CHOPPY miatt −10 P-score, pozícióskálázás csökkentve; ATR soft gate: alacsony volatilitás −5 P-score, méret felezve; Strukturális kapu lazítva: momentum erős, BOS hiány engedve; Liquidity gate skipped (no volume proxy available); missing: P_score>=44",,,,,,,
b451ace1-6af6-42b1-a956-6ad1c1432fbb,GOLD_CFD,2026-06-02T07:36:52Z,no entry,core,27,,1.0,20.0,,,,,,,4533.02809,2026-06-02T07:36:24Z,28,,,rule,"Bias(4H→1H)=short (+15.0); Regime filter inaktív; HTF sweep ok (+10.0); 5M BOS trendirányba (+16.0); ATR nincs rendben (relatív vagy abszolút küszöb); Alacsony realised vol → magasabb RR igény; Ár az intraday range felső zónájában (+4.0); Range expanzió támogatja a momentumot (+3.0); Order flow neutrális (−4.5); P-Score reduced by 4.0 due to regime CHOPPY; ATR-floor override: rel_atr 0.0006 < 0.0025 → adaptív RR/TP küszöb; Fém irány guard: 5m trend ellentétes a belépési biasszal; Regime kapu: CHOPPY miatt −10 P-score, pozícióskálázás csökkentve; ATR soft gate: alacsony volatilitás −5 P-score, méret felezve; Strukturális kapu lazítva: momentum erős, BOS hiány engedve; Liquidity gate skipped (no volume proxy available); missing: metal_bias_5m_alignment, P_score>=30",,,,,,,
1a54a02e-2b0e-409e-822f-910199f41b09,BTCUSD,2026-06-02T07:36:52Z,precision_arming,core,57,,1.0,2.0,,,,,,,70003.74,2026-06-02T07:36:24Z,28,,,rule,Bias(4H→1H)=short (+15.0); EMA21 slope 1.08× küszöb (+12.5); HTF sweep ok (+10.0); ATR erősség 1.79× küszöb (+15.7); Order flow neutrális (−4.2); Order flow ellentétes irányba tolódik (−4); OFI toxikus short irányra (−3.5); Mesterlövész mód: P-score minimum 35 érvényesítve; BTC ATR1h stop igazítás: kockázat ×1.15; Precision trigger kész → limit figyelés; Precision limit belépő parkolva 20 percig,,,,,,,
1862a030-06ff-4c22-a7be-4d7a7a2b42a7,USOIL,2026-06-02T07:36:52Z,no entry,core_only,43,,1.0,20.0,91.32969,88.48169232857143,97.02568534285714,99.87368301428572,3.0,,91.32969,2026-06-02T07:36:24Z,28,,,rule,"Mean reversion bias override (+19.5); Regime filter inaktív; ATR erősség 0.96× küszöb (+10.8); Ár az intraday range alsó zónájában (+4.0); Fib zóna konfluencia (0.618–0.886) (+18.0); Order flow neutrális (−4.8); P-Score reduced by 4.0 due to regime CHOPPY; P-Score reduced by 1.4 due to ATR Soft Gate tolerance; USOIL: parabolikus lendület — RR cél 1:1.4 környékére szűkítve; USOIL: európai délelőtt — pozícióméret ×0.85; USOIL: oldalazó szerkezet — H1/M5 BOS nélkül nincs belépő; OFI z-score 2.00 támogatja az irányt; Regime kapu: CHOPPY miatt −10 P-score, pozícióskálázás csökkentve; USOIL stop lazítás: ATR1h alapú kockázat ×0.92; Diagnosztika: k1m: utolsó zárt gyertya 10 perc késésben van; Diagnosztika: k1m: jelzés korlátozva 10 perc késés miatt; Diagnosztika: k5m: utolsó zárt gyertya 11 perc késésben van",,,,,,,
