journal_id,asset,analysis_timestamp,signal,mode,probability,model_probability,realtime_confidence,leverage,entry_price,stop_loss,take_profit_1,take_profit_2,risk_reward,initial_risk_abs,spot_price,spot_timestamp,spot_latency_seconds,precision_score,anchor_bias,probability_source,notes,validation_outcome,validation_rr,max_favorable_excursion,max_adverse_excursion,time_to_outcome_minutes,slippage,execution_latency_ms
2851a251-5a2f-445c-bc5b-6cf10e2468d5,XAGUSD,2026-01-21T06:00:09Z,precision_arming,core,56,,1.0,20.0,,,,,,,94.54694,2026-01-21T05:59:39Z,30,,,rule,"Bias(4H→1H)=long (+15.0); Regime filter inaktív; 5M BOS trendirányba (+16.0); ATR erősség 1.79× küszöb (+15.7); Range expanzió támogatja a momentumot (+3.0); XAG momentum override — stop tágítva erős trendnél; XAGUSD: momentum override — stop távolság 1.3×ATR-re tágítva; Fib zóna konfluencia (0.618–0.886) (+18.0); Order flow neutrális (−3.4); OFI toxikus long irányra (−3.6); XAGUSD: momentum kitörés — RR cél 1:1.45-re szűkítve; XAG momentum override — pozícióméret csökkentve; XAG: VWAP alatt — long setup türelmet igényel; Regime kapu: CHOPPY miatt −10 P-score, pozícióskálázás csökkentve; Strukturális soft gate: 1/3 jel + ATR/spread OK (−6 P-score, size ×0.70); Strukturális kapu lazítva: momentum erős, BOS hiány engedve; Liquidity gate skipped (no volume proxy available); Precision trigger kész → limit figyelés; Precision limit belépő parkolva 12 percig",,,,,,,
ssing: P_score>=26",,,,,,,
8d9b9310-2b4d-4606-a006-70c8b0797c6a,GOLD_CFD,2026-01-21T06:00:09Z,no entry,core,11,,1.0,20.0,,,,,,,4870.31498,2026-01-21T05:59:39Z,30,,,rule,"Bias(4H→1H)=long (+15.0); Regime filter inaktív; ATR erősség 1.34× küszöb (+13.0); Alacsony realised vol → magasabb RR igény; Intraday range felső harmada telített (−7.0); Order flow neutrális (−4.1); OFI toxikus long irányra (−3.3); P-Score reduced by 4.0 due to regime CHOPPY; Range guard lazítva: napi sáv teteje, de mikro-range visszahúzódott.; VWAP alatt — GOLD long breakout késleltetve; ATR-floor override: rel_atr 0.0011 < 0.0025 → adaptív RR/TP küszöb; Regime kapu: CHOPPY miatt −10 P-score, pozícióskálázás csökkentve; Liquidity gate skipped (no volume proxy available); missing: P_score>=20",,,,,,,
8af3e9c1-eac2-4134-b7bf-8f82c56d8c9a,BTCUSD,2026-01-21T06:00:09Z,no entry,core,18,,1.0,2.0,,,,,,,89818.21,2026-01-21T05:59:39Z,30,,,rule,"Intraday bias gate feltételek hiányosak — Crypto momentum long: 1m micro BOS long, Momentum volume ráta, ATR gate | Crypto momentum short: 1m micro BOS short, ATR gate | 5m BOS long  ATR: ATR gate | 5m BOS short  ATR: 5m BOS short, ATR gate | Micro BOS short  ATR (momentum nélkül): 1m micro BOS short, ATR gate; Bias neutrálsávban; EMA21 slope 1.08× küszöb (+12.5); ATR nincs rendben (relatív vagy abszolút küszöb); Alacsony realised vol → magasabb RR igény; Ár 1h EMA21 zónában (+10.0); Order flow neutrális (−3.9); P-Score reduced by 2.5 due to ATR Soft Gate tolerance; ATR-floor override: rel_atr 0.0012 < 0.0012 → adaptív RR/TP küszöb; ATR soft gate: alacsony volatilitás −5 P-score, méret felezve; missing: P_score>=25",,,,,,,
4f595ad4-729f-4634-9c06-1baf65ed5d86,USOIL,2026-01-21T06:00:10Z,no entry,core_only,24,,0.9999999999999999,20.0,,,,,,,59.90334,2026-01-21T05:59:39Z,31,,,rule,"Bias(4H→1H)=long (+15.0); Regime filter inaktív; 5M BOS trendirányba (+16.0); ATR nincs rendben (relatív vagy abszolút küszöb); Intraday range felső harmada telített (−7.0); Range expanzió támogatja a momentumot (+3.0); USOIL: erős momentum — invalid zóna 2.5×ATR(1h)-re tágítva; Fib zóna konfluencia (0.618–0.886) (+18.0); Order flow neutrális (−4.5); P-Score reduced by 4.0 due to regime CHOPPY; USOIL: 1h ATR <1 USD — P-score küszöb emelve a zajos sáv miatt; USOIL: csökkenő volatilitás — RR cél 1:1.5-re igazítva; USOIL: európai délelőtt — pozícióméret ×0.75; Regime kapu: CHOPPY miatt −10 P-score, pozícióskálázás csökkentve; ATR soft gate: alacsony volatilitás −5 P-score, méret felezve; Diagnosztika: k1m: utolsó zárt gyertya 11 perc késésben van; Diagnosztika: k1m: jelzés korlátozva 11 perc késés miatt; Diagnosztika: k5m: utolsó zárt gyertya 15 perc késésben van; missing: P_score>=27",,,,,,,
