journal_id,asset,analysis_timestamp,signal,mode,probability,model_probability,realtime_confidence,leverage,entry_price,stop_loss,take_profit_1,take_profit_2,risk_reward,initial_risk_abs,spot_price,spot_timestamp,spot_latency_seconds,precision_score,anchor_bias,probability_source,notes,validation_outcome,validation_rr,max_favorable_excursion,max_adverse_excursion,time_to_outcome_minutes,slippage,execution_latency_ms
ce38b5a5-f6b0-4eed-9781-a022271d5d0e,EURUSD,2026-04-06T09:16:36Z,no entry,core,0,,1.0,30.0,,,,,,,1.15559,2026-04-06T09:16:16Z,20,,,rule,"Intraday bias gate feltételek hiányosak — Micro BOS long  ATR rendben: 1m micro BOS long, ATR gate | Micro BOS short  ATR rendben: 1m micro BOS short, ATR gate; Bias neutrálsávban; Regime filter inaktív; ATR nincs rendben (relatív vagy abszolút küszöb); Alacsony realised vol → magasabb RR igény; Order flow neutrális (−3.7); P-Score reduced by 4.0 due to regime CHOPPY; EURUSD: ATR(1h) alacsony — P-score küszöb +6 pontra emelve; EURUSD: Visszafogott ATR — célok szűkítve, kockázat kontroll alatt; ATR-floor override: rel_atr 0.0002 < 0.0006 → adaptív RR/TP küszöb; Regime kapu: CHOPPY miatt −10 P-score, pozícióskálázás csökkentve; ATR soft gate: alacsony volatilitás −5 P-score, méret felezve; Liquidity gate skipped (no volume proxy available); missing: P_score>=44",,,,,,,
8bc92120-4968-455a-8614-e8fa2b4d2cb3,XAGUSD,2026-04-06T09:16:36Z,precision_arming,core,29,,1.0,20.0,,,,,,,73.39429,2026-04-06T09:16:16Z,20,,,rule,"Bias override: Intraday Micro BOS long  ATR (ezüst) (+19.5); Regime filter inaktív; 5M BOS trendirányba (+16.0); ATR erősség 0.97× küszöb (+10.8); Intraday range felső harmada telített (−7.0); Range expanzió támogatja a momentumot (+3.0); XAG momentum override — stop tágítva erős trendnél; XAGUSD: momentum override — stop távolság 1.3×ATR-re tágítva; Order flow neutrális (−2.7); P-Score reduced by 4.0 due to regime CHOPPY; P-Score reduced by 1.1 due to ATR Soft Gate tolerance; Intraday P-score lazítás: micro-bias long elsőbbséget kap (−1.5); Mesterlövész mód: P-score minimum 28 érvényesítve; XAGUSD: momentum kitörés — RR cél 1:1.45-re szűkítve; XAGUSD breakout-védelem: gyors BE + 20% giveback limit expanziós szakaszban; XAG momentum override — pozícióméret csökkentve; XAGUSD: ATR-alapú pozícióskálázás ×0.55; XAG: VWAP alatt — long setup türelmet igényel; ATR-floor override: rel_atr 0.0018 < 0.0018 → adaptív RR/TP küszöb; Regime kapu: CHOPPY miatt −10 P-score, pozícióskálázás csökkentve; Strukturális soft gate: 1/3 jel + ATR/spread OK (−6 P-score, size ×0.70); Strukturális kapu lazítva: momentum erős, BOS hiány engedve; Liquidity gate skipped (no volume proxy available); XAG stop lazítás: ATR1h alapú kockázat ×1.09; Precision trigger kész → limit figyelés; Precision limit belépő parkolva 12 percig",,,,,,,
a5ae97cc-4930-4231-b4b1-25ccae391ff8,GOLD_CFD,2026-04-06T09:16:36Z,no entry,core,0,,1.0,20.0,,,,,,,4700.49883,2026-04-06T09:16:16Z,20,,,rule,"Intraday bias gate feltételek hiányosak — 5m retest long  ATR: 5m retest long, ATR gate | 5m retest short  ATR: 5m retest short, ATR gate; Bias neutrálsávban; Regime filter inaktív; ATR nincs rendben (relatív vagy abszolút küszöb); Alacsony realised vol → magasabb RR igény; Range expanzió támogatja a momentumot (+3.0); Order flow neutrális (−2.8); P-Score reduced by 4.0 due to regime CHOPPY; ATR-floor override: rel_atr 0.0008 < 0.0025 → adaptív RR/TP küszöb; Regime kapu: CHOPPY miatt −10 P-score, pozícióskálázás csökkentve; ATR soft gate: alacsony volatilitás −5 P-score, méret felezve; Strukturális kapu lazítva: momentum erős, BOS hiány engedve; Liquidity gate skipped (no volume proxy available); missing: P_score>=30",,,,,,,
514dc3ca-52ee-4914-8987-f21e244a44ae,BTCUSD,2026-04-06T09:16:37Z,precision_arming,core,69,,1.0,2.0,,,,,,,69643.33,2026-04-06T09:16:16Z,20,,,rule,"Bias override: 1h trend long + momentum támogatás (+19.5); EMA21 slope 1.25× küszöb (+13.5); 5M BOS trendirányba (+16.0); ATR erősség 1.47× küszöb (+13.8); Intraday range felső harmada telített (−7.0); Range expanzió támogatja a momentumot (+3.0); Order flow neutrális (−4.2); Buy pressure támogatja a setupot (+5); Mesterlövész mód: P-score minimum 35 érvényesítve; OFI z-score 1.53 támogatja az irányt; Strukturális soft gate: 1/3 jel + ATR/spread OK (−6 P-score, size ×0.70); Likviditási kapu lazítva erős momentum miatt; BTC ATR1h stop igazítás: kockázat ×1.15; Precision trigger kész → limit figyelés; Precision limit belépő parkolva 20 percig",,,,,,,
67c9a9d9-addb-4590-bf28-518b7b3bd84b,USOIL,2026-04-06T09:16:37Z,no entry,core,17,,0.9999999999999998,20.0,,,,,,,109.22213,2026-04-06T09:16:16Z,21,,,rule,"Bias(4H→1H)=long (+15.0); Regime filter inaktív; ATR erősség 0.85× küszöb (+10.1); Ár az intraday range alsó zónájában (+4.0); Ár 1h EMA21 zónában (+10.0); Order flow neutrális (−4.2); OFI toxikus long irányra (−3.3); P-Score reduced by 4.0 due to regime CHOPPY; P-Score reduced by 5.9 due to ATR Soft Gate tolerance; USOIL: 1h ATR ≥1.5 USD — RR cél 1:2-re emelve; USOIL: európai délelőtt — pozícióméret ×0.85; USOIL: oldalazó szerkezet — H1/M5 BOS nélkül nincs belépő; Regime kapu: CHOPPY miatt −10 P-score, pozícióskálázás csökkentve; Strukturális soft gate: 1/3 jel + ATR/spread OK (−6 P-score, size ×0.70); Strukturális kapu lazítva: momentum erős, BOS hiány engedve; Liquidity gate skipped (no volume proxy available); Diagnosztika: k5m: utolsó zárt gyertya 11 perc késésben van; missing: P_score>=36",,,,,,,
