journal_id,asset,analysis_timestamp,signal,mode,probability,model_probability,realtime_confidence,leverage,entry_price,stop_loss,take_profit_1,take_profit_2,risk_reward,initial_risk_abs,spot_price,spot_timestamp,spot_latency_seconds,precision_score,anchor_bias,probability_source,notes,validation_outcome,validation_rr,max_favorable_excursion,max_adverse_excursion,time_to_outcome_minutes,slippage,execution_latency_ms,fill_timestamp,exit_timestamp,entry_kind,validation_source
5de7c0e6-6d11-4efb-b88e-dc72401901ea,EURUSD,2026-04-06T13:21:48Z,no entry,core,20,,1.0,30.0,,,,,,,1.15549,2026-04-06T13:21:28Z,20,,,rule,"Mean reversion bias override (+19.5); Regime filter inaktív; London–NY overlap profil (-1.0); ATR nincs rendben (relatív vagy abszolút küszöb); Alacsony realised vol → magasabb RR igény; Ár az intraday range felső zónájában (+4.0); Fib zóna konfluencia (0.618–0.886) (+18.0); Order flow neutrális (−4.3); P-Score reduced by 4.0 due to regime CHOPPY; EURUSD: ATR(1h) alacsony — P-score küszöb +6 pontra emelve; EURUSD: Visszafogott ATR — célok szűkítve, kockázat kontroll alatt; OFI z-score -1.38 támogatja az irányt; ATR-floor override: rel_atr 0.0002 < 0.0006 → adaptív RR/TP küszöb; Regime kapu: CHOPPY miatt −10 P-score, pozícióskálázás csökkentve; ATR soft gate: alacsony volatilitás −5 P-score, méret felezve; Liquidity gate skipped (no volume proxy available); missing: P_score>=44",,,,,,,,,,,
5e2e3cf8-ee65-4a2b-98db-3acbe99c1dd8,GOLD_CFD,2026-04-06T13:21:48Z,no entry,core,0,,1.0,20.0,,,,,,,4666.62551,2026-04-06T13:21:28Z,20,,,rule,"Intraday bias gate feltételek hiányosak — 5m retest long  ATR: 5m retest long, ATR gate | 5m retest short  ATR: 5m retest short, ATR gate; Bias neutrálsávban; Regime filter inaktív; London–NY overlap profil (-1.0); ATR nincs rendben (relatív vagy abszolút küszöb); Alacsony realised vol → magasabb RR igény; Ár 1h EMA21 zónában (+10.0); Order flow neutrális (−3.2); P-Score reduced by 4.0 due to regime CHOPPY; ATR-floor override: rel_atr 0.0012 < 0.0025 → adaptív RR/TP küszöb; Regime kapu: CHOPPY miatt −10 P-score, pozícióskálázás csökkentve; ATR soft gate: alacsony volatilitás −5 P-score, méret felezve; Liquidity gate skipped (no volume proxy available); missing: P_score>=30",,,,,,,,,,,
bd844c55-4a19-494d-b85a-913eac2019ad,BTCUSD,2026-04-06T13:21:48Z,sell,core,92,,1.0,2.0,69383.79,70077.62789999999,67996.1142,67302.2763,3.0,,69383.79,2026-04-06T13:21:28Z,20,,,rule,"Bias override: Intraday 5m BOS short  ATR (+19.5); EMA21 slope 1.08× küszöb (+12.5); 5M BOS trendirányba (+16.0); London–NY overlap profil (-1.0); ATR erősség 1.26× küszöb (+12.6); Alacsony realised vol → magasabb RR igény; Range expanzió támogatja a momentumot (+3.0); Fib zóna konfluencia (0.618–0.886) (+18.0); Order flow neutrális (−3.8); Mesterlövész mód: P-score minimum 35 érvényesítve; Strukturális kapu lazítva: momentum erős, BOS hiány engedve; BTC ATR1h stop igazítás: kockázat ×1.15; TP1 nettó profit ≈ 0.60%; Precision plan: entry 69363.6–69424.2, SL 69484.8; Precision confidence medium (62.0); Precision limit belépő parkolva 20 percig; missing: tp1_net>=+0.6%",insufficient_data,,,,,,,,,market,auto
df4f7554-e884-4e69-9b6b-76b94f38e00c,XAGUSD,2026-04-06T13:21:48Z,precision_arming,core,35,,1.0,20.0,,,,,,,72.75009,2026-04-06T13:21:28Z,20,,,rule,"Mean reversion bias override (+19.5); Regime filter inaktív; London–NY overlap profil (-1.0); ATR erősség 1.21× küszöb (+12.3); Fib zóna konfluencia (0.618–0.886) (+18.0); Order flow neutrális (−4.4); P-Score reduced by 4.0 due to regime CHOPPY; XAGUSD breakout-védelem: gyors BE + 20% giveback limit expanziós szakaszban; XAGUSD: ATR-alapú pozícióskálázás ×0.70; XAG: VWAP alatt — long setup türelmet igényel; Regime kapu: CHOPPY miatt −10 P-score, pozícióskálázás csökkentve; Strukturális soft gate: 1/3 jel + ATR/spread OK (−6 P-score, size ×0.70); Strukturális kapu lazítva: momentum erős, BOS hiány engedve; Liquidity gate skipped (no volume proxy available); XAG stop lazítás: ATR1h alapú kockázat ×1.03; Precision trigger kész → limit figyelés; Precision limit belépő parkolva 12 percig",,,,,,,,,,,
7e3739bb-34d1-4dfa-ad91-e78467cb8501,USOIL,2026-04-06T13:21:48Z,no entry,core,30,,1.0,20.0,,,,,,,112.38176,2026-04-06T13:21:28Z,20,,,rule,"Bias(4H→1H)=long (+15.0); Regime filter inaktív; 5M BOS trendirányba (+16.0); London–NY overlap profil (-1.0); ATR erősség 1.08× küszöb (+11.5); Intraday range felső harmada telített (−7.0); Range expanzió támogatja a momentumot (+3.0); USOIL: erős momentum — invalid zóna 2.5×ATR(1h)-re tágítva; Order flow neutrális (−4.2); P-Score reduced by 4.0 due to regime CHOPPY; Intraday P-score lazítás: micro-bias long elsőbbséget kap (−1.5); Mesterlövész mód: P-score minimum 35 érvényesítve; USOIL: 1h ATR ≥1.5 USD — RR cél 1:2-re emelve; OFI z-score 2.16 támogatja az irányt; Regime kapu: CHOPPY miatt −10 P-score, pozícióskálázás csökkentve; Liquidity gate skipped (no volume proxy available); missing: P_score>=35, precision_score>=55",,,,,,,,,,,
