journal_id,asset,analysis_timestamp,signal,mode,probability,model_probability,realtime_confidence,leverage,entry_price,stop_loss,take_profit_1,take_profit_2,risk_reward,initial_risk_abs,spot_price,spot_timestamp,spot_latency_seconds,precision_score,anchor_bias,probability_source,notes,validation_outcome,validation_rr,max_favorable_excursion,max_adverse_excursion,time_to_outcome_minutes,slippage,execution_latency_ms
e52ce730-b067-44cb-9f4b-1ab13aaddb25,XAGUSD,2026-06-02T17:41:56Z,no entry,core,5,,1.0,20.0,,,,,,,75.11337,2026-06-02T17:41:22Z,33,,,rule,"Intraday bias gate feltételek hiányosak — Micro BOS long  ATR (ezüst): 1m micro BOS long | Micro BOS short  ATR (ezüst): 1m micro BOS short; Bias neutrálsávban; Regime filter inaktív; ATR erősség 0.97× küszöb (+10.8); Range expanzió támogatja a momentumot (+3.0); XAG momentum override — stop tágítva erős trendnél; XAGUSD: momentum override — stop távolság 1.3×ATR-re tágítva; Order flow neutrális (−4.4); P-Score reduced by 4.0 due to regime CHOPPY; P-Score reduced by 1.3 due to ATR Soft Gate tolerance; XAGUSD: momentum kitörés — RR cél 1:1.45-re szűkítve; XAGUSD breakout-védelem: gyors BE + 20% giveback limit expanziós szakaszban; XAG momentum override — pozícióméret csökkentve; XAGUSD: ATR-alapú pozícióskálázás ×0.55; ATR-floor override: rel_atr 0.0018 < 0.0018 → adaptív RR/TP küszöb; Regime kapu: CHOPPY miatt −10 P-score, pozícióskálázás csökkentve; Strukturális kapu lazítva: momentum erős, BOS hiány engedve; Liquidity gate skipped (no volume proxy available); missing: P_score>=28",,,,,,,
d446ba83-4d1a-4a3b-9e9c-ab96de0ffabf,GOLD_CFD,2026-06-02T17:41:56Z,no entry,core,8,,1.0,20.0,,,,,,,4482.79381,2026-06-02T17:41:22Z,33,,,rule,"Bias(4H→1H)=short (+15.0); Regime filter inaktív; 5M BOS trendirányba (+16.0); ATR nincs rendben (relatív vagy abszolút küszöb); Alacsony realised vol → magasabb RR igény; Intraday range alsó harmada telített (−7.0); Range expanzió támogatja a momentumot (+3.0); Order flow neutrális (−2.8); P-Score reduced by 4.0 due to regime CHOPPY; Intraday P-score lazítás: micro-bias short elsőbbséget kap (−2.2); Mesterlövész mód: P-score minimum 30 érvényesítve; VWAP felett — GOLD short breakout várakozik; OFI z-score -2.31 támogatja az irányt; ATR-floor override: rel_atr 0.0006 < 0.0025 → adaptív RR/TP küszöb; Regime kapu: CHOPPY miatt −10 P-score, pozícióskálázás csökkentve; ATR soft gate: alacsony volatilitás −5 P-score, méret felezve; Liquidity gate skipped (no volume proxy available); missing: P_score>=30",,,,,,,
d3251182-0583-4719-a3f4-924e02f58251,EURUSD,2026-06-02T17:41:56Z,no entry,core,5,,1.0,30.0,,,,,,,1.1624,2026-06-02T17:41:22Z,33,,,rule,"Micro bias override: gyors struktúra dominál (+19.5); Regime filter inaktív; 5M BOS trendirányba (+16.0); ATR nincs rendben (relatív vagy abszolút küszöb); Alacsony realised vol → magasabb RR igény; Intraday range alsó harmada telített (−7.0); Range expanzió támogatja a momentumot (+3.0); Order flow neutrális (−4.9); P-Score reduced by 4.0 due to regime CHOPPY; P-Score reduced by 5.4 due to ATR Soft Gate tolerance; EURUSD: ATR(1h) alacsony — P-score küszöb +6 pontra emelve; Intraday P-score lazítás: micro-bias short elsőbbséget kap (−2.2); EURUSD: Visszafogott ATR — célok szűkítve, kockázat kontroll alatt; EURUSD BOS aktív, de VWAP felett — várakozás; ATR-floor override: rel_atr 0.0002 < 0.0006 → adaptív RR/TP küszöb; Regime kapu: CHOPPY miatt −10 P-score, pozícióskálázás csökkentve; ATR soft gate: alacsony volatilitás −5 P-score, méret felezve; Strukturális kapu lazítva: momentum erős, BOS hiány engedve; Liquidity gate skipped (no volume proxy available); missing: P_score>=41.8",,,,,,,
3af93a36-1325-48a9-b73d-20f02e6af0a4,NVDA,2026-06-02T17:41:56Z,no entry,core,29,,1.0,5.0,,,,,,,222.91,2026-06-02T17:41:22Z,33,,,rule,"Micro bias override: gyors struktúra dominál (+19.5); Regime filter inaktív; 5M BOS trendirányba (+16.0); ATR nincs rendben (relatív vagy abszolút küszöb); WARNING: No Liquidity Structure (Nearest: 197.152852, Dist: 43.19ATR); Intraday range alsó harmada telített (−7.0); Range expanzió támogatja a momentumot (+3.0); Fib zóna konfluencia (0.618–0.886) (+18.0); Order flow neutrális (−3.8); P-Score reduced by 4.0 due to regime CHOPPY; NVDA: magas napi ATR + momentum — P-score küszöb lazítva; Intraday P-score lazítás: micro-bias short elsőbbséget kap (−2.2); Mesterlövész mód: P-score minimum 35 érvényesítve; Regime kapu: CHOPPY miatt −10 P-score, pozícióskálázás csökkentve; ATR soft gate: alacsony volatilitás −5 P-score, méret felezve; missing: P_score>=35",,,,,,,
f6bcc150-f547-4d3e-be5b-abdcc562943a,BTCUSD,2026-06-02T17:41:56Z,precision_arming,core,76,,1.0,2.0,,,,,,,67520.41,2026-06-02T17:41:22Z,34,,,rule,"Bias(4H→1H)=short (+15.0); EMA21 slope 1.97× küszöb (+17.8); 5M BOS trendirányba (+16.0); ATR erősség 1.51× küszöb (+14.0); Range expanzió támogatja a momentumot (+3.0); Order flow neutrális (−4.6); Mesterlövész mód: P-score minimum 35 érvényesítve; Strukturális kapu lazítva: momentum erős, BOS hiány engedve; Likviditási kapu lazítva erős momentum miatt; BTC ATR1h stop igazítás: kockázat ×1.15; Precision trigger kész → limit figyelés; Precision limit belépő parkolva 20 percig",,,,,,,
c210f3bd-2149-4a65-9893-cd46cc1bb5fc,USOIL,2026-06-02T17:41:56Z,no entry,core_only,47,,1.0,20.0,96.069364,92.64046944571429,103.95582147485712,108.41338439542852,3.6,,96.069364,2026-06-02T17:41:22Z,34,,,rule,"Bias override: Intraday USOIL retest long  ATR (+19.5); Regime filter inaktív; 5M BOS trendirányba (+16.0); ATR erősség 5.16× küszöb (+23.0); Intraday range felső harmada telített (−7.0); Range expanzió támogatja a momentumot (+3.0); USOIL: erős momentum — invalid zóna 2.5×ATR(1h)-re tágítva; Order flow neutrális (−4.5); P-Score reduced by 4.0 due to regime CHOPPY; USOIL: parabolikus lendület — RR cél 1:1.4 környékére szűkítve; Regime kapu: CHOPPY miatt −10 P-score, pozícióskálázás csökkentve; Diagnosztika: k1m: utolsó zárt gyertya 8 perc késésben van; Diagnosztika: k1m: jelzés korlátozva 8 perc késés miatt; Diagnosztika: k5m: utolsó zárt gyertya 11 perc késésben van",,,,,,,
