journal_id,asset,analysis_timestamp,signal,mode,probability,model_probability,realtime_confidence,leverage,entry_price,stop_loss,take_profit_1,take_profit_2,risk_reward,initial_risk_abs,spot_price,spot_timestamp,spot_latency_seconds,precision_score,anchor_bias,probability_source,notes,validation_outcome,validation_rr,max_favorable_excursion,max_adverse_excursion,time_to_outcome_minutes,slippage,execution_latency_ms
7f949d74-f784-4429-ab5a-ff2753a3ac57,GOLD_CFD,2026-01-26T16:51:34Z,no entry,core,31,,1.0,20.0,,,,,,,5085.12647,2026-01-26T16:51:02Z,32,,,rule,"Bias(4H→1H)=long (+15.0); Regime filter inaktív; 5M BOS trendirányba (+16.0); ATR nincs rendben (relatív vagy abszolút küszöb); Range expanzió támogatja a momentumot (+3.0); Fib zóna konfluencia (0.618–0.886) (+18.0); Order flow neutrális (−4.9); P-Score reduced by 4.0 due to regime CHOPPY; VWAP alatt — GOLD long breakout késleltetve; OFI z-score 2.06 támogatja az irányt; ATR-floor override: rel_atr 0.0018 < 0.0025 → adaptív RR/TP küszöb; Regime kapu: CHOPPY miatt −10 P-score, pozícióskálázás csökkentve; ATR soft gate: alacsony volatilitás −5 P-score, méret felezve; Liquidity gate skipped (no volume proxy available); missing: P_score>=40",,,,,,,
2c42f2bd-cdf1-4581-8a54-969a862bb4f0,NVDA,2026-01-26T16:51:34Z,no entry,core,16,,1.0,5.0,,,,,,,186.62,2026-01-26T16:51:02Z,32,,,rule,"Bias(4H→1H)=long (+15.0); Regime filter inaktív; ATR nincs rendben (relatív vagy abszolút küszöb); WARNING: No Liquidity Structure (Nearest: 185.113564, Dist: 4.09ATR); Ár az intraday range alsó zónájában (+4.0); Fib zóna konfluencia (0.618–0.886) (+18.0); Order flow neutrális (−4.3); P-Score reduced by 4.0 due to regime CHOPPY; Regime kapu: CHOPPY miatt −10 P-score, pozícióskálázás csökkentve; ATR soft gate: alacsony volatilitás −5 P-score, méret felezve; missing: P_score>=38, precision_flow_alignment",,,,,,,
0f67fad2-8ed8-48bd-85c5-6a8c147a305b,EURUSD,2026-01-26T16:51:34Z,precision_arming,core,48,,0.9999999999999999,30.0,,,,,,,1.18873,2026-01-26T16:51:03Z,31,,,rule,"Bias(4H→1H)=long (+15.0); Regime filter inaktív; HTF sweep ok (+10.0); 5M BOS trendirányba (+16.0); ATR erősség 2.17× küszöb (+18.0); Alacsony realised vol → magasabb RR igény; Range expanzió támogatja a momentumot (+3.0); Order flow neutrális (−4.6); P-Score reduced by 4.0 due to regime CHOPPY; EURUSD: ATR-alapú pozícióskálázás ×0.69 — volatilitás kontroll; EURUSD BOS aktív, de VWAP alatt — türelem; OFI z-score 1.27 támogatja az irányt; ATR-floor override: rel_atr 0.0004 < 0.0006 → adaptív RR/TP küszöb; Regime kapu: CHOPPY miatt −10 P-score, pozícióskálázás csökkentve; Strukturális soft gate: 1/3 jel + ATR/spread OK (−6 P-score, size ×0.70); Strukturális kapu lazítva: momentum erős, BOS hiány engedve; Liquidity gate skipped (no volume proxy available); EURUSD stop lazítás: ATR1h alapú kockázat ×0.72; Precision trigger kész → limit figyelés; Precision limit belépő parkolva 12 percig",,,,,,,
202d385d-6be2-450e-ba9e-79b5dda6ca2b,XAGUSD,2026-01-26T16:51:34Z,precision_arming,core,69,,1.0,20.0,,,,,,,113.85238,2026-01-26T16:51:02Z,32,,,rule,"Bias(4H→1H)=long (+15.0); EMA21 slope 1.41× küszöb (+14.4); 5M BOS trendirányba (+16.0); ATR erősség 2.87× küszöb (+22.2); Intraday range felső harmada telített (−7.0); Range expanzió támogatja a momentumot (+3.0); XAG momentum override — stop tágítva erős trendnél; XAGUSD: momentum override — stop távolság 1.3×ATR-re tágítva; Order flow neutrális (−3.5); Intraday P-score lazítás: micro-bias long elsőbbséget kap (−1.5); XAGUSD: momentum kitörés — RR cél 1:1.45-re szűkítve; XAG momentum override — pozícióméret csökkentve; XAGUSD: ATR-alapú pozícióskálázás ×0.55; XAG: VWAP alatt — long setup türelmet igényel; Strukturális soft gate: 1/3 jel + ATR/spread OK (−6 P-score, size ×0.70); Strukturális kapu lazítva: momentum erős, BOS hiány engedve; Liquidity gate skipped (no volume proxy available); XAG stop lazítás: ATR1h alapú kockázat ×1.09; Precision trigger kész → limit figyelés; Precision limit belépő parkolva 12 percig",,,,,,,
ab75bc79-db78-4ac9-8fd1-4bdd5a94bf71,USOIL,2026-01-26T16:51:34Z,no entry,core_only,60,,1.0,20.0,60.79245,60.1845255,62.00829900000001,62.61622350000001,3.0,,60.79245,2026-01-26T16:51:02Z,32,,,rule,"Bias(4H→1H)=long (+15.0); Regime filter inaktív; HTF sweep ok (+10.0); 5M BOS trendirányba (+16.0); ATR erősség 1.21× küszöb (+12.3); Range expanzió támogatja a momentumot (+3.0); USOIL: erős momentum — invalid zóna 2.5×ATR(1h)-re tágítva; Fib zóna konfluencia (0.618–0.886) (+18.0); Order flow neutrális (−4.9); P-Score reduced by 4.0 due to regime CHOPPY; USOIL: 1h ATR <1 USD — P-score küszöb emelve a zajos sáv miatt; USOIL: csökkenő volatilitás — RR cél 1:1.5-re igazítva; USOIL: US nyitás — pozícióméret ×0.75; USOIL: oldalazó szerkezet — 1h BOS nélkül nincs belépő; Regime kapu: CHOPPY miatt −10 P-score, pozícióskálázás csökkentve; Strukturális soft gate: 1/3 jel + ATR/spread OK (−6 P-score, size ×0.70); Strukturális kapu lazítva: momentum erős, BOS hiány engedve; USOIL stop lazítás: ATR1h alapú kockázat ×0.97; Diagnosztika: k1m: utolsó zárt gyertya 7 perc késésben van; Diagnosztika: k1m: jelzés korlátozva 7 perc késés miatt; Diagnosztika: k5m: utolsó zárt gyertya 11 perc késésben van",,,,,,,
76667700-61ad-4e6d-90b6-b17e76119944,BTCUSD,2026-01-26T16:51:34Z,no entry,core,25,,1.0,2.0,,,,,,,87747.85,2026-01-26T16:51:02Z,32,,,rule,"Intraday bias gate feltételek hiányosak — Crypto momentum long: 1m micro BOS long, Momentum volume ráta | Crypto momentum short: 1m micro BOS short, Momentum volume ráta | 5m BOS long  ATR: 5m BOS long | 5m BOS short  ATR: 5m BOS short | Micro BOS short  ATR (momentum nélkül): 1m micro BOS short; Bias neutrálsávban; Regime filter inaktív; ATR erősség 1.64× küszöb (+14.8); Fib zóna konfluencia (0.618–0.886) (+18.0); Order flow neutrális (−4.6); P-Score reduced by 4.0 due to regime CHOPPY; Mesterlövész mód: P-score minimum 35 érvényesítve; Regime kapu: CHOPPY miatt −10 P-score, pozícióskálázás csökkentve; missing: P_score>=35",,,,,,,
