journal_id,asset,analysis_timestamp,signal,mode,probability,model_probability,realtime_confidence,leverage,entry_price,stop_loss,take_profit_1,take_profit_2,risk_reward,initial_risk_abs,spot_price,spot_timestamp,spot_latency_seconds,precision_score,anchor_bias,probability_source,notes,validation_outcome,validation_rr,max_favorable_excursion,max_adverse_excursion,time_to_outcome_minutes,slippage,execution_latency_ms
41548828-8fd7-44e6-b8e3-94ea5584c18f,EURUSD,2026-05-26T16:06:58Z,no entry,core,7,,1.0,30.0,,,,,,,1.16214,2026-05-26T16:06:25Z,32,,,rule,"Intraday bias gate feltételek hiányosak — Micro BOS long  ATR rendben: 1m micro BOS long | Micro BOS short  ATR rendben: 1m micro BOS short; Bias neutrálsávban; Regime filter inaktív; ATR erősség 1.40× küszöb (+13.4); Alacsony realised vol → magasabb RR igény; Order flow neutrális (−3.8); P-Score reduced by 4.0 due to regime CHOPPY; EURUSD: ATR(1h) alacsony — P-score küszöb +6 pontra emelve; EURUSD: Visszafogott ATR — célok szűkítve, kockázat kontroll alatt; ATR-floor override: rel_atr 0.0003 < 0.0006 → adaptív RR/TP küszöb; Regime kapu: CHOPPY miatt −10 P-score, pozícióskálázás csökkentve; Liquidity gate skipped (no volume proxy available); missing: P_score>=44",,,,,,,
cb8f9218-f616-4dd0-99a2-6c737b0baaf3,GOLD_CFD,2026-05-26T16:06:58Z,no entry,core,25,,1.0,20.0,,,,,,,4506.35541,2026-05-26T16:06:25Z,32,,,rule,"Bias(4H→1H)=short (+15.0); Regime filter inaktív; 5M BOS trendirányba (+16.0); ATR nincs rendben (relatív vagy abszolút küszöb); Alacsony realised vol → magasabb RR igény; Intraday range alsó harmada telített (−7.0); Range expanzió támogatja a momentumot (+3.0); Fib zóna konfluencia (0.618–0.886) (+18.0); Order flow neutrális (−4.1); P-Score reduced by 4.0 due to regime CHOPPY; VWAP felett — GOLD short breakout várakozik; ATR-floor override: rel_atr 0.0008 < 0.0025 → adaptív RR/TP küszöb; Regime kapu: CHOPPY miatt −10 P-score, pozícióskálázás csökkentve; ATR soft gate: alacsony volatilitás −5 P-score, méret felezve; Strukturális kapu lazítva: momentum erős, BOS hiány engedve; Liquidity gate skipped (no volume proxy available); missing: P_score>=30",,,,,,,
3ab7090d-a5f4-472f-80b9-819296297f89,XAGUSD,2026-05-26T16:06:58Z,no entry,core,15,,1.0,20.0,,,,,,,76.04044,2026-05-26T16:06:25Z,32,,,rule,"Intraday bias gate feltételek hiányosak — Micro BOS long  ATR (ezüst): 1m micro BOS long | Micro BOS short  ATR (ezüst): 1m micro BOS short; Bias neutrálsávban; Regime filter inaktív; ATR erősség 0.99× küszöb (+10.9); Fib zóna konfluencia (0.618–0.886) (+18.0); Order flow neutrális (−4.8); P-Score reduced by 4.0 due to regime CHOPPY; P-Score reduced by 0.4 due to ATR Soft Gate tolerance; XAGUSD: visszafogott ATR — RR cél 1:1.7-re emelve; XAGUSD breakout-védelem: gyors BE + 20% giveback limit expanziós szakaszban; XAGUSD: ATR-alapú pozícióskálázás ×0.70; Regime kapu: CHOPPY miatt −10 P-score, pozícióskálázás csökkentve; Strukturális soft gate: 1/3 jel + ATR/spread OK (−6 P-score, size ×0.70); Strukturális kapu lazítva: momentum erős, BOS hiány engedve; Liquidity gate skipped (no volume proxy available); missing: P_score>=28",,,,,,,
11a364cd-4f44-4a60-aae7-f394cf660255,USOIL,2026-05-26T16:06:58Z,no entry,core_only,53,,1.0,20.0,93.9191,91.67375713428571,99.08338859114288,102.00233431657145,3.6,,93.9191,2026-05-26T16:06:25Z,33,,,rule,"Mean reversion bias override (+19.5); Regime filter inaktív; ATR erősség 3.70× küszöb (+23.0); Fib zóna konfluencia (0.618–0.886) (+18.0); Order flow neutrális (−4.2); P-Score reduced by 4.0 due to regime CHOPPY; USOIL: parabolikus lendület — RR cél 1:1.4 környékére szűkítve; OFI z-score 1.72 támogatja az irányt; Regime kapu: CHOPPY miatt −10 P-score, pozícióskálázás csökkentve; USOIL stop lazítás: ATR1h alapú kockázat ×0.92; Diagnosztika: k1m: utolsó zárt gyertya 10 perc késésben van; Diagnosztika: k1m: jelzés korlátozva 10 perc késés miatt; Diagnosztika: k5m: utolsó zárt gyertya 11 perc késésben van; Diagnosztika: k1h: utolsó zárt gyertya 66 perc késésben van",,,,,,,
e763f133-c86a-439f-8f4e-bcf95c964e0f,BTCUSD,2026-05-26T16:06:58Z,precision_arming,core,41,,1.0,2.0,,,,,,,76362.24,2026-05-26T16:06:25Z,33,,,rule,"Bias(4H→1H)=short (+15.0); Regime filter inaktív; 5M BOS trendirányba (+16.0); ATR erősség 2.84× küszöb (+22.0); Intraday range alsó harmada telített (−7.0); Range expanzió támogatja a momentumot (+3.0); Order flow neutrális (−4.8); P-Score reduced by 4.0 due to regime CHOPPY; Mesterlövész mód: P-score minimum 35 érvényesítve; Regime kapu: CHOPPY miatt −10 P-score, pozícióskálázás csökkentve; Strukturális kapu lazítva: momentum erős, BOS hiány engedve; Likviditási kapu lazítva erős momentum miatt; BTC ATR1h stop igazítás: kockázat ×1.15; Precision trigger kész → limit figyelés; Precision limit belépő parkolva 20 percig",,,,,,,
