journal_id,asset,analysis_timestamp,signal,mode,probability,model_probability,realtime_confidence,leverage,entry_price,stop_loss,take_profit_1,take_profit_2,risk_reward,initial_risk_abs,spot_price,spot_timestamp,spot_latency_seconds,precision_score,anchor_bias,probability_source,notes,validation_outcome,validation_rr,max_favorable_excursion,max_adverse_excursion,time_to_outcome_minutes,slippage,execution_latency_ms
56ab9b15-834e-41dc-939f-88329aaf5f07,EURUSD,2026-04-20T06:51:47Z,precision_arming,core,41,,0.9999999999999999,30.0,,,,,,,1.17618,2026-04-20T06:51:21Z,26,,,rule,"Mean reversion bias override (+19.5); Regime filter inaktív; ATR erősség 1.29× küszöb (+12.7); Alacsony realised vol → magasabb RR igény; Ár az intraday range felső zónájában (+4.0); Fib zóna konfluencia (0.618–0.886) (+18.0); Order flow neutrális (−3.9); P-Score reduced by 4.0 due to regime CHOPPY; EURUSD BOS aktív, de VWAP felett — várakozás; ATR-floor override: rel_atr 0.0003 < 0.0006 → adaptív RR/TP küszöb; Regime kapu: CHOPPY miatt −10 P-score, pozícióskálázás csökkentve; Strukturális soft gate: 1/3 jel + ATR/spread OK (−6 P-score, size ×0.70); Strukturális kapu lazítva: momentum erős, BOS hiány engedve; Liquidity gate skipped (no volume proxy available); EURUSD stop lazítás: ATR1h alapú kockázat ×0.69; Precision trigger kész → limit figyelés; Precision limit belépő parkolva 12 percig",,,,,,,
acf9b36c-0105-4906-82fb-967151b2ee7a,GOLD_CFD,2026-04-20T06:51:47Z,no entry,core,2,,0.9999999999999999,20.0,,,,,,,4787.85603,2026-04-20T06:51:21Z,26,,,rule,"Intraday bias gate feltételek hiányosak — 5m retest long  ATR: 5m retest long, ATR gate | 5m retest short  ATR: 5m retest short, ATR gate; Bias neutrálsávban; Regime filter inaktív; ATR nincs rendben (relatív vagy abszolút küszöb); Alacsony realised vol → magasabb RR igény; Fib zóna konfluencia (0.618–0.886) (+18.0); Order flow neutrális (−4.2); ATR-floor override: rel_atr 0.0008 < 0.0025 → adaptív RR/TP küszöb; Regime kapu: CHOPPY miatt −10 P-score, pozícióskálázás csökkentve; ATR soft gate: alacsony volatilitás −5 P-score, méret felezve; Liquidity gate skipped (no volume proxy available); missing: P_score>=30",,,,,,,
c73cfa06-f2fb-4468-96c8-8482c150e7d0,XAGUSD,2026-04-20T06:51:47Z,no entry,core,23,,0.9999999999999999,20.0,,,,,,,79.61427,2026-04-20T06:51:21Z,26,,,rule,"Bias(4H→1H)=long (+15.0); Regime filter inaktív; ATR erősség 1.07× küszöb (+11.4); Order flow neutrális (−3.9); XAGUSD: visszafogott ATR — RR cél 1:1.7-re emelve; XAGUSD breakout-védelem: gyors BE + 20% giveback limit expanziós szakaszban; XAG: VWAP alatt — long setup türelmet igényel; Fém irány guard: 5m trend ellentétes a belépési biasszal; Regime kapu: CHOPPY miatt −10 P-score, pozícióskálázás csökkentve; Liquidity gate skipped (no volume proxy available); missing: metal_bias_5m_alignment, P_score>=28",,,,,,,
b78b42f6-4ff7-4559-bbb5-c3b2d7119252,BTCUSD,2026-04-20T06:51:47Z,precision_arming,core,47,,0.9999999999999999,2.0,,,,,,,74735.74,2026-04-20T06:51:21Z,26,,,rule,"Mean reversion bias override (+19.5); Regime filter inaktív; ATR erősség 1.57× küszöb (+14.4); Ár az intraday range felső zónájában (+4.0); Fib zóna konfluencia (0.618–0.886) (+18.0); Order flow neutrális (−4.8); Sell pressure támogatja a setupot (+5); P-Score reduced by 4.0 due to regime CHOPPY; Mesterlövész mód: P-score minimum 35 érvényesítve; OFI z-score -1.66 támogatja az irányt; Regime kapu: CHOPPY miatt −10 P-score, pozícióskálázás csökkentve; Strukturális soft gate: 1/3 jel + ATR/spread OK (−6 P-score, size ×0.70); BTC ATR1h stop igazítás: kockázat ×1.15; TP1 nettó profit ≈ 0.60%; Precision belépő: trigger ablak aktív; Precision limit belépő parkolva 20 percig; missing: tp1_net>=+0.6%",,,,,,,
d1db77aa-35a5-4537-a6b9-86a8fd1f091d,USOIL,2026-04-20T06:51:48Z,no entry,core,31,,1.0,20.0,,,,,,,91.16336,2026-04-20T06:51:21Z,27,,,rule,"Intraday bias gate feltételek hiányosak — USOIL retest long  ATR: 5m retest long, ATR gate | USOIL retest short  ATR: 5m retest short, ATR gate; Bias neutrálsávban; EMA21 slope 1.47× küszöb (+14.8); ATR nincs rendben (relatív vagy abszolút küszöb); Fib zóna konfluencia (0.618–0.886) (+18.0); Order flow neutrális (−3.9); USOIL: parabolikus lendület — RR cél 1:1.4 környékére szűkítve; ATR soft gate: alacsony volatilitás −5 P-score, méret felezve; Liquidity gate skipped (no volume proxy available); missing: P_score>=36",,,,,,,
