journal_id,asset,analysis_timestamp,signal,mode,probability,model_probability,realtime_confidence,leverage,entry_price,stop_loss,take_profit_1,take_profit_2,risk_reward,initial_risk_abs,spot_price,spot_timestamp,spot_latency_seconds,precision_score,anchor_bias,probability_source,notes,validation_outcome,validation_rr,max_favorable_excursion,max_adverse_excursion,time_to_outcome_minutes,slippage,execution_latency_ms
6e534e05-bdfe-4dd1-a8ef-778d73a1f12f,EURUSD,2026-01-27T13:26:03Z,market closed,session_closed,0,,0.9999999999999999,30.0,,,,,,,1.19279,2026-01-27T13:25:37Z,26,,,rule,"Piac nyitva; Bias(4H→1H)=long (+15.0); Regime filter inaktív; HTF sweep ok (+10.0); London–NY overlap profil (-1.0); ATR erősség 2.23× küszöb (+18.4); Alacsony realised vol → magasabb RR igény; Intraday range felső harmada telített (−7.0); Order flow neutrális (−3.2); OFI toxikus long irányra (−4.0); P-Score reduced by 4.0 due to regime CHOPPY; Range guard lazítva: napi sáv teteje, de mikro-range visszahúzódott.; EURUSD: ATR-alapú pozícióskálázás ×0.80 — volatilitás kontroll; EURUSD BOS aktív, de VWAP alatt — türelem; ATR-floor override: rel_atr 0.0005 < 0.0006 → adaptív RR/TP küszöb; Regime kapu: CHOPPY miatt −10 P-score, pozícióskálázás csökkentve; Liquidity gate skipped (no volume proxy available); missing: session, P_score>=38",,,,,,,
a0ec5606-2d1c-485a-9b63-6d660dbeddcf,GOLD_CFD,2026-01-27T13:26:03Z,market closed,session_closed,0,,0.9999999999999999,20.0,,,,,,,5085.64127,2026-01-27T13:25:37Z,26,,,rule,"Piac nyitva; Bias(4H→1H)=long (+15.0); Regime filter inaktív; London–NY overlap profil (-1.0); ATR nincs rendben (relatív vagy abszolút küszöb); Alacsony realised vol → magasabb RR igény; Fib zóna konfluencia (0.618–0.886) (+18.0); Order flow neutrális (−4.5); OFI toxikus long irányra (−4.3); VWAP alatt — GOLD long breakout késleltetve; ATR-floor override: rel_atr 0.0009 < 0.0025 → adaptív RR/TP küszöb; Regime kapu: CHOPPY miatt −10 P-score, pozícióskálázás csökkentve; ATR soft gate: alacsony volatilitás −5 P-score, méret felezve; Liquidity gate skipped (no volume proxy available); missing: session, P_score>=40",,,,,,,
155299dd-0717-4d97-8c39-408a4859983b,XAGUSD,2026-01-27T13:26:03Z,market closed,session_closed,0,,0.9999999999999999,20.0,,,,,,,112.35858,2026-01-27T13:25:37Z,26,,,rule,"Piac nyitva; Bias(4H→1H)=long (+15.0); Regime filter inaktív; 5M BOS trendirányba (+16.0); London–NY overlap profil (-1.0); ATR erősség 1.61× küszöb (+14.7); Intraday range felső harmada telített (−7.0); Range expanzió támogatja a momentumot (+3.0); XAG momentum override — stop tágítva erős trendnél; XAGUSD: momentum override — stop távolság 1.3×ATR-re tágítva; Fib zóna konfluencia (0.618–0.886) (+18.0); Order flow neutrális (−4.5); OFI toxikus long irányra (−3.7); P-Score reduced by 4.0 due to regime CHOPPY; XAGUSD: momentum kitörés — RR cél 1:1.45-re szűkítve; XAG momentum override — pozícióméret csökkentve; XAGUSD: ATR-alapú pozícióskálázás ×0.55; XAG: VWAP alatt — long setup türelmet igényel; Regime kapu: CHOPPY miatt −10 P-score, pozícióskálázás csökkentve; Strukturális soft gate: 1/3 jel + ATR/spread OK (−6 P-score, size ×0.70); Strukturális kapu lazítva: momentum erős, BOS hiány engedve; Liquidity gate skipped (no volume proxy available); missing: session",,,,,,,
0f96c06c-fc3c-4252-96f9-4cf09f06371e,BTCUSD,2026-01-27T13:26:03Z,no entry,core,12,,0.9999999999999999,2.0,,,,,,,87752.3,2026-01-27T13:25:37Z,26,,,rule,"Mean reversion bias override (+19.5); Regime filter inaktív; London–NY overlap profil (-1.0); ATR nincs rendben (relatív vagy abszolút küszöb); Alacsony realised vol → magasabb RR igény; Ár az intraday range alsó zónájában (+4.0); Ár 1h EMA21 zónában (+10.0); Order flow neutrális (−4.9); P-Score reduced by 4.0 due to regime CHOPPY; Mesterlövész mód: P-score minimum 35 érvényesítve; OFI z-score 2.60 támogatja az irányt; ATR-floor override: rel_atr 0.0008 < 0.0012 → adaptív RR/TP küszöb; Regime kapu: CHOPPY miatt −10 P-score, pozícióskálázás csökkentve; ATR soft gate: alacsony volatilitás −5 P-score, méret felezve; Precision limit belépő parkolva 20 percig; missing: P_score>=35",,,,,,,
d0647541-d41d-41c4-96b0-f7d6288d6680,USOIL,2026-01-27T13:26:04Z,market closed,session_closed,0,,1.0,20.0,,,,,,,60.79328,2026-01-27T13:25:37Z,27,,,rule,"Piac nyitva; Bias(4H→1H)=long (+15.0); Regime filter inaktív; 5M BOS trendirányba (+16.0); London–NY overlap profil (-1.0); ATR erősség 1.01× küszöb (+11.1); Range expanzió támogatja a momentumot (+3.0); USOIL: erős momentum — invalid zóna 2.5×ATR(1h)-re tágítva; Fib zóna konfluencia (0.618–0.886) (+18.0); Order flow neutrális (−4.8); P-Score reduced by 4.0 due to regime CHOPPY; USOIL: 1h ATR <1 USD — P-score küszöb emelve a zajos sáv miatt; USOIL: csökkenő volatilitás — RR cél 1:1.5-re igazítva; USOIL: US nyitás — pozícióméret ×0.75; OFI z-score 1.50 támogatja az irányt; Regime kapu: CHOPPY miatt −10 P-score, pozícióskálázás csökkentve; Diagnosztika: k1m: utolsó zárt gyertya 11 perc késésben van; Diagnosztika: k1m: jelzés korlátozva 11 perc késés miatt; Diagnosztika: k5m: utolsó zárt gyertya 11 perc késésben van; missing: session",,,,,,,
