journal_id,asset,analysis_timestamp,signal,mode,probability,model_probability,realtime_confidence,leverage,entry_price,stop_loss,take_profit_1,take_profit_2,risk_reward,initial_risk_abs,spot_price,spot_timestamp,spot_latency_seconds,precision_score,anchor_bias,probability_source,notes,validation_outcome,validation_rr,max_favorable_excursion,max_adverse_excursion,time_to_outcome_minutes,slippage,execution_latency_ms
372dfab7-87a6-425d-930e-a906b62fa620,EURUSD,2026-05-04T00:47:00Z,precision_arming,core,53,,1.0,30.0,,,,,,,1.17257,2026-05-04T00:46:40Z,19,,,rule,"Bias(4H→1H)=long (+15.0); Regime filter inaktív; 5M BOS trendirányba (+16.0); Nyitási illikviditás hatás (-2.0); ATR erősség 1.15× küszöb (+11.9); Alacsony realised vol → magasabb RR igény; Ár az intraday range alsó zónájában (+4.0); Range expanzió támogatja a momentumot (+3.0); Fib zóna konfluencia (0.618–0.886) (+18.0); Order flow neutrális (−4.1); P-Score reduced by 4.0 due to regime CHOPPY; EURUSD: ATR(1h) alacsony — P-score küszöb +6 pontra emelve; EURUSD: Visszafogott ATR — célok szűkítve, kockázat kontroll alatt; EURUSD BOS aktív, de VWAP alatt — türelem; ATR-floor override: rel_atr 0.0002 < 0.0006 → adaptív RR/TP küszöb; Regime kapu: CHOPPY miatt −10 P-score, pozícióskálázás csökkentve; Strukturális soft gate: 1/3 jel + ATR/spread OK (−6 P-score, size ×0.70); Strukturális kapu lazítva: momentum erős, BOS hiány engedve; Liquidity gate skipped (no volume proxy available); EURUSD stop lazítás: ATR1h alapú kockázat ×0.72; Precision trigger kész → limit figyelés; Precision limit belépő parkolva 12 percig",,,,,,,
66b75661-1e58-4135-ab0e-f88e167c2144,XAGUSD,2026-05-04T00:47:00Z,no entry,core,25,,1.0,20.0,,,,,,,75.48524,2026-05-04T00:46:40Z,19,,,rule,"Intraday bias gate feltételek hiányosak — Micro BOS long  ATR (ezüst): 1m micro BOS long | Micro BOS short  ATR (ezüst): 1m micro BOS short; Bias neutrálsávban; Regime filter inaktív; HTF sweep ok (+10.0); Nyitási illikviditás hatás (-2.0); ATR erősség 1.08× küszöb (+11.5); Fib zóna konfluencia (0.618–0.886) (+18.0); Order flow neutrális (−3.7); P-Score reduced by 4.0 due to regime CHOPPY; XAGUSD: visszafogott ATR — RR cél 1:1.7-re emelve; XAGUSD breakout-védelem: gyors BE + 20% giveback limit expanziós szakaszban; XAGUSD: ATR-alapú pozícióskálázás ×0.70; Regime kapu: CHOPPY miatt −10 P-score, pozícióskálázás csökkentve; Strukturális soft gate: 1/3 jel + ATR/spread OK (−6 P-score, size ×0.70); Strukturális kapu lazítva: momentum erős, BOS hiány engedve; Liquidity gate skipped (no volume proxy available); missing: P_score>=28",,,,,,,
9fd692e4-f774-42cc-8dfc-c3156dc7b098,GOLD_CFD,2026-05-04T00:47:00Z,no entry,core,12,,1.0,20.0,,,,,,,4607.79377,2026-05-04T00:46:40Z,19,,,rule,"Bias(4H→1H)=short (+15.0); Regime filter inaktív; 5M BOS trendirányba (+16.0); Nyitási illikviditás hatás (-2.0); ATR nincs rendben (relatív vagy abszolút küszöb); Alacsony realised vol → magasabb RR igény; Range expanzió támogatja a momentumot (+3.0); Order flow neutrális (−3.8); P-Score reduced by 4.0 due to regime CHOPPY; VWAP felett — GOLD short breakout várakozik; ATR-floor override: rel_atr 0.0012 < 0.0025 → adaptív RR/TP küszöb; Regime kapu: CHOPPY miatt −10 P-score, pozícióskálázás csökkentve; ATR soft gate: alacsony volatilitás −5 P-score, méret felezve; Strukturális kapu lazítva: momentum erős, BOS hiány engedve; Liquidity gate skipped (no volume proxy available); missing: P_score>=30",,,,,,,
c3a45dfb-3b26-4978-8099-5c1ce862c49a,BTCUSD,2026-05-04T00:47:00Z,precision_arming,core,52,,1.0,2.0,,,,,,,78434.0,2026-05-04T00:46:40Z,19,,,rule,"Bias(4H→1H)=long (+15.0); Regime filter inaktív; 5M BOS trendirányba (+16.0); Nyitási illikviditás hatás (-2.0); ATR erősség 1.52× küszöb (+14.1); Ár az intraday range alsó zónájában (+4.0); Range expanzió támogatja a momentumot (+3.0); Ár 1h EMA21 zónában (+10.0); Order flow neutrális (−3.7); Buy pressure támogatja a setupot (+5); P-Score reduced by 4.0 due to regime CHOPPY; Mesterlövész mód: P-score minimum 35 érvényesítve; OFI z-score 1.91 támogatja az irányt; Regime kapu: CHOPPY miatt −10 P-score, pozícióskálázás csökkentve; Strukturális soft gate: 1/3 jel + ATR/spread OK (−6 P-score, size ×0.70); Likviditási kapu lazítva erős momentum miatt; BTC ATR1h stop igazítás: kockázat ×1.15; Precision trigger kész → limit figyelés; Precision limit belépő parkolva 20 percig",,,,,,,
3ae7b6d6-df52-4700-b175-a5821dd6f48e,USOIL,2026-05-04T00:47:00Z,precision_arming,core,43,,1.0,20.0,,,,,,,103.60223,2026-05-04T00:46:40Z,20,,,rule,"Bias(4H→1H)=long (+15.0); EMA21 slope 1.34× küszöb (+14.0); Nyitási illikviditás hatás (-2.0); ATR nincs rendben (relatív vagy abszolút küszöb); Fib zóna konfluencia (0.618–0.886) (+18.0); Order flow neutrális (−4.4); USOIL: parabolikus lendület — RR cél 1:1.4 környékére szűkítve; USOIL: ázsiai sáv — pozícióméret ×0.70; USOIL: oldalazó szerkezet — H1/M5 BOS nélkül nincs belépő; ATR soft gate: alacsony volatilitás −5 P-score, méret felezve; Liquidity gate skipped (no volume proxy available); USOIL stop lazítás: ATR1h alapú kockázat ×0.92; Precision trigger kész → limit figyelés; Precision limit belépő parkolva 12 percig",,,,,,,
