journal_id,asset,analysis_timestamp,signal,mode,probability,model_probability,realtime_confidence,leverage,entry_price,stop_loss,take_profit_1,take_profit_2,risk_reward,initial_risk_abs,spot_price,spot_timestamp,spot_latency_seconds,precision_score,anchor_bias,probability_source,notes,validation_outcome,validation_rr,max_favorable_excursion,max_adverse_excursion,time_to_outcome_minutes,slippage,execution_latency_ms
2646a760-d6da-40b8-aa74-013d2e8a9f93,NVDA,2026-04-29T17:04:46Z,no entry,core,8,,1.0,5.0,,,,,,,209.05,2026-04-29T17:04:13Z,33,,,rule,"Bias(4H→1H)=long (+15.0); Regime filter inaktív; ATR nincs rendben (relatív vagy abszolút küszöb); WARNING: No Liquidity Structure (Nearest: 197.113756, Dist: 22.92ATR); Ár az intraday range alsó zónájában (+4.0); Ár 1h EMA21 zónában (+10.0); Order flow neutrális (−4.5); P-Score reduced by 4.0 due to regime CHOPPY; Regime kapu: CHOPPY miatt −10 P-score, pozícióskálázás csökkentve; ATR soft gate: alacsony volatilitás −5 P-score, méret felezve; missing: P_score>=38",,,,,,,
056d376f-7beb-4ef9-a7dd-7e583f9a0684,EURUSD,2026-04-29T17:04:46Z,precision_arming,momentum,23,,1.0,30.0,,,,,,,1.16831,2026-04-29T17:04:13Z,33,,,rule,"Bias override: Intraday Micro BOS short  ATR rendben (+19.5); Regime filter inaktív; 5M BOS trendirányba (+16.0); ATR erősség 1.33× küszöb (+13.0); Alacsony realised vol → magasabb RR igény; Intraday range alsó harmada telített (−7.0); Range expanzió támogatja a momentumot (+3.0); Order flow neutrális (−4.2); P-Score reduced by 4.0 due to regime CHOPPY; EURUSD: ATR(1h) alacsony — P-score küszöb +6 pontra emelve; Intraday P-score lazítás: micro-bias short elsőbbséget kap (−2.2); EURUSD: Visszafogott ATR — célok szűkítve, kockázat kontroll alatt; EURUSD BOS aktív, de VWAP felett — várakozás; ATR-floor override: rel_atr 0.0003 < 0.0006 → adaptív RR/TP küszöb; Regime kapu: CHOPPY miatt −10 P-score, pozícióskálázás csökkentve; Strukturális kapu lazítva: momentum erős, BOS hiány engedve; Liquidity gate skipped (no volume proxy available); Momentum soft gate: regime, liquidity, order_flow, order_flow_pressure, ofi (−14.0 P, size ×0.58); EURUSD stop lazítás: ATR1h alapú kockázat ×1.19; Precision trigger kész → limit figyelés; Precision limit belépő parkolva 12 percig",,,,,,,
a358354c-b61a-482d-89c0-569a4aa72fdd,GOLD_CFD,2026-04-29T17:04:46Z,precision_arming,core,31,,1.0,20.0,,,,,,,4545.25217,2026-04-29T17:04:13Z,33,,,rule,"Bias(4H→1H)=short (+15.0); Regime filter inaktív; 5M BOS trendirányba (+16.0); ATR nincs rendben (relatív vagy abszolút küszöb); Alacsony realised vol → magasabb RR igény; Range expanzió támogatja a momentumot (+3.0); Fib zóna konfluencia (0.618–0.886) (+18.0); Order flow neutrális (−4.9); P-Score reduced by 4.0 due to regime CHOPPY; ATR-floor override: rel_atr 0.0012 < 0.0025 → adaptív RR/TP küszöb; Regime kapu: CHOPPY miatt −10 P-score, pozícióskálázás csökkentve; ATR soft gate: alacsony volatilitás −5 P-score, méret felezve; Strukturális kapu lazítva: momentum erős, BOS hiány engedve; Liquidity gate skipped (no volume proxy available); GOLD stop lazítás: ATR1h alapú kockázat ×1.09; Precision trigger kész → limit figyelés; Precision limit belépő parkolva 12 percig",,,,,,,
3bc7a906-2c0c-4dd2-81ea-9df5a69e86dd,XAGUSD,2026-04-29T17:04:46Z,precision_arming,core,46,,1.0,20.0,,,,,,,71.45737,2026-04-29T17:04:13Z,33,,,rule,"Bias(4H→1H)=short (+15.0); Regime filter inaktív; 5M BOS trendirányba (+16.0); ATR erősség 0.87× küszöb (+10.2); Intraday range alsó harmada telített (−7.0); Range expanzió támogatja a momentumot (+3.0); XAG momentum override — stop tágítva erős trendnél; XAGUSD: momentum override — stop távolság 1.3×ATR-re tágítva; Fib zóna konfluencia (0.618–0.886) (+18.0); Order flow neutrális (−4.8); P-Score reduced by 5.0 due to ATR Soft Gate tolerance; XAGUSD: momentum kitörés — RR cél 1:1.45-re szűkítve; XAGUSD breakout-védelem: gyors BE + 20% giveback limit expanziós szakaszban; XAG momentum override — pozícióméret csökkentve; XAG: VWAP felett — short setup türelmet igényel; OFI z-score -1.31 támogatja az irányt; ATR-floor override: rel_atr 0.0016 < 0.0018 → adaptív RR/TP küszöb; Regime kapu: CHOPPY miatt −10 P-score, pozícióskálázás csökkentve; Liquidity gate skipped (no volume proxy available); XAG stop lazítás: ATR1h alapú kockázat ×1.09; Precision trigger kész → limit figyelés; Precision limit belépő parkolva 12 percig",,,,,,,
52da32ef-cbc0-4203-a3f6-dea03510793f,USOIL,2026-04-29T17:04:46Z,precision_arming,core,64,,1.0,20.0,,,,,,,109.80045,2026-04-29T17:04:13Z,33,,,rule,Bias(4H→1H)=long (+15.0); EMA21 slope 1.53× küszöb (+15.2); 5M BOS trendirányba (+16.0); ATR erősség 1.01× küszöb (+11.1); Intraday range felső harmada telített (−7.0); Range expanzió támogatja a momentumot (+3.0); USOIL: erős momentum — invalid zóna 2.5×ATR(1h)-re tágítva; Order flow neutrális (−4.2); Intraday P-score lazítás: micro-bias long elsőbbséget kap (−1.5); Mesterlövész mód: P-score minimum 35 érvényesítve; USOIL: parabolikus lendület — RR cél 1:1.4 környékére szűkítve; OFI z-score 1.52 támogatja az irányt; Liquidity gate skipped (no volume proxy available); Precision trigger kész → limit figyelés; Precision limit belépő parkolva 12 percig; Diagnosztika: k5m: utolsó zárt gyertya 9 perc késésben van; Diagnosztika: k1h: utolsó zárt gyertya 64 perc késésben van; Diagnosztika: k4h: utolsó zárt gyertya 244 perc késésben van,,,,,,,
059d529f-930c-414a-9437-6e6260e25b7a,BTCUSD,2026-04-29T17:04:46Z,precision_arming,core,58,,1.0,2.0,,,,,,,75954.05,2026-04-29T17:04:13Z,33,,,rule,"Bias override: Intraday 5m BOS long  ATR (+19.5); Regime filter inaktív; 5M BOS trendirányba (+16.0); ATR erősség 2.06× küszöb (+17.4); Ár az intraday range alsó zónájában (+4.0); Range expanzió támogatja a momentumot (+3.0); Order flow neutrális (−4.4); Buy pressure támogatja a setupot (+5); P-Score reduced by 4.0 due to regime CHOPPY; Mesterlövész mód: P-score minimum 35 érvényesítve; Regime kapu: CHOPPY miatt −10 P-score, pozícióskálázás csökkentve; Strukturális kapu lazítva: momentum erős, BOS hiány engedve; Likviditási kapu lazítva erős momentum miatt; BTC ATR1h stop igazítás: kockázat ×1.15; Precision trigger kész → limit figyelés; Precision limit belépő parkolva 20 percig",,,,,,,
