journal_id,asset,analysis_timestamp,signal,mode,probability,model_probability,realtime_confidence,leverage,entry_price,stop_loss,take_profit_1,take_profit_2,risk_reward,initial_risk_abs,spot_price,spot_timestamp,spot_latency_seconds,precision_score,anchor_bias,probability_source,notes,validation_outcome,validation_rr,max_favorable_excursion,max_adverse_excursion,time_to_outcome_minutes,slippage,execution_latency_ms
ff8c483e-67dc-41a6-bd8d-4fdafd69e15f,GOLD_CFD,2026-05-18T15:47:08Z,no entry,core,23,,1.0,20.0,,,,,,,4539.6166,2026-05-18T15:46:35Z,33,,,rule,"Bias(4H→1H)=short (+15.0); Regime filter inaktív; 5M BOS trendirányba (+16.0); London–NY overlap profil (-1.0); ATR nincs rendben (relatív vagy abszolút küszöb); Intraday range alsó harmada telített (−7.0); Range expanzió támogatja a momentumot (+3.0); Fib zóna konfluencia (0.618–0.886) (+18.0); Order flow neutrális (−4.6); P-Score reduced by 4.0 due to regime CHOPPY; VWAP felett — GOLD short breakout várakozik; OFI z-score -1.20 támogatja az irányt; ATR-floor override: rel_atr 0.0014 < 0.0025 → adaptív RR/TP küszöb; Regime kapu: CHOPPY miatt −10 P-score, pozícióskálázás csökkentve; ATR soft gate: alacsony volatilitás −5 P-score, méret felezve; Liquidity gate skipped (no volume proxy available); missing: P_score>=30",,,,,,,
c6d3be7d-30ac-4dc8-af01-2aed0dcebb6c,EURUSD,2026-05-18T15:47:08Z,no entry,core,19,,1.0,30.0,,,,,,,1.16473,2026-05-18T15:46:35Z,33,,,rule,"Intraday bias gate feltételek hiányosak — Micro BOS long  ATR rendben: 1m micro BOS long | Micro BOS short  ATR rendben: 1m micro BOS short; Bias neutrálsávban; Regime filter inaktív; London–NY overlap profil (-1.0); ATR erősség 1.75× küszöb (+15.5); Alacsony realised vol → magasabb RR igény; Fib zóna konfluencia (0.618–0.886) (+18.0); Order flow neutrális (−4.6); P-Score reduced by 4.0 due to regime CHOPPY; EURUSD: ATR(1h) alacsony — P-score küszöb +6 pontra emelve; EURUSD: Visszafogott ATR — célok szűkítve, kockázat kontroll alatt; ATR-floor override: rel_atr 0.0003 < 0.0006 → adaptív RR/TP küszöb; Regime kapu: CHOPPY miatt −10 P-score, pozícióskálázás csökkentve; Strukturális soft gate: 1/3 jel + ATR/spread OK (−6 P-score, size ×0.70); Strukturális kapu lazítva: momentum erős, BOS hiány engedve; Liquidity gate skipped (no volume proxy available); missing: P_score>=44",,,,,,,
27a4eebb-647d-4ea4-a87f-d8488cc4ee11,XAGUSD,2026-05-18T15:47:08Z,no entry,core,17,,1.0,20.0,,,,,,,76.65962,2026-05-18T15:46:35Z,33,,,rule,"Intraday bias gate feltételek hiányosak — Micro BOS long  ATR (ezüst): 1m micro BOS long | Micro BOS short  ATR (ezüst): 1m micro BOS short; Bias neutrálsávban; Regime filter inaktív; London–NY overlap profil (-1.0); ATR erősség 1.36× küszöb (+13.2); Fib zóna konfluencia (0.618–0.886) (+18.0); Order flow neutrális (−4.6); P-Score reduced by 4.0 due to regime CHOPPY; XAGUSD breakout-védelem: gyors BE + 20% giveback limit expanziós szakaszban; XAGUSD: ATR-alapú pozícióskálázás ×0.70; Regime kapu: CHOPPY miatt −10 P-score, pozícióskálázás csökkentve; Strukturális soft gate: 1/3 jel + ATR/spread OK (−6 P-score, size ×0.70); Strukturális kapu lazítva: momentum erős, BOS hiány engedve; Liquidity gate skipped (no volume proxy available); missing: P_score>=28",,,,,,,
ab4656e5-f41e-4e0a-a863-de12416e3d2b,NVDA,2026-05-18T15:47:08Z,precision_arming,core,46,,1.0,5.0,,,,,,,222.265,2026-05-18T15:46:35Z,33,,,rule,"Bias override: Intraday 5m BOS short  ATR (momentum nélkül) (+19.5); Regime filter inaktív; 5M BOS trendirányba (+16.0); London–NY overlap profil (-1.0); ATR erősség 1.18× küszöb (+12.1); WARNING: No Liquidity Structure (Nearest: 184.866953, Dist: 32.40ATR); Range expanzió támogatja a momentumot (+3.0); Order flow neutrális (−4.0); NVDA: magas napi ATR + momentum — P-score küszöb lazítva; Mesterlövész mód: P-score minimum 35 érvényesítve; NVDA momentum override — napi ATR támogatja a likviditási lazítást; OFI z-score -2.07 támogatja az irányt; Regime kapu: CHOPPY miatt −10 P-score, pozícióskálázás csökkentve; Likviditási kapu lazítva erős momentum miatt; NVDA ATR1h stop igazítás: kockázat ×1.04; Precision trigger kész → limit figyelés; Precision limit belépő parkolva 12 percig",,,,,,,
5dd5c300-a8de-41fb-af9e-34aebe550a4d,USOIL,2026-05-18T15:47:08Z,no entry,core_only,58,,1.0,20.0,103.063246,99.066075448,111.057587104,115.054757656,3.0,,103.063246,2026-05-18T15:46:35Z,33,,,rule,"Bias(4H→1H)=long (+15.0); Regime filter inaktív; 5M BOS trendirányba (+16.0); London–NY overlap profil (-1.0); ATR erősség 2.33× küszöb (+19.0); Range expanzió támogatja a momentumot (+3.0); USOIL: erős momentum — invalid zóna 2.5×ATR(1h)-re tágítva; Fib zóna konfluencia (0.618–0.886) (+18.0); Order flow neutrális (−3.2); P-Score reduced by 4.0 due to regime CHOPPY; USOIL: parabolikus lendület — RR cél 1:1.4 környékére szűkítve; USOIL: oldalazó szerkezet — H1/M5 BOS nélkül nincs belépő; Regime kapu: CHOPPY miatt −10 P-score, pozícióskálázás csökkentve; Strukturális soft gate: 1/3 jel + ATR/spread OK (−6 P-score, size ×0.70); Strukturális kapu lazítva: momentum erős, BOS hiány engedve; USOIL stop lazítás: ATR1h alapú kockázat ×0.97; Diagnosztika: k1m: utolsó zárt gyertya 11 perc késésben van; Diagnosztika: k1m: jelzés korlátozva 11 perc késés miatt; Diagnosztika: k5m: utolsó zárt gyertya 12 perc késésben van",,,,,,,
3e449a48-3f1c-446d-ac14-668c043bf3b6,BTCUSD,2026-05-18T15:47:08Z,no entry,core,24,,1.0,2.0,,,,,,,76263.3,2026-05-18T15:46:35Z,33,,,rule,"Intraday bias gate feltételek hiányosak — Crypto momentum long: 1m micro BOS long, Momentum volume ráta | Crypto momentum short: 1m micro BOS short | 5m BOS long  ATR: 5m BOS long | 5m BOS short  ATR: 5m BOS short | Micro BOS short  ATR (momentum nélkül): 1m micro BOS short; Bias neutrálsávban; Regime filter inaktív; HTF sweep ok (+10.0); London–NY overlap profil (-1.0); ATR erősség 2.50× küszöb (+20.0); Range expanzió támogatja a momentumot (+3.0); Order flow neutrális (−4.8); P-Score reduced by 4.0 due to regime CHOPPY; Mesterlövész mód: P-score minimum 35 érvényesítve; Regime kapu: CHOPPY miatt −10 P-score, pozícióskálázás csökkentve; Strukturális kapu lazítva: momentum erős, BOS hiány engedve; Likviditási kapu lazítva erős momentum miatt; missing: P_score>=35",,,,,,,
