journal_id,asset,analysis_timestamp,signal,mode,probability,model_probability,realtime_confidence,leverage,entry_price,stop_loss,take_profit_1,take_profit_2,risk_reward,initial_risk_abs,spot_price,spot_timestamp,spot_latency_seconds,precision_score,anchor_bias,probability_source,notes,validation_outcome,validation_rr,max_favorable_excursion,max_adverse_excursion,time_to_outcome_minutes,slippage,execution_latency_ms
9001ff0c-6105-49b8-86bf-ba97c80d7f36,EURUSD,2026-03-13T15:55:30Z,no entry,core,35,,1.0,30.0,,,,,,,1.14407,2026-03-13T15:54:49Z,40,,,rule,"Mean reversion bias override (+19.5); Regime filter inaktív; London–NY overlap profil (-1.0); ATR erősség 2.19× küszöb (+18.1); Alacsony realised vol → magasabb RR igény; Ár az intraday range alsó zónájában (+4.0); Order flow neutrális (−2.4); P-Score reduced by 4.0 due to regime CHOPPY; EURUSD: ATR-alapú pozícióskálázás ×0.72 — volatilitás kontroll; EURUSD BOS aktív, de VWAP alatt — türelem; ATR-floor override: rel_atr 0.0005 < 0.0006 → adaptív RR/TP küszöb; Regime kapu: CHOPPY miatt −10 P-score, pozícióskálázás csökkentve; Liquidity gate skipped (no volume proxy available); missing: P_score>=38",,,,,,,
9e2e8514-7390-47b0-b265-37ff95a86673,NVDA,2026-03-13T15:55:30Z,no entry,core,2,,1.0,5.0,,,,,,,181.115,2026-03-13T15:54:49Z,40,,,rule,"Mean reversion bias override (+19.5); Regime filter inaktív; London–NY overlap profil (-1.0); ATR nincs rendben (relatív vagy abszolút küszöb); WARNING: No Liquidity Structure (Nearest: 184.943727, Dist: 7.07ATR); Ár az intraday range alsó zónájában (+4.0); Order flow neutrális (−4.3); P-Score reduced by 4.0 due to regime CHOPPY; Regime kapu: CHOPPY miatt −10 P-score, pozícióskálázás csökkentve; ATR soft gate: alacsony volatilitás −5 P-score, méret felezve; missing: P_score>=38, precision_flow_alignment",,,,,,,
8fea6515-9cd0-4324-8e22-3d2a08811ad6,GOLD_CFD,2026-03-13T15:55:30Z,no entry,core,0,,1.0,20.0,,,,,,,5043.84176,2026-03-13T15:54:49Z,40,,,rule,"Intraday bias gate feltételek hiányosak — 5m retest long  ATR: 5m retest long, ATR gate | 5m retest short  ATR: 5m retest short, ATR gate; Bias neutrálsávban; Regime filter inaktív; London–NY overlap profil (-1.0); ATR nincs rendben (relatív vagy abszolút küszöb); Range expanzió támogatja a momentumot (+3.0); Order flow neutrális (−3.7); P-Score reduced by 4.0 due to regime CHOPPY; Regime kapu: CHOPPY miatt −10 P-score, pozícióskálázás csökkentve; ATR soft gate: alacsony volatilitás −5 P-score, méret felezve; Strukturális kapu lazítva: momentum erős, BOS hiány engedve; Liquidity gate skipped (no volume proxy available); missing: P_score>=30",,,,,,,
2f33893d-18e5-4080-8617-ed844e290d8d,BTCUSD,2026-03-13T15:55:30Z,precision_arming,core,100,,1.0,2.0,,,,,,,71976.01,2026-03-13T15:54:49Z,41,,,rule,"Bias override: Intraday 5m BOS short  ATR (+19.5); EMA21 slope 1.05× küszöb (+12.3); HTF sweep ok (+10.0); 5M BOS trendirányba (+16.0); London–NY overlap profil (-1.0); ATR erősség 2.06× küszöb (+17.3); Range expanzió támogatja a momentumot (+3.0); Fib zóna konfluencia (0.618–0.886) (+18.0); Order flow neutrális (−4.8); Sell pressure támogatja a setupot (+5); Mesterlövész mód: P-score minimum 35 érvényesítve; Strukturális kapu lazítva: momentum erős, BOS hiány engedve; BTC ATR1h stop igazítás: kockázat ×1.15; Precision trigger kész → limit figyelés; Precision limit belépő parkolva 20 percig",,,,,,,
57200f14-b750-4049-b7ad-92e4e17d512c,USOIL,2026-03-13T15:55:30Z,no entry,core_only,41,,1.0,20.0,96.58983,94.12136686800001,100.5393710112,102.5141415168,2.4,,96.58983,2026-03-13T15:54:49Z,41,,,rule,"Bias(4H→1H)=long (+15.0); Regime filter inaktív; 5M BOS trendirányba (+16.0); London–NY overlap profil (-1.0); ATR erősség 0.85× küszöb (+10.1); Range expanzió támogatja a momentumot (+3.0); USOIL: erős momentum — invalid zóna 2.5×ATR(1h)-re tágítva; Ár 1h EMA21 zónában (+10.0); Order flow neutrális (−3.5); P-Score reduced by 4.0 due to regime CHOPPY; P-Score reduced by 5.9 due to ATR Soft Gate tolerance; USOIL: parabolikus lendület — RR cél 1:1.4 környékére szűkítve; Regime kapu: CHOPPY miatt −10 P-score, pozícióskálázás csökkentve; USOIL stop lazítás: ATR1h alapú kockázat ×0.97; Diagnosztika: k1m: utolsó zárt gyertya 10 perc késésben van; Diagnosztika: k1m: jelzés korlátozva 10 perc késés miatt; Diagnosztika: k5m: utolsó zárt gyertya 10 perc késésben van",,,,,,,
