journal_id,asset,analysis_timestamp,signal,mode,probability,model_probability,realtime_confidence,leverage,entry_price,stop_loss,take_profit_1,take_profit_2,risk_reward,initial_risk_abs,spot_price,spot_timestamp,spot_latency_seconds,precision_score,anchor_bias,probability_source,notes,validation_outcome,validation_rr,max_favorable_excursion,max_adverse_excursion,time_to_outcome_minutes,slippage,execution_latency_ms
10a1c06f-7bc3-4def-a54a-6e280fdc1ed4,XAGUSD,2026-02-25T00:00:58Z,precision_arming,core,40,,1.0,20.0,,,,,,,87.26246,2026-02-25T00:00:39Z,18,,,rule,"Bias(4H→1H)=long (+15.0); Regime filter inaktív; 5M BOS trendirányba (+16.0); Nyitási illikviditás hatás (-2.0); ATR erősség 0.96× küszöb (+10.8); Range expanzió támogatja a momentumot (+3.0); XAG momentum override — stop tágítva erős trendnél; XAGUSD: momentum override — stop távolság 1.3×ATR-re tágítva; Fib zóna konfluencia (0.618–0.886) (+18.0); Order flow neutrális (−4.8); OFI toxikus long irányra (−5.5); P-Score reduced by 4.0 due to regime CHOPPY; P-Score reduced by 1.6 due to ATR Soft Gate tolerance; XAGUSD: momentum kitörés — RR cél 1:1.45-re szűkítve; XAGUSD breakout-védelem: gyors BE + 20% giveback limit expanziós szakaszban; XAG momentum override — pozícióméret csökkentve; XAGUSD: ATR-alapú pozícióskálázás ×0.55; XAG: VWAP alatt — long setup türelmet igényel; Regime kapu: CHOPPY miatt −10 P-score, pozícióskálázás csökkentve; Strukturális soft gate: 1/3 jel + ATR/spread OK (−6 P-score, size ×0.70); Strukturális kapu lazítva: momentum erős, BOS hiány engedve; Liquidity gate skipped (no volume proxy available); XAG stop lazítás: ATR1h alapú kockázat ×1.09; Precision trigger kész → limit figyelés; Precision limit belépő parkolva 12 percig",,,,,,,
54611ed3-5704-46db-9bd9-fe16234de748,EURUSD,2026-02-25T00:00:58Z,no entry,core,33,,1.0,30.0,,,,,,,1.1774,2026-02-25T00:00:39Z,18,,,rule,"Bias(4H→1H)=short (+15.0); Regime filter inaktív; 5M BOS trendirányba (+16.0); Nyitási illikviditás hatás (-2.0); ATR nincs rendben (relatív vagy abszolút küszöb); Alacsony realised vol → magasabb RR igény; Range expanzió támogatja a momentumot (+3.0); Fib zóna konfluencia (0.618–0.886) (+18.0); Order flow neutrális (−4.8); EURUSD: ATR(1h) alacsony — P-score küszöb +6 pontra emelve; EURUSD: Visszafogott ATR — célok szűkítve, kockázat kontroll alatt; EURUSD BOS aktív, de VWAP felett — várakozás; OFI z-score -1.06 támogatja az irányt; ATR-floor override: rel_atr 0.0001 < 0.0006 → adaptív RR/TP küszöb; Regime kapu: CHOPPY miatt −10 P-score, pozícióskálázás csökkentve; ATR soft gate: alacsony volatilitás −5 P-score, méret felezve; Liquidity gate skipped (no volume proxy available); missing: P_score>=44, precision_score>=55",,,,,,,
808fe814-8c8e-4fa0-91ed-7ab495c202ff,GOLD_CFD,2026-02-25T00:00:58Z,no entry,core,23,,1.0,20.0,,,,,,,5147.41723,2026-02-25T00:00:38Z,19,,,rule,"Bias(4H→1H)=long (+15.0); Regime filter inaktív; 5M BOS trendirányba (+16.0); Nyitási illikviditás hatás (-2.0); ATR nincs rendben (relatív vagy abszolút küszöb); Alacsony realised vol → magasabb RR igény; Range expanzió támogatja a momentumot (+3.0); Fib zóna konfluencia (0.618–0.886) (+18.0); Order flow neutrális (−4.6); OFI toxikus long irányra (−6.2); P-Score reduced by 4.0 due to regime CHOPPY; VWAP alatt — GOLD long breakout késleltetve; ATR-floor override: rel_atr 0.0012 < 0.0025 → adaptív RR/TP küszöb; Regime kapu: CHOPPY miatt −10 P-score, pozícióskálázás csökkentve; ATR soft gate: alacsony volatilitás −5 P-score, méret felezve; Strukturális kapu lazítva: momentum erős, BOS hiány engedve; Liquidity gate skipped (no volume proxy available); missing: P_score>=30",,,,,,,
7a1a45d7-78e1-4d05-846e-cf3f5d89b93f,BTCUSD,2026-02-25T00:00:58Z,no entry,core,0,,1.0,2.0,,,,,,,64068.33,2026-02-25T00:00:38Z,19,,,rule,"Intraday bias gate feltételek hiányosak — Crypto momentum long: 1m micro BOS long, Momentum volume ráta, ATR gate | Crypto momentum short: 1m micro BOS short, Momentum volume ráta, ATR gate | 5m BOS long  ATR: 5m BOS long, ATR gate | 5m BOS short  ATR: ATR gate | Micro BOS short  ATR (momentum nélkül): 1m micro BOS short, ATR gate; Bias neutrálsávban; Regime filter inaktív; Nyitási illikviditás hatás (-2.0); ATR nincs rendben (relatív vagy abszolút küszöb); Fib zóna konfluencia (0.618–0.886) (+18.0); Order flow neutrális (−4.2); Mesterlövész mód: P-score minimum 35 érvényesítve; Regime kapu: CHOPPY miatt −10 P-score, pozícióskálázás csökkentve; ATR soft gate: alacsony volatilitás −5 P-score, méret felezve; missing: P_score>=35",,,,,,,
2f5e38f2-6e54-4757-abe0-efef45f771ed,USOIL,2026-02-25T00:00:58Z,no entry,core,22,,1.0,20.0,,,,,,,65.98389,2026-02-25T00:00:38Z,20,,,rule,"Bias(4H→1H)=long (+15.0); Regime filter inaktív; 5M BOS trendirányba (+16.0); Nyitási illikviditás hatás (-2.0); ATR nincs rendben (relatív vagy abszolút küszöb); Range expanzió támogatja a momentumot (+3.0); USOIL: erős momentum — invalid zóna 2.5×ATR(1h)-re tágítva; Ár 1h EMA21 zónában (+10.0); Order flow neutrális (−4.2); P-Score reduced by 4.0 due to regime CHOPPY; USOIL: 1h ATR <1 USD — P-score küszöb emelve a zajos sáv miatt; USOIL: csökkenő volatilitás — RR cél 1:1.5-re igazítva; USOIL: ázsiai sáv — pozícióméret ×0.70; USOIL: oldalazó szerkezet — 1h BOS nélkül nincs belépő; Regime kapu: CHOPPY miatt −10 P-score, pozícióskálázás csökkentve; ATR soft gate: alacsony volatilitás −5 P-score, méret felezve; Strukturális kapu lazítva: momentum erős, BOS hiány engedve; Liquidity gate skipped (no volume proxy available); missing: P_score>=42",,,,,,,
