journal_id,asset,analysis_timestamp,signal,mode,probability,model_probability,realtime_confidence,leverage,entry_price,stop_loss,take_profit_1,take_profit_2,risk_reward,initial_risk_abs,spot_price,spot_timestamp,spot_latency_seconds,precision_score,anchor_bias,probability_source,notes,validation_outcome,validation_rr,max_favorable_excursion,max_adverse_excursion,time_to_outcome_minutes,slippage,execution_latency_ms
75b2b358-e31f-44e3-b431-7e0ed3861cc9,EURUSD,2026-01-12T01:16:01Z,no entry,core,39,,1.0,30.0,1.16674,1.1784074000000002,1.1399049799999998,1.1247373599999997,3.6,,1.16674,2026-01-12T01:15:42Z,18,,,rule,"Mean reversion bias override (+19.5); Regime filter inaktív; ATR erősség 6.80× küszöb (+23.0); Alacsony realised vol → magasabb RR igény; Ár az intraday range felső zónájában (+4.0); Order flow neutrális (−4.1); P-Score reduced by 4.0 due to regime CHOPPY; EURUSD: ATR(1h) alacsony — P-score küszöb +6 pontra emelve; EURUSD: Visszafogott ATR — célok szűkítve, kockázat kontroll alatt; ATR-floor override: rel_atr 0.0004 < 0.0006 → adaptív RR/TP küszöb; Regime kapu: CHOPPY miatt −10 P-score, pozícióskálázás csökkentve; Liquidity gate skipped (no volume proxy available); missing: precision_flow_alignment",,,,,,,
cca68d9c-454c-4b20-b91a-61ddd9b3526e,GOLD_CFD,2026-01-12T01:16:01Z,no entry,core,55,,1.0,20.0,4581.94581,4627.7652681,4471.979110560001,4407.831869220001,3.8,,4581.94581,2026-01-12T01:15:42Z,18,,,rule,"Mean reversion bias override (+19.5); Regime filter inaktív; 5M BOS trendirányba (+16.0); ATR erősség 2.17× küszöb (+18.0); Ár az intraday range felső zónájában (+4.0); Range expanzió támogatja a momentumot (+3.0); Order flow neutrális (−2.8); P-Score reduced by 4.0 due to regime CHOPPY; OFI z-score -1.06 támogatja az irányt; ATR-floor override: rel_atr 0.0018 < 0.0025 → adaptív RR/TP küszöb; Regime kapu: CHOPPY miatt −10 P-score, pozícióskálázás csökkentve; Likviditási kapu lazítva erős momentum miatt; Liquidity gate skipped (no volume proxy available); GOLD stop lazítás: ATR alapú kockázat ×2.00; missing: precision_flow_alignment, precision_trigger_sync",,,,,,,
2f183d16-44b2-43eb-89f5-3f4d2109dc86,XAGUSD,2026-01-12T01:16:01Z,no entry,core,50,,1.0,20.0,83.49886,84.3338486,81.57838621999998,80.49290103999998,3.6,,83.49886,2026-01-12T01:15:42Z,18,,,rule,"Mean reversion bias override (+19.5); Regime filter inaktív; HTF sweep ok (+10.0); ATR erősség 83.03× küszöb (+23.0); Ár az intraday range felső zónájában (+4.0); Order flow neutrális (−3.1); P-Score reduced by 4.0 due to regime CHOPPY; XAGUSD: ATR-alapú pozícióskálázás ×0.55; XAG: VWAP felett — short setup türelmet igényel; OFI z-score -1.12 támogatja az irányt; Regime kapu: CHOPPY miatt −10 P-score, pozícióskálázás csökkentve; Liquidity gate skipped (no volume proxy available); missing: precision_flow_alignment",,,,,,,
602d7ab6-4a27-4aa5-9892-852e0f178fbf,BTCUSD,2026-01-12T01:16:01Z,precision_arming,core,47,,1.0,2.0,,,,,,,91399.14,2026-01-12T01:15:42Z,19,,,rule,"Bias override: Intraday 5m BOS long  ATR (+19.5); Regime filter inaktív; 5M BOS trendirányba (+16.0); ATR erősség 3.93× küszöb (+23.0); Intraday range felső harmada telített (−7.0); Range expanzió támogatja a momentumot (+3.0); Order flow neutrális (−4.2); P-Score reduced by 4.0 due to regime CHOPPY; Regime kapu: CHOPPY miatt −10 P-score, pozícióskálázás csökkentve; Strukturális kapu lazítva: momentum erős, BOS hiány engedve; Likviditási kapu lazítva erős momentum miatt; Precision trigger kész → limit figyelés; Precision limit belépő parkolva 20 percig",,,,,,,
ba7e2289-bfd8-4438-aa4d-eb49e9a252bb,USOIL,2026-01-12T01:16:01Z,no entry,core,18,,1.0,20.0,,,,,,,58.92,2026-01-12T01:15:42Z,19,,,rule,"Intraday bias gate feltételek hiányosak — USOIL retest long  ATR: 5m retest long | USOIL retest short  ATR: 5m retest short; Bias neutrálsávban; Regime filter inaktív; ATR erősség 1.44× küszöb (+13.6); Fib zóna konfluencia (0.618–0.886) (+18.0); Order flow neutrális (−4.5); P-Score reduced by 4.0 due to regime CHOPPY; USOIL: 1h ATR <1 USD — P-score küszöb emelve a zajos sáv miatt; USOIL: csökkenő volatilitás — RR cél 1:1.5-re igazítva; USOIL: ázsiai sáv — pozícióméret ×0.70; Regime kapu: CHOPPY miatt −10 P-score, pozícióskálázás csökkentve; Strukturális soft gate: 1/3 jel + ATR/spread OK (−6 P-score, size ×0.70); Strukturális kapu lazítva: momentum erős, BOS hiány engedve; Liquidity gate skipped (no volume proxy available); missing: P_score>=29",,,,,,,
