journal_id,asset,analysis_timestamp,signal,mode,probability,model_probability,realtime_confidence,leverage,entry_price,stop_loss,take_profit_1,take_profit_2,risk_reward,initial_risk_abs,spot_price,spot_timestamp,spot_latency_seconds,precision_score,anchor_bias,probability_source,notes,validation_outcome,validation_rr,max_favorable_excursion,max_adverse_excursion,time_to_outcome_minutes,slippage,execution_latency_ms
08624e3c-02cc-431c-baf3-55afcf507622,XAGUSD,2026-05-14T16:21:08Z,precision_arming,momentum,44,,1.0,20.0,,,,,,,84.96888,2026-05-14T16:20:35Z,32,,,rule,"Bias(4H→1H)=long (+15.0); Regime filter inaktív; 5M BOS trendirányba (+16.0); ATR erősség 0.94× küszöb (+10.7); Ár az intraday range alsó zónájában (+4.0); Range expanzió támogatja a momentumot (+3.0); XAG momentum override — stop tágítva erős trendnél; XAGUSD: momentum override — stop távolság 1.3×ATR-re tágítva; Fib zóna konfluencia (0.618–0.886) (+18.0); Order flow neutrális (−3.5); P-Score reduced by 4.0 due to regime CHOPPY; P-Score reduced by 2.3 due to ATR Soft Gate tolerance; XAGUSD: momentum kitörés — RR cél 1:1.45-re szűkítve; XAGUSD breakout-védelem: gyors BE + 20% giveback limit expanziós szakaszban; XAG momentum override — pozícióméret csökkentve; XAGUSD: ATR-alapú pozícióskálázás ×0.55; XAG: VWAP alatt — long setup türelmet igényel; Fém irány guard: 5m trend ellentétes a belépési biasszal; Regime kapu: CHOPPY miatt −10 P-score, pozícióskálázás csökkentve; Strukturális soft gate: 1/3 jel + ATR/spread OK (−6 P-score, size ×0.70); Strukturális kapu lazítva: momentum erős, BOS hiány engedve; Liquidity gate skipped (no volume proxy available); Momentum soft gate: liquidity, order_flow, order_flow_pressure, ofi (−8.0 P, size ×0.68); XAG stop lazítás: ATR1h alapú kockázat ×1.09; Precision trigger kész → limit figyelés; Precision limit belépő parkolva 12 percig",,,,,,,
d3a7777e-55ab-4bd1-bbba-2288ebc51dae,GOLD_CFD,2026-05-14T16:21:08Z,no entry,core,27,,1.0,20.0,,,,,,,4680.29869,2026-05-14T16:20:35Z,32,,,rule,"Bias(4H→1H)=short (+15.0); Regime filter inaktív; 5M BOS trendirányba (+16.0); ATR nincs rendben (relatív vagy abszolút küszöb); Alacsony realised vol → magasabb RR igény; Range expanzió támogatja a momentumot (+3.0); Fib zóna konfluencia (0.618–0.886) (+18.0); Order flow neutrális (−3.9); OFI toxikus short irányra (−4.8); P-Score reduced by 4.0 due to regime CHOPPY; VWAP felett — GOLD short breakout várakozik; ATR-floor override: rel_atr 0.0007 < 0.0025 → adaptív RR/TP küszöb; Regime kapu: CHOPPY miatt −10 P-score, pozícióskálázás csökkentve; ATR soft gate: alacsony volatilitás −5 P-score, méret felezve; Strukturális kapu lazítva: momentum erős, BOS hiány engedve; Liquidity gate skipped (no volume proxy available); missing: P_score>=30",,,,,,,
db807d77-3b03-4629-b7a2-b249b2bd7777,NVDA,2026-05-14T16:21:08Z,precision_arming,core,47,,1.0,5.0,,,,,,,235.23,2026-05-14T16:20:35Z,32,,,rule,"Bias(4H→1H)=long (+15.0); EMA21 slope 1.19× küszöb (+13.2); HTF sweep ok (+10.0); 5M BOS trendirányba (+16.0); ATR nincs rendben (relatív vagy abszolút küszöb); WARNING: No Liquidity Structure (Nearest: 184.844153, Dist: 68.52ATR); Intraday range felső harmada telített (−7.0); Range expanzió támogatja a momentumot (+3.0); Order flow neutrális (−4.5); NVDA: magas napi ATR + momentum — P-score küszöb lazítva; Mesterlövész mód: P-score minimum 35 érvényesítve; NVDA momentum override — napi ATR támogatja a likviditási lazítást; ATR soft gate: alacsony volatilitás −5 P-score, méret felezve; Likviditási kapu lazítva erős momentum miatt; NVDA ATR1h stop igazítás: kockázat ×1.04; Precision trigger kész → limit figyelés; Precision limit belépő parkolva 12 percig",,,,,,,
91930573-06e1-4b02-a85f-ae14ba6d3a7f,EURUSD,2026-05-14T16:21:08Z,no entry,core,0,,1.0,30.0,,,,,,,1.16792,2026-05-14T16:20:35Z,32,,,rule,"Intraday bias gate feltételek hiányosak — Micro BOS long  ATR rendben: 1m micro BOS long, ATR gate | Micro BOS short  ATR rendben: 1m micro BOS short, ATR gate; Bias neutrálsávban; Regime filter inaktív; ATR nincs rendben (relatív vagy abszolút küszöb); Alacsony realised vol → magasabb RR igény; Order flow neutrális (−4.5); P-Score reduced by 4.0 due to regime CHOPPY; EURUSD: ATR(1h) alacsony — P-score küszöb +6 pontra emelve; EURUSD: Visszafogott ATR — célok szűkítve, kockázat kontroll alatt; ATR-floor override: rel_atr 0.0002 < 0.0006 → adaptív RR/TP küszöb; Regime kapu: CHOPPY miatt −10 P-score, pozícióskálázás csökkentve; ATR soft gate: alacsony volatilitás −5 P-score, méret felezve; Liquidity gate skipped (no volume proxy available); missing: P_score>=44",,,,,,,
515bd1c1-931a-4768-ad59-6541a13d2a1e,USOIL,2026-05-14T16:21:08Z,no entry,core_only,24,,1.0,20.0,,,,,,,100.78446,2026-05-14T16:20:35Z,33,,,rule,"Bias(4H→1H)=long (+15.0); Regime filter inaktív; ATR erősség 0.86× küszöb (+10.2); Fib zóna konfluencia (0.618–0.886) (+18.0); Order flow neutrális (−4.2); P-Score reduced by 4.0 due to regime CHOPPY; P-Score reduced by 5.6 due to ATR Soft Gate tolerance; USOIL: 1h ATR ≥1.5 USD — RR cél 1:2-re emelve; USOIL: oldalazó szerkezet — H1/M5 BOS nélkül nincs belépő; Regime kapu: CHOPPY miatt −10 P-score, pozícióskálázás csökkentve; Strukturális soft gate: 1/3 jel + ATR/spread OK (−6 P-score, size ×0.70); Strukturális kapu lazítva: momentum erős, BOS hiány engedve; Diagnosztika: k1m: utolsó zárt gyertya 11 perc késésben van; Diagnosztika: k1m: jelzés korlátozva 11 perc késés miatt; Diagnosztika: k5m: utolsó zárt gyertya 11 perc késésben van; missing: P_score>=36",,,,,,,
7b6f458d-071b-4c77-968a-f3339cae449c,BTCUSD,2026-05-14T16:21:08Z,no entry,core,32,,1.0,2.0,,,,,,,81487.78,2026-05-14T16:20:35Z,33,,,rule,"Mean reversion bias override (+19.5); Regime filter inaktív; ATR erősség 1.78× küszöb (+15.7); Ár az intraday range felső zónájában (+4.0); Order flow neutrális (−3.1); Sell pressure támogatja a setupot (+5); P-Score reduced by 4.0 due to regime CHOPPY; Mesterlövész mód: P-score minimum 35 érvényesítve; OFI z-score -1.02 támogatja az irányt; Regime kapu: CHOPPY miatt −10 P-score, pozícióskálázás csökkentve; Strukturális soft gate: 1/3 jel + ATR/spread OK (−6 P-score, size ×0.70); Precision limit belépő parkolva 20 percig; missing: P_score>=35",,,,,,,
