journal_id,asset,analysis_timestamp,signal,mode,probability,model_probability,realtime_confidence,leverage,entry_price,stop_loss,take_profit_1,take_profit_2,risk_reward,initial_risk_abs,spot_price,spot_timestamp,spot_latency_seconds,precision_score,anchor_bias,probability_source,notes,validation_outcome,validation_rr,max_favorable_excursion,max_adverse_excursion,time_to_outcome_minutes,slippage,execution_latency_ms
50c2ee7e-df03-49d3-9e81-346b48b849cd,XAGUSD,2026-05-20T08:51:08Z,no entry,core,21,,0.9999999999999999,20.0,,,,,,,75.48747,2026-05-20T08:50:41Z,26,,,rule,"Bias(4H→1H)=short (+15.0); Regime filter inaktív; ATR erősség 0.97× küszöb (+10.8); Ár az intraday range felső zónájában (+4.0); Order flow neutrális (−4.9); P-Score reduced by 4.0 due to regime CHOPPY; P-Score reduced by 1.3 due to ATR Soft Gate tolerance; XAGUSD: visszafogott ATR — RR cél 1:1.7-re emelve; XAGUSD breakout-védelem: gyors BE + 20% giveback limit expanziós szakaszban; XAGUSD: ATR-alapú pozícióskálázás ×0.70; XAG: VWAP felett — short setup türelmet igényel; Fém irány guard: 5m trend ellentétes a belépési biasszal; Regime kapu: CHOPPY miatt −10 P-score, pozícióskálázás csökkentve; Liquidity gate skipped (no volume proxy available); missing: metal_bias_5m_alignment, P_score>=28",,,,,,,
85bb508e-bd6e-4a01-82a7-b48bbbfb836a,BTCUSD,2026-05-20T08:51:08Z,no entry,core,0,,1.0,2.0,,,,,,,77397.87,2026-05-20T08:50:41Z,27,,,rule,"Intraday bias gate feltételek hiányosak — Crypto momentum long: 1m micro BOS long, Momentum volume ráta, ATR gate | Crypto momentum short: 1m micro BOS short, Momentum volume ráta, ATR gate | 5m BOS long  ATR: ATR gate | 5m BOS short  ATR: 5m BOS short, ATR gate | Micro BOS short  ATR (momentum nélkül): 1m micro BOS short, ATR gate; Bias neutrálsávban; Regime filter inaktív; HTF sweep ok (+10.0); ATR nincs rendben (relatív vagy abszolút küszöb); Alacsony realised vol → magasabb RR igény; Order flow neutrális (−4.9); P-Score reduced by 4.0 due to regime CHOPPY; P-Score reduced by 2.3 due to ATR Soft Gate tolerance; Mesterlövész mód: P-score minimum 35 érvényesítve; ATR-floor override: rel_atr 0.0010 < 0.0012 → adaptív RR/TP küszöb; Regime kapu: CHOPPY miatt −10 P-score, pozícióskálázás csökkentve; ATR soft gate: alacsony volatilitás −5 P-score, méret felezve; missing: P_score>=35",,,,,,,
448c07ac-4bef-43b7-ad0e-e745857e582f,EURUSD,2026-05-20T08:51:08Z,no entry,core,30,,0.9999999999999999,30.0,,,,,,,1.15928,2026-05-20T08:50:41Z,26,,,rule,"Bias(4H→1H)=short (+15.0); Regime filter inaktív; HTF sweep ok (+10.0); ATR erősség 1.18× küszöb (+12.1); Alacsony realised vol → magasabb RR igény; Order flow neutrális (−4.2); P-Score reduced by 4.0 due to regime CHOPPY; EURUSD: ATR(1h) alacsony — P-score küszöb +6 pontra emelve; EURUSD: Visszafogott ATR — célok szűkítve, kockázat kontroll alatt; EURUSD BOS aktív, de VWAP felett — várakozás; ATR-floor override: rel_atr 0.0003 < 0.0006 → adaptív RR/TP küszöb; Regime kapu: CHOPPY miatt −10 P-score, pozícióskálázás csökkentve; Liquidity gate skipped (no volume proxy available); missing: P_score>=44",,,,,,,
847a7dc8-76e5-4279-ae3a-2589f93a7660,GOLD_CFD,2026-05-20T08:51:08Z,no entry,core,27,,0.9999999999999999,20.0,,,,,,,4480.74552,2026-05-20T08:50:41Z,26,,,rule,"Bias(4H→1H)=short (+15.0); Regime filter inaktív; 5M BOS trendirányba (+16.0); ATR nincs rendben (relatív vagy abszolút küszöb); Range expanzió támogatja a momentumot (+3.0); Fib zóna konfluencia (0.618–0.886) (+18.0); Order flow neutrális (−4.8); OFI toxikus short irányra (−3.9); P-Score reduced by 4.0 due to regime CHOPPY; ATR-floor override: rel_atr 0.0011 < 0.0025 → adaptív RR/TP küszöb; Regime kapu: CHOPPY miatt −10 P-score, pozícióskálázás csökkentve; ATR soft gate: alacsony volatilitás −5 P-score, méret felezve; Strukturális kapu lazítva: momentum erős, BOS hiány engedve; Liquidity gate skipped (no volume proxy available); missing: P_score>=30",,,,,,,
aaea5d10-241e-4c24-a678-bd116c451e77,USOIL,2026-05-20T08:51:08Z,no entry,core_only,44,,1.0,20.0,102.40417,97.85635042857143,111.49980914285712,116.04762871428568,3.0,,102.40417,2026-05-20T08:50:41Z,27,,,rule,"Bias(4H→1H)=long (+15.0); Regime filter inaktív; ATR erősség 2.60× küszöb (+20.6); Ár az intraday range alsó zónájában (+4.0); Fib zóna konfluencia (0.618–0.886) (+18.0); Order flow neutrális (−4.2); P-Score reduced by 4.0 due to regime CHOPPY; USOIL: parabolikus lendület — RR cél 1:1.4 környékére szűkítve; USOIL: európai délelőtt — pozícióméret ×0.85; USOIL: oldalazó szerkezet — H1/M5 BOS nélkül nincs belépő; Regime kapu: CHOPPY miatt −10 P-score, pozícióskálázás csökkentve; Strukturális soft gate: 1/3 jel + ATR/spread OK (−6 P-score, size ×0.70); Strukturális kapu lazítva: momentum erős, BOS hiány engedve; USOIL stop lazítás: ATR1h alapú kockázat ×0.92; Diagnosztika: k1m: utolsó zárt gyertya 11 perc késésben van; Diagnosztika: k1m: jelzés korlátozva 11 perc késés miatt; Diagnosztika: k5m: utolsó zárt gyertya 11 perc késésben van",,,,,,,
