journal_id,asset,analysis_timestamp,signal,mode,probability,model_probability,realtime_confidence,leverage,entry_price,stop_loss,take_profit_1,take_profit_2,risk_reward,initial_risk_abs,spot_price,spot_timestamp,spot_latency_seconds,precision_score,anchor_bias,probability_source,notes,validation_outcome,validation_rr,max_favorable_excursion,max_adverse_excursion,time_to_outcome_minutes,slippage,execution_latency_ms
64e43e06-6a02-4fd6-a610-73c5335864bb,XAGUSD,2026-05-21T12:42:04Z,market closed,session_closed,0,,1.0,20.0,,,,,,,75.08193,2026-05-21T12:41:37Z,27,,,rule,"Piac nyitva; Bias(4H→1H)=short (+15.0); Regime filter inaktív; ATR erősség 1.01× küszöb (+11.1); Ár 1h EMA21 zónában (+10.0); Order flow neutrális (−3.0); XAGUSD: visszafogott ATR — RR cél 1:1.7-re emelve; XAGUSD breakout-védelem: gyors BE + 20% giveback limit expanziós szakaszban; XAG: VWAP felett — short setup türelmet igényel; OFI z-score -1.11 támogatja az irányt; Regime kapu: CHOPPY miatt −10 P-score, pozícióskálázás csökkentve; Liquidity gate skipped (no volume proxy available); missing: session",,,,,,,
4d9ed181-6da3-48ba-8f6d-12732e5800cb,GOLD_CFD,2026-05-21T12:42:04Z,market closed,session_closed,0,,1.0,20.0,,,,,,,4512.78992,2026-05-21T12:41:37Z,27,,,rule,"Piac nyitva; Bias(4H→1H)=short (+15.0); Regime filter inaktív; 5M BOS trendirányba (+16.0); ATR nincs rendben (relatív vagy abszolút küszöb); Alacsony realised vol → magasabb RR igény; Range expanzió támogatja a momentumot (+3.0); Ár 1h EMA21 zónában (+10.0); Order flow neutrális (−3.5); P-Score reduced by 4.0 due to regime CHOPPY; VWAP felett — GOLD short breakout várakozik; ATR-floor override: rel_atr 0.0010 < 0.0025 → adaptív RR/TP küszöb; Regime kapu: CHOPPY miatt −10 P-score, pozícióskálázás csökkentve; ATR soft gate: alacsony volatilitás −5 P-score, méret felezve; Strukturális kapu lazítva: momentum erős, BOS hiány engedve; Liquidity gate skipped (no volume proxy available); missing: session, P_score>=30",,,,,,,
0524fee3-48bb-48c2-a22a-b9b15f1ae28e,BTCUSD,2026-05-21T12:42:04Z,no entry,core,0,,1.0,2.0,,,,,,,77200.55,2026-05-21T12:41:37Z,27,,,rule,"Intraday bias gate feltételek hiányosak — Crypto momentum long: 1m micro BOS long, Momentum volume ráta, ATR gate | Crypto momentum short: 1m micro BOS short, Momentum volume ráta, ATR gate | 5m BOS long  ATR: ATR gate | 5m BOS short  ATR: 5m BOS short, ATR gate | Micro BOS short  ATR (momentum nélkül): 1m micro BOS short, ATR gate; Bias neutrálsávban; Regime filter inaktív; ATR nincs rendben (relatív vagy abszolút küszöb); Alacsony realised vol → magasabb RR igény; Ár 1h EMA21 zónában (+10.0); Order flow neutrális (−4.4); P-Score reduced by 4.0 due to regime CHOPPY; Mesterlövész mód: P-score minimum 35 érvényesítve; ATR-floor override: rel_atr 0.0010 < 0.0012 → adaptív RR/TP küszöb; Regime kapu: CHOPPY miatt −10 P-score, pozícióskálázás csökkentve; ATR soft gate: alacsony volatilitás −5 P-score, méret felezve; missing: P_score>=35",,,,,,,
862ffe4c-94d2-4221-a619-51154b4c1d83,EURUSD,2026-05-21T12:42:04Z,market closed,session_closed,0,,1.0,30.0,,,,,,,1.16043,2026-05-21T12:41:37Z,27,,,rule,"Piac nyitva; Bias(4H→1H)=short (+15.0); Regime filter inaktív; 5M BOS trendirányba (+16.0); ATR erősség 1.68× küszöb (+15.1); Alacsony realised vol → magasabb RR igény; Range expanzió támogatja a momentumot (+3.0); Ár 1h EMA21 zónában (+10.0); Order flow neutrális (−3.8); P-Score reduced by 4.0 due to regime CHOPPY; EURUSD: ATR(1h) alacsony — P-score küszöb +6 pontra emelve; EURUSD: Visszafogott ATR — célok szűkítve, kockázat kontroll alatt; EURUSD BOS aktív, de VWAP felett — várakozás; ATR-floor override: rel_atr 0.0004 < 0.0006 → adaptív RR/TP küszöb; Regime kapu: CHOPPY miatt −10 P-score, pozícióskálázás csökkentve; Strukturális kapu lazítva: momentum erős, BOS hiány engedve; Liquidity gate skipped (no volume proxy available); missing: session",,,,,,,
3c323698-3e3e-4130-95a5-74396a7281ec,USOIL,2026-05-21T12:42:04Z,market closed,session_closed,0,,1.0,20.0,,,,,,,101.14888,2026-05-21T12:41:37Z,27,,,rule,"Piac nyitva; Mean reversion bias override (+19.5); Regime filter inaktív; ATR nincs rendben (relatív vagy abszolút küszöb); Fib zóna konfluencia (0.618–0.886) (+18.0); Order flow neutrális (−4.4); P-Score reduced by 4.0 due to regime CHOPPY; USOIL: parabolikus lendület — RR cél 1:1.4 környékére szűkítve; USOIL: oldalazó szerkezet — H1/M5 BOS nélkül nincs belépő; Regime kapu: CHOPPY miatt −10 P-score, pozícióskálázás csökkentve; ATR soft gate: alacsony volatilitás −5 P-score, méret felezve; Diagnosztika: k1m: utolsó zárt gyertya 11 perc késésben van; Diagnosztika: k1m: jelzés korlátozva 11 perc késés miatt; Diagnosztika: k5m: utolsó zárt gyertya 12 perc késésben van; missing: session, P_score>=36",,,,,,,
