journal_id,asset,analysis_timestamp,signal,mode,probability,model_probability,realtime_confidence,leverage,entry_price,stop_loss,take_profit_1,take_profit_2,risk_reward,initial_risk_abs,spot_price,spot_timestamp,spot_latency_seconds,precision_score,anchor_bias,probability_source,notes,validation_outcome,validation_rr,max_favorable_excursion,max_adverse_excursion,time_to_outcome_minutes,slippage,execution_latency_ms
d0776d06-f139-49d4-a27c-7d04495bd4d7,GOLD_CFD,2026-04-13T08:21:26Z,no entry,core,16,,0.9999999999999999,20.0,,,,,,,4732.57201,2026-04-13T08:21:00Z,26,,,rule,"Bias(4H→1H)=short (+15.0); Regime filter inaktív; ATR nincs rendben (relatív vagy abszolút küszöb); Alacsony realised vol → magasabb RR igény; Ár az intraday range felső zónájában (+4.0); Fib zóna konfluencia (0.618–0.886) (+18.0); Order flow neutrális (−4.8); P-Score reduced by 4.0 due to regime CHOPPY; ATR-floor override: rel_atr 0.0009 < 0.0025 → adaptív RR/TP küszöb; Fém irány guard: 5m trend ellentétes a belépési biasszal; Regime kapu: CHOPPY miatt −10 P-score, pozícióskálázás csökkentve; ATR soft gate: alacsony volatilitás −5 P-score, méret felezve; Liquidity gate skipped (no volume proxy available); missing: metal_bias_5m_alignment, P_score>=30",,,,,,,
68e8fd9e-169c-4b68-a817-293eb1c774e2,EURUSD,2026-04-13T08:21:26Z,no entry,core,17,,0.9999999999999999,30.0,,,,,,,1.16927,2026-04-13T08:21:00Z,26,,,rule,"Intraday bias gate feltételek hiányosak — Micro BOS long  ATR rendben: 1m micro BOS long | Micro BOS short  ATR rendben: 1m micro BOS short; Bias neutrálsávban; Regime filter inaktív; ATR erősség 1.25× küszöb (+12.5); Alacsony realised vol → magasabb RR igény; Fib zóna konfluencia (0.618–0.886) (+18.0); Order flow neutrális (−5.0); P-Score reduced by 4.0 due to regime CHOPPY; EURUSD: ATR-alapú pozícióskálázás ×0.79 — volatilitás kontroll; ATR-floor override: rel_atr 0.0002 < 0.0006 → adaptív RR/TP küszöb; Regime kapu: CHOPPY miatt −10 P-score, pozícióskálázás csökkentve; Strukturális soft gate: 1/3 jel + ATR/spread OK (−6 P-score, size ×0.70); Strukturális kapu lazítva: momentum erős, BOS hiány engedve; Liquidity gate skipped (no volume proxy available); missing: P_score>=38",,,,,,,
fd73bb59-2009-4eb6-8a1d-96ea691c4856,XAGUSD,2026-04-13T08:21:27Z,precision_arming,core,39,,0.9999999999999999,20.0,,,,,,,74.68982,2026-04-13T08:21:00Z,26,,,rule,"Bias(4H→1H)=short (+15.0); Regime filter inaktív; 5M BOS trendirányba (+16.0); ATR nincs rendben (relatív vagy abszolút küszöb); Ár az intraday range felső zónájában (+4.0); Range expanzió támogatja a momentumot (+3.0); XAG momentum override — stop tágítva erős trendnél; XAGUSD: momentum override — stop távolság 1.3×ATR-re tágítva; Fib zóna konfluencia (0.618–0.886) (+18.0); Order flow neutrális (−4.8); XAGUSD: momentum kitörés — RR cél 1:1.45-re szűkítve; XAGUSD breakout-védelem: gyors BE + 20% giveback limit expanziós szakaszban; XAG momentum override — pozícióméret csökkentve; XAG: VWAP felett — short setup türelmet igényel; ATR-floor override: rel_atr 0.0016 < 0.0018 → adaptív RR/TP küszöb; Regime kapu: CHOPPY miatt −10 P-score, pozícióskálázás csökkentve; ATR soft gate: alacsony volatilitás −5 P-score, méret felezve; Strukturális kapu lazítva: momentum erős, BOS hiány engedve; Liquidity gate skipped (no volume proxy available); XAG stop lazítás: ATR1h alapú kockázat ×1.09; Precision trigger kész → limit figyelés; Precision limit belépő parkolva 12 percig",,,,,,,
d94341c3-d7cb-4a1d-ba1b-97e818892725,BTCUSD,2026-04-13T08:21:27Z,precision_arming,core,37,,0.9999999999999999,2.0,,,,,,,70700.55,2026-04-13T08:21:00Z,26,,,rule,"Micro bias override: gyors struktúra dominál (+19.5); Regime filter inaktív; 5M BOS trendirányba (+16.0); ATR erősség 1.34× küszöb (+13.0); Alacsony realised vol → magasabb RR igény; Intraday range alsó harmada telített (−7.0); Range expanzió támogatja a momentumot (+3.0); Order flow neutrális (−4.0); Sell pressure támogatja a setupot (+5); P-Score reduced by 4.0 due to regime CHOPPY; Intraday P-score lazítás: micro-bias short elsőbbséget kap (−2.2); Mesterlövész mód: P-score minimum 35 érvényesítve; BTC mikro BOS short aktív; Regime kapu: CHOPPY miatt −10 P-score, pozícióskálázás csökkentve; Strukturális soft gate: 1/3 jel + ATR/spread OK (−6 P-score, size ×0.70); Likviditási kapu lazítva erős momentum miatt; BTC ATR1h stop igazítás: kockázat ×1.15; TP1 nettó profit ≈ 0.60%; Precision belépő: trigger ablak aktív; Precision limit belépő parkolva 20 percig; missing: tp1_net>=+0.6%",,,,,,,
51dee89d-df51-40ab-a1ca-1ae123d6364c,USOIL,2026-04-13T08:21:27Z,no entry,core_only,86,,1.0,20.0,103.95436,102.290270923,107.282538154,108.946627231,3.0,,103.95436,2026-04-13T08:21:00Z,27,,,rule,"Bias(4H→1H)=long (+15.0); EMA21 slope 1.97× küszöb (+17.8); 5M BOS trendirányba (+16.0); ATR erősség 1.18× küszöb (+12.1); Range expanzió támogatja a momentumot (+3.0); USOIL: erős momentum — invalid zóna 2.5×ATR(1h)-re tágítva; Fib zóna konfluencia (0.618–0.886) (+18.0); Order flow neutrális (−4.5); USOIL: 1h ATR ≥1.5 USD — RR cél 1:2-re emelve; USOIL: európai délelőtt — pozícióméret ×0.85; USOIL: oldalazó szerkezet — H1/M5 BOS nélkül nincs belépő; Strukturális soft gate: 1/3 jel + ATR/spread OK (−6 P-score, size ×0.70); Strukturális kapu lazítva: momentum erős, BOS hiány engedve; USOIL stop lazítás: ATR1h alapú kockázat ×0.97; Diagnosztika: k1m: utolsó zárt gyertya 11 perc késésben van; Diagnosztika: k1m: jelzés korlátozva 11 perc késés miatt; Diagnosztika: k5m: utolsó zárt gyertya 11 perc késésben van",,,,,,,
