journal_id,asset,analysis_timestamp,signal,mode,probability,model_probability,realtime_confidence,leverage,entry_price,stop_loss,take_profit_1,take_profit_2,risk_reward,initial_risk_abs,spot_price,spot_timestamp,spot_latency_seconds,precision_score,anchor_bias,probability_source,notes,validation_outcome,validation_rr,max_favorable_excursion,max_adverse_excursion,time_to_outcome_minutes,slippage,execution_latency_ms
ba1c81ef-d866-4cae-ad7c-5ee10651e5b0,EURUSD,2026-05-19T22:26:13Z,no entry,core,40,,1.0,30.0,,,,,,,1.16081,2026-05-19T22:25:46Z,27,,,rule,"Micro bias override: gyors struktúra dominál (+19.5); Regime filter inaktív; 5M BOS trendirányba (+16.0); ATR nincs rendben (relatív vagy abszolút küszöb); Alacsony realised vol → magasabb RR igény; Range expanzió támogatja a momentumot (+3.0); Fib zóna konfluencia (0.618–0.886) (+18.0); Order flow neutrális (−4.5); EURUSD: ATR(1h) alacsony — P-score küszöb +6 pontra emelve; Intraday P-score lazítás: micro-bias long elsőbbséget kap (−1.5); EURUSD: Visszafogott ATR — célok szűkítve, kockázat kontroll alatt; EURUSD BOS aktív, de VWAP alatt — türelem; ATR-floor override: rel_atr 0.0001 < 0.0006 → adaptív RR/TP küszöb; Regime kapu: CHOPPY miatt −10 P-score, pozícióskálázás csökkentve; ATR soft gate: alacsony volatilitás −5 P-score, méret felezve; Strukturális kapu lazítva: momentum erős, BOS hiány engedve; Liquidity gate skipped (no volume proxy available); missing: P_score>=42.5",,,,,,,
apu: CHOPPY miatt −10 P-score, pozícióskálázás csökkentve; ATR soft gate: alacsony volatilitás −5 P-score, méret felezve; Strukturális kapu lazítva: momentum erős, BOS hiány engedve; Liquidity gate skipped (no volume proxy available); missing: session, P_score>=28",,,,,,,
3edcce82-9ed2-401e-bc95-5cf1305df974,GOLD_CFD,2026-05-19T22:26:13Z,market closed,session_closed,0,,1.0,20.0,,,,,,,4480.97107,2026-05-19T22:25:46Z,27,,,rule,"Piac zárva (napi karbantartás 22:00–23:00 UTC); Bias(4H→1H)=short (+15.0); Regime filter inaktív; 5M BOS trendirányba (+16.0); ATR nincs rendben (relatív vagy abszolút küszöb); Alacsony realised vol → magasabb RR igény; Range expanzió támogatja a momentumot (+3.0); Fib zóna konfluencia (0.618–0.886) (+18.0); Order flow neutrális (−4.5); P-Score reduced by 4.0 due to regime CHOPPY; VWAP felett — GOLD short breakout várakozik; ATR-floor override: rel_atr 0.0003 < 0.0025 → adaptív RR/TP küszöb; Regime kapu: CHOPPY miatt −10 P-score, pozícióskálázás csökkentve; ATR soft gate: alacsony volatilitás −5 P-score, méret felezve; Strukturális kapu lazítva: momentum erős, BOS hiány engedve; Liquidity gate skipped (no volume proxy available); missing: session",,,,,,,
a4a3dbf4-8e32-4966-b8c5-c85eb920f549,BTCUSD,2026-05-19T22:26:13Z,no entry,core,34,,1.0,2.0,,,,,,,76612.0,2026-05-19T22:25:46Z,27,,,rule,"Micro bias override: gyors struktúra dominál (+19.5); Regime filter inaktív; 5M BOS trendirányba (+16.0); ATR nincs rendben (relatív vagy abszolút küszöb); Alacsony realised vol → magasabb RR igény; Intraday range alsó harmada telített (−7.0); Range expanzió támogatja a momentumot (+3.0); Fib zóna konfluencia (0.618–0.886) (+18.0); Order flow neutrális (−4.1); Sell pressure támogatja a setupot (+5); P-Score reduced by 4.0 due to regime CHOPPY; Intraday P-score lazítás: micro-bias short elsőbbséget kap (−2.2); Mesterlövész mód: P-score minimum 35 érvényesítve; BTC mikro BOS short aktív; ATR-floor override: rel_atr 0.0009 < 0.0012 → adaptív RR/TP küszöb; Regime kapu: CHOPPY miatt −10 P-score, pozícióskálázás csökkentve; ATR soft gate: alacsony volatilitás −5 P-score, méret felezve; Strukturális kapu lazítva: momentum erős, BOS hiány engedve; P-score soft gate: −0.6 pont tolerancia (size ×0.65, RR +0.15); Position size scale 0.0305 below floor 0.04 — entry blocked; Precision limit belépő parkolva 20 percig; missing: position_sizing_floor",,,,,,,
ce182ed9-af24-401c-aa3d-de974ce306f7,USOIL,2026-05-19T22:26:14Z,market closed,session_closed,0,,1.0,20.0,,,,,,,104.32297,2026-05-19T22:25:46Z,27,,,rule,"Piac zárva (napi karbantartás 22:00–23:00 UTC); Bias(4H→1H)=long (+15.0); Regime filter inaktív; ATR erősség 1.46× küszöb (+13.7); Ár az intraday range alsó zónájában (+4.0); Fib zóna konfluencia (0.618–0.886) (+18.0); Order flow neutrális (−4.6); P-Score reduced by 4.0 due to regime CHOPPY; USOIL: parabolikus lendület — RR cél 1:1.4 környékére szűkítve; USOIL: nyitás előtti sáv — pozícióméret ×0.75; Regime kapu: CHOPPY miatt −10 P-score, pozícióskálázás csökkentve; Liquidity gate skipped (no volume proxy available); Diagnosztika: k1m: utolsó zárt gyertya 11 perc késésben van; Diagnosztika: k1m: jelzés korlátozva 11 perc késés miatt; Diagnosztika: k5m: utolsó zárt gyertya 11 perc késésben van; missing: session",,,,,,,
