journal_id,asset,analysis_timestamp,signal,mode,probability,model_probability,realtime_confidence,leverage,entry_price,stop_loss,take_profit_1,take_profit_2,risk_reward,initial_risk_abs,spot_price,spot_timestamp,spot_latency_seconds,precision_score,anchor_bias,probability_source,notes,validation_outcome,validation_rr,max_favorable_excursion,max_adverse_excursion,time_to_outcome_minutes,slippage,execution_latency_ms,fill_timestamp,exit_timestamp,entry_kind,validation_source
0553a9f0-b069-4be5-9b36-c90088496575,EURUSD,2026-02-18T08:25:23Z,no entry,core,0,,1.0,30.0,,,,,,,1.18352,2026-02-18T08:25:04Z,19,,,rule,"Intraday bias gate feltételek hiányosak — Micro BOS long  ATR rendben: 1m micro BOS long, ATR gate | Micro BOS short  ATR rendben: 1m micro BOS short, ATR gate; Bias neutrálsávban; Regime filter inaktív; ATR nincs rendben (relatív vagy abszolút küszöb); Alacsony realised vol → magasabb RR igény; Ár 1h EMA21 zónában (+10.0); Order flow neutrális (−4.2); P-Score reduced by 4.0 due to regime CHOPPY; EURUSD: ATR(1h) alacsony — P-score küszöb +6 pontra emelve; EURUSD: Visszafogott ATR — célok szűkítve, kockázat kontroll alatt; ATR-floor override: rel_atr 0.0002 < 0.0006 → adaptív RR/TP küszöb; Regime kapu: CHOPPY miatt −10 P-score, pozícióskálázás csökkentve; ATR soft gate: alacsony volatilitás −5 P-score, méret felezve; Liquidity gate skipped (no volume proxy available); missing: P_score>=44",,,,,,,,,,,
c645b127-c9db-4d38-8dca-887034f57318,GOLD_CFD,2026-02-18T08:25:23Z,no entry,core,18,,1.0,20.0,,,,,,,4925.31659,2026-02-18T08:25:04Z,19,,,rule,"Mean reversion bias override (+19.5); Regime filter inaktív; ATR nincs rendben (relatív vagy abszolút küszöb); Alacsony realised vol → magasabb RR igény; Fib zóna konfluencia (0.618–0.886) (+18.0); Order flow neutrális (−3.5); P-Score reduced by 4.0 due to regime CHOPPY; Mesterlövész mód: P-score minimum 35 érvényesítve; VWAP alatt — GOLD long breakout késleltetve; ATR-floor override: rel_atr 0.0006 < 0.0025 → adaptív RR/TP küszöb; Regime kapu: CHOPPY miatt −10 P-score, pozícióskálázás csökkentve; ATR soft gate: alacsony volatilitás −5 P-score, méret felezve; Liquidity gate skipped (no volume proxy available); missing: P_score>=35, precision_score>=55",,,,,,,,,,,
897852ea-27f9-49ae-bc14-2df24fa1e537,XAGUSD,2026-02-18T08:25:23Z,no entry,core,17,,1.0,20.0,,,,,,,75.6368,2026-02-18T08:25:04Z,19,,,rule,"Bias(4H→1H)=short (+15.0); Regime filter inaktív; 5M BOS trendirányba (+16.0); ATR nincs rendben (relatív vagy abszolút küszöb); Ár az intraday range felső zónájában (+4.0); Range expanzió támogatja a momentumot (+3.0); XAG momentum override — stop tágítva erős trendnél; XAGUSD: momentum override — stop távolság 1.3×ATR-re tágítva; Order flow neutrális (−4.5); P-Score reduced by 4.0 due to regime CHOPPY; Mesterlövész mód: P-score minimum 35 érvényesítve; XAGUSD: momentum kitörés — RR cél 1:1.45-re szűkítve; XAG momentum override — pozícióméret csökkentve; XAGUSD: ATR-alapú pozícióskálázás ×0.55; XAG: VWAP felett — short setup türelmet igényel; Fém irány guard: 5m trend ellentétes a belépési biasszal; Regime kapu: CHOPPY miatt −10 P-score, pozícióskálázás csökkentve; ATR soft gate: alacsony volatilitás −5 P-score, méret felezve; Strukturális kapu lazítva: momentum erős, BOS hiány engedve; Liquidity gate skipped (no volume proxy available); missing: metal_bias_5m_alignment, P_score>=35",,,,,,,,,,,
d4ea63b2-6396-474d-b32b-01edf6e2fcb9,BTCUSD,2026-02-18T08:25:23Z,sell,momentum,75,,1.0,2.0,68266.81,68949.4781,67242.80785000001,66628.40656,2.4,,68266.81,2026-02-18T08:25:04Z,19,,,rule,"Mean reversion bias override (+19.5); Regime filter inaktív; ATR erősség 1.06× küszöb (+11.4); Ár az intraday range felső zónájában (+4.0); ema9x21+ofi_z=-999.00; Order flow neutrális (−4.9); Sell pressure támogatja a setupot (+5); P-Score reduced by 4.0 due to regime CHOPPY; Mesterlövész mód: P-score minimum 35 érvényesítve; BTC momentum override — pozícióméret csökkentve; BTC momentum override — likviditási kapu lazítva; OFI z-score -2.04 támogatja az irányt; Regime kapu: CHOPPY miatt −10 P-score, pozícióskálázás csökkentve; Strukturális soft gate: 1/3 jel + ATR/spread OK (−6 P-score, size ×0.70); Strukturális kapu lazítva: momentum erős, BOS hiány engedve; Likviditási kapu lazítva erős momentum miatt; Momentum soft gate: regime (−6.0 P, size ×0.85); BTC ATR1h stop igazítás: kockázat ×1.03; Momentum override (ema9x21+ofi_z=-999.00); Momentum: rész-realizálás javasolt 2.0R-n és trailing SL aktiválása; TP1 nettó profit ≈ 0.10%; Precision plan: entry 68240.4–68319.6, SL 68398.7; Precision confidence medium (72.0); Precision limit belépő parkolva 20 percig; missing: rr_min, tp1_net>=+0.6%",insufficient_data,,,,,,,,,market,auto
36c9caa9-a1ca-4fa6-af45-c9b450898efb,USOIL,2026-02-18T08:25:23Z,no entry,core,22,,1.0,20.0,,,,,,,62.55999,2026-02-18T08:25:04Z,19,,,rule,"Intraday bias gate feltételek hiányosak — USOIL retest long  ATR: ATR gate | USOIL retest short  ATR: 5m retest short, ATR gate; Micro bias override: neutral -> micro irány (+19.5); Regime filter inaktív; 5M BOS trendirányba (+16.0); ATR nincs rendben (relatív vagy abszolút küszöb); Intraday range felső harmada telített (−7.0); Range expanzió támogatja a momentumot (+3.0); USOIL: erős momentum — invalid zóna 2.5×ATR(1h)-re tágítva; Ár 1h EMA21 zónában (+10.0); Order flow neutrális (−3.7); P-Score reduced by 4.0 due to regime CHOPPY; USOIL: 1h ATR <1 USD — P-score küszöb emelve a zajos sáv miatt; Intraday P-score lazítás: micro-bias long elsőbbséget kap (−1.5); USOIL: csökkenő volatilitás — RR cél 1:1.5-re igazítva; USOIL: európai délelőtt — pozícióméret ×0.75; Regime kapu: CHOPPY miatt −10 P-score, pozícióskálázás csökkentve; ATR soft gate: alacsony volatilitás −5 P-score, méret felezve; Liquidity gate skipped (no volume proxy available); missing: P_score>=40.5",,,,,,,,,,,
