journal_id,asset,analysis_timestamp,signal,mode,probability,model_probability,realtime_confidence,leverage,entry_price,stop_loss,take_profit_1,take_profit_2,risk_reward,initial_risk_abs,spot_price,spot_timestamp,spot_latency_seconds,precision_score,anchor_bias,probability_source,notes,validation_outcome,validation_rr,max_favorable_excursion,max_adverse_excursion,time_to_outcome_minutes,slippage,execution_latency_ms
47b36ec8-0b66-43aa-a396-2cd213dbee1c,GOLD_CFD,2026-06-10T05:21:09Z,no entry,core,0,,0.9999999999999999,20.0,,,,,,,4176.55576,2026-06-10T05:20:42Z,26,,,rule,"Bias(4H→1H)=short (+15.0); Regime filter inaktív; ATR nincs rendben (relatív vagy abszolút küszöb); Alacsony realised vol → magasabb RR igény; Intraday range alsó harmada telített (−7.0); Order flow neutrális (−4.8); P-Score reduced by 4.0 due to regime CHOPPY; Range guard lazítva: napi sáv alja, de mikro-range visszapattant.; VWAP felett — GOLD short breakout várakozik; OFI z-score -1.15 támogatja az irányt; ATR-floor override: rel_atr 0.0008 < 0.0025 → adaptív RR/TP küszöb; Regime kapu: CHOPPY miatt −10 P-score, pozícióskálázás csökkentve; ATR soft gate: alacsony volatilitás −5 P-score, méret felezve; Liquidity gate skipped (no volume proxy available); missing: P_score>=30",,,,,,,
03ea6e44-0e20-4d8a-b1e4-dc1e0770b586,EURUSD,2026-06-10T05:21:08Z,no entry,core,1,,0.9999999999999999,30.0,,,,,,,1.15465,2026-06-10T05:20:42Z,26,,,rule,"Intraday bias gate feltételek hiányosak — Micro BOS long  ATR rendben: 1m micro BOS long, ATR gate | Micro BOS short  ATR rendben: 1m micro BOS short, ATR gate; Bias neutrálsávban; Regime filter inaktív; ATR nincs rendben (relatív vagy abszolút küszöb); Alacsony realised vol → magasabb RR igény; Range expanzió támogatja a momentumot (+3.0); Fib zóna konfluencia (0.618–0.886) (+18.0); Order flow neutrális (−4.2); P-Score reduced by 4.0 due to regime CHOPPY; EURUSD: ATR(1h) alacsony — P-score küszöb +6 pontra emelve; EURUSD: Visszafogott ATR — célok szűkítve, kockázat kontroll alatt; ATR-floor override: rel_atr 0.0002 < 0.0006 → adaptív RR/TP küszöb; Regime kapu: CHOPPY miatt −10 P-score, pozícióskálázás csökkentve; ATR soft gate: alacsony volatilitás −5 P-score, méret felezve; Strukturális kapu lazítva: momentum erős, BOS hiány engedve; Liquidity gate skipped (no volume proxy available); missing: P_score>=44",,,,,,,
086498fa-a9ad-49b4-b032-d0bc0b5a2d34,XAGUSD,2026-06-10T05:21:09Z,precision_arming,core,74,,0.9999999999999999,20.0,,,,,,,63.71234,2026-06-10T05:20:42Z,26,,,rule,Bias(4H→1H)=short (+15.0); EMA21 slope 1.38× küszöb (+14.3); HTF sweep ok (+10.0); 5M BOS trendirányba (+16.0); ATR erősség 1.27× küszöb (+12.6); Intraday range alsó harmada telített (−7.0); Range expanzió támogatja a momentumot (+3.0); XAG momentum override — stop tágítva erős trendnél; XAGUSD: momentum override — stop távolság 1.3×ATR-re tágítva; Order flow neutrális (−4.9); XAGUSD: momentum kitörés — RR cél 1:1.45-re szűkítve; XAGUSD breakout-védelem: gyors BE + 20% giveback limit expanziós szakaszban; XAG momentum override — pozícióméret csökkentve; XAGUSD: ATR-alapú pozícióskálázás ×0.55; XAG: VWAP felett — short setup türelmet igényel; OFI z-score -1.37 támogatja az irányt; Liquidity gate skipped (no volume proxy available); XAG stop lazítás: ATR1h alapú kockázat ×1.09; Precision trigger kész → limit figyelés; Precision limit belépő parkolva 12 percig,,,,,,,
c6a407c7-2d19-4073-9e16-f4c3e5160c3f,BTCUSD,2026-06-10T05:21:09Z,precision_arming,core,38,,0.9999999999999999,2.0,,,,,,,61060.09,2026-06-10T05:20:42Z,26,,,rule,"Micro bias override: gyors struktúra dominál (+19.5); Regime filter inaktív; 5M BOS trendirányba (+16.0); ATR erősség 0.95× küszöb (+10.7); Intraday range alsó harmada telített (−7.0); Range expanzió támogatja a momentumot (+3.0); ema9x21+ofi_z=-999.00; Order flow neutrális (−3.9); Sell pressure támogatja a setupot (+5); P-Score reduced by 4.0 due to regime CHOPPY; P-Score reduced by 1.9 due to ATR Soft Gate tolerance; Intraday P-score lazítás: micro-bias short elsőbbséget kap (−2.2); Mesterlövész mód: P-score minimum 35 érvényesítve; BTC momentum override — pozícióméret csökkentve; BTC momentum override — likviditási kapu lazítva; BTC mikro BOS short aktív; OFI z-score -1.49 támogatja az irányt; Regime kapu: CHOPPY miatt −10 P-score, pozícióskálázás csökkentve; Likviditási kapu lazítva erős momentum miatt; BTC ATR1h stop igazítás: kockázat ×1.03; TP1 nettó profit ≈ 0.20%; Precision belépő: trigger ablak aktív; Precision limit belépő parkolva 20 percig; missing: rr_min, tp1_net>=+0.6%",,,,,,,
86e23582-a4cd-4fc3-8fdc-1ed9d92d3f5f,USOIL,2026-06-10T05:21:09Z,no entry,core_only,60,,1.0,20.0,88.56734,90.65835393714286,83.75800794457142,81.0396898262857,3.6,,88.56734,2026-06-10T05:20:42Z,27,,,rule,"Bias(4H→1H)=short (+15.0); Regime filter inaktív; 5M BOS trendirányba (+16.0); ATR erősség 2.91× küszöb (+22.4); Intraday range alsó harmada telített (−7.0); Range expanzió támogatja a momentumot (+3.0); USOIL: erős momentum — invalid zóna 2.5×ATR(1h)-re tágítva; Fib zóna konfluencia (0.618–0.886) (+18.0); Order flow neutrális (−3.9); P-Score reduced by 4.0 due to regime CHOPPY; USOIL: 1h ATR ≥1.5 USD — RR cél 1:2-re emelve; USOIL: ázsiai sáv — pozícióméret ×0.70; Regime kapu: CHOPPY miatt −10 P-score, pozícióskálázás csökkentve; Diagnosztika: k1m: utolsó zárt gyertya 11 perc késésben van; Diagnosztika: k1m: jelzés korlátozva 11 perc késés miatt; Diagnosztika: k5m: utolsó zárt gyertya 11 perc késésben van",,,,,,,
