journal_id,asset,analysis_timestamp,signal,mode,probability,model_probability,realtime_confidence,leverage,entry_price,stop_loss,take_profit_1,take_profit_2,risk_reward,initial_risk_abs,spot_price,spot_timestamp,spot_latency_seconds,precision_score,anchor_bias,probability_source,notes,validation_outcome,validation_rr,max_favorable_excursion,max_adverse_excursion,time_to_outcome_minutes,slippage,execution_latency_ms
0d82f340-7633-45b7-9d07-981e4e3f8be5,EURUSD,2026-01-27T11:31:08Z,no entry,core,4,,1.0,30.0,,,,,,,1.18881,2026-01-27T11:30:40Z,28,,,rule,"Bias(4H→1H)=long (+15.0); Regime filter inaktív; ATR nincs rendben (relatív vagy abszolút küszöb); Alacsony realised vol → magasabb RR igény; Intraday range felső harmada telített (−7.0); Fib zóna konfluencia (0.618–0.886) (+18.0); Order flow neutrális (−4.8); P-Score reduced by 4.0 due to regime CHOPPY; P-Score reduced by 1.2 due to ATR Soft Gate tolerance; Range guard lazítva: napi sáv teteje, de mikro-range visszahúzódott.; EURUSD: ATR(1h) alacsony — P-score küszöb +6 pontra emelve; EURUSD: Visszafogott ATR — célok szűkítve, kockázat kontroll alatt; EURUSD BOS aktív, de VWAP alatt — türelem; OFI z-score 1.26 támogatja az irányt; ATR-floor override: rel_atr 0.0003 < 0.0006 → adaptív RR/TP küszöb; Regime kapu: CHOPPY miatt −10 P-score, pozícióskálázás csökkentve; ATR soft gate: alacsony volatilitás −5 P-score, méret felezve; Liquidity gate skipped (no volume proxy available); missing: P_score>=44",,,,,,,
5db746e4-b935-42ab-9a6b-82ec376786f7,GOLD_CFD,2026-01-27T11:31:08Z,no entry,core,36,,1.0,20.0,,,,,,,5086.73329,2026-01-27T11:30:40Z,28,,,rule,"Bias(4H→1H)=long (+15.0); Regime filter inaktív; 5M BOS trendirányba (+16.0); ATR nincs rendben (relatív vagy abszolút küszöb); Alacsony realised vol → magasabb RR igény; Range expanzió támogatja a momentumot (+3.0); Fib zóna konfluencia (0.618–0.886) (+18.0); Order flow neutrális (−3.9); ATR-floor override: rel_atr 0.0007 < 0.0025 → adaptív RR/TP küszöb; Regime kapu: CHOPPY miatt −10 P-score, pozícióskálázás csökkentve; ATR soft gate: alacsony volatilitás −5 P-score, méret felezve; Strukturális kapu lazítva: momentum erős, BOS hiány engedve; Liquidity gate skipped (no volume proxy available); missing: P_score>=40",,,,,,,
e69ebd05-9139-4bb8-9e02-35f3b7910d32,XAGUSD,2026-01-27T11:31:08Z,precision_arming,core,46,,1.0,20.0,,,,,,,112.69626,2026-01-27T11:30:40Z,28,,,rule,"Bias(4H→1H)=long (+15.0); Regime filter inaktív; 5M BOS trendirányba (+16.0); ATR erősség 0.87× küszöb (+10.2); Intraday range felső harmada telített (−7.0); Range expanzió támogatja a momentumot (+3.0); XAG momentum override — stop tágítva erős trendnél; XAGUSD: momentum override — stop távolság 1.3×ATR-re tágítva; Fib zóna konfluencia (0.618–0.886) (+18.0); Order flow neutrális (−4.8); P-Score reduced by 5.1 due to ATR Soft Gate tolerance; XAGUSD: momentum kitörés — RR cél 1:1.45-re szűkítve; XAG momentum override — pozícióméret csökkentve; XAG: VWAP alatt — long setup türelmet igényel; OFI z-score 1.04 támogatja az irányt; Regime kapu: CHOPPY miatt −10 P-score, pozícióskálázás csökkentve; Liquidity gate skipped (no volume proxy available); XAG stop lazítás: ATR1h alapú kockázat ×1.09; Precision trigger kész → limit figyelés; Precision limit belépő parkolva 12 percig",,,,,,,
559e4800-ac38-4834-bca4-d319205c9979,BTCUSD,2026-01-27T11:31:08Z,no entry,core,0,,1.0,2.0,,,,,,,87755.65,2026-01-27T11:30:41Z,27,,,rule,"Bias(4H→1H)=short (+15.0); Regime filter inaktív; ATR nincs rendben (relatív vagy abszolút küszöb); Alacsony realised vol → magasabb RR igény; Intraday range alsó harmada telített (−7.0); Ár 1h EMA21 zónában (+10.0); Order flow neutrális (−4.2); Order flow ellentétes irányba tolódik (−4); P-Score reduced by 4.0 due to regime CHOPPY; Range guard lazítva: napi sáv alja, de mikro-range visszapattant.; Mesterlövész mód: P-score minimum 35 érvényesítve; ATR-floor override: rel_atr 0.0008 < 0.0012 → adaptív RR/TP küszöb; Regime kapu: CHOPPY miatt −10 P-score, pozícióskálázás csökkentve; ATR soft gate: alacsony volatilitás −5 P-score, méret felezve; Precision limit belépő parkolva 20 percig; missing: P_score>=35",,,,,,,
4d14f354-a8de-473a-b4a3-163e851d6856,USOIL,2026-01-27T11:31:09Z,no entry,core_only,0,,1.0,20.0,,,,,,,60.9299,2026-01-27T11:30:40Z,28,,,rule,"Bias(4H→1H)=long (+15.0); Regime filter inaktív; ATR nincs rendben (relatív vagy abszolút küszöb); Intraday range felső harmada telített (−7.0); Ár 1h EMA21 zónában (+10.0); Order flow neutrális (−4.9); P-Score reduced by 4.0 due to regime CHOPPY; Range guard lazítva: napi sáv teteje, de mikro-range visszahúzódott.; USOIL: 1h ATR <1 USD — P-score küszöb emelve a zajos sáv miatt; USOIL: csökkenő volatilitás — RR cél 1:1.5-re igazítva; USOIL: európai délelőtt — pozícióméret ×0.75; Regime kapu: CHOPPY miatt −10 P-score, pozícióskálázás csökkentve; ATR soft gate: alacsony volatilitás −5 P-score, méret felezve; Diagnosztika: k1m: utolsó zárt gyertya 11 perc késésben van; Diagnosztika: k1m: jelzés korlátozva 11 perc késés miatt; Diagnosztika: k5m: utolsó zárt gyertya 11 perc késésben van; missing: P_score>=45",,,,,,,
