journal_id,asset,analysis_timestamp,signal,mode,probability,model_probability,realtime_confidence,leverage,entry_price,stop_loss,take_profit_1,take_profit_2,risk_reward,initial_risk_abs,spot_price,spot_timestamp,spot_latency_seconds,precision_score,anchor_bias,probability_source,notes,validation_outcome,validation_rr,max_favorable_excursion,max_adverse_excursion,time_to_outcome_minutes,slippage,execution_latency_ms,fill_timestamp,exit_timestamp,entry_kind,validation_source
59b4dbe4-f034-445c-b7ee-d5f4c87cc256,XAGUSD,2026-04-07T12:41:58Z,precision_arming,core,51,,1.0,20.0,,,,,,,72.25195,2026-04-07T12:41:30Z,27,,,rule,"Bias(4H→1H)=short (+15.0); Regime filter inaktív; 5M BOS trendirányba (+16.0); ATR erősség 0.93× küszöb (+10.6); Range expanzió támogatja a momentumot (+3.0); XAG momentum override — stop tágítva erős trendnél; XAGUSD: momentum override — stop távolság 1.3×ATR-re tágítva; Fib zóna konfluencia (0.618–0.886) (+18.0); Order flow neutrális (−4.1); P-Score reduced by 2.7 due to ATR Soft Gate tolerance; XAGUSD: momentum kitörés — RR cél 1:1.45-re szűkítve; XAGUSD breakout-védelem: gyors BE + 20% giveback limit expanziós szakaszban; XAG momentum override — pozícióméret csökkentve; XAG: VWAP felett — short setup türelmet igényel; Regime kapu: CHOPPY miatt −10 P-score, pozícióskálázás csökkentve; Strukturális soft gate: 1/3 jel + ATR/spread OK (−6 P-score, size ×0.70); Strukturális kapu lazítva: momentum erős, BOS hiány engedve; Liquidity gate skipped (no volume proxy available); XAG stop lazítás: ATR1h alapú kockázat ×1.09; Precision trigger kész → limit figyelés; Precision limit belépő parkolva 12 percig",,,,,,,,,,,
b5967ac6-5837-40e4-94fc-e0275e8fcf3b,GOLD_CFD,2026-04-07T12:41:58Z,no entry,core,4,,1.0,20.0,,,,,,,4663.46637,2026-04-07T12:41:30Z,27,,,rule,"Intraday bias gate feltételek hiányosak — 5m retest long  ATR: 5m retest long, ATR gate | 5m retest short  ATR: 5m retest short, ATR gate; Bias neutrálsávban; Regime filter inaktív; ATR nincs rendben (relatív vagy abszolút küszöb); Alacsony realised vol → magasabb RR igény; Range expanzió támogatja a momentumot (+3.0); Fib zóna konfluencia (0.618–0.886) (+18.0); Order flow neutrális (−4.8); ATR-floor override: rel_atr 0.0012 < 0.0025 → adaptív RR/TP küszöb; Regime kapu: CHOPPY miatt −10 P-score, pozícióskálázás csökkentve; ATR soft gate: alacsony volatilitás −5 P-score, méret felezve; Strukturális kapu lazítva: momentum erős, BOS hiány engedve; Liquidity gate skipped (no volume proxy available); missing: P_score>=30",,,,,,,,,,,
16ddd1d7-06c7-4534-8fc8-3880b6a5658a,EURUSD,2026-04-07T12:41:58Z,precision_arming,core,64,,1.0,30.0,,,,,,,1.15662,2026-04-07T12:41:30Z,27,,,rule,"Micro bias override: gyors struktúra dominál (+19.5); Regime filter inaktív; 5M BOS trendirányba (+16.0); ATR erősség 1.63× küszöb (+14.8); Alacsony realised vol → magasabb RR igény; Range expanzió támogatja a momentumot (+3.0); Fib zóna konfluencia (0.618–0.886) (+18.0); Order flow neutrális (−4.6); P-Score reduced by 4.0 due to regime CHOPPY; EURUSD: ATR(1h) alacsony — P-score küszöb +6 pontra emelve; Intraday P-score lazítás: micro-bias long elsőbbséget kap (−1.5); EURUSD: Visszafogott ATR — célok szűkítve, kockázat kontroll alatt; EURUSD BOS aktív, de VWAP alatt — türelem; OFI z-score 1.12 támogatja az irányt; ATR-floor override: rel_atr 0.0003 < 0.0006 → adaptív RR/TP küszöb; Regime kapu: CHOPPY miatt −10 P-score, pozícióskálázás csökkentve; Liquidity gate skipped (no volume proxy available); EURUSD stop lazítás: ATR1h alapú kockázat ×1.19; Precision trigger kész → limit figyelés; Precision limit belépő parkolva 12 percig",,,,,,,,,,,
4c78ceb4-26af-480f-b0c2-543a96ae9e38,BTCUSD,2026-04-07T12:41:58Z,buy,core,70,,1.0,2.0,68390.0,67706.1,69757.79999999999,70441.69999999998,3.0,,68390.0,2026-04-07T12:41:30Z,27,,,rule,"Bias override: Intraday 5m BOS long  ATR (+19.5); Regime filter inaktív; 5M BOS trendirányba (+16.0); ATR erősség 1.33× küszöb (+13.0); Ár az intraday range alsó zónájában (+4.0); Range expanzió támogatja a momentumot (+3.0); Fib zóna konfluencia (0.618–0.886) (+18.0); Order flow neutrális (−4.4); Mesterlövész mód: P-score minimum 35 érvényesítve; Regime kapu: CHOPPY miatt −10 P-score, pozícióskálázás csökkentve; Strukturális kapu lazítva: momentum erős, BOS hiány engedve; BTC ATR1h stop igazítás: kockázat ×1.15; TP1 nettó profit ≈ 0.60%; Precision plan: entry 68327.7–68420.9, SL 68234.4; Precision confidence medium (62.0); Precision limit belépő parkolva 20 percig; missing: tp1_net>=+0.6%",insufficient_data,,,,,,,,,market,auto
9fdf4619-ea49-4f4c-b1c4-dc1f864e4ea8,USOIL,2026-04-07T12:41:58Z,precision_arming,core,67,,1.0,20.0,,,,,,,115.10172,2026-04-07T12:41:30Z,28,,,rule,"Bias(4H→1H)=long (+15.0); Regime filter inaktív; HTF sweep ok (+10.0); 5M BOS trendirányba (+16.0); ATR erősség 1.27× küszöb (+12.6); Range expanzió támogatja a momentumot (+3.0); USOIL: erős momentum — invalid zóna 2.5×ATR(1h)-re tágítva; Fib zóna konfluencia (0.618–0.886) (+18.0); Order flow neutrális (−4.6); P-Score reduced by 4.0 due to regime CHOPPY; USOIL: 1h ATR ≥1.5 USD — RR cél 1:2-re emelve; Regime kapu: CHOPPY miatt −10 P-score, pozícióskálázás csökkentve; Liquidity gate skipped (no volume proxy available); USOIL stop lazítás: ATR1h alapú kockázat ×0.97; Precision trigger kész → limit figyelés; Precision limit belépő parkolva 12 percig",,,,,,,,,,,
