journal_id,asset,analysis_timestamp,signal,mode,probability,model_probability,realtime_confidence,leverage,entry_price,stop_loss,take_profit_1,take_profit_2,risk_reward,initial_risk_abs,spot_price,spot_timestamp,spot_latency_seconds,precision_score,anchor_bias,probability_source,notes,validation_outcome,validation_rr,max_favorable_excursion,max_adverse_excursion,time_to_outcome_minutes,slippage,execution_latency_ms
0f11d484-d900-4b32-94e8-c9d57162d891,GOLD_CFD,2026-05-25T03:06:48Z,no entry,core,1,,1.0,20.0,,,,,,,4563.01698,2026-05-25T03:06:20Z,28,,,rule,"Intraday bias gate feltételek hiányosak — 5m retest long  ATR: 5m retest long, ATR gate | 5m retest short  ATR: 5m retest short, ATR gate; Bias neutrálsávban; Regime filter inaktív; ATR nincs rendben (relatív vagy abszolút küszöb); Alacsony realised vol → magasabb RR igény; Fib zóna konfluencia (0.618–0.886) (+18.0); Order flow neutrális (−4.8); ATR-floor override: rel_atr 0.0010 < 0.0025 → adaptív RR/TP küszöb; Regime kapu: CHOPPY miatt −10 P-score, pozícióskálázás csökkentve; ATR soft gate: alacsony volatilitás −5 P-score, méret felezve; Liquidity gate skipped (no volume proxy available); missing: P_score>=30",,,,,,,
2f360a5e-3df6-4a21-b2d5-2bcb3edcbd1d,EURUSD,2026-05-25T03:06:48Z,no entry,core,0,,1.0,30.0,,,,,,,1.16371,2026-05-25T03:06:20Z,28,,,rule,"Intraday bias gate feltételek hiányosak — Micro BOS long  ATR rendben: 1m micro BOS long, ATR gate | Micro BOS short  ATR rendben: 1m micro BOS short, ATR gate; Bias neutrálsávban; Regime filter inaktív; ATR nincs rendben (relatív vagy abszolút küszöb); Alacsony realised vol → magasabb RR igény; Fib zóna konfluencia (0.618–0.886) (+18.0); Order flow neutrális (−4.3); P-Score reduced by 4.0 due to regime CHOPPY; P-Score reduced by 5.3 due to ATR Soft Gate tolerance; EURUSD: Magas volatilitás → RR célok 1:2 környékére szélesítve; EURUSD: ATR-alapú pozícióskálázás ×0.60 — volatilitás kontroll; ATR-floor override: rel_atr 0.0002 < 0.0006 → adaptív RR/TP küszöb; Regime kapu: CHOPPY miatt −10 P-score, pozícióskálázás csökkentve; ATR soft gate: alacsony volatilitás −5 P-score, méret felezve; Position size scale 0.0375 below floor 0.05 — entry blocked; Liquidity gate skipped (no volume proxy available); missing: position_sizing_floor, P_score>=38",,,,,,,
5f00365d-17ee-4041-bcc5-6e4b82fba198,XAGUSD,2026-05-25T03:06:48Z,precision_arming,core,38,,1.0,20.0,,,,,,,77.47104,2026-05-25T03:06:20Z,28,,,rule,"Bias override: Intraday Micro BOS short  ATR (ezüst) (+19.5); Regime filter inaktív; 5M BOS trendirányba (+16.0); ATR erősség 1.31× küszöb (+12.9); Range expanzió támogatja a momentumot (+3.0); XAG momentum override — stop tágítva erős trendnél; XAGUSD: momentum override — stop távolság 1.3×ATR-re tágítva; Order flow neutrális (−4.8); P-Score reduced by 4.0 due to regime CHOPPY; Intraday P-score lazítás: micro-bias short elsőbbséget kap (−2.2); Mesterlövész mód: P-score minimum 28 érvényesítve; XAGUSD: momentum kitörés — RR cél 1:1.45-re szűkítve; XAGUSD breakout-védelem: gyors BE + 20% giveback limit expanziós szakaszban; XAG momentum override — pozícióméret csökkentve; XAGUSD: ATR-alapú pozícióskálázás ×0.55; XAG: VWAP felett — short setup türelmet igényel; Regime kapu: CHOPPY miatt −10 P-score, pozícióskálázás csökkentve; Strukturális soft gate: 1/3 jel + ATR/spread OK (−6 P-score, size ×0.70); Strukturális kapu lazítva: momentum erős, BOS hiány engedve; Liquidity gate skipped (no volume proxy available); XAG stop lazítás: ATR1h alapú kockázat ×1.09; Precision trigger kész → limit figyelés; Precision limit belépő parkolva 12 percig",,,,,,,
a66d334d-edf1-4e7a-a11a-e24088cf7174,BTCUSD,2026-05-25T03:06:48Z,no entry,core,26,,1.0,2.0,,,,,,,76985.04,2026-05-25T03:06:20Z,28,,,rule,"Intraday bias gate feltételek hiányosak — Crypto momentum long: 1m micro BOS long, Momentum volume ráta | Crypto momentum short: 1m micro BOS short, Momentum volume ráta | 5m BOS long  ATR: 5m BOS long | 5m BOS short  ATR: 5m BOS short | Micro BOS short  ATR (momentum nélkül): 1m micro BOS short; Bias neutrálsávban; Regime filter inaktív; ATR erősség 1.81× küszöb (+15.9); Fib zóna konfluencia (0.618–0.886) (+18.0); Order flow neutrális (−4.9); P-Score reduced by 4.0 due to regime CHOPPY; Mesterlövész mód: P-score minimum 35 érvényesítve; Regime kapu: CHOPPY miatt −10 P-score, pozícióskálázás csökkentve; missing: P_score>=35",,,,,,,
3d812cc9-6c55-4faa-8afd-c0897b494c48,USOIL,2026-05-25T03:06:48Z,no entry,core_only,66,,1.0,20.0,95.36117,97.001561165,92.736544136,91.42423120400001,2.4,,95.36117,2026-05-25T03:06:20Z,28,,,rule,"Bias override: 1h trend short + momentum támogatás (+19.5); EMA21 slope 1.03× küszöb (+12.2); 5M BOS trendirányba (+16.0); ATR nincs rendben (relatív vagy abszolút küszöb); Range expanzió támogatja a momentumot (+3.0); USOIL: erős momentum — invalid zóna 2.5×ATR(1h)-re tágítva; Fib zóna konfluencia (0.618–0.886) (+18.0); Order flow neutrális (−4.9); USOIL: 1h ATR ≥1.5 USD — RR cél 1:2-re emelve; USOIL: ázsiai sáv — pozícióméret ×0.70; OFI z-score -1.49 támogatja az irányt; ATR soft gate: alacsony volatilitás −5 P-score, méret felezve; USOIL stop lazítás: ATR1h alapú kockázat ×0.97; Diagnosztika: k1m: utolsó zárt gyertya 10 perc késésben van; Diagnosztika: k1m: jelzés korlátozva 10 perc késés miatt; Diagnosztika: k5m: utolsó zárt gyertya 11 perc késésben van; Diagnosztika: k1h: utolsó zárt gyertya 66 perc késésben van",,,,,,,
