journal_id,asset,analysis_timestamp,signal,mode,probability,model_probability,realtime_confidence,leverage,entry_price,stop_loss,take_profit_1,take_profit_2,risk_reward,initial_risk_abs,spot_price,spot_timestamp,spot_latency_seconds,precision_score,anchor_bias,probability_source,notes,validation_outcome,validation_rr,max_favorable_excursion,max_adverse_excursion,time_to_outcome_minutes,slippage,execution_latency_ms
6fb966bf-5558-4a24-b9b6-9830b29b80e6,GOLD_CFD,2026-04-02T15:41:04Z,no entry,core,0,,1.0,20.0,,,,,,,4671.66524,2026-04-02T15:40:32Z,32,,,rule,"Intraday bias gate feltételek hiányosak — 5m retest long  ATR: 5m retest long, ATR gate | 5m retest short  ATR: 5m retest short, ATR gate; Bias neutrálsávban; Regime filter inaktív; London–NY overlap profil (-1.0); ATR nincs rendben (relatív vagy abszolút küszöb); Ár 1h EMA21 zónában (+10.0); Order flow neutrális (−4.5); P-Score reduced by 4.0 due to regime CHOPPY; ATR-floor override: rel_atr 0.0025 < 0.0025 → adaptív RR/TP küszöb; Regime kapu: CHOPPY miatt −10 P-score, pozícióskálázás csökkentve; ATR soft gate: alacsony volatilitás −5 P-score, méret felezve; Liquidity gate skipped (no volume proxy available); missing: P_score>=30",,,,,,,
b3d64c61-0574-493b-945a-fb38abe33b0b,XAGUSD,2026-04-02T15:41:04Z,no entry,core,47,,1.0,20.0,,,,,,,72.2732,2026-04-02T15:40:32Z,32,,,rule,"Intraday bias gate feltételek hiányosak — Micro BOS long  ATR (ezüst): 1m micro BOS long | Micro BOS short  ATR (ezüst): 1m micro BOS short; Bias neutrálsávban; EMA21 slope 1.30× küszöb (+13.8); London–NY overlap profil (-1.0); ATR erősség 2.54× küszöb (+20.3); Ár 1h EMA21 zónában (+10.0); Order flow neutrális (−4.6); XAGUSD breakout-védelem: gyors BE + 20% giveback limit expanziós szakaszban; XAGUSD: ATR-alapú pozícióskálázás ×0.55; Strukturális soft gate: 1/3 jel + ATR/spread OK (−6 P-score, size ×0.70); Strukturális kapu lazítva: momentum erős, BOS hiány engedve; Liquidity gate skipped (no volume proxy available)",,,,,,,
56b0128a-8211-4ef4-ab4f-7f6da1c61ea0,EURUSD,2026-04-02T15:41:04Z,no entry,core,23,,1.0,30.0,,,,,,,1.15505,2026-04-02T15:40:32Z,32,,,rule,"Intraday bias gate feltételek hiányosak — Micro BOS long  ATR rendben: 1m micro BOS long | Micro BOS short  ATR rendben: 1m micro BOS short; Bias neutrálsávban; Regime filter inaktív; London–NY overlap profil (-1.0); ATR erősség 2.72× küszöb (+21.3); Alacsony realised vol → magasabb RR igény; Ár 1h EMA21 zónában (+10.0); Order flow neutrális (−4.1); P-Score reduced by 4.0 due to regime CHOPPY; Regime kapu: CHOPPY miatt −10 P-score, pozícióskálázás csökkentve; Liquidity gate skipped (no volume proxy available); missing: P_score>=38",,,,,,,
68ea21f1-d94d-46a0-a420-a1a014c02195,NVDA,2026-04-02T15:41:04Z,no entry,core,37,,1.0,5.0,176.74,178.55087318607144,172.5749916720357,170.22085653014284,3.6,,176.74,2026-04-02T15:40:32Z,32,,,rule,"Mean reversion bias override (+19.5); Regime filter inaktív; London–NY overlap profil (-1.0); ATR erősség 0.99× küszöb (+10.9); WARNING: No Liquidity Structure (Nearest: 178.568830, Dist: 2.37ATR); Ár az intraday range felső zónájában (+4.0); Fib zóna konfluencia (0.618–0.886) (+18.0); Order flow neutrális (−3.9); P-Score reduced by 4.0 due to regime CHOPPY; P-Score reduced by 0.3 due to ATR Soft Gate tolerance; Regime kapu: CHOPPY miatt −10 P-score, pozícióskálázás csökkentve; Strukturális soft gate: 1/3 jel + ATR/spread OK (−6 P-score, size ×0.70); Strukturális kapu lazítva: momentum erős, BOS hiány engedve; P-score soft gate: −0.5 pont tolerancia (size ×0.65, RR +0.15); NVDA ATR1h stop igazítás: kockázat ×1.04; missing: precision_flow_alignment",,,,,,,
f0fef683-83ff-482c-9aa0-cbf31a37e5ad,USOIL,2026-04-02T15:41:05Z,no entry,core_only,92,,1.0,20.0,110.078368,107.912271424,115.0603901248,117.8763156736,3.6,,110.078368,2026-04-02T15:40:32Z,33,,,rule,Bias(4H→1H)=long (+15.0); EMA21 slope 2.56× küszöb (+21.0); HTF sweep ok (+10.0); 5M BOS trendirányba (+16.0); London–NY overlap profil (-1.0); ATR erősség 2.14× küszöb (+17.8); Range expanzió támogatja a momentumot (+3.0); USOIL: erős momentum — invalid zóna 2.5×ATR(1h)-re tágítva; Order flow neutrális (−4.5); USOIL: parabolikus lendület — RR cél 1:1.4 környékére szűkítve; USOIL stop lazítás: ATR1h alapú kockázat ×0.97; Diagnosztika: k1m: utolsó zárt gyertya 11 perc késésben van; Diagnosztika: k1m: jelzés korlátozva 11 perc késés miatt; Diagnosztika: k5m: utolsó zárt gyertya 11 perc késésben van,,,,,,,
7858e4e0-c6e6-422a-b747-7267c74c87b0,BTCUSD,2026-04-02T15:41:05Z,precision_arming,core,36,,1.0,2.0,,,,,,,66917.24,2026-04-02T15:40:32Z,33,,,rule,"Bias(4H→1H)=short (+15.0); Regime filter inaktív; London–NY overlap profil (-1.0); ATR erősség 2.35× küszöb (+19.1); Ár az intraday range felső zónájában (+4.0); Ár 1h EMA21 zónában (+10.0); Order flow neutrális (−4.1); Order flow ellentétes irányba tolódik (−4); P-Score reduced by 4.0 due to regime CHOPPY; Mesterlövész mód: P-score minimum 35 érvényesítve; Regime kapu: CHOPPY miatt −10 P-score, pozícióskálázás csökkentve; BTC ATR1h stop igazítás: kockázat ×1.15; Precision trigger kész → limit figyelés; Precision limit belépő parkolva 20 percig",,,,,,,
