journal_id,asset,analysis_timestamp,signal,mode,probability,model_probability,realtime_confidence,leverage,entry_price,stop_loss,take_profit_1,take_profit_2,risk_reward,initial_risk_abs,spot_price,spot_timestamp,spot_latency_seconds,precision_score,anchor_bias,probability_source,notes,validation_outcome,validation_rr,max_favorable_excursion,max_adverse_excursion,time_to_outcome_minutes,slippage,execution_latency_ms
5bf7c5d0-8a51-45a0-95a0-8299b04f6af7,NVDA,2026-05-01T15:46:34Z,no entry,core,26,,1.0,5.0,,,,,,,199.54,2026-05-01T15:46:02Z,32,,,rule,"Intraday bias gate feltételek hiányosak — EMA9×21 long  magas ATR: EMA9×21 long, Magas ATR megerősítés | EMA9×21 short  magas ATR: EMA9×21 short, Magas ATR megerősítés | 5m BOS short  ATR (momentum nélkül): 5m BOS short, ATR gate; Bias neutrálsávban; EMA21 slope 1.05× küszöb (+12.3); London–NY overlap profil (-1.0); ATR nincs rendben (relatív vagy abszolút küszöb); WARNING: No Liquidity Structure (Nearest: 197.113756, Dist: 3.58ATR); Fib zóna konfluencia (0.618–0.886) (+18.0); Order flow neutrális (−4.3); ATR soft gate: alacsony volatilitás −5 P-score, méret felezve; missing: P_score>=38",,,,,,,
cec209b4-82e9-4928-ad47-0d796f2901aa,EURUSD,2026-05-01T15:46:34Z,no entry,core,26,,1.0,30.0,,,,,,,1.17628,2026-05-01T15:46:01Z,33,,,rule,"Bias(4H→1H)=long (+15.0); Regime filter inaktív; HTF sweep ok (+10.0); London–NY overlap profil (-1.0); ATR erősség 1.78× küszöb (+15.7); Alacsony realised vol → magasabb RR igény; Order flow neutrális (−4.0); OFI toxikus long irányra (−6.7); P-Score reduced by 4.0 due to regime CHOPPY; EURUSD: ATR(1h) alacsony — P-score küszöb +6 pontra emelve; EURUSD: Visszafogott ATR — célok szűkítve, kockázat kontroll alatt; EURUSD BOS aktív, de VWAP alatt — türelem; ATR-floor override: rel_atr 0.0004 < 0.0006 → adaptív RR/TP küszöb; Regime kapu: CHOPPY miatt −10 P-score, pozícióskálázás csökkentve; Liquidity gate skipped (no volume proxy available); missing: P_score>=44",,,,,,,
b10c4ade-691f-4af7-a699-0196a20c45f1,GOLD_CFD,2026-05-01T15:46:34Z,no entry,core,1,,1.0,20.0,,,,,,,4643.25135,2026-05-01T15:46:02Z,32,,,rule,"Bias(4H→1H)=short (+15.0); Regime filter inaktív; London–NY overlap profil (-1.0); ATR nincs rendben (relatív vagy abszolút küszöb); Ár az intraday range felső zónájában (+4.0); Order flow neutrális (−4.9); ATR-floor override: rel_atr 0.0015 < 0.0025 → adaptív RR/TP küszöb; Fém irány guard: 5m trend ellentétes a belépési biasszal; Regime kapu: CHOPPY miatt −10 P-score, pozícióskálázás csökkentve; ATR soft gate: alacsony volatilitás −5 P-score, méret felezve; Liquidity gate skipped (no volume proxy available); missing: metal_bias_5m_alignment, P_score>=30",,,,,,,
30b69628-4193-4d79-a06b-2e09937ff025,XAGUSD,2026-05-01T15:46:34Z,no entry,core,8,,1.0,20.0,,,,,,,76.26382,2026-05-01T15:46:01Z,33,,,rule,"Intraday bias gate feltételek hiányosak — Micro BOS long  ATR (ezüst): 1m micro BOS long | Micro BOS short  ATR (ezüst): 1m micro BOS short; Bias neutrálsávban; Regime filter inaktív; London–NY overlap profil (-1.0); ATR erősség 1.88× küszöb (+16.3); Order flow neutrális (−4.2); P-Score reduced by 4.0 due to regime CHOPPY; XAGUSD breakout-védelem: gyors BE + 20% giveback limit expanziós szakaszban; XAGUSD: ATR-alapú pozícióskálázás ×0.55; Regime kapu: CHOPPY miatt −10 P-score, pozícióskálázás csökkentve; Liquidity gate skipped (no volume proxy available); missing: P_score>=28",,,,,,,
bfa2754b-c215-4438-8c14-de8146db3165,USOIL,2026-05-01T15:46:34Z,no entry,core_only,22,,1.0,20.0,,,,,,,101.93009,2026-05-01T15:46:02Z,32,,,rule,"Bias(4H→1H)=long (+15.0); Regime filter inaktív; London–NY overlap profil (-1.0); ATR erősség 1.21× küszöb (+12.2); Ár az intraday range alsó zónájában (+4.0); Order flow neutrális (−4.8); P-Score reduced by 4.0 due to regime CHOPPY; USOIL: parabolikus lendület — RR cél 1:1.4 környékére szűkítve; USOIL: oldalazó szerkezet — H1/M5 BOS nélkül nincs belépő; Regime kapu: CHOPPY miatt −10 P-score, pozícióskálázás csökkentve; Diagnosztika: k1m: utolsó zárt gyertya 11 perc késésben van; Diagnosztika: k1m: jelzés korlátozva 11 perc késés miatt; Diagnosztika: k5m: utolsó zárt gyertya 11 perc késésben van; missing: P_score>=36",,,,,,,
146499aa-3653-452f-b628-c0b92ecda9f9,BTCUSD,2026-05-01T15:46:34Z,no entry,core,31,,1.0,2.0,,,,,,,78666.56,2026-05-01T15:46:02Z,32,,,rule,"Mean reversion bias override (+19.5); Regime filter inaktív; London–NY overlap profil (-1.0); ATR erősség 1.86× küszöb (+16.2); Ár az intraday range felső zónájában (+4.0); Order flow neutrális (−4.4); P-Score reduced by 4.0 due to regime CHOPPY; Mesterlövész mód: P-score minimum 35 érvényesítve; Regime kapu: CHOPPY miatt −10 P-score, pozícióskálázás csökkentve; Precision limit belépő parkolva 20 percig; missing: P_score>=35",,,,,,,
