journal_id,asset,analysis_timestamp,signal,mode,probability,model_probability,realtime_confidence,leverage,entry_price,stop_loss,take_profit_1,take_profit_2,risk_reward,initial_risk_abs,spot_price,spot_timestamp,spot_latency_seconds,precision_score,anchor_bias,probability_source,notes,validation_outcome,validation_rr,max_favorable_excursion,max_adverse_excursion,time_to_outcome_minutes,slippage,execution_latency_ms
b9ed4e7f-92d0-4af2-813e-c3d552b7f521,EURUSD,2026-01-21T03:50:50Z,precision_arming,core,60,,1.0,30.0,,,,,,,1.17157,2026-01-21T03:50:23Z,27,,,rule,"Mean reversion bias override (+19.5); Regime filter inaktív; 5M BOS trendirányba (+16.0); ATR erősség 1.20× küszöb (+12.2); Alacsony realised vol → magasabb RR igény; Ár az intraday range alsó zónájában (+4.0); Range expanzió támogatja a momentumot (+3.0); Fib zóna konfluencia (0.618–0.886) (+18.0); Order flow neutrális (−3.4); P-Score reduced by 4.0 due to regime CHOPPY; EURUSD: ATR(1h) alacsony — P-score küszöb +6 pontra emelve; EURUSD: Visszafogott ATR — célok szűkítve, kockázat kontroll alatt; EURUSD BOS aktív, de VWAP alatt — türelem; ATR-floor override: rel_atr 0.0002 < 0.0006 → adaptív RR/TP küszöb; Regime kapu: CHOPPY miatt −10 P-score, pozícióskálázás csökkentve; Strukturális soft gate: 1/3 jel + ATR/spread OK (−6 P-score, size ×0.70); Strukturális kapu lazítva: momentum erős, BOS hiány engedve; Liquidity gate skipped (no volume proxy available); Precision trigger kész → limit figyelés; Precision limit belépő parkolva 12 percig",,,,,,,
1fad2ecd-a59b-41b5-8378-efbdfbd77989,XAGUSD,2026-01-21T03:50:50Z,precision_arming,core,50,,1.0,20.0,,,,,,,93.7989,2026-01-21T03:50:23Z,27,,,rule,"Bias(4H→1H)=long (+15.0); Regime filter inaktív; 5M BOS trendirányba (+16.0); ATR erősség 1.79× küszöb (+15.7); Ár az intraday range alsó zónájában (+4.0); Range expanzió támogatja a momentumot (+3.0); XAG momentum override — stop tágítva erős trendnél; XAGUSD: momentum override — stop távolság 1.3×ATR-re tágítva; Ár 1h EMA21 zónában (+10.0); Order flow neutrális (−4.4); P-Score reduced by 4.0 due to regime CHOPPY; XAGUSD: momentum kitörés — RR cél 1:1.45-re szűkítve; XAG momentum override — pozícióméret csökkentve; XAGUSD: ATR-alapú pozícióskálázás ×0.55; XAG: VWAP alatt — long setup türelmet igényel; Regime kapu: CHOPPY miatt −10 P-score, pozícióskálázás csökkentve; Strukturális soft gate: 1/3 jel + ATR/spread OK (−6 P-score, size ×0.70); Strukturális kapu lazítva: momentum erős, BOS hiány engedve; Liquidity gate skipped (no volume proxy available); Precision trigger kész → limit figyelés; Precision limit belépő parkolva 12 percig",,,,,,,
89fdae19-a0c0-408f-aa78-cb0f5c164810,GOLD_CFD,2026-01-21T03:50:50Z,precision_arming,core,35,,1.0,20.0,,,,,,,4841.00804,2026-01-21T03:50:23Z,27,,,rule,"Bias(4H→1H)=long (+15.0); Regime filter inaktív; HTF sweep ok (+10.0); 5M BOS trendirányba (+16.0); ATR erősség 1.75× küszöb (+15.5); Alacsony realised vol → magasabb RR igény; Intraday range felső harmada telített (−7.0); Range expanzió támogatja a momentumot (+3.0); Order flow neutrális (−3.5); OFI toxikus long irányra (−5.0); P-Score reduced by 4.0 due to regime CHOPPY; VWAP alatt — GOLD long breakout késleltetve; ATR-floor override: rel_atr 0.0014 < 0.0025 → adaptív RR/TP küszöb; Regime kapu: CHOPPY miatt −10 P-score, pozícióskálázás csökkentve; Strukturális soft gate: 1/3 jel + ATR/spread OK (−6 P-score, size ×0.70); Strukturális kapu lazítva: momentum erős, BOS hiány engedve; Liquidity gate skipped (no volume proxy available); GOLD stop lazítás: ATR alapú kockázat ×2.00; Precision trigger kész → limit figyelés; Precision limit belépő parkolva 12 percig",,,,,,,
f7343d0c-3195-41a6-b676-a0bbfd191c68,BTCUSD,2026-01-21T03:50:50Z,precision_arming,core,79,,1.0,2.0,,,,,,,89391.92,2026-01-21T03:50:23Z,27,,,rule,"Bias override: Intraday 5m BOS long  ATR (+19.5); EMA21 slope 1.26× küszöb (+13.6); 5M BOS trendirányba (+16.0); ATR erősség 0.96× küszöb (+10.8); Intraday range felső harmada telített (−7.0); Range expanzió támogatja a momentumot (+3.0); Fib zóna konfluencia (0.618–0.886) (+18.0); Order flow neutrális (−4.6); Order flow ellentétes irányba tolódik (−4); P-Score reduced by 1.4 due to ATR Soft Gate tolerance; Strukturális kapu lazítva: momentum erős, BOS hiány engedve; BTC ATR stop igazítás: kockázat ×2.20; Precision trigger kész → limit figyelés; Precision limit belépő parkolva 20 percig",,,,,,,
98d17c29-7b0d-43ed-b9f1-eedc082b09c5,USOIL,2026-01-21T03:50:50Z,no entry,core_only,15,,1.0,20.0,,,,,,,59.77322,2026-01-21T03:50:23Z,27,,,rule,"Bias(4H→1H)=long (+15.0); Regime filter inaktív; ATR nincs rendben (relatív vagy abszolút küszöb); Fib zóna konfluencia (0.618–0.886) (+18.0); Order flow neutrális (−4.8); P-Score reduced by 1.6 due to ATR Soft Gate tolerance; USOIL: 1h ATR <1 USD — P-score küszöb emelve a zajos sáv miatt; USOIL: csökkenő volatilitás — RR cél 1:1.5-re igazítva; Regime kapu: CHOPPY miatt −10 P-score, pozícióskálázás csökkentve; ATR soft gate: alacsony volatilitás −5 P-score, méret felezve; Diagnosztika: k1m: utolsó zárt gyertya 8 perc késésben van; Diagnosztika: k1m: jelzés korlátozva 8 perc késés miatt; Diagnosztika: k5m: utolsó zárt gyertya 10 perc késésben van; missing: P_score>=27",,,,,,,
