journal_id,asset,analysis_timestamp,signal,mode,probability,model_probability,realtime_confidence,leverage,entry_price,stop_loss,take_profit_1,take_profit_2,risk_reward,initial_risk_abs,spot_price,spot_timestamp,spot_latency_seconds,precision_score,anchor_bias,probability_source,notes,validation_outcome,validation_rr,max_favorable_excursion,max_adverse_excursion,time_to_outcome_minutes,slippage,execution_latency_ms
a4f96a68-d4b6-4a2c-a7e0-e2978a62d5fd,GOLD_CFD,2026-06-03T23:36:28Z,precision_arming,core,32,,1.0,20.0,,,,,,,4450.07971,2026-06-03T23:36:08Z,20,,,rule,"Micro bias override: gyors struktúra dominál (+19.5); Regime filter inaktív; HTF sweep ok (+10.0); 5M BOS trendirányba (+16.0); Zárási sáv likviditás büntetés (-2.0); ATR nincs rendben (relatív vagy abszolút küszöb); Alacsony realised vol → magasabb RR igény; Intraday range felső harmada telített (−7.0); Range expanzió támogatja a momentumot (+3.0); Fib zóna konfluencia (0.618–0.886) (+18.0); Order flow neutrális (−4.1); OFI toxikus long irányra (−5.3); P-Score reduced by 4.0 due to regime CHOPPY; Intraday P-score lazítás: micro-bias long elsőbbséget kap (−1.5); Mesterlövész mód: P-score minimum 30 érvényesítve; VWAP alatt — GOLD long breakout késleltetve; ATR-floor override: rel_atr 0.0012 < 0.0025 → adaptív RR/TP küszöb; Regime kapu: CHOPPY miatt −10 P-score, pozícióskálázás csökkentve; ATR soft gate: alacsony volatilitás −5 P-score, méret felezve; Strukturális kapu lazítva: momentum erős, BOS hiány engedve; Liquidity gate skipped (no volume proxy available); GOLD stop lazítás: ATR1h alapú kockázat ×1.09; Trend alignment: COUNTER — TP1 minimum szigorítva (+0.07%); Precision trigger kész → limit figyelés; Precision limit belépő parkolva 12 percig",,,,,,,
e250aced-898d-48bd-aeb3-074196311c4d,XAGUSD,2026-06-03T23:36:28Z,precision_arming,core,46,,1.0,20.0,,,,,,,73.1469,2026-06-03T23:36:08Z,20,,,rule,"Bias(4H→1H)=short (+15.0); Regime filter inaktív; HTF sweep ok (+10.0); Zárási sáv likviditás büntetés (-2.0); ATR erősség 0.91× küszöb (+10.5); Ár az intraday range felső zónájában (+4.0); Fib zóna konfluencia (0.618–0.886) (+18.0); Order flow neutrális (−3.2); P-Score reduced by 4.0 due to regime CHOPPY; P-Score reduced by 3.5 due to ATR Soft Gate tolerance; XAGUSD: visszafogott ATR — RR cél 1:1.7-re emelve; XAGUSD breakout-védelem: gyors BE + 20% giveback limit expanziós szakaszban; XAGUSD: ATR-alapú pozícióskálázás ×0.70; XAG: VWAP felett — short setup türelmet igényel; OFI z-score -1.28 támogatja az irányt; ATR-floor override: rel_atr 0.0017 < 0.0018 → adaptív RR/TP küszöb; Regime kapu: CHOPPY miatt −10 P-score, pozícióskálázás csökkentve; Liquidity gate skipped (no volume proxy available); XAG stop lazítás: ATR1h alapú kockázat ×1.03; Precision trigger kész → limit figyelés; Precision limit belépő parkolva 12 percig",,,,,,,
282ef06e-9395-41a8-87f9-8b3b96d05ce6,EURUSD,2026-06-03T23:36:28Z,precision_arming,core,63,,1.0,30.0,,,,,,,1.16065,2026-06-03T23:36:08Z,20,,,rule,"Bias(4H→1H)=short (+15.0); Regime filter inaktív; HTF sweep ok (+10.0); 5M BOS trendirányba (+16.0); Zárási sáv likviditás büntetés (-2.0); ATR erősség 1.26× küszöb (+12.6); Alacsony realised vol → magasabb RR igény; Ár az intraday range felső zónájában (+4.0); Range expanzió támogatja a momentumot (+3.0); Fib zóna konfluencia (0.618–0.886) (+18.0); Order flow neutrális (−4.6); P-Score reduced by 4.0 due to regime CHOPPY; EURUSD: ATR(1h) alacsony — P-score küszöb +6 pontra emelve; EURUSD: Visszafogott ATR — célok szűkítve, kockázat kontroll alatt; EURUSD BOS aktív, de VWAP felett — várakozás; ATR-floor override: rel_atr 0.0002 < 0.0006 → adaptív RR/TP küszöb; Regime kapu: CHOPPY miatt −10 P-score, pozícióskálázás csökkentve; Strukturális soft gate: 1/3 jel + ATR/spread OK (−6 P-score, size ×0.70); Strukturális kapu lazítva: momentum erős, BOS hiány engedve; Liquidity gate skipped (no volume proxy available); Precision trigger kész → limit figyelés; Precision limit belépő parkolva 12 percig",,,,,,,
c3836a2d-6e37-4ebd-8d1f-3d102328d8da,BTCUSD,2026-06-03T23:36:28Z,precision_arming,core,62,,1.0,2.0,,,,,,,64431.25,2026-06-03T23:36:08Z,20,,,rule,"Bias(4H→1H)=short (+15.0); EMA21 slope 1.26× küszöb (+13.6); 5M BOS trendirányba (+16.0); Zárási sáv likviditás büntetés (-2.0); ATR erősség 1.35× küszöb (+13.1); Intraday range alsó harmada telített (−7.0); Range expanzió támogatja a momentumot (+3.0); Order flow neutrális (−4.2); Sell pressure támogatja a setupot (+5); Mesterlövész mód: P-score minimum 35 érvényesítve; OFI z-score -1.15 támogatja az irányt; Strukturális soft gate: 1/3 jel + ATR/spread OK (−6 P-score, size ×0.70); Likviditási kapu lazítva erős momentum miatt; BTC ATR1h stop igazítás: kockázat ×1.15; Precision trigger kész → limit figyelés; Precision limit belépő parkolva 20 percig",,,,,,,
5ebb6d4c-7ed2-48e8-b431-0877adadb032,USOIL,2026-06-03T23:36:28Z,market closed,session_closed,0,,1.0,20.0,,,,,,,97.59527,2026-06-03T23:36:08Z,20,,,rule,"Piac zárva (nyitáson kívül); Intraday bias gate feltételek hiányosak — USOIL retest long  ATR: 5m retest long, ATR gate | USOIL retest short  ATR: 5m retest short, ATR gate; Bias neutrálsávban; Regime filter inaktív; Zárási sáv likviditás büntetés (-2.0); ATR nincs rendben (relatív vagy abszolút küszöb); Range expanzió támogatja a momentumot (+3.0); USOIL: erős momentum — invalid zóna 2.5×ATR(1h)-re tágítva; Fib zóna konfluencia (0.618–0.886) (+18.0); Order flow neutrális (−4.2); P-Score reduced by 4.0 due to regime CHOPPY; USOIL: parabolikus lendület — RR cél 1:1.4 környékére szűkítve; USOIL: nyitás előtti sáv — pozícióméret ×0.75; Regime kapu: CHOPPY miatt −10 P-score, pozícióskálázás csökkentve; ATR soft gate: alacsony volatilitás −5 P-score, méret felezve; Strukturális kapu lazítva: momentum erős, BOS hiány engedve; Liquidity gate skipped (no volume proxy available); missing: session, P_score>=36",,,,,,,
