journal_id,asset,analysis_timestamp,signal,mode,probability,model_probability,realtime_confidence,leverage,entry_price,stop_loss,take_profit_1,take_profit_2,risk_reward,initial_risk_abs,spot_price,spot_timestamp,spot_latency_seconds,precision_score,anchor_bias,probability_source,notes,validation_outcome,validation_rr,max_favorable_excursion,max_adverse_excursion,time_to_outcome_minutes,slippage,execution_latency_ms
05bb7771-3223-4e58-9a3f-99fed0e37ed3,EURUSD,2026-05-11T13:36:17Z,no entry,core,8,,1.0,30.0,,,,,,,1.17812,2026-05-11T13:35:52Z,24,,,rule,"Intraday bias gate feltételek hiányosak — Micro BOS long  ATR rendben: 1m micro BOS long | Micro BOS short  ATR rendben: 1m micro BOS short; Bias neutrálsávban; Regime filter inaktív; London–NY overlap profil (-1.0); ATR erősség 1.84× küszöb (+16.0); Alacsony realised vol → magasabb RR igény; Order flow neutrális (−3.8); P-Score reduced by 4.0 due to regime CHOPPY; EURUSD: ATR(1h) alacsony — P-score küszöb +6 pontra emelve; EURUSD: Visszafogott ATR — célok szűkítve, kockázat kontroll alatt; ATR-floor override: rel_atr 0.0004 < 0.0006 → adaptív RR/TP küszöb; Regime kapu: CHOPPY miatt −10 P-score, pozícióskálázás csökkentve; Liquidity gate skipped (no volume proxy available); missing: P_score>=44",,,,,,,
4a85b20a-4a80-43cd-a1fb-93f06eb08b4c,GOLD_CFD,2026-05-11T13:36:17Z,no entry,core,3,,1.0,20.0,,,,,,,4735.14596,2026-05-11T13:35:52Z,24,,,rule,"Mean reversion bias override (+19.5); Regime filter inaktív; London–NY overlap profil (-1.0); ATR nincs rendben (relatív vagy abszolút küszöb); Ár az intraday range felső zónájában (+4.0); Order flow neutrális (−3.4); P-Score reduced by 4.0 due to regime CHOPPY; ATR-floor override: rel_atr 0.0019 < 0.0025 → adaptív RR/TP küszöb; Fém irány guard: 5m trend ellentétes a belépési biasszal; Regime kapu: CHOPPY miatt −10 P-score, pozícióskálázás csökkentve; ATR soft gate: alacsony volatilitás −5 P-score, méret felezve; Liquidity gate skipped (no volume proxy available); missing: metal_bias_5m_alignment, P_score>=30",,,,,,,
ce6358ac-b116-4ad1-a6ac-a48c2638a2e0,NVDA,2026-05-11T13:36:17Z,precision_arming,core,60,,1.0,5.0,,,,,,,215.36,2026-05-11T13:35:52Z,25,,,rule,"Bias(4H→1H)=long (+15.0); EMA21 slope 1.02× küszöb (+12.1); 5M BOS trendirányba (+16.0); London–NY overlap profil (-1.0); ATR nincs rendben (relatív vagy abszolút küszöb); WARNING: No Liquidity Structure (Nearest: 197.190953, Dist: 36.26ATR); Range expanzió támogatja a momentumot (+3.0); Fib zóna konfluencia (0.618–0.886) (+18.0); Order flow neutrális (−3.9); NVDA: magas napi ATR + momentum — P-score küszöb lazítva; Intraday P-score lazítás: micro-bias long elsőbbséget kap (−1.5); Mesterlövész mód: P-score minimum 35 érvényesítve; NVDA: nyitási BOS/momentum elfogadva — early session bias; ATR soft gate: alacsony volatilitás −5 P-score, méret felezve; NVDA ATR1h stop igazítás: kockázat ×1.03; Precision trigger kész → limit figyelés; Precision limit belépő parkolva 12 percig",,,,,,,
bf8c913e-0369-4c0b-999b-c0f8703bd8de,XAGUSD,2026-05-11T13:36:17Z,precision_arming,core,38,,1.0,20.0,,,,,,,85.30845,2026-05-11T13:35:52Z,24,,,rule,"Bias(4H→1H)=long (+15.0); Regime filter inaktív; 5M BOS trendirányba (+16.0); London–NY overlap profil (-1.0); ATR erősség 3.11× küszöb (+23.0); Intraday range felső harmada telített (−7.0); Range expanzió támogatja a momentumot (+3.0); XAG momentum override — stop tágítva erős trendnél; XAGUSD: momentum override — stop távolság 1.3×ATR-re tágítva; Order flow neutrális (−2.0); P-Score reduced by 4.0 due to regime CHOPPY; Intraday P-score lazítás: micro-bias long elsőbbséget kap (−1.5); Mesterlövész mód: P-score minimum 28 érvényesítve; XAGUSD: momentum kitörés — RR cél 1:1.45-re szűkítve; XAGUSD breakout-védelem: gyors BE + 20% giveback limit expanziós szakaszban; XAG momentum override — pozícióméret csökkentve; XAGUSD: ATR-alapú pozícióskálázás ×0.55; XAG: VWAP alatt — long setup türelmet igényel; Regime kapu: CHOPPY miatt −10 P-score, pozícióskálázás csökkentve; Strukturális soft gate: 1/3 jel + ATR/spread OK (−6 P-score, size ×0.70); Strukturális kapu lazítva: momentum erős, BOS hiány engedve; Liquidity gate skipped (no volume proxy available); XAG stop lazítás: ATR1h alapú kockázat ×1.09; Precision trigger kész → limit figyelés; Precision limit belépő parkolva 12 percig",,,,,,,
787c2dfe-c9ac-415c-b1d9-0f253bfb52d1,USOIL,2026-05-11T13:36:17Z,no entry,core,11,,1.0,20.0,,,,,,,98.044559,2026-05-11T13:35:52Z,25,,,rule,"Intraday bias gate feltételek hiányosak — USOIL retest long  ATR: 5m retest long | USOIL retest short  ATR: 5m retest short; Bias neutrálsávban; Regime filter inaktív; London–NY overlap profil (-1.0); ATR erősség 0.91× küszöb (+10.5); Fib zóna konfluencia (0.618–0.886) (+18.0); Order flow neutrális (−4.5); P-Score reduced by 4.0 due to regime CHOPPY; P-Score reduced by 3.5 due to ATR Soft Gate tolerance; USOIL: 1h ATR ≥1.5 USD — RR cél 1:2-re emelve; Regime kapu: CHOPPY miatt −10 P-score, pozícióskálázás csökkentve; Strukturális soft gate: 1/3 jel + ATR/spread OK (−6 P-score, size ×0.70); Strukturális kapu lazítva: momentum erős, BOS hiány engedve; Liquidity gate skipped (no volume proxy available); missing: P_score>=36",,,,,,,
340a045a-ff06-42ed-a6df-ee1ee7697bf7,BTCUSD,2026-05-11T13:36:18Z,precision_arming,core,67,,1.0,2.0,,,,,,,80872.91,2026-05-11T13:35:52Z,25,,,rule,"Micro bias override: gyors struktúra dominál (+19.5); Regime filter inaktív; 5M BOS trendirányba (+16.0); London–NY overlap profil (-1.0); ATR erősség 1.52× küszöb (+14.1); Alacsony realised vol → magasabb RR igény; Range expanzió támogatja a momentumot (+3.0); ema9x21+ofi_z=-999.00; Fib zóna konfluencia (0.618–0.886) (+18.0); Order flow neutrális (−4.8); Sell pressure támogatja a setupot (+5); P-Score reduced by 4.0 due to regime CHOPPY; Intraday P-score lazítás: micro-bias short elsőbbséget kap (−2.2); Mesterlövész mód: P-score minimum 35 érvényesítve; BTC momentum override — pozícióméret csökkentve; BTC mikro BOS short aktív; OFI z-score -1.22 támogatja az irányt; Regime kapu: CHOPPY miatt −10 P-score, pozícióskálázás csökkentve; Precision trigger kész → limit figyelés; Precision limit belépő parkolva 20 percig",,,,,,,
