journal_id,asset,analysis_timestamp,signal,mode,probability,model_probability,realtime_confidence,leverage,entry_price,stop_loss,take_profit_1,take_profit_2,risk_reward,initial_risk_abs,spot_price,spot_timestamp,spot_latency_seconds,precision_score,anchor_bias,probability_source,notes,validation_outcome,validation_rr,max_favorable_excursion,max_adverse_excursion,time_to_outcome_minutes,slippage,execution_latency_ms
d4ba7b59-c89c-4c0b-921d-d5cf0015953a,NVDA,2026-06-04T16:56:26Z,no entry,core,20,,1.0,5.0,,,,,,,218.5,2026-06-04T16:55:54Z,32,,,rule,"Micro bias override: gyors struktúra dominál (+19.5); Regime filter inaktív; 5M BOS trendirányba (+16.0); ATR nincs rendben (relatív vagy abszolút küszöb); WARNING: No Liquidity Structure (Nearest: 197.152852, Dist: 32.64ATR); Intraday range felső harmada telített (−7.0); Range expanzió támogatja a momentumot (+3.0); Ár 1h EMA21 zónában (+10.0); Order flow neutrális (−4.8); P-Score reduced by 4.0 due to regime CHOPPY; NVDA: magas napi ATR + momentum — P-score küszöb lazítva; Intraday P-score lazítás: micro-bias long elsőbbséget kap (−1.5); Mesterlövész mód: P-score minimum 35 érvényesítve; OFI z-score 1.01 támogatja az irányt; Regime kapu: CHOPPY miatt −10 P-score, pozícióskálázás csökkentve; ATR soft gate: alacsony volatilitás −5 P-score, méret felezve; missing: P_score>=35",,,,,,,
1c4d1a27-ccf8-42ea-a6a4-5a75bae46d82,EURUSD,2026-06-04T16:56:26Z,no entry,core,0,,1.0,30.0,,,,,,,1.1625,2026-06-04T16:55:54Z,32,,,rule,"Intraday bias gate feltételek hiányosak — Micro BOS long  ATR rendben: 1m micro BOS long, ATR gate | Micro BOS short  ATR rendben: 1m micro BOS short, ATR gate; Bias neutrálsávban; Regime filter inaktív; ATR nincs rendben (relatív vagy abszolút küszöb); Alacsony realised vol → magasabb RR igény; Ár 1h EMA21 zónában (+10.0); Order flow neutrális (−4.9); P-Score reduced by 4.0 due to regime CHOPPY; P-Score reduced by 0.7 due to ATR Soft Gate tolerance; EURUSD: ATR(1h) alacsony — P-score küszöb +6 pontra emelve; EURUSD: Visszafogott ATR — célok szűkítve, kockázat kontroll alatt; ATR-floor override: rel_atr 0.0002 < 0.0006 → adaptív RR/TP küszöb; Regime kapu: CHOPPY miatt −10 P-score, pozícióskálázás csökkentve; ATR soft gate: alacsony volatilitás −5 P-score, méret felezve; Liquidity gate skipped (no volume proxy available); missing: P_score>=44",,,,,,,
2a332778-9185-479e-ae47-02fcc664dda3,XAGUSD,2026-06-04T16:56:26Z,no entry,core,9,,1.0,20.0,,,,,,,73.87001,2026-06-04T16:55:54Z,32,,,rule,"Bias(4H→1H)=short (+15.0); Regime filter inaktív; ATR nincs rendben (relatív vagy abszolút küszöb); Ár 1h EMA21 zónában (+10.0); Order flow neutrális (−3.8); XAGUSD: visszafogott ATR — RR cél 1:1.7-re emelve; XAGUSD breakout-védelem: gyors BE + 20% giveback limit expanziós szakaszban; XAG: VWAP felett — short setup türelmet igényel; ATR-floor override: rel_atr 0.0012 < 0.0018 → adaptív RR/TP küszöb; Regime kapu: CHOPPY miatt −10 P-score, pozícióskálázás csökkentve; ATR soft gate: alacsony volatilitás −5 P-score, méret felezve; Liquidity gate skipped (no volume proxy available); missing: P_score>=28",,,,,,,
d4c74b47-dd68-4098-ae24-e0492f6e54c3,GOLD_CFD,2026-06-04T16:56:26Z,no entry,core,33,,1.0,20.0,,,,,,,4481.39945,2026-06-04T16:55:54Z,32,,,rule,"Bias(4H→1H)=short (+15.0); Regime filter inaktív; 5M BOS trendirányba (+16.0); ATR nincs rendben (relatív vagy abszolút küszöb); Alacsony realised vol → magasabb RR igény; Range expanzió támogatja a momentumot (+3.0); Fib zóna konfluencia (0.618–0.886) (+18.0); Order flow neutrális (−3.2); P-Score reduced by 4.0 due to regime CHOPPY; ATR-floor override: rel_atr 0.0007 < 0.0025 → adaptív RR/TP küszöb; Fém irány guard: 5m trend ellentétes a belépési biasszal; Regime kapu: CHOPPY miatt −10 P-score, pozícióskálázás csökkentve; ATR soft gate: alacsony volatilitás −5 P-score, méret felezve; Strukturális kapu lazítva: momentum erős, BOS hiány engedve; Liquidity gate skipped (no volume proxy available); missing: metal_bias_5m_alignment",,,,,,,
76090efe-ee9e-466a-a577-0fa01edbfe96,USOIL,2026-06-04T16:56:26Z,no entry,core_only,27,,1.0,20.0,,,,,,,92.69231,2026-06-04T16:55:54Z,32,,,rule,"Intraday bias gate feltételek hiányosak — USOIL retest long  ATR: 5m retest long | USOIL retest short  ATR: 5m retest short; Bias neutrálsávban; Regime filter inaktív; ATR erősség 3.89× küszöb (+23.0); Fib zóna konfluencia (0.618–0.886) (+18.0); Order flow neutrális (−4.8); P-Score reduced by 4.0 due to regime CHOPPY; USOIL: 1h ATR ≥1.5 USD — RR cél 1:2-re emelve; Regime kapu: CHOPPY miatt −10 P-score, pozícióskálázás csökkentve; Strukturális soft gate: 1/3 jel + ATR/spread OK (−6 P-score, size ×0.70); Strukturális kapu lazítva: momentum erős, BOS hiány engedve; Diagnosztika: k1m: utolsó zárt gyertya 11 perc késésben van; Diagnosztika: k1m: jelzés korlátozva 11 perc késés miatt; Diagnosztika: k5m: utolsó zárt gyertya 11 perc késésben van; missing: P_score>=36",,,,,,,
fa2de04f-0290-4b9e-b3cf-3c79956928b2,BTCUSD,2026-06-04T16:56:26Z,precision_arming,core,92,,1.0,2.0,,,,,,,63574.71,2026-06-04T16:55:54Z,32,,,rule,"Bias(4H→1H)=short (+15.0); EMA21 slope 1.13× küszöb (+12.8); 5M BOS trendirányba (+16.0); ATR erősség 1.10× küszöb (+11.6); Range expanzió támogatja a momentumot (+3.0); Fib zóna konfluencia (0.618–0.886) (+18.0); Order flow neutrális (−4.2); Sell pressure támogatja a setupot (+5); Mesterlövész mód: P-score minimum 35 érvényesítve; Strukturális kapu lazítva: momentum erős, BOS hiány engedve; BTC ATR1h stop igazítás: kockázat ×1.15; Precision trigger kész → limit figyelés; Precision limit belépő parkolva 20 percig",,,,,,,
