journal_id,asset,analysis_timestamp,signal,mode,probability,model_probability,realtime_confidence,leverage,entry_price,stop_loss,take_profit_1,take_profit_2,risk_reward,initial_risk_abs,spot_price,spot_timestamp,spot_latency_seconds,precision_score,anchor_bias,probability_source,notes,validation_outcome,validation_rr,max_favorable_excursion,max_adverse_excursion,time_to_outcome_minutes,slippage,execution_latency_ms
ba1c7a1d-332c-4b3a-b8c1-fe2a9c3239a4,GOLD_CFD,2026-02-16T05:12:30Z,no entry,core,0,,1.0,20.0,,,,,,,4982.18667,2026-02-16T05:12:02Z,28,,,rule,"Intraday bias gate feltételek hiányosak — 5m retest long  ATR: 5m retest long, ATR gate | 5m retest short  ATR: 5m retest short, ATR gate; Bias neutrálsávban; Regime filter inaktív; HTF sweep ok (+10.0); ATR nincs rendben (relatív vagy abszolút küszöb); Alacsony realised vol → magasabb RR igény; Order flow neutrális (−4.9); P-Score reduced by 4.0 due to regime CHOPPY; Mesterlövész mód: P-score minimum 35 érvényesítve; ATR-floor override: rel_atr 0.0009 < 0.0025 → adaptív RR/TP küszöb; Regime kapu: CHOPPY miatt −10 P-score, pozícióskálázás csökkentve; ATR soft gate: alacsony volatilitás −5 P-score, méret felezve; Liquidity gate skipped (no volume proxy available); missing: P_score>=35",,,,,,,
0edcbcd9-297a-462e-bb57-8f1bd5793d24,EURUSD,2026-02-16T05:12:30Z,no entry,core,21,,1.0,30.0,,,,,,,1.18631,2026-02-16T05:12:02Z,28,,,rule,"Mean reversion bias override (+19.5); Regime filter inaktív; ATR nincs rendben (relatív vagy abszolút küszöb); Alacsony realised vol → magasabb RR igény; Ár az intraday range alsó zónájában (+4.0); Fib zóna konfluencia (0.618–0.886) (+18.0); Order flow neutrális (−4.6); P-Score reduced by 4.0 due to regime CHOPPY; EURUSD: ATR(1h) alacsony — P-score küszöb +6 pontra emelve; EURUSD: Visszafogott ATR — célok szűkítve, kockázat kontroll alatt; OFI z-score 2.10 támogatja az irányt; ATR-floor override: rel_atr 0.0001 < 0.0006 → adaptív RR/TP küszöb; Regime kapu: CHOPPY miatt −10 P-score, pozícióskálázás csökkentve; ATR soft gate: alacsony volatilitás −5 P-score, méret felezve; Liquidity gate skipped (no volume proxy available); missing: P_score>=44",,,,,,,
2577b92b-d0d2-4ecb-b36e-63242d8d94f6,XAGUSD,2026-02-16T05:12:30Z,no entry,core,21,,1.0,20.0,,,,,,,75.52341,2026-02-16T05:12:02Z,28,,,rule,"Bias(4H→1H)=short (+15.0); Regime filter inaktív; ATR erősség 1.34× küszöb (+13.0); Order flow neutrális (−4.1); P-Score reduced by 4.0 due to regime CHOPPY; Mesterlövész mód: P-score minimum 35 érvényesítve; XAGUSD: ATR-alapú pozícióskálázás ×0.70; XAG: VWAP felett — short setup türelmet igényel; Regime kapu: CHOPPY miatt −10 P-score, pozícióskálázás csökkentve; Liquidity gate skipped (no volume proxy available); missing: P_score>=35",,,,,,,
87b75572-6a20-408f-9501-61b7cb634577,BTCUSD,2026-02-16T05:12:30Z,no entry,core,0,,1.0,2.0,,,,,,,68641.98,2026-02-16T05:12:02Z,28,,,rule,"Intraday bias gate feltételek hiányosak — Crypto momentum long: 1m micro BOS long, Momentum volume ráta, ATR gate | Crypto momentum short: 1m micro BOS short, Momentum volume ráta, ATR gate | 5m BOS long  ATR: 5m BOS long, ATR gate | 5m BOS short  ATR: 5m BOS short, ATR gate | Micro BOS short  ATR (momentum nélkül): 1m micro BOS short, ATR gate; Bias neutrálsávban; Regime filter inaktív; ATR nincs rendben (relatív vagy abszolút küszöb); Alacsony realised vol → magasabb RR igény; Range expanzió támogatja a momentumot (+3.0); Fib zóna konfluencia (0.618–0.886) (+18.0); Order flow neutrális (−4.5); P-Score reduced by 4.0 due to regime CHOPPY; P-Score reduced by 5.5 due to ATR Soft Gate tolerance; Mesterlövész mód: P-score minimum 35 érvényesítve; Regime kapu: CHOPPY miatt −10 P-score, pozícióskálázás csökkentve; ATR soft gate: alacsony volatilitás −5 P-score, méret felezve; Strukturális kapu lazítva: momentum erős, BOS hiány engedve; missing: P_score>=35",,,,,,,
947d5521-d566-4a46-b9eb-1d124dc74f24,USOIL,2026-02-16T05:12:30Z,no entry,core_only,0,,1.0,20.0,,,,,,,62.83724,2026-02-16T05:12:02Z,28,,,rule,"Intraday bias gate feltételek hiányosak — USOIL retest long  ATR: 5m retest long, ATR gate | USOIL retest short  ATR: 5m retest short, ATR gate; Bias neutrálsávban; Regime filter inaktív; ATR nincs rendben (relatív vagy abszolút küszöb); Fib zóna konfluencia (0.618–0.886) (+18.0); Order flow neutrális (−4.8); P-Score reduced by 4.0 due to regime CHOPPY; USOIL: 1h ATR <1 USD — P-score küszöb emelve a zajos sáv miatt; USOIL: csökkenő volatilitás — RR cél 1:1.5-re igazítva; USOIL: ázsiai sáv — pozícióméret ×0.70; Regime kapu: CHOPPY miatt −10 P-score, pozícióskálázás csökkentve; ATR soft gate: alacsony volatilitás −5 P-score, méret felezve; Diagnosztika: k1m: utolsó zárt gyertya 10 perc késésben van; Diagnosztika: k1m: jelzés korlátozva 10 perc késés miatt; Diagnosztika: k5m: utolsó zárt gyertya 12 perc késésben van; missing: P_score>=42",,,,,,,
