journal_id,asset,analysis_timestamp,signal,mode,probability,model_probability,realtime_confidence,leverage,entry_price,stop_loss,take_profit_1,take_profit_2,risk_reward,initial_risk_abs,spot_price,spot_timestamp,spot_latency_seconds,precision_score,anchor_bias,probability_source,notes,validation_outcome,validation_rr,max_favorable_excursion,max_adverse_excursion,time_to_outcome_minutes,slippage,execution_latency_ms
2c775af8-7a71-4607-a964-880efb621bef,EURUSD,2026-01-21T03:25:44Z,precision_arming,core,42,,1.0,30.0,,,,,,,1.1714,2026-01-21T03:25:24Z,20,,,rule,"Mean reversion bias override (+19.5); Regime filter inaktív; ATR erősség 1.31× küszöb (+12.9); Alacsony realised vol → magasabb RR igény; Ár az intraday range alsó zónájában (+4.0); Fib zóna konfluencia (0.618–0.886) (+18.0); Order flow neutrális (−3.5); P-Score reduced by 4.0 due to regime CHOPPY; EURUSD: ATR(1h) alacsony — P-score küszöb +6 pontra emelve; EURUSD: Visszafogott ATR — célok szűkítve, kockázat kontroll alatt; EURUSD BOS aktív, de VWAP alatt — türelem; ATR-floor override: rel_atr 0.0002 < 0.0006 → adaptív RR/TP küszöb; Regime kapu: CHOPPY miatt −10 P-score, pozícióskálázás csökkentve; Strukturális soft gate: 1/3 jel + ATR/spread OK (−6 P-score, size ×0.70); Strukturális kapu lazítva: momentum erős, BOS hiány engedve; Liquidity gate skipped (no volume proxy available); Precision trigger kész → limit figyelés; Precision limit belépő parkolva 12 percig",,,,,,,
444b3a9e-9519-4f38-981b-30778c85fbc5,XAGUSD,2026-01-21T03:25:44Z,precision_arming,core,33,,1.0,20.0,,,,,,,93.6742,2026-01-21T03:25:24Z,20,,,rule,"Bias(4H→1H)=long (+15.0); Regime filter inaktív; ATR erősség 2.14× küszöb (+17.8); Ár az intraday range alsó zónájában (+4.0); Ár 1h EMA21 zónában (+10.0); Order flow neutrális (−4.4); P-Score reduced by 4.0 due to regime CHOPPY; XAGUSD: ATR-alapú pozícióskálázás ×0.55; XAG: VWAP alatt — long setup türelmet igényel; Regime kapu: CHOPPY miatt −10 P-score, pozícióskálázás csökkentve; Strukturális soft gate: 1/3 jel + ATR/spread OK (−6 P-score, size ×0.70); Strukturális kapu lazítva: momentum erős, BOS hiány engedve; Liquidity gate skipped (no volume proxy available); Precision trigger kész → limit figyelés; Precision limit belépő parkolva 12 percig",,,,,,,
abe17a61-3f0a-4156-8a82-73e2a51a7204,GOLD_CFD,2026-01-21T03:25:44Z,precision_arming,core,48,,1.0,20.0,,,,,,,4830.07688,2026-01-21T03:25:24Z,20,,,rule,"Bias(4H→1H)=long (+15.0); Regime filter inaktív; HTF sweep ok (+10.0); 5M BOS trendirányba (+16.0); ATR erősség 1.89× küszöb (+16.3); Range expanzió támogatja a momentumot (+3.0); Order flow neutrális (−3.1); P-Score reduced by 4.0 due to regime CHOPPY; VWAP alatt — GOLD long breakout késleltetve; ATR-floor override: rel_atr 0.0016 < 0.0025 → adaptív RR/TP küszöb; Regime kapu: CHOPPY miatt −10 P-score, pozícióskálázás csökkentve; Strukturális soft gate: 1/3 jel + ATR/spread OK (−6 P-score, size ×0.70); Strukturális kapu lazítva: momentum erős, BOS hiány engedve; Liquidity gate skipped (no volume proxy available); GOLD stop lazítás: ATR alapú kockázat ×2.00; Precision trigger kész → limit figyelés; Precision limit belépő parkolva 12 percig",,,,,,,
baad65b2-925a-4362-b2ab-8a1b0a38b391,BTCUSD,2026-01-21T03:25:44Z,precision_arming,core,81,,1.0,2.0,,,,,,,89146.3,2026-01-21T03:25:24Z,20,,,rule,"Bias override: Intraday 5m BOS long  ATR (+19.5); EMA21 slope 1.28× küszöb (+13.7); 5M BOS trendirányba (+16.0); ATR erősség 0.91× küszöb (+10.5); Intraday range felső harmada telített (−7.0); Range expanzió támogatja a momentumot (+3.0); Fib zóna konfluencia (0.618–0.886) (+18.0); Order flow neutrális (−4.2); P-Score reduced by 3.4 due to ATR Soft Gate tolerance; Strukturális kapu lazítva: momentum erős, BOS hiány engedve; Precision trigger kész → limit figyelés; Precision limit belépő parkolva 20 percig",,,,,,,
e40bdcd8-1598-4b5f-aad4-33a72f28437e,USOIL,2026-01-21T03:25:44Z,precision_arming,core,31,,1.0,20.0,,,,,,,59.78771,2026-01-21T03:25:24Z,20,,,rule,"Bias(4H→1H)=long (+15.0); Regime filter inaktív; 5M BOS trendirányba (+16.0); ATR nincs rendben (relatív vagy abszolút küszöb); Range expanzió támogatja a momentumot (+3.0); USOIL: erős momentum — invalid zóna 2.5×ATR(1h)-re tágítva; Fib zóna konfluencia (0.618–0.886) (+18.0); Order flow neutrális (−4.5); P-Score reduced by 4.0 due to regime CHOPPY; USOIL: 1h ATR <1 USD — P-score küszöb emelve a zajos sáv miatt; USOIL: csökkenő volatilitás — RR cél 1:1.5-re igazítva; USOIL: ázsiai sáv — pozícióméret ×0.70; OFI z-score 2.05 támogatja az irányt; Regime kapu: CHOPPY miatt −10 P-score, pozícióskálázás csökkentve; ATR soft gate: alacsony volatilitás −5 P-score, méret felezve; Liquidity gate skipped (no volume proxy available); Precision trigger kész → limit figyelés; Precision limit belépő parkolva 12 percig",,,,,,,
