journal_id,asset,analysis_timestamp,signal,mode,probability,model_probability,realtime_confidence,leverage,entry_price,stop_loss,take_profit_1,take_profit_2,risk_reward,initial_risk_abs,spot_price,spot_timestamp,spot_latency_seconds,precision_score,anchor_bias,probability_source,notes,validation_outcome,validation_rr,max_favorable_excursion,max_adverse_excursion,time_to_outcome_minutes,slippage,execution_latency_ms
93b7204a-ebdb-4b33-a17f-3b0884e3a54e,EURUSD,2026-01-13T01:56:33Z,no entry,core,0,,1.0,30.0,,,,,,,1.16601,2026-01-13T01:56:10Z,23,,,rule,"Intraday bias gate feltételek hiányosak — Micro BOS long  ATR rendben: 1m micro BOS long, ATR gate | Micro BOS short  ATR rendben: 1m micro BOS short, ATR gate; Bias neutrálsávban; Regime filter inaktív; ATR nincs rendben (relatív vagy abszolút küszöb); Alacsony realised vol → magasabb RR igény; Range expanzió támogatja a momentumot (+3.0); Ár 1h EMA21 zónában (+10.0); Order flow neutrális (−3.3); P-Score reduced by 4.0 due to regime CHOPPY; EURUSD: ATR(1h) alacsony — P-score küszöb +6 pontra emelve; EURUSD: Visszafogott ATR — célok szűkítve, kockázat kontroll alatt; ATR-floor override: rel_atr 0.0002 < 0.0006 → adaptív RR/TP küszöb; Regime kapu: CHOPPY miatt −10 P-score, pozícióskálázás csökkentve; ATR soft gate: alacsony volatilitás −5 P-score, méret felezve; Strukturális kapu lazítva: momentum erős, BOS hiány engedve; Liquidity gate skipped (no volume proxy available); missing: P_score>=27",,,,,,,
285707dd-a5da-4a3a-b92f-d47081ad237f,XAGUSD,2026-01-13T01:56:33Z,no entry,core,27,,1.0,20.0,83.81353,82.9753947,85.48980060000001,86.32793590000001,3.0,,83.81353,2026-01-13T01:56:10Z,23,,,rule,"Bias(4H→1H)=long (+15.0); Regime filter inaktív; ATR erősség 1.08× küszöb (+11.5); Ár az intraday range alsó zónájában (+4.0); Ár 1h EMA21 zónában (+10.0); Order flow neutrális (−4.2); P-Score reduced by 4.0 due to regime CHOPPY; XAGUSD: visszafogott ATR — RR cél 1:1.7-re emelve; XAGUSD: ATR-alapú pozícióskálázás ×0.70; XAG: VWAP alatt — long setup türelmet igényel; Regime kapu: CHOPPY miatt −10 P-score, pozícióskálázás csökkentve; Strukturális soft gate: 1/3 jel + ATR/spread OK (−6 P-score, size ×0.70); Strukturális kapu lazítva: momentum erős, BOS hiány engedve; Liquidity gate skipped (no volume proxy available); missing: precision_flow_alignment",,,,,,,
a96b34ef-afb6-4f57-92ae-d8648b683801,GOLD_CFD,2026-01-13T01:56:33Z,no entry,core,29,,1.0,20.0,4581.26175,4535.4491325,4691.212031999999,4755.349696499999,3.8,,4581.26175,2026-01-13T01:56:10Z,23,,,rule,"Bias(4H→1H)=long (+15.0); Regime filter inaktív; ATR erősség 1.30× küszöb (+12.8); Alacsony realised vol → magasabb RR igény; Ár az intraday range alsó zónájában (+4.0); Ár 1h EMA21 zónában (+10.0); Order flow neutrális (−3.9); P-Score reduced by 4.0 due to regime CHOPPY; ATR-floor override: rel_atr 0.0011 < 0.0025 → adaptív RR/TP küszöb; Regime kapu: CHOPPY miatt −10 P-score, pozícióskálázás csökkentve; Strukturális soft gate: 1/3 jel + ATR/spread OK (−6 P-score, size ×0.70); Strukturális kapu lazítva: momentum erős, BOS hiány engedve; Liquidity gate skipped (no volume proxy available); GOLD stop lazítás: ATR alapú kockázat ×2.00; missing: precision_flow_alignment",,,,,,,
b340b1ce-ce23-43ac-86a1-3dedef3b8aee,BTCUSD,2026-01-13T01:56:33Z,no entry,core,0,,1.0,2.0,,,,,,,91074.0,2026-01-13T01:56:10Z,23,,,rule,"Intraday bias gate feltételek hiányosak — Crypto momentum long: 1m micro BOS long, Momentum volume ráta, ATR gate | Crypto momentum short: 1m micro BOS short, Momentum volume ráta, ATR gate | 5m BOS long  ATR: 5m BOS long, ATR gate | 5m BOS short  ATR: 5m BOS short, ATR gate | Micro BOS short  ATR (momentum nélkül): 1m micro BOS short, ATR gate; Bias neutrálsávban; Regime filter inaktív; ATR nincs rendben (relatív vagy abszolút küszöb); Alacsony realised vol → magasabb RR igény; Fib zóna konfluencia (0.618–0.886) (+18.0); Order flow neutrális (−4.6); P-Score reduced by 4.0 due to regime CHOPPY; ATR-floor override: rel_atr 0.0011 < 0.0012 → adaptív RR/TP küszöb; Regime kapu: CHOPPY miatt −10 P-score, pozícióskálázás csökkentve; ATR soft gate: alacsony volatilitás −5 P-score, méret felezve; Position size scale 0.0387 below floor 0.04 — entry blocked; missing: position_sizing_floor, P_score>=34",,,,,,,
cf7e5ff1-1955-406b-8080-ba80a3ef39e7,USOIL,2026-01-13T01:56:34Z,no entry,core,44,,1.0,20.0,59.71,59.1129,60.904199999999996,61.50129999999999,3.0,,59.71,2026-01-13T01:56:10Z,24,,,rule,"Bias(4H→1H)=long (+15.0); Regime filter inaktív; HTF sweep ok (+10.0); ATR erősség 1.78× küszöb (+15.7); Fib zóna konfluencia (0.618–0.886) (+18.0); Order flow neutrális (−4.8); OFI toxikus long irányra (−4.8); USOIL: 1h ATR <1 USD — P-score küszöb emelve a zajos sáv miatt; USOIL: csökkenő volatilitás — RR cél 1:1.5-re igazítva; Regime kapu: CHOPPY miatt −10 P-score, pozícióskálázás csökkentve; Strukturális soft gate: 1/3 jel + ATR/spread OK (−6 P-score, size ×0.70); Strukturális kapu lazítva: momentum erős, BOS hiány engedve; Liquidity gate skipped (no volume proxy available); missing: precision_score>=55",,,,,,,
