journal_id,asset,analysis_timestamp,signal,mode,probability,model_probability,realtime_confidence,leverage,entry_price,stop_loss,take_profit_1,take_profit_2,risk_reward,initial_risk_abs,spot_price,spot_timestamp,spot_latency_seconds,precision_score,anchor_bias,probability_source,notes,validation_outcome,validation_rr,max_favorable_excursion,max_adverse_excursion,time_to_outcome_minutes,slippage,execution_latency_ms
059a1976-5cf1-4955-943b-1285b3f3c945,XAGUSD,2026-05-04T20:22:10Z,no entry,core,24,,1.0,20.0,,,,,,,72.69379,2026-05-04T20:21:43Z,27,,,rule,"Bias(4H→1H)=short (+15.0); Regime filter inaktív; 5M BOS trendirányba (+16.0); ATR nincs rendben (relatív vagy abszolút küszöb); Intraday range alsó harmada telített (−7.0); Range expanzió támogatja a momentumot (+3.0); XAG momentum override — stop tágítva erős trendnél; XAGUSD: momentum override — stop távolság 1.3×ATR-re tágítva; Fib zóna konfluencia (0.618–0.886) (+18.0); Order flow neutrális (−4.5); P-Score reduced by 4.0 due to regime CHOPPY; XAGUSD: momentum kitörés — RR cél 1:1.45-re szűkítve; XAGUSD breakout-védelem: gyors BE + 20% giveback limit expanziós szakaszban; XAG momentum override — pozícióméret csökkentve; XAGUSD: ATR-alapú pozícióskálázás ×0.55; XAG: VWAP felett — short setup türelmet igényel; OFI z-score -2.19 támogatja az irányt; ATR-floor override: rel_atr 0.0013 < 0.0018 → adaptív RR/TP küszöb; Regime kapu: CHOPPY miatt −10 P-score, pozícióskálázás csökkentve; ATR soft gate: alacsony volatilitás −5 P-score, méret felezve; Liquidity gate skipped (no volume proxy available); missing: P_score>=28",,,,,,,
bf46f92d-58cb-4e5f-bb7e-e1eb4f10cbc0,EURUSD,2026-05-04T20:22:10Z,no entry,core,25,,1.0,30.0,,,,,,,1.16902,2026-05-04T20:21:43Z,27,,,rule,"Mean reversion bias override (+19.5); Regime filter inaktív; HTF sweep ok (+10.0); ATR nincs rendben (relatív vagy abszolút küszöb); Alacsony realised vol → magasabb RR igény; Ár az intraday range alsó zónájában (+4.0); Fib zóna konfluencia (0.618–0.886) (+18.0); Order flow neutrális (−4.5); OFI toxikus long irányra (−6.0); P-Score reduced by 4.0 due to regime CHOPPY; ATR-floor override: rel_atr 0.0002 < 0.0006 → adaptív RR/TP küszöb; Regime kapu: CHOPPY miatt −10 P-score, pozícióskálázás csökkentve; ATR soft gate: alacsony volatilitás −5 P-score, méret felezve; Liquidity gate skipped (no volume proxy available); missing: P_score>=38, precision_score>=55",,,,,,,
3885a7a5-453b-4b9a-be18-8b4367a5e777,GOLD_CFD,2026-05-04T20:22:10Z,no entry,core,24,,1.0,20.0,,,,,,,4512.85586,2026-05-04T20:21:43Z,27,,,rule,"Bias(4H→1H)=short (+15.0); Regime filter inaktív; 5M BOS trendirányba (+16.0); ATR nincs rendben (relatív vagy abszolút küszöb); Alacsony realised vol → magasabb RR igény; Intraday range alsó harmada telített (−7.0); Range expanzió támogatja a momentumot (+3.0); Fib zóna konfluencia (0.618–0.886) (+18.0); Order flow neutrális (−4.5); P-Score reduced by 4.0 due to regime CHOPPY; ATR-floor override: rel_atr 0.0008 < 0.0025 → adaptív RR/TP küszöb; Regime kapu: CHOPPY miatt −10 P-score, pozícióskálázás csökkentve; ATR soft gate: alacsony volatilitás −5 P-score, méret felezve; Strukturális kapu lazítva: momentum erős, BOS hiány engedve; Liquidity gate skipped (no volume proxy available); missing: P_score>=30",,,,,,,
5442faf3-55ff-408d-85ce-a7e58b676008,BTCUSD,2026-05-04T20:22:10Z,precision_arming,core,34,,1.0,2.0,,,,,,,79964.47,2026-05-04T20:21:43Z,27,,,rule,"Bias(4H→1H)=long (+15.0); Regime filter inaktív; ATR erősség 1.39× küszöb (+13.3); Fib zóna konfluencia (0.618–0.886) (+18.0); Order flow neutrális (−4.9); Order flow ellentétes irányba tolódik (−4); P-Score reduced by 4.0 due to regime CHOPPY; Mesterlövész mód: P-score minimum 35 érvényesítve; Regime kapu: CHOPPY miatt −10 P-score, pozícióskálázás csökkentve; P-score soft gate: −0.6 pont tolerancia (size ×0.65, RR +0.15); BTC ATR1h stop igazítás: kockázat ×1.15; Precision trigger kész → limit figyelés; Precision limit belépő parkolva 20 percig",,,,,,,
fd674b77-63a6-40da-8b74-0b26818effd0,USOIL,2026-05-04T20:22:10Z,no entry,core_only,41,,1.0,20.0,105.064118,101.76834561714284,111.6556627657143,114.95143514857145,3.0,,105.064118,2026-05-04T20:21:43Z,27,,,rule,"Bias(4H→1H)=long (+15.0); Regime filter inaktív; ATR erősség 1.07× küszöb (+11.4); Fib zóna konfluencia (0.618–0.886) (+18.0); Order flow neutrális (−4.6); USOIL: parabolikus lendület — RR cél 1:1.4 környékére szűkítve; Regime kapu: CHOPPY miatt −10 P-score, pozícióskálázás csökkentve; USOIL stop lazítás: ATR1h alapú kockázat ×0.92; Diagnosztika: k1m: utolsó zárt gyertya 11 perc késésben van; Diagnosztika: k1m: jelzés korlátozva 11 perc késés miatt; Diagnosztika: k5m: utolsó zárt gyertya 12 perc késésben van",,,,,,,
