journal_id,asset,analysis_timestamp,signal,mode,probability,model_probability,realtime_confidence,leverage,entry_price,stop_loss,take_profit_1,take_profit_2,risk_reward,initial_risk_abs,spot_price,spot_timestamp,spot_latency_seconds,precision_score,anchor_bias,probability_source,notes,validation_outcome,validation_rr,max_favorable_excursion,max_adverse_excursion,time_to_outcome_minutes,slippage,execution_latency_ms
763ac88c-184f-48dd-b3a0-b0e7a5d9c94d,GOLD_CFD,2026-03-10T16:06:45Z,no entry,core,6,,1.0,20.0,,,,,,,5227.53681,2026-03-10T16:06:12Z,33,,,rule,"Bias(4H→1H)=long (+15.0); Regime filter inaktív; 5M BOS trendirányba (+16.0); ATR nincs rendben (relatív vagy abszolút küszöb); Alacsony realised vol → magasabb RR igény; Intraday range felső harmada telített (−7.0); Range expanzió támogatja a momentumot (+3.0); Order flow neutrális (−4.8); P-Score reduced by 4.0 due to regime CHOPPY; VWAP alatt — GOLD long breakout késleltetve; ATR-floor override: rel_atr 0.0010 < 0.0025 → adaptív RR/TP küszöb; Regime kapu: CHOPPY miatt −10 P-score, pozícióskálázás csökkentve; ATR soft gate: alacsony volatilitás −5 P-score, méret felezve; Strukturális kapu lazítva: momentum erős, BOS hiány engedve; Liquidity gate skipped (no volume proxy available); missing: P_score>=30",,,,,,,
af9145fd-a467-49a3-afc5-bc193b6ff7dc,EURUSD,2026-03-10T16:06:45Z,no entry,core,0,,1.0,30.0,1.16486,1.1643165714285715,1.1664902857142856,1.1664902857142856,3.0,,1.16436,2026-03-10T16:06:12Z,33,,,rule,"Intraday bias gate feltételek hiányosak — Micro BOS long  ATR rendben: 1m micro BOS long, ATR gate | Micro BOS short  ATR rendben: 1m micro BOS short, ATR gate; Bias neutrálsávban; Regime filter inaktív; ATR nincs rendben (relatív vagy abszolút küszöb); Alacsony realised vol → magasabb RR igény; Fib zóna konfluencia (0.618–0.886) (+18.0); Order flow neutrális (−4.9); P-Score reduced by 4.0 due to regime CHOPPY; P-Score reduced by 1.4 due to ATR Soft Gate tolerance; EURUSD: ATR-alapú pozícióskálázás ×0.78 — volatilitás kontroll; ATR-floor override: rel_atr 0.0004 < 0.0006 → adaptív RR/TP küszöb; Regime kapu: CHOPPY miatt −10 P-score, pozícióskálázás csökkentve; ATR soft gate: alacsony volatilitás −5 P-score, méret felezve; Position size scale 0.0485 below floor 0.05 — entry blocked; Liquidity gate skipped (no volume proxy available); missing: position_sizing_floor, P_score>=38; Pozíciómenedzsment: aktív long pozíció (opened_at: 2026-03-10T15:06:51Z, Entry: 1.16486, SL: 1.1643165714285715, TP2: 1.1664902857142856)",,,,,,,
57afaddc-784c-4d86-abee-4dcbb2f85582,XAGUSD,2026-03-10T16:06:45Z,no entry,core,0,,1.0,20.0,88.75872,88.39789971428571,89.84118085714286,89.84118085714286,3.0000000000000395,,89.32488,2026-03-10T16:06:12Z,33,,,rule,"Bias(4H→1H)=long (+15.0); Regime filter inaktív; ATR nincs rendben (relatív vagy abszolút küszöb); Order flow neutrális (−3.5); P-Score reduced by 4.0 due to regime CHOPPY; XAGUSD: visszafogott ATR — RR cél 1:1.7-re emelve; XAGUSD breakout-védelem: gyors BE + 20% giveback limit expanziós szakaszban; XAGUSD: ATR-alapú pozícióskálázás ×0.70; XAG: VWAP alatt — long setup türelmet igényel; Regime kapu: CHOPPY miatt −10 P-score, pozícióskálázás csökkentve; ATR soft gate: alacsony volatilitás −5 P-score, méret felezve; Liquidity gate skipped (no volume proxy available); missing: P_score>=28; Pozíciómenedzsment: aktív long pozíció (opened_at: 2026-03-10T14:06:37Z, Entry: 88.75872, SL: 88.39789971428571, TP2: 89.84118085714286)",,,,,,,
0183bd48-e858-4fcf-adb4-779d430fe2fb,NVDA,2026-03-10T16:06:45Z,no entry,core,0,,1.0,5.0,,,,,,,185.31,2026-03-10T16:06:12Z,33,,,rule,"Intraday bias gate feltételek hiányosak — EMA9×21 long  magas ATR: EMA9×21 long, Magas ATR megerősítés | EMA9×21 short  magas ATR: EMA9×21 short, Magas ATR megerősítés | 5m BOS short  ATR (momentum nélkül): 5m BOS short, ATR gate; Bias neutrálsávban; Regime filter inaktív; ATR nincs rendben (relatív vagy abszolút küszöb); WARNING: No Liquidity Structure (Nearest: 184.866880, Dist: 0.93ATR); Order flow neutrális (−4.6); P-Score reduced by 4.0 due to regime CHOPPY; Regime kapu: CHOPPY miatt −10 P-score, pozícióskálázás csökkentve; ATR soft gate: alacsony volatilitás −5 P-score, méret felezve; missing: P_score>=38",,,,,,,
e5611f68-86e8-4fc3-bb71-ca7f5b04d0f3,USOIL,2026-03-10T16:06:45Z,no entry,core_only,73,,1.0,20.0,84.64817,82.04487654285714,92.45805037142857,92.45805037142857,2.4,,83.050478,2026-03-10T16:06:12Z,33,,,rule,"Bias(4H→1H)=long (+15.0); EMA21 slope 2.18× küszöb (+19.1); 5M BOS trendirányba (+16.0); ATR nincs rendben (relatív vagy abszolút küszöb); Ár az intraday range alsó zónájában (+4.0); Range expanzió támogatja a momentumot (+3.0); USOIL: erős momentum — invalid zóna 2.5×ATR(1h)-re tágítva; Fib zóna konfluencia (0.618–0.886) (+18.0); Order flow neutrális (−4.5); USOIL: parabolikus lendület — RR cél 1:1.4 környékére szűkítve; USOIL: oldalazó szerkezet — H1/M5 BOS nélkül nincs belépő; ATR soft gate: alacsony volatilitás −5 P-score, méret felezve; Strukturális kapu lazítva: momentum erős, BOS hiány engedve; USOIL stop lazítás: ATR1h alapú kockázat ×0.97; Diagnosztika: k1m: utolsó zárt gyertya 10 perc késésben van; Diagnosztika: k1m: jelzés korlátozva 10 perc késés miatt; Diagnosztika: k5m: utolsó zárt gyertya 11 perc késésben van; Diagnosztika: k1h: utolsó zárt gyertya 66 perc késésben van; Diagnosztika: k4h: utolsó zárt gyertya 246 perc késésben van; Pozíciómenedzsment: aktív long pozíció (opened_at: 2026-03-10T14:31:36Z, Entry: 84.64817, SL: 82.04487654285714, TP2: 92.45805037142857)",,,,,,,
ed0acd8f-7323-4d6d-963d-9155b5ee8f74,BTCUSD,2026-03-10T16:06:45Z,precision_arming,core,95,,1.0,2.0,71192.44,70755.99485714285,72501.77542857143,72501.77542857143,2.9999999999999667,,71253.98,2026-03-10T16:06:12Z,33,,,rule,"Bias override: 1h trend long + momentum támogatás (+19.5); EMA21 slope 1.25× küszöb (+13.5); 5M BOS trendirányba (+16.0); ATR erősség 2.14× küszöb (+17.8); Range expanzió támogatja a momentumot (+3.0); Fib zóna konfluencia (0.618–0.886) (+18.0); Order flow neutrális (−4.1); Order flow ellentétes irányba tolódik (−4); Mesterlövész mód: P-score minimum 35 érvényesítve; Strukturális kapu lazítva: momentum erős, BOS hiány engedve; BTC ATR1h stop igazítás: kockázat ×1.15; Precision trigger kész → limit figyelés; Precision limit belépő parkolva 20 percig; Pozíciómenedzsment: aktív long pozíció (opened_at: 2026-03-10T15:11:48Z, Entry: 71192.44, SL: 70755.99485714285, TP2: 72501.77542857143)",,,,,,,
