journal_id,asset,analysis_timestamp,signal,mode,probability,model_probability,realtime_confidence,leverage,entry_price,stop_loss,take_profit_1,take_profit_2,risk_reward,initial_risk_abs,spot_price,spot_timestamp,spot_latency_seconds,precision_score,anchor_bias,probability_source,notes,validation_outcome,validation_rr,max_favorable_excursion,max_adverse_excursion,time_to_outcome_minutes,slippage,execution_latency_ms
263f7471-d2b3-4478-870d-bdb20acb78d4,EURUSD,2026-05-20T15:02:08Z,precision_arming,core,43,,1.0,30.0,,,,,,,1.16186,2026-05-20T15:01:34Z,34,,,rule,"Bias(4H→1H)=short (+15.0); Regime filter inaktív; HTF sweep ok (+10.0); London–NY overlap profil (-1.0); ATR erősség 3.40× küszöb (+23.0); Alacsony realised vol → magasabb RR igény; Ár az intraday range felső zónájában (+4.0); Order flow neutrális (−4.9); P-Score reduced by 4.0 due to regime CHOPPY; EURUSD: ATR(1h) alacsony — P-score küszöb +6 pontra emelve; EURUSD: Visszafogott ATR — célok szűkítve, kockázat kontroll alatt; Regime kapu: CHOPPY miatt −10 P-score, pozícióskálázás csökkentve; P-score soft gate: −0.9 pont tolerancia (size ×0.65, RR +0.15); Liquidity gate skipped (no volume proxy available); EURUSD stop lazítás: ATR1h alapú kockázat ×0.69; Precision trigger kész → limit figyelés; Precision limit belépő parkolva 12 percig",,,,,,,
553c9827-7065-4136-8605-d7c17fa12f70,GOLD_CFD,2026-05-20T15:02:08Z,no entry,core,0,,1.0,20.0,,,,,,,4533.05793,2026-05-20T15:01:34Z,34,,,rule,"Bias(4H→1H)=short (+15.0); Regime filter inaktív; London–NY overlap profil (-1.0); ATR nincs rendben (relatív vagy abszolút küszöb); Ár az intraday range felső zónájában (+4.0); Order flow neutrális (−4.9); P-Score reduced by 4.0 due to regime CHOPPY; ATR-floor override: rel_atr 0.0021 < 0.0025 → adaptív RR/TP küszöb; Fém irány guard: 5m trend ellentétes a belépési biasszal; Regime kapu: CHOPPY miatt −10 P-score, pozícióskálázás csökkentve; ATR soft gate: alacsony volatilitás −5 P-score, méret felezve; Liquidity gate skipped (no volume proxy available); missing: metal_bias_5m_alignment, P_score>=30",,,,,,,
fb04bd69-297f-485b-8a7c-adb1dfa901d4,XAGUSD,2026-05-20T15:02:08Z,no entry,core,27,,1.0,20.0,,,,,,,76.20421,2026-05-20T15:01:34Z,34,,,rule,"Bias(4H→1H)=short (+15.0); Regime filter inaktív; London–NY overlap profil (-1.0); ATR erősség 1.84× küszöb (+16.0); Ár az intraday range felső zónájában (+4.0); Order flow neutrális (−4.4); P-Score reduced by 4.0 due to regime CHOPPY; XAGUSD breakout-védelem: gyors BE + 20% giveback limit expanziós szakaszban; XAGUSD: ATR-alapú pozícióskálázás ×0.55; XAG: VWAP felett — short setup türelmet igényel; Fém irány guard: 5m trend ellentétes a belépési biasszal; Regime kapu: CHOPPY miatt −10 P-score, pozícióskálázás csökkentve; Liquidity gate skipped (no volume proxy available); missing: metal_bias_5m_alignment, P_score>=28",,,,,,,
91a8bb7e-c6fe-49ed-ae77-4f0d2226c4d9,NVDA,2026-05-20T15:02:08Z,no entry,core,30,,1.0,5.0,,,,,,,224.83,2026-05-20T15:01:35Z,33,,,rule,"Mean reversion bias override (+19.5); Regime filter inaktív; London–NY overlap profil (-1.0); ATR erősség 1.01× küszöb (+11.0); WARNING: No Liquidity Structure (Nearest: 184.866953, Dist: 40.19ATR); Ár az intraday range felső zónájában (+4.0); Ár 1h EMA21 zónában (+10.0); Order flow neutrális (−3.8); P-Score reduced by 4.0 due to regime CHOPPY; Mean-revert setup: méret ×0.70, RR +0.20; VWAP túlnyúlás → mean reversion setup; Regime kapu: CHOPPY miatt −10 P-score, pozícióskálázás csökkentve; Strukturális soft gate: 1/3 jel + ATR/spread OK (−6 P-score, size ×0.70); Strukturális kapu lazítva: momentum erős, BOS hiány engedve; missing: P_score>=38, precision_flow_alignment",,,,,,,
f0a4addc-8841-4563-8705-ecbc05067dea,USOIL,2026-05-20T15:02:08Z,no entry,core_only,34,,1.0,20.0,100.67143,96.028193473,109.957903054,114.601139581,3.0,,100.67143,2026-05-20T15:01:34Z,34,,,rule,"Bias(4H→1H)=long (+15.0); Regime filter inaktív; 5M BOS trendirányba (+16.0); London–NY overlap profil (-1.0); ATR nincs rendben (relatív vagy abszolút küszöb); Ár az intraday range alsó zónájában (+4.0); Range expanzió támogatja a momentumot (+3.0); USOIL: erős momentum — invalid zóna 2.5×ATR(1h)-re tágítva; Fib zóna konfluencia (0.618–0.886) (+18.0); Order flow neutrális (−4.9); P-Score reduced by 4.0 due to regime CHOPPY; USOIL: parabolikus lendület — RR cél 1:1.4 környékére szűkítve; USOIL: oldalazó szerkezet — H1/M5 BOS nélkül nincs belépő; Regime kapu: CHOPPY miatt −10 P-score, pozícióskálázás csökkentve; ATR soft gate: alacsony volatilitás −5 P-score, méret felezve; Strukturális kapu lazítva: momentum erős, BOS hiány engedve; P-score soft gate: −1.9 pont tolerancia (size ×0.65, RR +0.15); USOIL stop lazítás: ATR1h alapú kockázat ×0.97; Diagnosztika: k1m: utolsó zárt gyertya 11 perc késésben van; Diagnosztika: k1m: jelzés korlátozva 11 perc késés miatt; Diagnosztika: k5m: utolsó zárt gyertya 12 perc késésben van",,,,,,,
7777bfa5-9060-4171-b6ac-762dcab21dc0,BTCUSD,2026-05-20T15:02:08Z,no entry,core,34,,1.0,2.0,,,,,,,77390.21,2026-05-20T15:01:34Z,34,,,rule,"Intraday bias gate feltételek hiányosak — Crypto momentum long: 1m micro BOS long, Momentum volume ráta | Crypto momentum short: 1m micro BOS short | 5m BOS long  ATR: 5m BOS long | 5m BOS short  ATR: 5m BOS short | Micro BOS short  ATR (momentum nélkül): 1m micro BOS short; Bias neutrálsávban; Regime filter inaktív; London–NY overlap profil (-1.0); ATR erősség 2.43× küszöb (+19.6); Fib zóna konfluencia (0.618–0.886) (+18.0); Order flow neutrális (−3.9); Mesterlövész mód: P-score minimum 35 érvényesítve; Regime kapu: CHOPPY miatt −10 P-score, pozícióskálázás csökkentve; P-score soft gate: −1.4 pont tolerancia (size ×0.65, RR +0.15)",,,,,,,
