journal_id,asset,analysis_timestamp,signal,mode,probability,model_probability,realtime_confidence,leverage,entry_price,stop_loss,take_profit_1,take_profit_2,risk_reward,initial_risk_abs,spot_price,spot_timestamp,spot_latency_seconds,precision_score,anchor_bias,probability_source,notes,validation_outcome,validation_rr,max_favorable_excursion,max_adverse_excursion,time_to_outcome_minutes,slippage,execution_latency_ms
adef6c12-f70d-458c-85c0-c544a8ef03fc,XAGUSD,2026-01-16T13:31:54Z,market closed,session_closed,0,,1.0,20.0,,,,,,,88.01987,2026-01-16T13:31:00Z,54,,,rule,"Piac nyitva; Bias(4H→1H)=long (+15.0); Regime filter inaktív; London–NY overlap profil (-1.0); ATR erősség 2.23× küszöb (+18.4); Ár az intraday range alsó zónájában (+4.0); Order flow neutrális (−3.7); P-Score reduced by 4.0 due to regime CHOPPY; XAGUSD: ATR-alapú pozícióskálázás ×0.55; XAG: VWAP alatt — long setup türelmet igényel; Regime kapu: CHOPPY miatt −10 P-score, pozícióskálázás csökkentve; Liquidity gate skipped (no volume proxy available); missing: session, precision_flow_alignment",,,,,,,
04b08b39-fa64-43b4-962d-0a17f8975eb1,EURUSD,2026-01-16T13:31:54Z,market closed,session_closed,0,,1.0,30.0,,,,,,,1.16162,2026-01-16T13:31:00Z,54,,,rule,"Piac nyitva; Intraday bias gate feltételek hiányosak — Micro BOS long  ATR rendben: 1m micro BOS long | Micro BOS short  ATR rendben: 1m micro BOS short; Bias neutrálsávban; Regime filter inaktív; London–NY overlap profil (-1.0); ATR erősség 1.71× küszöb (+15.2); Alacsony realised vol → magasabb RR igény; Fib zóna konfluencia (0.618–0.886) (+18.0); Order flow neutrális (−4.7); P-Score reduced by 4.0 due to regime CHOPPY; EURUSD: ATR(1h) alacsony — P-score küszöb +6 pontra emelve; EURUSD: Visszafogott ATR — célok szűkítve, kockázat kontroll alatt; ATR-floor override: rel_atr 0.0003 < 0.0006 → adaptív RR/TP küszöb; Regime kapu: CHOPPY miatt −10 P-score, pozícióskálázás csökkentve; Strukturális soft gate: 1/3 jel + ATR/spread OK (−6 P-score, size ×0.70); Strukturális kapu lazítva: momentum erős, BOS hiány engedve; Liquidity gate skipped (no volume proxy available); missing: session, P_score>=26",,,,,,,
93e02e3a-cb20-49dc-8bd4-60daf6171721,GOLD_CFD,2026-01-16T13:31:54Z,market closed,session_closed,0,,1.0,20.0,,,,,,,4586.75182,2026-01-16T13:31:00Z,54,,,rule,"Piac nyitva; Bias(4H→1H)=long (+15.0); Regime filter inaktív; HTF sweep ok (+10.0); London–NY overlap profil (-1.0); ATR nincs rendben (relatív vagy abszolút küszöb); Alacsony realised vol → magasabb RR igény; Ár az intraday range alsó zónájában (+4.0); Order flow neutrális (−3.7); P-Score reduced by 4.0 due to regime CHOPPY; ATR-floor override: rel_atr 0.0011 < 0.0025 → adaptív RR/TP küszöb; Regime kapu: CHOPPY miatt −10 P-score, pozícióskálázás csökkentve; ATR soft gate: alacsony volatilitás −5 P-score, méret felezve; Liquidity gate skipped (no volume proxy available); missing: session, P_score>=20, precision_flow_alignment",,,,,,,
14a8a94a-482e-42db-8af8-6f362c1203f9,BTCUSD,2026-01-16T13:31:54Z,no entry,core,0,,1.0,2.0,,,,,,,95516.54,2026-01-16T13:31:00Z,54,,,rule,"Intraday bias gate feltételek hiányosak — Crypto momentum long: 1m micro BOS long, Momentum volume ráta, ATR gate | Crypto momentum short: 1m micro BOS short, Momentum volume ráta, ATR gate | 5m BOS long  ATR: ATR gate | 5m BOS short  ATR: 5m BOS short, ATR gate | Micro BOS short  ATR (momentum nélkül): 1m micro BOS short, ATR gate; Bias neutrálsávban; Regime filter inaktív; London–NY overlap profil (-1.0); ATR nincs rendben (relatív vagy abszolút küszöb); Alacsony realised vol → magasabb RR igény; Fib zóna konfluencia (0.618–0.886) (+18.0); Order flow neutrális (−4.9); ATR-floor override: rel_atr 0.0008 < 0.0012 → adaptív RR/TP küszöb; Regime kapu: CHOPPY miatt −10 P-score, pozícióskálázás csökkentve; ATR soft gate: alacsony volatilitás −5 P-score, méret felezve; missing: P_score>=34",,,,,,,
e43edb40-b0bf-41fb-b278-4c497a53cb28,USOIL,2026-01-16T13:31:54Z,market closed,session_closed,0,,1.0,20.0,,,,,,,59.71,2026-01-16T13:31:00Z,54,,,rule,"Piac nyitva; Intraday bias gate feltételek hiányosak — USOIL retest long  ATR: 5m retest long, ATR gate | USOIL retest short  ATR: 5m retest short, ATR gate; Bias neutrálsávban; Regime filter inaktív; London–NY overlap profil (-1.0); ATR nincs rendben (relatív vagy abszolút küszöb); Range expanzió támogatja a momentumot (+3.0); USOIL: erős momentum — invalid zóna 2.5×ATR(1h)-re tágítva; Fib zóna konfluencia (0.618–0.886) (+18.0); Order flow neutrális (−4.9); P-Score reduced by 4.0 due to regime CHOPPY; USOIL: 1h ATR <1 USD — P-score küszöb emelve a zajos sáv miatt; USOIL: csökkenő volatilitás — RR cél 1:1.5-re igazítva; USOIL: US nyitás — pozícióméret ×0.75; Regime kapu: CHOPPY miatt −10 P-score, pozícióskálázás csökkentve; ATR soft gate: alacsony volatilitás −5 P-score, méret felezve; Strukturális kapu lazítva: momentum erős, BOS hiány engedve; Liquidity gate skipped (no volume proxy available); missing: session, P_score>=27",,,,,,,
