journal_id,asset,analysis_timestamp,signal,mode,probability,model_probability,realtime_confidence,leverage,entry_price,stop_loss,take_profit_1,take_profit_2,risk_reward,initial_risk_abs,spot_price,spot_timestamp,spot_latency_seconds,precision_score,anchor_bias,probability_source,notes,validation_outcome,validation_rr,max_favorable_excursion,max_adverse_excursion,time_to_outcome_minutes,slippage,execution_latency_ms,fill_timestamp,exit_timestamp,entry_kind,validation_source
2e5d1863-98d5-4ef7-a0b8-4119bb47fdc8,EURUSD,2026-04-24T16:26:48Z,no entry,core,6,,1.0,30.0,,,,,,,1.17146,2026-04-24T16:26:15Z,33,,,rule,"Intraday bias gate feltételek hiányosak — Micro BOS long  ATR rendben: 1m micro BOS long | Micro BOS short  ATR rendben: 1m micro BOS short; Bias neutrálsávban; Regime filter inaktív; ATR erősség 1.44× küszöb (+13.6); Alacsony realised vol → magasabb RR igény; Order flow neutrális (−4.6); P-Score reduced by 4.0 due to regime CHOPPY; EURUSD: ATR(1h) alacsony — P-score küszöb +6 pontra emelve; EURUSD: Visszafogott ATR — célok szűkítve, kockázat kontroll alatt; ATR-floor override: rel_atr 0.0003 < 0.0006 → adaptív RR/TP küszöb; Regime kapu: CHOPPY miatt −10 P-score, pozícióskálázás csökkentve; Liquidity gate skipped (no volume proxy available); missing: P_score>=44",,,,,,,,,,,
a1a90948-d118-4402-9225-7824defdb879,XAGUSD,2026-04-24T16:26:48Z,no entry,core,8,,1.0,20.0,,,,,,,76.14987,2026-04-24T16:26:15Z,33,,,rule,"Intraday bias gate feltételek hiányosak — Micro BOS long  ATR (ezüst): 1m micro BOS long | Micro BOS short  ATR (ezüst): 1m micro BOS short; Bias neutrálsávban; Regime filter inaktív; ATR erősség 1.16× küszöb (+12.0); Ár 1h EMA21 zónában (+10.0); Order flow neutrális (−4.9); P-Score reduced by 4.0 due to regime CHOPPY; XAGUSD breakout-védelem: gyors BE + 20% giveback limit expanziós szakaszban; XAGUSD: ATR-alapú pozícióskálázás ×0.70; Regime kapu: CHOPPY miatt −10 P-score, pozícióskálázás csökkentve; Strukturális soft gate: 1/3 jel + ATR/spread OK (−6 P-score, size ×0.70); Strukturális kapu lazítva: momentum erős, BOS hiány engedve; Liquidity gate skipped (no volume proxy available); missing: P_score>=28",,,,,,,,,,,
a6a0407e-795f-4060-9f6e-d73d28d8fc4d,NVDA,2026-04-24T16:26:48Z,no entry,core,7,,1.0,5.0,,,,,,,209.85,2026-04-24T16:26:15Z,33,,,rule,"Bias(4H→1H)=long (+15.0); Regime filter inaktív; 5M BOS trendirányba (+16.0); ATR nincs rendben (relatív vagy abszolút küszöb); WARNING: No Liquidity Structure (Nearest: 196.909751, Dist: 16.57ATR); Intraday range felső harmada telített (−7.0); Range expanzió támogatja a momentumot (+3.0); Order flow neutrális (−2.9); P-Score reduced by 4.0 due to regime CHOPPY; NVDA: magas napi ATR + momentum — P-score küszöb lazítva; Mesterlövész mód: P-score minimum 35 érvényesítve; NVDA momentum override — napi ATR támogatja a likviditási lazítást; Regime kapu: CHOPPY miatt −10 P-score, pozícióskálázás csökkentve; ATR soft gate: alacsony volatilitás −5 P-score, méret felezve; Likviditási kapu lazítva erős momentum miatt; missing: P_score>=35",,,,,,,,,,,
1a219d86-51ae-4313-aaaa-9647e8f69cbb,GOLD_CFD,2026-04-24T16:26:48Z,no entry,core,12,,1.0,20.0,,,,,,,4723.88753,2026-04-24T16:26:15Z,33,,,rule,"Bias(4H→1H)=short (+15.0); Regime filter inaktív; 5M BOS trendirányba (+16.0); ATR nincs rendben (relatív vagy abszolút küszöb); Alacsony realised vol → magasabb RR igény; Ár az intraday range felső zónájában (+4.0); Range expanzió támogatja a momentumot (+3.0); Order flow neutrális (−4.2); OFI toxikus short irányra (−5.5); P-Score reduced by 4.0 due to regime CHOPPY; ATR-floor override: rel_atr 0.0010 < 0.0025 → adaptív RR/TP küszöb; Fém irány guard: 5m trend ellentétes a belépési biasszal; Regime kapu: CHOPPY miatt −10 P-score, pozícióskálázás csökkentve; ATR soft gate: alacsony volatilitás −5 P-score, méret felezve; Strukturális kapu lazítva: momentum erős, BOS hiány engedve; Liquidity gate skipped (no volume proxy available); missing: metal_bias_5m_alignment, P_score>=30",,,,,,,,,,,
e6c1570e-c8ea-4998-a5ff-c97a55416df9,USOIL,2026-04-24T16:26:48Z,no entry,core_only,35,,1.0,20.0,93.98866,89.96283712571429,102.0403057485714,106.06612862285712,3.0,,93.98866,2026-04-24T16:26:15Z,33,,,rule,"Bias(4H→1H)=long (+15.0); Regime filter inaktív; ATR erősség 1.10× küszöb (+11.6); Ár az intraday range alsó zónájában (+4.0); Fib zóna konfluencia (0.618–0.886) (+18.0); Order flow neutrális (−4.9); P-Score reduced by 4.0 due to regime CHOPPY; USOIL: parabolikus lendület — RR cél 1:1.4 környékére szűkítve; USOIL: oldalazó szerkezet — H1/M5 BOS nélkül nincs belépő; Regime kapu: CHOPPY miatt −10 P-score, pozícióskálázás csökkentve; Strukturális soft gate: 1/3 jel + ATR/spread OK (−6 P-score, size ×0.70); Strukturális kapu lazítva: momentum erős, BOS hiány engedve; P-score soft gate: −1.3 pont tolerancia (size ×0.65, RR +0.15); USOIL stop lazítás: ATR1h alapú kockázat ×0.92; Diagnosztika: k1m: utolsó zárt gyertya 10 perc késésben van; Diagnosztika: k1m: jelzés korlátozva 10 perc késés miatt; Diagnosztika: k5m: utolsó zárt gyertya 11 perc késésben van",,,,,,,,,,,
ed3c985a-8475-42af-bde1-d498690a903f,BTCUSD,2026-04-24T16:26:48Z,sell,core,62,,1.0,2.0,77770.88,78548.5888,76215.46240000002,75437.75360000003,3.0,,77770.88,2026-04-24T16:26:15Z,33,,,rule,"Bias override: Intraday 5m BOS short  ATR (+19.5); Regime filter inaktív; 5M BOS trendirányba (+16.0); ATR erősség 1.40× küszöb (+13.4); Range expanzió támogatja a momentumot (+3.0); ema9x21+ofi_z=-999.00; Fib zóna konfluencia (0.618–0.886) (+18.0); Order flow neutrális (−4.6); P-Score reduced by 4.0 due to regime CHOPPY; Mesterlövész mód: P-score minimum 35 érvényesítve; BTC momentum override — pozícióméret csökkentve; Regime kapu: CHOPPY miatt −10 P-score, pozícióskálázás csökkentve; Strukturális kapu lazítva: momentum erős, BOS hiány engedve; BTC ATR1h stop igazítás: kockázat ×1.03; TP1 nettó profit ≈ 0.60%; Precision plan: entry 77732.8–77847.0, SL 77961.1; Precision confidence medium (62.0); Precision limit belépő parkolva 20 percig; missing: tp1_net>=+0.6%",insufficient_data,,,,,,,,,market,auto
