journal_id,asset,analysis_timestamp,signal,mode,probability,model_probability,realtime_confidence,leverage,entry_price,stop_loss,take_profit_1,take_profit_2,risk_reward,initial_risk_abs,spot_price,spot_timestamp,spot_latency_seconds,precision_score,anchor_bias,probability_source,notes,validation_outcome,validation_rr,max_favorable_excursion,max_adverse_excursion,time_to_outcome_minutes,slippage,execution_latency_ms
ff382a28-77d2-469b-8ebf-e6459baf8a3f,XAGUSD,2025-12-24T08:46:19Z,precision_arming,core,68,,0.9999999999999999,20.0,,,,,,,71.86224,2025-12-24T08:45:48Z,31,,,rule,"Bias(4H→1H)=long (+15.0); Regime filter inaktív; 5M BOS trendirányba (+16.0); ATR erősség 1.70× küszöb (+15.2); Ár az intraday range alsó zónájában (+4.0); Range expanzió támogatja a momentumot (+3.0); XAG momentum override — stop tágítva erős trendnél; XAGUSD: momentum override — stop távolság 1.3×ATR-re tágítva; Fib zóna konfluencia (0.618–0.886) (+18.0); P-Score reduced by 4.0 due to regime CHOPPY; XAGUSD: momentum kitörés — RR cél 1:1.45-re szűkítve; XAG momentum override — pozícióméret csökkentve; XAGUSD: ATR-alapú pozícióskálázás ×0.55; XAG: VWAP alatt — long setup türelmet igényel; Regime kapu: CHOPPY miatt −10 P-score, pozícióskálázás csökkentve; Strukturális kapu lazítva: momentum erős, BOS hiány engedve; Liquidity gate skipped (no volume proxy available); Order-flow gates skipped (no tick/imbalance data); TP1 nettó profit ≈ 1.90%; Precision belépő: trigger ablak aktív; Precision limit belépő parkolva 20 percig",,,,,,,
335ef979-f3a6-47dd-89bb-69054f6727bf,EURUSD,2025-12-24T08:46:19Z,precision_arming,core,56,,1.0,30.0,,,,,,,1.17911,2025-12-24T08:46:02Z,17,,,rule,"Bias(4H→1H)=long (+15.0); Regime filter inaktív; 5M BOS trendirányba (+16.0); ATR erősség 1.69× küszöb (+15.1); Alacsony realised vol → magasabb RR igény; Range expanzió támogatja a momentumot (+3.0); Ár 1h EMA21 zónában (+10.0); P-Score reduced by 4.0 due to regime CHOPPY; EURUSD: ATR(1h) alacsony — P-score küszöb +6 pontra emelve; EURUSD: Visszafogott ATR — célok szűkítve, kockázat kontroll alatt; EURUSD BOS aktív, de VWAP alatt — türelem; ATR-floor override: rel_atr 0.0003 < 0.0006 → adaptív RR/TP küszöb; Regime kapu: CHOPPY miatt −10 P-score, pozícióskálázás csökkentve; Strukturális kapu lazítva: momentum erős, BOS hiány engedve; Liquidity gate skipped (no volume proxy available); Order-flow gates skipped (no tick/imbalance data); TP1 nettó profit ≈ 2.28%; Precision belépő: trigger ablak aktív; Precision limit belépő parkolva 20 percig",,,,,,,
92a08c2a-86d1-4bce-bcbc-a818fe61c93f,GOLD_CFD,2025-12-24T08:46:19Z,precision_arming,core,36,,1.0,20.0,,,,,,,4491.67068,2025-12-24T08:46:04Z,15,,,rule,"Bias(4H→1H)=long (+15.0); Regime filter inaktív; 5M BOS trendirányba (+16.0); ATR nincs rendben (relatív vagy abszolút küszöb); Alacsony realised vol → magasabb RR igény; Range expanzió támogatja a momentumot (+3.0); Fib zóna konfluencia (0.618–0.886) (+18.0); P-Score reduced by 4.0 due to regime CHOPPY; ATR-floor override: rel_atr 0.0008 < 0.0025 → adaptív RR/TP küszöb; Regime kapu: CHOPPY miatt −10 P-score, pozícióskálázás csökkentve; ATR soft gate: alacsony volatilitás −5 P-score, méret felezve; Strukturális kapu lazítva: momentum erős, BOS hiány engedve; Liquidity gate skipped (no volume proxy available); Order-flow gates skipped (no tick/imbalance data); TP1 nettó profit ≈ 1.88%; Precision belépő: trigger ablak aktív; Precision limit belépő parkolva 20 percig",,,,,,,
4fa99209-4bc4-4037-aa2c-88de5259d652,BTCUSD,2025-12-24T08:46:19Z,precision_arming,core,62,,1.0,2.0,,,,,,,86869.99,2025-12-24T08:46:01Z,18,,,rule,"Bias(4H→1H)=short (+15.0); Regime filter inaktív; 5M BOS trendirányba (+16.0); ATR erősség 1.30× küszöb (+12.8); Alacsony realised vol → magasabb RR igény; Range expanzió támogatja a momentumot (+3.0); ema9x21+ofi_z=-999.00; Fib zóna konfluencia (0.618–0.886) (+18.0); P-Score reduced by 4.0 due to regime CHOPPY; BTC momentum override — pozícióméret csökkentve; Regime kapu: CHOPPY miatt −10 P-score, pozícióskálázás csökkentve; Strukturális kapu lazítva: momentum erős, BOS hiány engedve; TP1 nettó profit ≈ 0.60%; Order-flow gates skipped (no tick/imbalance data); Precision belépő: trigger ablak aktív; Precision limit belépő parkolva 16 percig",,,,,,,
821fbbf0-1771-4a56-8108-4397685412b8,USOIL,2025-12-24T08:46:19Z,no entry,core,8,,1.0,20.0,,,,,,,58.65,2025-12-24T08:45:47Z,32,,,rule,"Mean reversion bias override (+19.5); Regime filter inaktív; ATR nincs rendben (relatív vagy abszolút küszöb); Alacsony realised vol → magasabb RR igény; Ár az intraday range felső zónájában (+4.0); P-Score reduced by 4.0 due to regime CHOPPY; USOIL: 1h ATR <1 USD — P-score küszöb emelve a zajos sáv miatt; USOIL: csökkenő volatilitás — RR cél 1:1.5-re igazítva; USOIL: európai délelőtt — pozícióméret ×0.75; USOIL: oldalazó szerkezet — 1h BOS nélkül nincs belépő; ATR-floor override: rel_atr 0.0008 < 0.0008 → adaptív RR/TP küszöb; Regime kapu: CHOPPY miatt −10 P-score, pozícióskálázás csökkentve; ATR soft gate: alacsony volatilitás −5 P-score, méret felezve; Liquidity gate skipped (no volume proxy available); Order-flow gates skipped (no tick/imbalance data); missing: P_score>=36",,,,,,,
