journal_id,asset,analysis_timestamp,signal,mode,probability,model_probability,realtime_confidence,leverage,entry_price,stop_loss,take_profit_1,take_profit_2,risk_reward,initial_risk_abs,spot_price,spot_timestamp,spot_latency_seconds,precision_score,anchor_bias,probability_source,notes,validation_outcome,validation_rr,max_favorable_excursion,max_adverse_excursion,time_to_outcome_minutes,slippage,execution_latency_ms
f81aecae-1166-432d-bff5-026da1245f09,EURUSD,2026-01-02T11:16:12Z,no entry,core,1,,1.0,30.0,,,,,,,1.17187,2026-01-02T11:15:55Z,17,,,rule,"Intraday bias gate feltételek hiányosak — Micro BOS long  ATR rendben: 1m micro BOS long | Micro BOS short  ATR rendben: 1m micro BOS short; Bias neutrálsávban; Regime filter inaktív; ATR erősség 1.85× küszöb (+16.1); Alacsony realised vol → magasabb RR igény; Range expanzió támogatja a momentumot (+3.0); P-Score reduced by 4.0 due to regime CHOPPY; EURUSD: ATR(1h) alacsony — P-score küszöb +6 pontra emelve; EURUSD: Visszafogott ATR — célok szűkítve, kockázat kontroll alatt; ATR-floor override: rel_atr 0.0002 < 0.0006 → adaptív RR/TP küszöb; Regime kapu: CHOPPY miatt −10 P-score, pozícióskálázás csökkentve; Bias eltérés: H1 trend ütközik az M5 belépéssel (−15 P-score); Strukturális kapu lazítva: momentum erős, BOS hiány engedve; Liquidity gate skipped (no volume proxy available); Order-flow gates skipped (no tick/imbalance data); missing: P_score>=34",,,,,,,
851a7d26-62e9-4904-9a9a-868153379d33,GOLD_CFD,2026-01-02T11:16:12Z,no entry,core,0,,1.0,20.0,,,,,,,4393.91959,2026-01-02T11:15:57Z,15,,,rule,"Intraday bias gate feltételek hiányosak — 5m retest long  ATR: 5m retest long, ATR gate | 5m retest short  ATR: 5m retest short, ATR gate; Bias neutrálsávban; Regime filter inaktív; ATR nincs rendben (relatív vagy abszolút küszöb); Alacsony realised vol → magasabb RR igény; P-Score reduced by 4.0 due to regime CHOPPY; ATR-floor override: rel_atr 0.0008 < 0.0025 → adaptív RR/TP küszöb; Regime kapu: CHOPPY miatt −10 P-score, pozícióskálázás csökkentve; ATR soft gate: alacsony volatilitás −5 P-score, méret felezve; Bias eltérés: H1 trend ütközik az M5 belépéssel (−15 P-score); Liquidity gate skipped (no volume proxy available); Order-flow gates skipped (no tick/imbalance data); missing: P_score>=30",,,,,,,
61c9e254-a77e-4978-b3e0-c711c2a67246,XAGUSD,2026-01-02T11:16:12Z,no entry,core,0,,1.0,20.0,,,,,,,74.51607,2026-01-02T11:15:35Z,37,,,rule,"Intraday bias gate feltételek hiányosak — Micro BOS long  ATR (ezüst): 1m micro BOS long, ATR gate | Micro BOS short  ATR (ezüst): 1m micro BOS short, ATR gate; Bias neutrálsávban; EMA21 slope 1.01× küszöb (+12.1); ATR nincs rendben (relatív vagy abszolút küszöb); Alacsony realised vol → magasabb RR igény; ATR-floor override: rel_atr 0.0007 < 0.0008 → adaptív RR/TP küszöb; ATR soft gate: alacsony volatilitás −5 P-score, méret felezve; Bias eltérés: H1 trend ütközik az M5 belépéssel (−15 P-score); Liquidity gate skipped (no volume proxy available); Order-flow gates skipped (no tick/imbalance data); missing: P_score>=30",,,,,,,
6bd14c8b-4af4-441b-9372-a2b2c134837c,BTCUSD,2026-01-02T11:16:12Z,no entry,core,67,,1.0,2.0,89444.03,90338.4703,87386.81731,86224.04491999999,3.6,,89444.03,2026-01-02T11:15:56Z,16,,,rule,"Bias override: Intraday 5m BOS short  ATR (+19.5); Regime filter inaktív; HTF sweep ok (+10.0); 5M BOS trendirányba (+16.0); ATR erősség 2.05× küszöb (+17.3); Ár az intraday range felső zónájában (+4.0); Range expanzió támogatja a momentumot (+3.0); P-Score reduced by 4.0 due to regime CHOPPY; Regime kapu: CHOPPY miatt −10 P-score, pozícióskálázás csökkentve; Strukturális kapu lazítva: momentum erős, BOS hiány engedve; Likviditási kapu lazítva erős momentum miatt; Order-flow gates skipped (no tick/imbalance data); Precision limit belépő parkolva 16 percig",,,,,,,
5ffdaec4-d782-4d84-9426-2d371a66a8a0,USOIL,2026-01-02T11:16:12Z,no entry,core,17,,1.0,20.0,,,,,,,57.3,2026-01-02T11:15:38Z,34,,,rule,"Bias(4H→1H)=short (+15.0); Regime filter inaktív; ATR nincs rendben (relatív vagy abszolút küszöb); Fib zóna konfluencia (0.618–0.886) (+18.0); P-Score reduced by 4.0 due to regime CHOPPY; USOIL: 1h ATR <1 USD — P-score küszöb emelve a zajos sáv miatt; USOIL: csökkenő volatilitás — RR cél 1:1.5-re igazítva; USOIL: európai délelőtt — pozícióméret ×0.75; Regime kapu: CHOPPY miatt −10 P-score, pozícióskálázás csökkentve; ATR soft gate: alacsony volatilitás −5 P-score, méret felezve; Liquidity gate skipped (no volume proxy available); Order-flow gates skipped (no tick/imbalance data); missing: P_score>=36",,,,,,,
