journal_id,asset,analysis_timestamp,signal,mode,probability,model_probability,realtime_confidence,leverage,entry_price,stop_loss,take_profit_1,take_profit_2,risk_reward,initial_risk_abs,spot_price,spot_timestamp,spot_latency_seconds,precision_score,anchor_bias,probability_source,notes,validation_outcome,validation_rr,max_favorable_excursion,max_adverse_excursion,time_to_outcome_minutes,slippage,execution_latency_ms
48b9c2d0-3ecf-4d3d-bcdf-71b2e2e3f0d2,NVDA,2026-04-13T14:51:43Z,no entry,core,22,,1.0,5.0,,,,,,,189.1,2026-04-13T14:51:10Z,33,,,rule,"Mean reversion bias override (+19.5); Regime filter inaktív; London–NY overlap profil (-1.0); ATR nincs rendben (relatív vagy abszolút küszöb); WARNING: No Liquidity Structure (Nearest: 184.770730, Dist: 8.00ATR); Ár az intraday range felső zónájában (+4.0); Fib zóna konfluencia (0.618–0.886) (+18.0); Order flow neutrális (−2.4); P-Score reduced by 4.0 due to regime CHOPPY; Regime kapu: CHOPPY miatt −10 P-score, pozícióskálázás csökkentve; ATR soft gate: alacsony volatilitás −5 P-score, méret felezve; missing: P_score>=38",,,,,,,
74a35344-03b8-4705-b57b-3f401e05b874,GOLD_CFD,2026-04-13T14:51:43Z,precision_arming,core,30,,1.0,20.0,,,,,,,4716.11269,2026-04-13T14:51:10Z,33,,,rule,"Bias(4H→1H)=short (+15.0); Regime filter inaktív; 5M BOS trendirányba (+16.0); London–NY overlap profil (-1.0); ATR nincs rendben (relatív vagy abszolút küszöb); Range expanzió támogatja a momentumot (+3.0); Fib zóna konfluencia (0.618–0.886) (+18.0); Order flow neutrális (−4.5); P-Score reduced by 4.0 due to regime CHOPPY; VWAP felett — GOLD short breakout várakozik; OFI z-score -2.50 támogatja az irányt; ATR-floor override: rel_atr 0.0013 < 0.0025 → adaptív RR/TP küszöb; Regime kapu: CHOPPY miatt −10 P-score, pozícióskálázás csökkentve; ATR soft gate: alacsony volatilitás −5 P-score, méret felezve; Liquidity gate skipped (no volume proxy available); GOLD stop lazítás: ATR1h alapú kockázat ×1.09; Precision trigger kész → limit figyelés; Precision limit belépő parkolva 12 percig",,,,,,,
e0f19108-c10e-4e27-bec6-6c953b88e4e9,EURUSD,2026-04-13T14:51:43Z,no entry,core,31,,1.0,30.0,,,,,,,1.17162,2026-04-13T14:51:10Z,33,,,rule,"Bias(4H→1H)=long (+15.0); Regime filter inaktív; 5M BOS trendirányba (+16.0); London–NY overlap profil (-1.0); ATR erősség 1.70× küszöb (+15.2); Alacsony realised vol → magasabb RR igény; Intraday range felső harmada telített (−7.0); Range expanzió támogatja a momentumot (+3.0); Order flow neutrális (−3.5); OFI toxikus long irányra (−3.7); P-Score reduced by 4.0 due to regime CHOPPY; EURUSD: ATR(1h) alacsony — P-score küszöb +6 pontra emelve; EURUSD: Visszafogott ATR — célok szűkítve, kockázat kontroll alatt; EURUSD BOS aktív, de VWAP alatt — türelem; ATR-floor override: rel_atr 0.0003 < 0.0006 → adaptív RR/TP küszöb; Regime kapu: CHOPPY miatt −10 P-score, pozícióskálázás csökkentve; Strukturális kapu lazítva: momentum erős, BOS hiány engedve; Liquidity gate skipped (no volume proxy available); missing: P_score>=44",,,,,,,
3a071c46-1491-43dd-8f91-c713f856a7f8,XAGUSD,2026-04-13T14:51:43Z,precision_arming,core,62,,1.0,20.0,,,,,,,74.04234,2026-04-13T14:51:10Z,33,,,rule,"Bias(4H→1H)=short (+15.0); Regime filter inaktív; 5M BOS trendirányba (+16.0); London–NY overlap profil (-1.0); ATR erősség 1.69× küszöb (+15.1); Range expanzió támogatja a momentumot (+3.0); XAG momentum override — stop tágítva erős trendnél; XAGUSD: momentum override — stop távolság 1.3×ATR-re tágítva; Fib zóna konfluencia (0.618–0.886) (+18.0); Order flow neutrális (−4.9); XAGUSD: momentum kitörés — RR cél 1:1.45-re szűkítve; XAGUSD breakout-védelem: gyors BE + 20% giveback limit expanziós szakaszban; XAG momentum override — pozícióméret csökkentve; XAG: VWAP felett — short setup türelmet igényel; OFI z-score -2.19 támogatja az irányt; Regime kapu: CHOPPY miatt −10 P-score, pozícióskálázás csökkentve; Liquidity gate skipped (no volume proxy available); XAG stop lazítás: ATR1h alapú kockázat ×1.09; Precision trigger kész → limit figyelés; Precision limit belépő parkolva 12 percig",,,,,,,
0926166c-606d-4b37-8b67-c1ffb709b69d,USOIL,2026-04-13T14:51:43Z,no entry,core_only,89,,1.0,20.0,101.64542,100.426946171,104.44790980670001,106.03192578440002,3.6,,101.64542,2026-04-13T14:51:10Z,33,,,rule,Bias(4H→1H)=long (+15.0); EMA21 slope 1.08× küszöb (+12.5); 5M BOS trendirányba (+16.0); London–NY overlap profil (-1.0); ATR erősség 2.30× küszöb (+18.8); Ár az intraday range alsó zónájában (+4.0); Range expanzió támogatja a momentumot (+3.0); USOIL: erős momentum — invalid zóna 2.5×ATR(1h)-re tágítva; Ár 1h EMA21 zónában (+10.0); Order flow neutrális (−4.1); USOIL: csökkenő volatilitás — RR cél 1:1.5-re igazítva; USOIL: oldalazó szerkezet — H1/M5 BOS nélkül nincs belépő; OFI z-score 1.16 támogatja az irányt; USOIL stop lazítás: ATR1h alapú kockázat ×0.97; Diagnosztika: k1m: utolsó zárt gyertya 10 perc késésben van; Diagnosztika: k1m: jelzés korlátozva 10 perc késés miatt; Diagnosztika: k5m: utolsó zárt gyertya 11 perc késésben van,,,,,,,
ddd87190-3210-4122-82cf-1a4a2b823f8e,BTCUSD,2026-04-13T14:51:43Z,precision_arming,core,37,,1.0,2.0,,,,,,,72010.64,2026-04-13T14:51:10Z,33,,,rule,"Micro bias override: gyors struktúra dominál (+19.5); Regime filter inaktív; 5M BOS trendirányba (+16.0); London–NY overlap profil (-1.0); ATR erősség 3.84× küszöb (+23.0); Intraday range felső harmada telített (−7.0); Range expanzió támogatja a momentumot (+3.0); Order flow neutrális (−4.5); OFI toxikus long irányra (−3.1); P-Score reduced by 4.0 due to regime CHOPPY; Intraday P-score lazítás: micro-bias long elsőbbséget kap (−1.5); Mesterlövész mód: P-score minimum 35 érvényesítve; BTC mikro BOS long aktív; Regime kapu: CHOPPY miatt −10 P-score, pozícióskálázás csökkentve; Strukturális soft gate: 1/3 jel + ATR/spread OK (−6 P-score, size ×0.70); Likviditási kapu lazítva erős momentum miatt; BTC ATR1h stop igazítás: kockázat ×1.15; Precision trigger kész → limit figyelés; Precision limit belépő parkolva 20 percig",,,,,,,
