journal_id,asset,analysis_timestamp,signal,mode,probability,model_probability,realtime_confidence,leverage,entry_price,stop_loss,take_profit_1,take_profit_2,risk_reward,initial_risk_abs,spot_price,spot_timestamp,spot_latency_seconds,precision_score,anchor_bias,probability_source,notes,validation_outcome,validation_rr,max_favorable_excursion,max_adverse_excursion,time_to_outcome_minutes,slippage,execution_latency_ms
0fa704dd-2ca4-4069-ae31-3658a5800df7,EURUSD,2026-05-04T06:56:58Z,precision_arming,core,58,,1.0,30.0,,,,,,,1.1731,2026-05-04T06:56:32Z,25,,,rule,"Bias(4H→1H)=long (+15.0); Regime filter inaktív; 5M BOS trendirányba (+16.0); ATR erősség 1.54× küszöb (+14.2); Alacsony realised vol → magasabb RR igény; Range expanzió támogatja a momentumot (+3.0); Fib zóna konfluencia (0.618–0.886) (+18.0); Order flow neutrális (−4.8); P-Score reduced by 4.0 due to regime CHOPPY; EURUSD BOS aktív, de VWAP alatt — türelem; OFI z-score 1.85 támogatja az irányt; ATR-floor override: rel_atr 0.0003 < 0.0006 → adaptív RR/TP küszöb; Regime kapu: CHOPPY miatt −10 P-score, pozícióskálázás csökkentve; Liquidity gate skipped (no volume proxy available); EURUSD stop lazítás: ATR1h alapú kockázat ×0.72; Precision trigger kész → limit figyelés; Precision limit belépő parkolva 12 percig",,,,,,,
84ea0716-c4ae-4b39-a62a-e8e8f92caf84,XAGUSD,2026-05-04T06:56:58Z,no entry,core,3,,1.0,20.0,,,,,,,74.97296,2026-05-04T06:56:32Z,25,,,rule,"Intraday bias gate feltételek hiányosak — Micro BOS long  ATR (ezüst): 1m micro BOS long | Micro BOS short  ATR (ezüst): 1m micro BOS short; Bias neutrálsávban; Regime filter inaktív; ATR erősség 1.01× küszöb (+11.0); Order flow neutrális (−4.8); P-Score reduced by 4.0 due to regime CHOPPY; XAGUSD: visszafogott ATR — RR cél 1:1.7-re emelve; XAGUSD breakout-védelem: gyors BE + 20% giveback limit expanziós szakaszban; XAGUSD: ATR-alapú pozícióskálázás ×0.70; Regime kapu: CHOPPY miatt −10 P-score, pozícióskálázás csökkentve; Liquidity gate skipped (no volume proxy available); missing: P_score>=28",,,,,,,
46b5afe6-2566-421c-80ce-114f0408ba9c,GOLD_CFD,2026-05-04T06:56:58Z,no entry,core,11,,1.0,20.0,,,,,,,4590.32069,2026-05-04T06:56:32Z,25,,,rule,"Bias(4H→1H)=short (+15.0); Regime filter inaktív; 5M BOS trendirányba (+16.0); ATR nincs rendben (relatív vagy abszolút küszöb); Alacsony realised vol → magasabb RR igény; Intraday range alsó harmada telített (−7.0); Range expanzió támogatja a momentumot (+3.0); Order flow neutrális (−4.4); VWAP felett — GOLD short breakout várakozik; ATR-floor override: rel_atr 0.0011 < 0.0025 → adaptív RR/TP küszöb; Regime kapu: CHOPPY miatt −10 P-score, pozícióskálázás csökkentve; ATR soft gate: alacsony volatilitás −5 P-score, méret felezve; Strukturális kapu lazítva: momentum erős, BOS hiány engedve; Liquidity gate skipped (no volume proxy available); missing: P_score>=30",,,,,,,
c118277a-3af7-4f10-be13-d5c20fa87d21,BTCUSD,2026-05-04T06:56:58Z,precision_arming,core,41,,0.9999999999999999,2.0,,,,,,,79924.42,2026-05-04T06:56:32Z,26,,,rule,"Bias(4H→1H)=long (+15.0); Regime filter inaktív; HTF sweep ok (+10.0); 5M BOS trendirányba (+16.0); ATR nincs rendben (relatív vagy abszolút küszöb); Range expanzió támogatja a momentumot (+3.0); Fib zóna konfluencia (0.618–0.886) (+18.0); Order flow neutrális (−4.9); P-Score reduced by 4.0 due to regime CHOPPY; Mesterlövész mód: P-score minimum 35 érvényesítve; ATR-floor override: rel_atr 0.0012 < 0.0012 → adaptív RR/TP küszöb; Regime kapu: CHOPPY miatt −10 P-score, pozícióskálázás csökkentve; ATR soft gate: alacsony volatilitás −5 P-score, méret felezve; Strukturális kapu lazítva: momentum erős, BOS hiány engedve; BTC ATR1h stop igazítás: kockázat ×1.15; Precision trigger kész → limit figyelés; Precision limit belépő parkolva 20 percig",,,,,,,
c7dc6239-870a-42c8-a4fc-40040fc84bb6,USOIL,2026-05-04T06:56:58Z,precision_arming,core,43,,0.9999999999999999,20.0,,,,,,,104.19876,2026-05-04T06:56:32Z,26,,,rule,"Bias(4H→1H)=long (+15.0); Regime filter inaktív; 5M BOS trendirányba (+16.0); ATR erősség 0.99× küszöb (+11.0); Intraday range felső harmada telített (−7.0); Range expanzió támogatja a momentumot (+3.0); USOIL: erős momentum — invalid zóna 2.5×ATR(1h)-re tágítva; Fib zóna konfluencia (0.618–0.886) (+18.0); Order flow neutrális (−4.9); OFI toxikus long irányra (−4.8); P-Score reduced by 4.0 due to regime CHOPPY; P-Score reduced by 0.3 due to ATR Soft Gate tolerance; USOIL: parabolikus lendület — RR cél 1:1.4 környékére szűkítve; USOIL: európai délelőtt — pozícióméret ×0.85; Regime kapu: CHOPPY miatt −10 P-score, pozícióskálázás csökkentve; Liquidity gate skipped (no volume proxy available); USOIL stop lazítás: ATR1h alapú kockázat ×0.97; Precision trigger kész → limit figyelés; Precision limit belépő parkolva 12 percig",,,,,,,
