journal_id,asset,analysis_timestamp,signal,mode,probability,model_probability,realtime_confidence,leverage,entry_price,stop_loss,take_profit_1,take_profit_2,risk_reward,initial_risk_abs,spot_price,spot_timestamp,spot_latency_seconds,precision_score,anchor_bias,probability_source,notes,validation_outcome,validation_rr,max_favorable_excursion,max_adverse_excursion,time_to_outcome_minutes,slippage,execution_latency_ms
8d4d7f86-5128-4676-b7e5-87cfae9cba30,GOLD_CFD,2026-05-20T15:22:04Z,no entry,core,10,,1.0,20.0,,,,,,,4544.66408,2026-05-20T15:21:31Z,33,,,rule,"Micro bias override: gyors struktúra dominál (+19.5); Regime filter inaktív; 5M BOS trendirányba (+16.0); London–NY overlap profil (-1.0); ATR nincs rendben (relatív vagy abszolút küszöb); Intraday range felső harmada telített (−7.0); Range expanzió támogatja a momentumot (+3.0); Order flow neutrális (−4.9); P-Score reduced by 4.0 due to regime CHOPPY; Intraday P-score lazítás: micro-bias long elsőbbséget kap (−1.5); Mesterlövész mód: P-score minimum 30 érvényesítve; VWAP alatt — GOLD long breakout késleltetve; OFI z-score 1.45 támogatja az irányt; Regime kapu: CHOPPY miatt −10 P-score, pozícióskálázás csökkentve; ATR soft gate: alacsony volatilitás −5 P-score, méret felezve; Liquidity gate skipped (no volume proxy available); missing: P_score>=30, precision_score>=55",,,,,,,
a73a732b-1007-4d96-a116-8a1684fb8d9d,NVDA,2026-05-20T15:22:04Z,no entry,core,8,,1.0,5.0,,,,,,,225.6,2026-05-20T15:21:31Z,33,,,rule,"Intraday bias gate feltételek hiányosak — EMA9×21 long  magas ATR: EMA9×21 long, Magas ATR megerősítés | EMA9×21 short  magas ATR: EMA9×21 short, Magas ATR megerősítés | 5m BOS short  ATR (momentum nélkül): 5m BOS short; Bias neutrálsávban; Regime filter inaktív; London–NY overlap profil (-1.0); ATR erősség 0.86× küszöb (+10.1); WARNING: No Liquidity Structure (Nearest: 184.866953, Dist: 47.84ATR); Ár 1h EMA21 zónában (+10.0); Order flow neutrális (−2.1); P-Score reduced by 4.0 due to regime CHOPPY; P-Score reduced by 5.7 due to ATR Soft Gate tolerance; Regime kapu: CHOPPY miatt −10 P-score, pozícióskálázás csökkentve; missing: P_score>=38",,,,,,,
c5ce85ea-16b5-4986-b742-6677a205df66,EURUSD,2026-05-20T15:22:04Z,precision_arming,core,48,,1.0,30.0,,,,,,,1.16433,2026-05-20T15:21:31Z,33,,,rule,"Mean reversion bias override (+19.5); Regime filter inaktív; HTF sweep ok (+10.0); London–NY overlap profil (-1.0); ATR erősség 4.88× küszöb (+23.0); Alacsony realised vol → magasabb RR igény; Ár az intraday range felső zónájában (+4.0); Order flow neutrális (−4.5); P-Score reduced by 4.0 due to regime CHOPPY; Regime kapu: CHOPPY miatt −10 P-score, pozícióskálázás csökkentve; Liquidity gate skipped (no volume proxy available); EURUSD stop lazítás: ATR1h alapú kockázat ×0.69; Precision trigger kész → limit figyelés; Precision limit belépő parkolva 12 percig",,,,,,,
b34de221-1ddb-4f83-90c9-08811ad28d69,XAGUSD,2026-05-20T15:22:04Z,no entry,core,33,,1.0,20.0,,,,,,,76.26261,2026-05-20T15:21:31Z,33,,,rule,"Bias(4H→1H)=short (+15.0); Regime filter inaktív; HTF sweep ok (+10.0); London–NY overlap profil (-1.0); ATR erősség 2.16× küszöb (+18.0); Ár az intraday range felső zónájában (+4.0); Order flow neutrális (−4.1); P-Score reduced by 4.0 due to regime CHOPPY; XAGUSD breakout-védelem: gyors BE + 20% giveback limit expanziós szakaszban; XAGUSD: ATR-alapú pozícióskálázás ×0.55; XAG: VWAP felett — short setup türelmet igényel; Fém irány guard: 5m trend ellentétes a belépési biasszal; Regime kapu: CHOPPY miatt −10 P-score, pozícióskálázás csökkentve; Strukturális soft gate: 1/3 jel + ATR/spread OK (−6 P-score, size ×0.70); Strukturális kapu lazítva: momentum erős, BOS hiány engedve; Liquidity gate skipped (no volume proxy available); missing: metal_bias_5m_alignment",,,,,,,
44f6aefe-78a5-4cfe-823e-8f59afceabbb,USOIL,2026-05-20T15:22:04Z,no entry,core_only,34,,1.0,20.0,100.65929,96.345823586,109.286222828,113.59968924200001,3.0,,100.65929,2026-05-20T15:21:31Z,33,,,rule,"Bias(4H→1H)=long (+15.0); Regime filter inaktív; 5M BOS trendirányba (+16.0); London–NY overlap profil (-1.0); ATR nincs rendben (relatív vagy abszolút küszöb); Ár az intraday range alsó zónájában (+4.0); Range expanzió támogatja a momentumot (+3.0); USOIL: erős momentum — invalid zóna 2.5×ATR(1h)-re tágítva; Fib zóna konfluencia (0.618–0.886) (+18.0); Order flow neutrális (−4.9); P-Score reduced by 4.0 due to regime CHOPPY; USOIL: parabolikus lendület — RR cél 1:1.4 környékére szűkítve; USOIL: oldalazó szerkezet — H1/M5 BOS nélkül nincs belépő; Regime kapu: CHOPPY miatt −10 P-score, pozícióskálázás csökkentve; ATR soft gate: alacsony volatilitás −5 P-score, méret felezve; Strukturális kapu lazítva: momentum erős, BOS hiány engedve; P-score soft gate: −1.9 pont tolerancia (size ×0.65, RR +0.15); USOIL stop lazítás: ATR1h alapú kockázat ×0.97; Diagnosztika: k1m: utolsó zárt gyertya 11 perc késésben van; Diagnosztika: k1m: jelzés korlátozva 11 perc késés miatt; Diagnosztika: k5m: utolsó zárt gyertya 12 perc késésben van",,,,,,,
d3b56212-cab5-4157-b85f-df28771ba6a6,BTCUSD,2026-05-20T15:22:04Z,precision_arming,core,50,,1.0,2.0,,,,,,,77635.0,2026-05-20T15:21:31Z,33,,,rule,"Mean reversion bias override (+19.5); Regime filter inaktív; HTF sweep ok (+10.0); London–NY overlap profil (-1.0); ATR erősség 2.48× küszöb (+19.9); Ár az intraday range felső zónájában (+4.0); Order flow neutrális (−4.6); Sell pressure támogatja a setupot (+5); P-Score reduced by 4.0 due to regime CHOPPY; Mesterlövész mód: P-score minimum 35 érvényesítve; Regime kapu: CHOPPY miatt −10 P-score, pozícióskálázás csökkentve; BTC ATR1h stop igazítás: kockázat ×1.15; Precision trigger kész → limit figyelés; Precision limit belépő parkolva 20 percig",,,,,,,
