journal_id,asset,analysis_timestamp,signal,mode,probability,model_probability,realtime_confidence,leverage,entry_price,stop_loss,take_profit_1,take_profit_2,risk_reward,initial_risk_abs,spot_price,spot_timestamp,spot_latency_seconds,precision_score,anchor_bias,probability_source,notes,validation_outcome,validation_rr,max_favorable_excursion,max_adverse_excursion,time_to_outcome_minutes,slippage,execution_latency_ms
f3c80d27-7654-470b-96d6-28aa8e4afbea,XAGUSD,2026-02-03T19:10:54Z,no entry,core,42,,1.0,20.0,,,,,,,83.23454,2026-02-03T19:10:30Z,24,,,rule,"Intraday bias gate feltételek hiányosak — Micro BOS long  ATR (ezüst): 1m micro BOS long | Micro BOS short  ATR (ezüst): 1m micro BOS short; Bias neutrálsávban; EMA21 slope 1.40× küszöb (+14.4); ATR erősség 1.40× küszöb (+13.4); Ár 1h EMA21 zónában (+10.0); Order flow neutrális (−4.8); Mesterlövész mód: P-score minimum 35 érvényesítve; XAGUSD: ATR-alapú pozícióskálázás ×0.62; Strukturális soft gate: 1/3 jel + ATR/spread OK (−6 P-score, size ×0.70); Strukturális kapu lazítva: momentum erős, BOS hiány engedve; Liquidity gate skipped (no volume proxy available)",,,,,,,
f12ac61d-0d2c-4361-9092-9fbd22bf69db,NVDA,2026-02-03T19:10:54Z,no entry,core,7,,1.0,5.0,,,,,,,178.155,2026-02-03T19:10:30Z,24,,,rule,"Intraday bias gate feltételek hiányosak — EMA9×21 long  magas ATR: EMA9×21 long, Magas ATR megerősítés | EMA9×21 short  magas ATR: EMA9×21 short, Magas ATR megerősítés | 5m BOS short  ATR (momentum nélkül): ATR gate; Micro bias override: neutral -> micro irány (+19.5); Regime filter inaktív; 5M BOS trendirányba (+16.0); ATR nincs rendben (relatív vagy abszolút küszöb); WARNING: No Liquidity Structure (Nearest: 180.423176, Dist: 5.20ATR); Intraday range alsó harmada telített (−7.0); Range expanzió támogatja a momentumot (+3.0); Order flow neutrális (−4.1); OFI toxikus short irányra (−3.7); P-Score reduced by 4.0 due to regime CHOPPY; NVDA: magas napi ATR + momentum — P-score küszöb lazítva; Intraday P-score lazítás: micro-bias short elsőbbséget kap (−2.2); Mesterlövész mód: P-score minimum 35 érvényesítve; Regime kapu: CHOPPY miatt −10 P-score, pozícióskálázás csökkentve; ATR soft gate: alacsony volatilitás −5 P-score, méret felezve; missing: P_score>=35",,,,,,,
560311f1-c888-4c20-97f0-e83d7ad6a4a6,EURUSD,2026-02-03T19:10:54Z,precision_arming,core,61,,1.0,30.0,,,,,,,1.18086,2026-02-03T19:10:29Z,25,,,rule,"Bias override: Intraday Micro BOS short  ATR rendben (+19.5); Regime filter inaktív; 5M BOS trendirányba (+16.0); ATR erősség 1.41× küszöb (+13.5); Alacsony realised vol → magasabb RR igény; Range expanzió támogatja a momentumot (+3.0); Fib zóna konfluencia (0.618–0.886) (+18.0); Order flow neutrális (−4.3); EURUSD: ATR(1h) alacsony — P-score küszöb +6 pontra emelve; Intraday P-score lazítás: micro-bias short elsőbbséget kap (−2.2); EURUSD: Visszafogott ATR — célok szűkítve, kockázat kontroll alatt; EURUSD BOS aktív, de VWAP felett — várakozás; ATR-floor override: rel_atr 0.0003 < 0.0006 → adaptív RR/TP küszöb; Regime kapu: CHOPPY miatt −10 P-score, pozícióskálázás csökkentve; Strukturális soft gate: 1/3 jel + ATR/spread OK (−6 P-score, size ×0.70); Strukturális kapu lazítva: momentum erős, BOS hiány engedve; Liquidity gate skipped (no volume proxy available); Precision trigger kész → limit figyelés; Precision limit belépő parkolva 12 percig",,,,,,,
9846e21f-3de6-4063-bbd4-775bef818dff,GOLD_CFD,2026-02-03T19:10:54Z,no entry,core,21,,1.0,20.0,,,,,,,4891.74845,2026-02-03T19:10:29Z,25,,,rule,"Mean reversion bias override (+19.5); Regime filter inaktív; ATR nincs rendben (relatív vagy abszolút küszöb); Ár az intraday range alsó zónájában (+4.0); Fib zóna konfluencia (0.618–0.886) (+18.0); Order flow neutrális (−4.5); P-Score reduced by 4.0 due to regime CHOPPY; Mesterlövész mód: P-score minimum 35 érvényesítve; Regime kapu: CHOPPY miatt −10 P-score, pozícióskálázás csökkentve; ATR soft gate: alacsony volatilitás −5 P-score, méret felezve; Liquidity gate skipped (no volume proxy available); missing: P_score>=35",,,,,,,
fc2d77ac-1b6b-47bc-94d5-08b03c000dab,USOIL,2026-02-03T19:10:55Z,no entry,core,17,,1.0,20.0,,,,,,,62.52525,2026-02-03T19:10:30Z,25,,,rule,"Intraday bias gate feltételek hiányosak — USOIL retest long  ATR: 5m retest long | USOIL retest short  ATR: 5m retest short; Bias neutrálsávban; Regime filter inaktív; ATR erősség 1.23× küszöb (+12.4); Fib zóna konfluencia (0.618–0.886) (+18.0); Order flow neutrális (−4.2); P-Score reduced by 4.0 due to regime CHOPPY; USOIL: 1h ATR <1 USD — P-score küszöb emelve a zajos sáv miatt; USOIL: csökkenő volatilitás — RR cél 1:1.5-re igazítva; USOIL: US nyitás — pozícióméret ×0.75; Regime kapu: CHOPPY miatt −10 P-score, pozícióskálázás csökkentve; Strukturális soft gate: 1/3 jel + ATR/spread OK (−6 P-score, size ×0.70); Strukturális kapu lazítva: momentum erős, BOS hiány engedve; Liquidity gate skipped (no volume proxy available); missing: P_score>=42",,,,,,,
dfe704ec-4c95-43ea-8e2d-66a973b5dc17,BTCUSD,2026-02-03T19:10:55Z,precision_arming,core,69,,1.0,2.0,,,,,,,73470.01,2026-02-03T19:10:30Z,25,,,rule,"Bias(4H→1H)=short (+15.0); EMA21 slope 1.25× küszöb (+13.5); HTF sweep ok (+10.0); 5M BOS trendirányba (+16.0); ATR erősség 2.15× küszöb (+17.9); Intraday range alsó harmada telített (−7.0); Range expanzió támogatja a momentumot (+3.0); Order flow neutrális (−3.1); Order flow ellentétes irányba tolódik (−4); OFI toxikus short irányra (−6.9); Mesterlövész mód: P-score minimum 35 érvényesítve; Strukturális kapu lazítva: momentum erős, BOS hiány engedve; Likviditási kapu lazítva erős momentum miatt; BTC ATR1h stop igazítás: kockázat ×1.15; Precision trigger kész → limit figyelés; Precision limit belépő parkolva 20 percig",,,,,,,
