journal_id,asset,analysis_timestamp,signal,mode,probability,model_probability,realtime_confidence,leverage,entry_price,stop_loss,take_profit_1,take_profit_2,risk_reward,initial_risk_abs,spot_price,spot_timestamp,spot_latency_seconds,precision_score,anchor_bias,probability_source,notes,validation_outcome,validation_rr,max_favorable_excursion,max_adverse_excursion,time_to_outcome_minutes,slippage,execution_latency_ms
4727b5e2-c534-456e-8f7f-ef266d735a0b,NVDA,2025-12-22T19:19:51Z,no entry,core,0,,1.0,5.0,,,,,,,183.19,2025-12-22T19:19:15Z,35,,,rule,"Intraday bias gate feltételek hiányosak — EMA9×21 long + magas ATR: EMA9×21 long, Magas ATR megerősítés | EMA9×21 short + magas ATR: Magas ATR megerősítés | 5m BOS short + ATR (momentum nélkül): 5m BOS short, ATR gate; Bias neutrálsávban; Regime filter inaktív; ATR nincs rendben (relatív vagy abszolút küszöb); Alacsony realised vol → magasabb RR igény; Fib zóna konfluencia (0.618–0.886) (+18.0); Order flow neutrális (−4.8); Regime kapu: CHOPPY miatt −10 P-score, pozícióskálázás csökkentve; ATR soft gate: alacsony volatilitás −5 P-score, méret felezve; Bias eltérés: H1 trend ütközik az M5 belépéssel (−15 P-score); missing: P_score>=30",,,,,,,
dea4a464-726b-4774-a9dd-d8d40cca58b0,EURUSD,2025-12-22T19:19:51Z,no entry,core,16,,1.0,30.0,,,,,,,1.1751,2025-12-22T19:19:31Z,19,,,rule,"Bias(4H→1H)=long (+15.0); Regime filter inaktív; ATR nincs rendben (relatív vagy abszolút küszöb); Alacsony realised vol → magasabb RR igény; Ár az intraday range alsó zónájában (+4.0); Fib zóna konfluencia (0.618–0.886) (+18.0); P-Score reduced by 4.0 due to regime CHOPPY; P-Score reduced by 5.0 due to ATR Soft Gate tolerance; EURUSD: ATR(1h) alacsony — P-score küszöb +6 pontra emelve; EURUSD: Visszafogott ATR — célok szűkítve, kockázat kontroll alatt; ATR-floor override: rel_atr 0.0001 < 0.0006 → adaptív RR/TP küszöb; Regime kapu: CHOPPY miatt −10 P-score, pozícióskálázás csökkentve; ATR soft gate: alacsony volatilitás −5 P-score, méret felezve; Liquidity gate skipped (no volume proxy available); Order-flow gates skipped (no tick/imbalance data); missing: P_score>=34, precision_score>=55",,,,,,,
4f586954-cd01-4a0e-89e6-27e636338702,GOLD_CFD,2025-12-22T19:19:51Z,no entry,core,27,,1.0,20.0,,,,,,,4429.61628,2025-12-22T19:19:43Z,7,,,rule,"Bias(4H→1H)=long (+15.0); Regime filter inaktív; HTF sweep ok (+10.0); ATR nincs rendben (relatív vagy abszolút küszöb); Alacsony realised vol → magasabb RR igény; Fib zóna konfluencia (0.618–0.886) (+18.0); P-Score reduced by 4.0 due to regime CHOPPY; VWAP alatt — GOLD long breakout késleltetve; ATR-floor override: rel_atr 0.0006 < 0.0025 → adaptív RR/TP küszöb; Regime kapu: CHOPPY miatt −10 P-score, pozícióskálázás csökkentve; ATR soft gate: alacsony volatilitás −5 P-score, méret felezve; Liquidity gate skipped (no volume proxy available); Order-flow gates skipped (no tick/imbalance data); missing: P_score>=30",,,,,,,
03477ad8-2ab5-4b28-badd-b3187c391887,XAGUSD,2025-12-22T19:19:51Z,precision_arming,core,49,,1.0,20.0,,,,,,,68.25395,2025-12-22T19:19:09Z,41,,,rule,"Bias(4H→1H)=long (+15.0); Regime filter inaktív; ATR erősség 19.74× küszöb (+23.0); Alacsony realised vol → magasabb RR igény; Ár az intraday range alsó zónájában (+4.0); Ár 1h EMA21 zónában (+10.0); P-Score reduced by 4.0 due to regime CHOPPY; XAGUSD: ATR-alapú pozícióskálázás ×0.55; XAG: VWAP alatt — long setup türelmet igényel; Regime kapu: CHOPPY miatt −10 P-score, pozícióskálázás csökkentve; Liquidity gate skipped (no volume proxy available); Order-flow gates skipped (no tick/imbalance data); TP1 nettó profit ≈ 1.90%; Precision belépő: trigger ablak aktív; Precision limit belépő parkolva 20 percig",,,,,,,
e5177636-626a-491b-9669-78d6f960a756,USOIL,2025-12-22T19:19:51Z,no entry,core,0,,1.0,20.0,,,,,,,57.9,2025-12-22T19:19:22Z,29,,,rule,"Intraday bias gate feltételek hiányosak — USOIL retest long + ATR: 5m retest long, ATR gate | USOIL retest short + ATR: 5m retest short, ATR gate; Bias neutrálsávban; Regime filter inaktív; ATR nincs rendben (relatív vagy abszolút küszöb); Alacsony realised vol → magasabb RR igény; Fib zóna konfluencia (0.618–0.886) (+18.0); USOIL: 1h ATR <1 USD — P-score küszöb emelve a zajos sáv miatt; USOIL: csökkenő volatilitás — RR cél 1:1.5-re igazítva; Regime kapu: CHOPPY miatt −10 P-score, pozícióskálázás csökkentve; ATR soft gate: alacsony volatilitás −5 P-score, méret felezve; Bias eltérés: H1 trend ütközik az M5 belépéssel (−15 P-score); Liquidity gate skipped (no volume proxy available); Order-flow gates skipped (no tick/imbalance data); missing: P_score>=36",,,,,,,
c4319e62-bf63-4338-b731-97f35306744c,BTCUSD,2025-12-22T19:19:51Z,no entry,core,56,,1.0,2.0,88744.11,89631.5511,86969.22780000001,86081.78670000001,3.0,,88744.11,2025-12-22T19:19:32Z,19,,,rule,"Bias override: Intraday 5m BOS short + ATR (+19.5); Regime filter inaktív; 5M BOS trendirányba (+16.0); ATR erősség 2.13× küszöb (+17.8); Intraday range alsó harmada telített (−7.0); Range expanzió támogatja a momentumot (+3.0); Ár 1h EMA21 zónában (+10.0); P-Score reduced by 4.0 due to regime CHOPPY; Regime kapu: CHOPPY miatt −10 P-score, pozícióskálázás csökkentve; Strukturális kapu lazítva: momentum erős, BOS hiány engedve; Likviditási kapu lazítva erős momentum miatt; Order-flow gates skipped (no tick/imbalance data); Precision limit belépő parkolva 16 percig; missing: tp1_net>=+0.6%",,,,,,,
