journal_id,asset,analysis_timestamp,signal,mode,probability,model_probability,realtime_confidence,leverage,entry_price,stop_loss,take_profit_1,take_profit_2,risk_reward,initial_risk_abs,spot_price,spot_timestamp,spot_latency_seconds,precision_score,anchor_bias,probability_source,notes,validation_outcome,validation_rr,max_favorable_excursion,max_adverse_excursion,time_to_outcome_minutes,slippage,execution_latency_ms
09d70aaa-1179-4185-8ecc-8148d2116bf7,XAGUSD,2026-01-04T23:16:14Z,no entry,core,42,,1.0,20.0,73.44694,74.18140939999999,71.75766038,70.80285016000002,3.6,,73.44694,2026-01-04T23:15:41Z,33,,,rule,"Mean reversion bias override (+19.5); Regime filter inaktív; Zárási sáv likviditás büntetés (-2.0); ATR erősség 28.23× küszöb (+23.0); Ár az intraday range felső zónájában (+4.0); P-Score reduced by 4.0 due to regime CHOPPY; XAGUSD: ATR-alapú pozícióskálázás ×0.55; XAG: VWAP felett — short setup türelmet igényel; ATR-floor override: rel_atr 0.0017 < 0.0018 → adaptív RR/TP küszöb; Regime kapu: CHOPPY miatt −10 P-score, pozícióskálázás csökkentve; Liquidity gate skipped (no volume proxy available); Order-flow gates skipped (no tick/imbalance data)",,,,,,,
2d1eb618-7059-4220-81ab-5a83c3413490,GOLD_CFD,2026-01-04T23:16:14Z,no entry,core,16,,1.0,20.0,,,,,,,4370.16017,2026-01-04T23:15:58Z,16,,,rule,"Mean reversion bias override (+19.5); Regime filter inaktív; HTF sweep ok (+10.0); Zárási sáv likviditás büntetés (-2.0); ATR nincs rendben (relatív vagy abszolút küszöb); Alacsony realised vol → magasabb RR igény; Ár az intraday range felső zónájában (+4.0); P-Score reduced by 4.0 due to regime CHOPPY; VWAP felett — GOLD short breakout várakozik; ATR-floor override: rel_atr 0.0008 < 0.0025 → adaptív RR/TP küszöb; Regime kapu: CHOPPY miatt −10 P-score, pozícióskálázás csökkentve; ATR soft gate: alacsony volatilitás −5 P-score, méret felezve; Liquidity gate skipped (no volume proxy available); Order-flow gates skipped (no tick/imbalance data); missing: P_score>=30, precision_score>=55",,,,,,,
15227e73-f8c7-4fcd-9d42-1db85a398a50,EURUSD,2026-01-04T23:16:14Z,no entry,core,28,,1.0,30.0,,,,,,,1.17121,2026-01-04T23:16:07Z,7,,,rule,"Intraday bias gate feltételek hiányosak — Micro BOS long  ATR rendben: 1m micro BOS long | Micro BOS short  ATR rendben: 1m micro BOS short; Bias neutrálsávban; Regime filter inaktív; HTF sweep ok (+10.0); Zárási sáv likviditás büntetés (-2.0); ATR erősség 2.08× küszöb (+17.5); Alacsony realised vol → magasabb RR igény; Range expanzió támogatja a momentumot (+3.0); Fib zóna konfluencia (0.618–0.886) (+18.0); P-Score reduced by 4.0 due to regime CHOPPY; EURUSD: ATR(1h) alacsony — P-score küszöb +6 pontra emelve; EURUSD: Visszafogott ATR — célok szűkítve, kockázat kontroll alatt; ATR-floor override: rel_atr 0.0003 < 0.0006 → adaptív RR/TP küszöb; Regime kapu: CHOPPY miatt −10 P-score, pozícióskálázás csökkentve; Bias eltérés: H1 trend ütközik az M5 belépéssel (−15 P-score); Strukturális kapu lazítva: momentum erős, BOS hiány engedve; Liquidity gate skipped (no volume proxy available); Order-flow gates skipped (no tick/imbalance data); missing: P_score>=34",,,,,,,
d5821d72-73f5-41f0-bee4-1f5df6577987,BTCUSD,2026-01-04T23:16:14Z,precision_arming,core,62,,1.0,2.0,,,,,,,91304.92,2026-01-04T23:15:54Z,20,,,rule,"Bias(4H→1H)=long (+15.0); Regime filter inaktív; 5M BOS trendirányba (+16.0); Zárási sáv likviditás büntetés (-2.0); ATR erősség 1.66× küszöb (+14.9); Alacsony realised vol → magasabb RR igény; Range expanzió támogatja a momentumot (+3.0); Fib zóna konfluencia (0.618–0.886) (+18.0); P-Score reduced by 4.0 due to regime CHOPPY; Regime kapu: CHOPPY miatt −10 P-score, pozícióskálázás csökkentve; Strukturális kapu lazítva: momentum erős, BOS hiány engedve; Order-flow gates skipped (no tick/imbalance data); Precision trigger kész → limit figyelés; Precision limit belépő parkolva 16 percig",,,,,,,
1f9ee8ca-1837-4805-9f49-24e60d52be22,USOIL,2026-01-04T23:16:14Z,market closed,session_closed,0,,1.0,20.0,,,,,,,56.86,2026-01-04T23:15:45Z,29,,,rule,"Piac zárva (nyitáson kívül); Bias(4H→1H)=short (+15.0); Regime filter inaktív; 5M BOS trendirányba (+16.0); Zárási sáv likviditás büntetés (-2.0); ATR erősség 2.72× küszöb (+21.3); Range expanzió támogatja a momentumot (+3.0); USOIL: erős momentum — invalid zóna 2.5×ATR(1h)-re tágítva; Fib zóna konfluencia (0.618–0.886) (+18.0); P-Score reduced by 4.0 due to regime CHOPPY; USOIL: 1h ATR <1 USD — P-score küszöb emelve a zajos sáv miatt; USOIL: csökkenő volatilitás — RR cél 1:1.5-re igazítva; USOIL: nyitás előtti sáv — pozícióméret ×0.75; Regime kapu: CHOPPY miatt −10 P-score, pozícióskálázás csökkentve; Liquidity gate skipped (no volume proxy available); Order-flow gates skipped (no tick/imbalance data); missing: session",,,,,,,
