journal_id,asset,analysis_timestamp,signal,mode,probability,model_probability,realtime_confidence,leverage,entry_price,stop_loss,take_profit_1,take_profit_2,risk_reward,initial_risk_abs,spot_price,spot_timestamp,spot_latency_seconds,precision_score,anchor_bias,probability_source,notes,validation_outcome,validation_rr,max_favorable_excursion,max_adverse_excursion,time_to_outcome_minutes,slippage,execution_latency_ms,fill_timestamp,exit_timestamp,entry_kind,validation_source
2aaaeea3-862d-4bf9-b68d-f20f2373514e,XAGUSD,2026-04-13T22:11:19Z,market closed,session_closed,0,,1.0,20.0,,,,,,,75.59954,2026-04-13T22:10:59Z,20,,,rule,"Piac zárva (napi karbantartás 22:00–23:00 UTC); Intraday bias gate feltételek hiányosak — Micro BOS long  ATR (ezüst): 1m micro BOS long, ATR gate | Micro BOS short  ATR (ezüst): 1m micro BOS short, ATR gate; Bias neutrálsávban; Regime filter inaktív; ATR nincs rendben (relatív vagy abszolút küszöb); Alacsony realised vol → magasabb RR igény; Range expanzió támogatja a momentumot (+3.0); XAG momentum override — stop tágítva erős trendnél; XAGUSD: momentum override — stop távolság 1.3×ATR-re tágítva; Fib zóna konfluencia (0.618–0.886) (+18.0); Order flow neutrális (−4.6); P-Score reduced by 4.0 due to regime CHOPPY; XAGUSD: momentum kitörés — RR cél 1:1.45-re szűkítve; XAGUSD breakout-védelem: gyors BE + 20% giveback limit expanziós szakaszban; XAG momentum override — pozícióméret csökkentve; XAGUSD: ATR-alapú pozícióskálázás ×0.55; ATR-floor override: rel_atr 0.0005 < 0.0018 → adaptív RR/TP küszöb; Regime kapu: CHOPPY miatt −10 P-score, pozícióskálázás csökkentve; ATR soft gate: alacsony volatilitás −5 P-score, méret felezve; Strukturális kapu lazítva: momentum erős, BOS hiány engedve; Liquidity gate skipped (no volume proxy available); missing: session, P_score>=28",,,,,,,,,,,
2110fd5a-4137-4c7d-a0bf-f61c9c8cf464,GOLD_CFD,2026-04-13T22:11:19Z,market closed,session_closed,0,,1.0,20.0,,,,,,,4747.65434,2026-04-13T22:10:59Z,20,,,rule,"Piac zárva (napi karbantartás 22:00–23:00 UTC); Intraday bias gate feltételek hiányosak — 5m retest long  ATR: 5m retest long, ATR gate | 5m retest short  ATR: 5m retest short, ATR gate; Bias neutrálsávban; Regime filter inaktív; ATR nincs rendben (relatív vagy abszolút küszöb); Alacsony realised vol → magasabb RR igény; Range expanzió támogatja a momentumot (+3.0); Fib zóna konfluencia (0.618–0.886) (+18.0); Order flow neutrális (−4.5); P-Score reduced by 4.0 due to regime CHOPPY; ATR-floor override: rel_atr 0.0003 < 0.0025 → adaptív RR/TP küszöb; Regime kapu: CHOPPY miatt −10 P-score, pozícióskálázás csökkentve; ATR soft gate: alacsony volatilitás −5 P-score, méret felezve; Strukturális kapu lazítva: momentum erős, BOS hiány engedve; Liquidity gate skipped (no volume proxy available); missing: session, P_score>=30",,,,,,,,,,,
df56acce-2c27-4340-af37-c030fc3bb8ae,EURUSD,2026-04-13T22:11:19Z,no entry,core,25,,1.0,30.0,,,,,,,1.17628,2026-04-13T22:10:59Z,20,,,rule,"Bias(4H→1H)=long (+15.0); Regime filter inaktív; 5M BOS trendirányba (+16.0); ATR nincs rendben (relatív vagy abszolút küszöb); Alacsony realised vol → magasabb RR igény; Intraday range felső harmada telített (−7.0); Range expanzió támogatja a momentumot (+3.0); Fib zóna konfluencia (0.618–0.886) (+18.0); Order flow neutrális (−3.9); P-Score reduced by 4.0 due to regime CHOPPY; EURUSD: ATR(1h) alacsony — P-score küszöb +6 pontra emelve; EURUSD: Visszafogott ATR — célok szűkítve, kockázat kontroll alatt; EURUSD BOS aktív, de VWAP alatt — türelem; ATR-floor override: rel_atr 0.0002 < 0.0006 → adaptív RR/TP küszöb; Regime kapu: CHOPPY miatt −10 P-score, pozícióskálázás csökkentve; ATR soft gate: alacsony volatilitás −5 P-score, méret felezve; Strukturális kapu lazítva: momentum erős, BOS hiány engedve; Liquidity gate skipped (no volume proxy available); missing: P_score>=44",,,,,,,,,,,
cbcbb6fe-dcf9-4891-919a-f23bc969bdbf,BTCUSD,2026-04-13T22:11:19Z,buy,core,43,,1.0,2.0,73355.54,72621.9846,74822.65079999999,75556.20619999999,3.0,,73355.54,2026-04-13T22:10:59Z,20,,,rule,"Bias(4H→1H)=long (+15.0); Regime filter inaktív; HTF sweep ok (+10.0); 5M BOS trendirányba (+16.0); ATR erősség 1.29× küszöb (+12.8); Range expanzió támogatja a momentumot (+3.0); Order flow neutrális (−4.4); P-Score reduced by 4.0 due to regime CHOPPY; Intraday P-score lazítás: micro-bias long elsőbbséget kap (−1.5); Mesterlövész mód: P-score minimum 35 érvényesítve; BTC mikro BOS long aktív; Regime kapu: CHOPPY miatt −10 P-score, pozícióskálázás csökkentve; Strukturális soft gate: 1/3 jel + ATR/spread OK (−6 P-score, size ×0.70); BTC ATR1h stop igazítás: kockázat ×1.15; TP1 nettó profit ≈ 0.60%; Precision plan: entry 73277.6–73361.5, SL 73193.8; Precision confidence medium (62.0); Precision limit belépő parkolva 20 percig; missing: tp1_net>=+0.6%",insufficient_data,,,,,,,,,market,auto
39d660d4-a666-4754-b8d5-1b3b99de4017,USOIL,2026-04-13T22:11:19Z,market closed,session_closed,0,,1.0,20.0,,,,,,,97.8418,2026-04-13T22:10:59Z,20,,,rule,"Piac zárva (napi karbantartás 22:00–23:00 UTC); Intraday bias gate feltételek hiányosak — USOIL retest long  ATR: 5m retest long | USOIL retest short  ATR: 5m retest short; Bias neutrálsávban; Regime filter inaktív; ATR erősség 0.97× küszöb (+10.8); Range expanzió támogatja a momentumot (+3.0); USOIL: erős momentum — invalid zóna 2.5×ATR(1h)-re tágítva; Fib zóna konfluencia (0.618–0.886) (+18.0); Order flow neutrális (−4.9); P-Score reduced by 1.3 due to ATR Soft Gate tolerance; USOIL: 1h ATR ≥1.5 USD — RR cél 1:2-re emelve; Regime kapu: CHOPPY miatt −10 P-score, pozícióskálázás csökkentve; Strukturális soft gate: 1/3 jel + ATR/spread OK (−6 P-score, size ×0.70); Strukturális kapu lazítva: momentum erős, BOS hiány engedve; Liquidity gate skipped (no volume proxy available); missing: session, P_score>=36",,,,,,,,,,,
