journal_id,asset,analysis_timestamp,signal,mode,probability,model_probability,realtime_confidence,leverage,entry_price,stop_loss,take_profit_1,take_profit_2,risk_reward,initial_risk_abs,spot_price,spot_timestamp,spot_latency_seconds,precision_score,anchor_bias,probability_source,notes,validation_outcome,validation_rr,max_favorable_excursion,max_adverse_excursion,time_to_outcome_minutes,slippage,execution_latency_ms
4d248035-fcad-4ed4-9860-869920df40d5,XAGUSD,2026-03-06T19:25:44Z,no entry,core,15,,1.0,20.0,,,,,,,84.58416,2026-03-06T19:25:20Z,24,,,rule,"Intraday bias gate feltételek hiányosak — Micro BOS long  ATR (ezüst): 1m micro BOS long | Micro BOS short  ATR (ezüst): 1m micro BOS short; Bias neutrálsávban; Regime filter inaktív; ATR erősség 0.99× küszöb (+10.9); Fib zóna konfluencia (0.618–0.886) (+18.0); Order flow neutrális (−4.9); P-Score reduced by 4.0 due to regime CHOPPY; P-Score reduced by 0.3 due to ATR Soft Gate tolerance; XAGUSD: visszafogott ATR — RR cél 1:1.7-re emelve; XAGUSD breakout-védelem: gyors BE + 20% giveback limit expanziós szakaszban; XAGUSD: ATR-alapú pozícióskálázás ×0.70; Regime kapu: CHOPPY miatt −10 P-score, pozícióskálázás csökkentve; Strukturális soft gate: 1/3 jel + ATR/spread OK (−6 P-score, size ×0.70); Strukturális kapu lazítva: momentum erős, BOS hiány engedve; Liquidity gate skipped (no volume proxy available); missing: P_score>=28",,,,,,,
0ee59efb-9b12-49ac-9e2f-50ef37aa2a37,NVDA,2026-03-06T19:25:44Z,no entry,core,32,,1.0,5.0,,,,,,,180.46,2026-03-06T19:25:20Z,24,,,rule,"Micro bias override: gyors struktúra dominál (+19.5); Regime filter inaktív; 5M BOS trendirányba (+16.0); ATR nincs rendben (relatív vagy abszolút küszöb); WARNING: No Liquidity Structure (Nearest: 182.532879, Dist: 5.68ATR); Range expanzió támogatja a momentumot (+3.0); Fib zóna konfluencia (0.618–0.886) (+18.0); Order flow neutrális (−4.7); OFI toxikus short irányra (−3.3); P-Score reduced by 4.0 due to regime CHOPPY; NVDA: magas napi ATR + momentum — P-score küszöb lazítva; Intraday P-score lazítás: micro-bias short elsőbbséget kap (−2.2); Mesterlövész mód: P-score minimum 35 érvényesítve; Regime kapu: CHOPPY miatt −10 P-score, pozícióskálázás csökkentve; ATR soft gate: alacsony volatilitás −5 P-score, méret felezve; missing: P_score>=35",,,,,,,
e9dd460c-b3f5-40be-ac73-e125d46a3196,EURUSD,2026-03-06T19:25:45Z,precision_arming,core,36,,1.0,30.0,,,,,,,1.1604,2026-03-06T19:25:20Z,24,,,rule,"Bias(4H→1H)=short (+15.0); Regime filter inaktív; ATR erősség 1.34× küszöb (+13.1); Alacsony realised vol → magasabb RR igény; Ár az intraday range felső zónájában (+4.0); Fib zóna konfluencia (0.618–0.886) (+18.0); Order flow neutrális (−4.9); P-Score reduced by 4.0 due to regime CHOPPY; EURUSD: ATR-alapú pozícióskálázás ×0.65 — volatilitás kontroll; ATR-floor override: rel_atr 0.0004 < 0.0006 → adaptív RR/TP küszöb; Regime kapu: CHOPPY miatt −10 P-score, pozícióskálázás csökkentve; Strukturális soft gate: 1/3 jel + ATR/spread OK (−6 P-score, size ×0.70); Strukturális kapu lazítva: momentum erős, BOS hiány engedve; P-score soft gate: −1.9 pont tolerancia (size ×0.65, RR +0.15); Liquidity gate skipped (no volume proxy available); EURUSD stop lazítás: ATR1h alapú kockázat ×0.69; Precision trigger kész → limit figyelés; Precision limit belépő parkolva 12 percig",,,,,,,
e51ed816-cc89-4dba-905a-ccb28f202c19,GOLD_CFD,2026-03-06T19:25:44Z,no entry,core,18,,1.0,20.0,,,,,,,5166.55821,2026-03-06T19:25:20Z,24,,,rule,"Micro bias override: gyors struktúra dominál (+19.5); Regime filter inaktív; HTF sweep ok (+10.0); 5M BOS trendirányba (+16.0); ATR nincs rendben (relatív vagy abszolút küszöb); Alacsony realised vol → magasabb RR igény; Intraday range felső harmada telített (−7.0); Range expanzió támogatja a momentumot (+3.0); Order flow neutrális (−3.4); OFI toxikus long irányra (−3.6); P-Score reduced by 4.0 due to regime CHOPPY; Intraday P-score lazítás: micro-bias long elsőbbséget kap (−1.5); Mesterlövész mód: P-score minimum 30 érvényesítve; VWAP alatt — GOLD long breakout késleltetve; ATR-floor override: rel_atr 0.0011 < 0.0025 → adaptív RR/TP küszöb; Regime kapu: CHOPPY miatt −10 P-score, pozícióskálázás csökkentve; ATR soft gate: alacsony volatilitás −5 P-score, méret felezve; Strukturális kapu lazítva: momentum erős, BOS hiány engedve; Liquidity gate skipped (no volume proxy available); missing: P_score>=30",,,,,,,
fbf20b0f-217e-48e8-995c-e6d17d5133c0,USOIL,2026-03-06T19:25:45Z,precision_arming,core,88,,1.0,20.0,,,,,,,88.52492,2026-03-06T19:25:20Z,25,,,rule,Bias(4H→1H)=long (+15.0); EMA21 slope 3.54× küszöb (+21.0); HTF sweep ok (+10.0); ATR erősség 1.55× küszöb (+14.3); Fib zóna konfluencia (0.618–0.886) (+18.0); Order flow neutrális (−4.9); USOIL: parabolikus lendület — RR cél 1:1.4 környékére szűkítve; Liquidity gate skipped (no volume proxy available); USOIL stop lazítás: ATR1h alapú kockázat ×0.92; Precision trigger kész → limit figyelés; Precision limit belépő parkolva 12 percig,,,,,,,
e316b053-b96a-41a7-9689-bb4fd8205dda,BTCUSD,2026-03-06T19:25:45Z,no entry,core,34,,1.0,2.0,,,,,,,68209.06,2026-03-06T19:25:20Z,25,,,rule,"Intraday bias gate feltételek hiányosak — Crypto momentum long: 1m micro BOS long, Momentum volume ráta | Crypto momentum short: 1m micro BOS short | 5m BOS long  ATR: 5m BOS long | 5m BOS short  ATR: 5m BOS short | Micro BOS short  ATR (momentum nélkül): 1m micro BOS short; Bias neutrálsávban; EMA21 slope 1.54× küszöb (+15.2); ATR erősség 0.94× küszöb (+10.7); Order flow neutrális (−4.5); P-Score reduced by 2.3 due to ATR Soft Gate tolerance; Mesterlövész mód: P-score minimum 35 érvényesítve; P-score soft gate: −0.9 pont tolerancia (size ×0.65, RR +0.15)",,,,,,,
