journal_id,asset,analysis_timestamp,signal,mode,probability,model_probability,realtime_confidence,leverage,entry_price,stop_loss,take_profit_1,take_profit_2,risk_reward,initial_risk_abs,spot_price,spot_timestamp,spot_latency_seconds,precision_score,anchor_bias,probability_source,notes,validation_outcome,validation_rr,max_favorable_excursion,max_adverse_excursion,time_to_outcome_minutes,slippage,execution_latency_ms
d4d56f90-a3cf-40bf-8e5c-f6fa319a28fa,EURUSD,2026-06-01T15:51:57Z,no entry,core,16,,1.0,30.0,,,,,,,1.16224,2026-06-01T15:51:25Z,32,,,rule,"Intraday bias gate feltételek hiányosak — Micro BOS long  ATR rendben: 1m micro BOS long | Micro BOS short  ATR rendben: 1m micro BOS short; Bias neutrálsávban; Regime filter inaktív; HTF sweep ok (+10.0); London–NY overlap profil (-1.0); ATR erősség 1.47× küszöb (+13.8); Alacsony realised vol → magasabb RR igény; Order flow neutrális (−3.8); P-Score reduced by 4.0 due to regime CHOPPY; EURUSD: ATR(1h) alacsony — P-score küszöb +6 pontra emelve; EURUSD: Visszafogott ATR — célok szűkítve, kockázat kontroll alatt; ATR-floor override: rel_atr 0.0003 < 0.0006 → adaptív RR/TP küszöb; Regime kapu: CHOPPY miatt −10 P-score, pozícióskálázás csökkentve; Liquidity gate skipped (no volume proxy available); missing: P_score>=44",,,,,,,
39e02a22-ffc1-4618-90d2-e6e87d14b6ea,XAGUSD,2026-06-01T15:51:58Z,precision_arming,core,42,,1.0,20.0,,,,,,,74.87804,2026-06-01T15:51:25Z,32,,,rule,"Bias(4H→1H)=short (+15.0); Regime filter inaktív; 5M BOS trendirányba (+16.0); London–NY overlap profil (-1.0); ATR erősség 1.28× küszöb (+12.7); Range expanzió támogatja a momentumot (+3.0); XAG momentum override — stop tágítva erős trendnél; XAGUSD: momentum override — stop távolság 1.3×ATR-re tágítva; Ár 1h EMA21 zónában (+10.0); Order flow neutrális (−4.2); P-Score reduced by 4.0 due to regime CHOPPY; XAGUSD: momentum kitörés — RR cél 1:1.45-re szűkítve; XAGUSD breakout-védelem: gyors BE + 20% giveback limit expanziós szakaszban; XAG momentum override — pozícióméret csökkentve; XAGUSD: ATR-alapú pozícióskálázás ×0.55; XAG: VWAP felett — short setup türelmet igényel; Regime kapu: CHOPPY miatt −10 P-score, pozícióskálázás csökkentve; Strukturális soft gate: 1/3 jel + ATR/spread OK (−6 P-score, size ×0.70); Strukturális kapu lazítva: momentum erős, BOS hiány engedve; Liquidity gate skipped (no volume proxy available); XAG stop lazítás: ATR1h alapú kockázat ×1.09; Precision trigger kész → limit figyelés; Precision limit belépő parkolva 12 percig",,,,,,,
88751813-46d1-41ad-9b6e-747df955023f,GOLD_CFD,2026-06-01T15:51:57Z,no entry,core,13,,1.0,20.0,,,,,,,4469.59475,2026-06-01T15:51:25Z,32,,,rule,"Bias(4H→1H)=short (+15.0); Regime filter inaktív; 5M BOS trendirányba (+16.0); London–NY overlap profil (-1.0); ATR nincs rendben (relatív vagy abszolút küszöb); Alacsony realised vol → magasabb RR igény; Range expanzió támogatja a momentumot (+3.0); Order flow neutrális (−3.8); P-Score reduced by 4.0 due to regime CHOPPY; VWAP felett — GOLD short breakout várakozik; ATR-floor override: rel_atr 0.0010 < 0.0025 → adaptív RR/TP küszöb; Regime kapu: CHOPPY miatt −10 P-score, pozícióskálázás csökkentve; ATR soft gate: alacsony volatilitás −5 P-score, méret felezve; Strukturális kapu lazítva: momentum erős, BOS hiány engedve; Liquidity gate skipped (no volume proxy available); missing: P_score>=30",,,,,,,
eeddcf27-ca6c-4d3c-949d-6c06ecaee1a2,NVDA,2026-06-01T15:51:57Z,no entry,core,0,,1.0,5.0,,,,,,,220.015,2026-06-01T15:51:25Z,32,,,rule,"Intraday bias gate feltételek hiányosak — EMA9×21 long  magas ATR: EMA9×21 long, Magas ATR megerősítés | EMA9×21 short  magas ATR: EMA9×21 short, Magas ATR megerősítés | 5m BOS short  ATR (momentum nélkül): 5m BOS short, ATR gate; Bias neutrálsávban; Regime filter inaktív; London–NY overlap profil (-1.0); ATR nincs rendben (relatív vagy abszolút küszöb); WARNING: No Liquidity Structure (Nearest: 197.152852, Dist: 37.74ATR); Range expanzió támogatja a momentumot (+3.0); Order flow neutrális (−3.9); P-Score reduced by 4.0 due to regime CHOPPY; NVDA: magas napi ATR + momentum — P-score küszöb lazítva; Mesterlövész mód: P-score minimum 35 érvényesítve; NVDA momentum override — napi ATR támogatja a likviditási lazítást; Regime kapu: CHOPPY miatt −10 P-score, pozícióskálázás csökkentve; ATR soft gate: alacsony volatilitás −5 P-score, méret felezve; Strukturális kapu lazítva: momentum erős, BOS hiány engedve; Likviditási kapu lazítva erős momentum miatt; missing: P_score>=35",,,,,,,
a382b997-819d-47cd-8b54-c821877d1583,USOIL,2026-06-01T15:51:58Z,no entry,core_only,85,,1.0,20.0,93.62722,96.554424181,87.77281163799998,84.84560745699997,3.0,,93.62722,2026-06-01T15:51:25Z,33,,,rule,"Bias(4H→1H)=short (+15.0); EMA21 slope 1.25× küszöb (+13.5); HTF sweep ok (+10.0); 5M BOS trendirányba (+16.0); London–NY overlap profil (-1.0); ATR erősség 1.58× küszöb (+14.5); Range expanzió támogatja a momentumot (+3.0); USOIL: erős momentum — invalid zóna 2.5×ATR(1h)-re tágítva; Ár 1h EMA21 zónában (+10.0); Order flow neutrális (−4.6); USOIL: parabolikus lendület — RR cél 1:1.4 környékére szűkítve; USOIL: oldalazó szerkezet — H1/M5 BOS nélkül nincs belépő; Strukturális soft gate: 1/3 jel + ATR/spread OK (−6 P-score, size ×0.70); Strukturális kapu lazítva: momentum erős, BOS hiány engedve; USOIL stop lazítás: ATR1h alapú kockázat ×0.97; Diagnosztika: k1m: utolsó zárt gyertya 10 perc késésben van; Diagnosztika: k1m: jelzés korlátozva 10 perc késés miatt; Diagnosztika: k5m: utolsó zárt gyertya 11 perc késésben van",,,,,,,
351090c7-0b38-4337-85ce-4e1691308a88,BTCUSD,2026-06-01T15:51:58Z,precision_arming,core,44,,1.0,2.0,,,,,,,71033.79,2026-06-01T15:51:25Z,33,,,rule,"Bias(4H→1H)=short (+15.0); Regime filter inaktív; 5M BOS trendirányba (+16.0); London–NY overlap profil (-1.0); ATR erősség 2.60× küszöb (+20.6); Intraday range alsó harmada telített (−7.0); Range expanzió támogatja a momentumot (+3.0); Order flow neutrális (−4.1); Sell pressure támogatja a setupot (+5); P-Score reduced by 4.0 due to regime CHOPPY; Mesterlövész mód: P-score minimum 35 érvényesítve; Regime kapu: CHOPPY miatt −10 P-score, pozícióskálázás csökkentve; Strukturális kapu lazítva: momentum erős, BOS hiány engedve; Likviditási kapu lazítva erős momentum miatt; BTC ATR1h stop igazítás: kockázat ×1.15; Precision trigger kész → limit figyelés; Precision limit belépő parkolva 20 percig",,,,,,,
