journal_id,asset,analysis_timestamp,signal,mode,probability,model_probability,realtime_confidence,leverage,entry_price,stop_loss,take_profit_1,take_profit_2,risk_reward,initial_risk_abs,spot_price,spot_timestamp,spot_latency_seconds,precision_score,anchor_bias,probability_source,notes,validation_outcome,validation_rr,max_favorable_excursion,max_adverse_excursion,time_to_outcome_minutes,slippage,execution_latency_ms
60429734-4a84-45bc-838e-c0b043b3eee0,XAGUSD,2026-01-16T18:18:00Z,precision_arming,core,37,,0.9999999999999999,20.0,,,,,,,88.53359,2026-01-16T18:17:29Z,31,,,rule,"Bias(4H→1H)=long (+15.0); Regime filter inaktív; 5M BOS trendirányba (+16.0); ATR erősség 1.89× küszöb (+16.3); Range expanzió támogatja a momentumot (+3.0); XAG momentum override — stop tágítva erős trendnél; XAGUSD: momentum override — stop távolság 1.3×ATR-re tágítva; Order flow neutrális (−4.5); P-Score reduced by 4.0 due to regime CHOPPY; XAGUSD: momentum kitörés — RR cél 1:1.45-re szűkítve; XAG momentum override — pozícióméret csökkentve; XAGUSD: ATR-alapú pozícióskálázás ×0.55; XAG: VWAP alatt — long setup türelmet igényel; Regime kapu: CHOPPY miatt −10 P-score, pozícióskálázás csökkentve; Strukturális soft gate: 1/3 jel + ATR/spread OK (−6 P-score, size ×0.70); Strukturális kapu lazítva: momentum erős, BOS hiány engedve; Likviditási kapu lazítva erős momentum miatt; Liquidity gate skipped (no volume proxy available); Precision trigger kész → limit figyelés; Precision limit belépő parkolva 20 percig",,,,,,,
3cd114d0-d752-403f-b380-117a295b18c4,GOLD_CFD,2026-01-16T18:18:00Z,precision_arming,core,23,,1.0,20.0,,,,,,,4583.67108,2026-01-16T18:17:28Z,32,,,rule,"Bias(4H→1H)=long (+15.0); Regime filter inaktív; 5M BOS trendirányba (+16.0); ATR nincs rendben (relatív vagy abszolút küszöb); Alacsony realised vol → magasabb RR igény; Range expanzió támogatja a momentumot (+3.0); Ár 1h EMA21 zónában (+10.0); Order flow neutrális (−4.9); P-Score reduced by 4.0 due to regime CHOPPY; ATR-floor override: rel_atr 0.0009 < 0.0025 → adaptív RR/TP küszöb; Regime kapu: CHOPPY miatt −10 P-score, pozícióskálázás csökkentve; ATR soft gate: alacsony volatilitás −5 P-score, méret felezve; Strukturális kapu lazítva: momentum erős, BOS hiány engedve; Liquidity gate skipped (no volume proxy available); GOLD stop lazítás: ATR alapú kockázat ×2.00; Precision trigger kész → limit figyelés; Precision limit belépő parkolva 20 percig",,,,,,,
d03e6460-c6fc-4525-a0a1-50ddfda7e6f3,NVDA,2026-01-16T18:18:00Z,precision_arming,core,27,,1.0,5.0,,,,,,,188.03,2026-01-16T18:17:28Z,32,,,rule,"Bias(4H→1H)=long (+15.0); Regime filter inaktív; 5M BOS trendirányba (+16.0); ATR nincs rendben (relatív vagy abszolút küszöb); Ár az intraday range alsó zónájában (+4.0); Range expanzió támogatja a momentumot (+3.0); Ár 1h EMA21 zónában (+10.0); Order flow neutrális (−4.6); P-Score reduced by 4.0 due to ATR Soft Gate tolerance; NVDA: magas napi ATR + momentum — P-score küszöb lazítva; NVDA momentum override — napi ATR támogatja a likviditási lazítást; ATR-floor override: rel_atr 0.0013 < 0.0014 → adaptív RR/TP küszöb; Regime kapu: CHOPPY miatt −10 P-score, pozícióskálázás csökkentve; ATR soft gate: alacsony volatilitás −5 P-score, méret felezve; Likviditási kapu lazítva erős momentum miatt; NVDA stop igazítás: kockázat ×0.90 ATR; Precision trigger kész → limit figyelés; Precision limit belépő parkolva 20 percig",,,,,,,
f8a23644-4315-43fd-9e86-997595398100,EURUSD,2026-01-16T18:18:00Z,no entry,core,26,,1.0,30.0,1.15912,1.1475288,1.1823024,1.1938936,3.0,,1.15912,2026-01-16T18:17:28Z,32,,,rule,"Mean reversion bias override (+19.5); Regime filter inaktív; ATR erősség 1.75× küszöb (+15.5); Alacsony realised vol → magasabb RR igény; Ár az intraday range alsó zónájában (+4.0); Order flow neutrális (−4.2); P-Score reduced by 4.0 due to regime CHOPPY; EURUSD: ATR(1h) alacsony — P-score küszöb +6 pontra emelve; EURUSD: Visszafogott ATR — célok szűkítve, kockázat kontroll alatt; OFI z-score 1.93 támogatja az irányt; ATR-floor override: rel_atr 0.0002 < 0.0006 → adaptív RR/TP küszöb; Regime kapu: CHOPPY miatt −10 P-score, pozícióskálázás csökkentve; Strukturális soft gate: 1/3 jel + ATR/spread OK (−6 P-score, size ×0.70); Strukturális kapu lazítva: momentum erős, BOS hiány engedve; P-score soft gate: −0.2 pont tolerancia (size ×0.65, RR +0.15); Liquidity gate skipped (no volume proxy available); missing: precision_flow_alignment, precision_trigger_sync",,,,,,,
6b9fd8cc-94c1-42e7-ac22-c90f16a549d0,USOIL,2026-01-16T18:18:00Z,no entry,core_only,1,,1.0,20.0,,,,,,,59.74277,2026-01-16T18:17:28Z,32,,,rule,"Intraday bias gate feltételek hiányosak — USOIL retest long  ATR: 5m retest long, ATR gate | USOIL retest short  ATR: 5m retest short, ATR gate; Bias neutrálsávban; Regime filter inaktív; ATR nincs rendben (relatív vagy abszolút küszöb); Range expanzió támogatja a momentumot (+3.0); USOIL: erős momentum — invalid zóna 2.5×ATR(1h)-re tágítva; Fib zóna konfluencia (0.618–0.886) (+18.0); Order flow neutrális (−4.5); P-Score reduced by 4.0 due to regime CHOPPY; USOIL: 1h ATR <1 USD — P-score küszöb emelve a zajos sáv miatt; USOIL: csökkenő volatilitás — RR cél 1:1.5-re igazítva; USOIL: US nyitás — pozícióméret ×0.75; Regime kapu: CHOPPY miatt −10 P-score, pozícióskálázás csökkentve; ATR soft gate: alacsony volatilitás −5 P-score, méret felezve; Strukturális kapu lazítva: momentum erős, BOS hiány engedve; Diagnosztika: k1m: utolsó zárt gyertya 12 perc késésben van; Diagnosztika: k1m: jelzés korlátozva 12 perc késés miatt; Diagnosztika: k5m: utolsó zárt gyertya 13 perc késésben van; missing: P_score>=27",,,,,,,
2a071d15-084e-4c3f-adf7-d2045ae629fd,BTCUSD,2026-01-16T18:18:00Z,no entry,core,22,,1.0,2.0,,,,,,,95056.73,2026-01-16T18:17:28Z,32,,,rule,"Intraday bias gate feltételek hiányosak — Crypto momentum long: 1m micro BOS long, Momentum volume ráta | Crypto momentum short: 1m micro BOS short, Momentum volume ráta | 5m BOS long  ATR: 5m BOS long | 5m BOS short  ATR: 5m BOS short | Micro BOS short  ATR (momentum nélkül): 1m micro BOS short; Bias neutrálsávban; Regime filter inaktív; ATR erősség 1.06× küszöb (+11.3); Fib zóna konfluencia (0.618–0.886) (+18.0); Order flow neutrális (−4.2); P-Score reduced by 4.0 due to regime CHOPPY; Regime kapu: CHOPPY miatt −10 P-score, pozícióskálázás csökkentve; missing: P_score>=34",,,,,,,
