journal_id,asset,analysis_timestamp,signal,mode,probability,model_probability,realtime_confidence,leverage,entry_price,stop_loss,take_profit_1,take_profit_2,risk_reward,initial_risk_abs,spot_price,spot_timestamp,spot_latency_seconds,precision_score,anchor_bias,probability_source,notes,validation_outcome,validation_rr,max_favorable_excursion,max_adverse_excursion,time_to_outcome_minutes,slippage,execution_latency_ms
fd608ae5-f443-4bad-8324-2820325bd5b4,GOLD_CFD,2026-03-04T10:16:19Z,precision_arming,core,29,,1.0,20.0,,,,,,,5193.9965,2026-03-04T10:15:52Z,27,,,rule,"Micro bias override: gyors struktúra dominál (+19.5); Regime filter inaktív; 5M BOS trendirányba (+16.0); ATR nincs rendben (relatív vagy abszolút küszöb); Alacsony realised vol → magasabb RR igény; Intraday range felső harmada telített (−7.0); Range expanzió támogatja a momentumot (+3.0); Fib zóna konfluencia (0.618–0.886) (+18.0); Order flow neutrális (−4.1); P-Score reduced by 4.0 due to regime CHOPPY; Intraday P-score lazítás: micro-bias long elsőbbséget kap (−1.5); Mesterlövész mód: P-score minimum 30 érvényesítve; VWAP alatt — GOLD long breakout késleltetve; ATR-floor override: rel_atr 0.0011 < 0.0025 → adaptív RR/TP küszöb; Regime kapu: CHOPPY miatt −10 P-score, pozícióskálázás csökkentve; ATR soft gate: alacsony volatilitás −5 P-score, méret felezve; Strukturális kapu lazítva: momentum erős, BOS hiány engedve; P-score soft gate: −0.6 pont tolerancia (size ×0.65, RR +0.15); Liquidity gate skipped (no volume proxy available); GOLD stop lazítás: ATR1h alapú kockázat ×1.09; Trend alignment: COUNTER — TP1 minimum szigorítva (+0.07%); Precision trigger kész → limit figyelés; Precision limit belépő parkolva 12 percig",,,,,,,
9fa57acd-9241-4cf0-a631-dfd17c516530,XAGUSD,2026-03-04T10:16:19Z,no entry,core,4,,1.0,20.0,,,,,,,86.51242,2026-03-04T10:15:52Z,27,,,rule,"Mean reversion bias override (+19.5); Regime filter inaktív; ATR nincs rendben (relatív vagy abszolút küszöb); Ár az intraday range felső zónájában (+4.0); Order flow neutrális (−3.2); P-Score reduced by 4.0 due to regime CHOPPY; XAGUSD: visszafogott ATR — RR cél 1:1.7-re emelve; XAGUSD breakout-védelem: gyors BE + 20% giveback limit expanziós szakaszban; XAGUSD: ATR-alapú pozícióskálázás ×0.70; XAG: VWAP felett — short setup türelmet igényel; Fém irány guard: 5m trend ellentétes a belépési biasszal; Regime kapu: CHOPPY miatt −10 P-score, pozícióskálázás csökkentve; ATR soft gate: alacsony volatilitás −5 P-score, méret felezve; Liquidity gate skipped (no volume proxy available); missing: metal_bias_5m_alignment, P_score>=28",,,,,,,
9fb12f49-e4b9-4e69-926a-ca708f5bd44b,EURUSD,2026-03-04T10:16:19Z,no entry,core,29,,1.0,30.0,,,,,,,1.16348,2026-03-04T10:15:52Z,27,,,rule,"Bias(4H→1H)=short (+15.0); Regime filter inaktív; ATR erősség 1.98× küszöb (+16.9); Alacsony realised vol → magasabb RR igény; Ár az intraday range felső zónájában (+4.0); Order flow neutrális (−4.3); P-Score reduced by 4.0 due to regime CHOPPY; EURUSD: ATR-alapú pozícióskálázás ×0.71 — volatilitás kontroll; Regime kapu: CHOPPY miatt −10 P-score, pozícióskálázás csökkentve; Liquidity gate skipped (no volume proxy available); missing: P_score>=38, precision_score>=55",,,,,,,
5cdc6296-5376-4036-8d95-cc965ce2a854,BTCUSD,2026-03-04T10:16:19Z,precision_arming,core,59,,1.0,2.0,,,,,,,71663.59,2026-03-04T10:15:52Z,27,,,rule,"Mean reversion bias override (+19.5); Regime filter inaktív; HTF sweep ok (+10.0); 5M BOS trendirányba (+16.0); ATR erősség 1.51× küszöb (+14.0); Ár az intraday range felső zónájában (+4.0); Range expanzió támogatja a momentumot (+3.0); Order flow neutrális (−3.2); Sell pressure támogatja a setupot (+5); P-Score reduced by 4.0 due to regime CHOPPY; Mesterlövész mód: P-score minimum 35 érvényesítve; OFI z-score -2.10 támogatja az irányt; Regime kapu: CHOPPY miatt −10 P-score, pozícióskálázás csökkentve; Strukturális soft gate: 1/3 jel + ATR/spread OK (−6 P-score, size ×0.70); Likviditási kapu lazítva erős momentum miatt; BTC ATR1h stop igazítás: kockázat ×1.15; Precision trigger kész → limit figyelés; Precision limit belépő parkolva 20 percig",,,,,,,
dd925e68-8244-4a8b-b266-0c3d2ab22dce,USOIL,2026-03-04T10:16:19Z,no entry,core_only,37,,1.0,20.0,76.75049,75.385120277,79.481229446,80.846599169,3.0,,76.75049,2026-03-04T10:15:52Z,27,,,rule,"Bias(4H→1H)=long (+15.0); Regime filter inaktív; 5M BOS trendirányba (+16.0); ATR erősség 1.49× küszöb (+14.0); Intraday range felső harmada telített (−7.0); Range expanzió támogatja a momentumot (+3.0); USOIL: erős momentum — invalid zóna 2.5×ATR(1h)-re tágítva; Order flow neutrális (−4.6); USOIL: csökkenő volatilitás — RR cél 1:1.5-re igazítva; OFI z-score 1.18 támogatja az irányt; Regime kapu: CHOPPY miatt −10 P-score, pozícióskálázás csökkentve; Likviditási kapu lazítva erős momentum miatt; USOIL stop lazítás: ATR1h alapú kockázat ×0.97; Diagnosztika: k1m: utolsó zárt gyertya 11 perc késésben van; Diagnosztika: k1m: jelzés korlátozva 11 perc késés miatt; Diagnosztika: k5m: utolsó zárt gyertya 11 perc késésben van",,,,,,,
