journal_id,asset,analysis_timestamp,signal,mode,probability,model_probability,realtime_confidence,leverage,entry_price,stop_loss,take_profit_1,take_profit_2,risk_reward,initial_risk_abs,spot_price,spot_timestamp,spot_latency_seconds,precision_score,anchor_bias,probability_source,notes,validation_outcome,validation_rr,max_favorable_excursion,max_adverse_excursion,time_to_outcome_minutes,slippage,execution_latency_ms
9e0565e8-6003-4445-8d1f-3a73b8dfc0ba,XAGUSD,2026-03-03T23:36:18Z,no entry,core,31,,1.0,20.0,,,,,,,82.63628,2026-03-03T23:35:58Z,20,,,rule,"Intraday bias gate feltételek hiányosak — Micro BOS long  ATR (ezüst): 1m micro BOS long, ATR gate | Micro BOS short  ATR (ezüst): 1m micro BOS short, ATR gate; Bias neutrálsávban; EMA21 slope 1.94× küszöb (+17.6); Zárási sáv likviditás büntetés (-2.0); ATR nincs rendben (relatív vagy abszolút küszöb); Fib zóna konfluencia (0.618–0.886) (+18.0); Order flow neutrális (−4.6); XAGUSD: visszafogott ATR — RR cél 1:1.7-re emelve; XAGUSD breakout-védelem: gyors BE + 20% giveback limit expanziós szakaszban; XAGUSD: ATR-alapú pozícióskálázás ×0.70; ATR soft gate: alacsony volatilitás −5 P-score, méret felezve; Liquidity gate skipped (no volume proxy available)",,,,,,,
06902266-666a-4a82-8085-20965dfafae7,GOLD_CFD,2026-03-03T23:36:18Z,no entry,core,26,,1.0,20.0,,,,,,,5126.26051,2026-03-03T23:35:58Z,20,,,rule,"Intraday bias gate feltételek hiányosak — 5m retest long  ATR: 5m retest long, ATR gate | 5m retest short  ATR: 5m retest short, ATR gate; Bias neutrálsávban; EMA21 slope 1.19× küszöb (+13.1); Zárási sáv likviditás büntetés (-2.0); ATR nincs rendben (relatív vagy abszolút küszöb); Fib zóna konfluencia (0.618–0.886) (+18.0); Order flow neutrális (−4.6); ATR-floor override: rel_atr 0.0012 < 0.0025 → adaptív RR/TP küszöb; ATR soft gate: alacsony volatilitás −5 P-score, méret felezve; Liquidity gate skipped (no volume proxy available); missing: P_score>=30",,,,,,,
7e6cffe0-897b-4a73-9fc0-ac258623eb1c,EURUSD,2026-03-03T23:36:18Z,no entry,core,31,,1.0,30.0,,,,,,,1.16167,2026-03-03T23:35:58Z,20,,,rule,"Bias(4H→1H)=short (+15.0); Regime filter inaktív; 5M BOS trendirányba (+16.0); Zárási sáv likviditás büntetés (-2.0); ATR nincs rendben (relatív vagy abszolút küszöb); Alacsony realised vol → magasabb RR igény; Range expanzió támogatja a momentumot (+3.0); Fib zóna konfluencia (0.618–0.886) (+18.0); Order flow neutrális (−3.3); P-Score reduced by 4.0 due to regime CHOPPY; EURUSD: Momentum override aktív — extra P-score követelmény (+2); EURUSD: Magas volatilitás → RR célok 1:2 környékére szélesítve; EURUSD: ATR-alapú pozícióskálázás ×0.58 — volatilitás kontroll; EURUSD BOS aktív, de VWAP felett — várakozás; ATR-floor override: rel_atr 0.0002 < 0.0006 → adaptív RR/TP küszöb; Regime kapu: CHOPPY miatt −10 P-score, pozícióskálázás csökkentve; ATR soft gate: alacsony volatilitás −5 P-score, méret felezve; Strukturális kapu lazítva: momentum erős, BOS hiány engedve; Position size scale 0.0364 below floor 0.05 — entry blocked; Liquidity gate skipped (no volume proxy available); missing: position_sizing_floor, P_score>=40",,,,,,,
fd2723e7-e82b-4deb-83f3-d15dda6dd483,BTCUSD,2026-03-03T23:36:18Z,no entry,core,0,,1.0,2.0,,,,,,,68452.04,2026-03-03T23:35:58Z,20,,,rule,"Intraday bias gate feltételek hiányosak — Crypto momentum long: 1m micro BOS long, Momentum volume ráta, ATR gate | Crypto momentum short: 1m micro BOS short, Momentum volume ráta, ATR gate | 5m BOS long  ATR: 5m BOS long, ATR gate | 5m BOS short  ATR: ATR gate | Micro BOS short  ATR (momentum nélkül): 1m micro BOS short, ATR gate; Bias neutrálsávban; Regime filter inaktív; Zárási sáv likviditás büntetés (-2.0); ATR nincs rendben (relatív vagy abszolút küszöb); Fib zóna konfluencia (0.618–0.886) (+18.0); Order flow neutrális (−4.8); P-Score reduced by 4.0 due to regime CHOPPY; Mesterlövész mód: P-score minimum 35 érvényesítve; Regime kapu: CHOPPY miatt −10 P-score, pozícióskálázás csökkentve; ATR soft gate: alacsony volatilitás −5 P-score, méret felezve; missing: P_score>=35",,,,,,,
e4e9ef1f-a84a-4c2a-a533-003676408d75,USOIL,2026-03-03T23:36:18Z,market closed,session_closed,0,,1.0,20.0,,,,,,,74.69085,2026-03-03T23:35:58Z,20,,,rule,Piac zárva (nyitáson kívül); Bias(4H→1H)=long (+15.0); EMA21 slope 1.20× küszöb (+13.2); 5M BOS trendirányba (+16.0); Zárási sáv likviditás büntetés (-2.0); ATR erősség 1.38× küszöb (+13.3); Range expanzió támogatja a momentumot (+3.0); USOIL: erős momentum — invalid zóna 2.5×ATR(1h)-re tágítva; Fib zóna konfluencia (0.618–0.886) (+18.0); Order flow neutrális (−3.9); USOIL: 1h ATR ≥1.5 USD — RR cél 1:2-re emelve; USOIL: nyitás előtti sáv — pozícióméret ×0.75; Liquidity gate skipped (no volume proxy available); missing: session,,,,,,,
