journal_id,asset,analysis_timestamp,signal,mode,probability,model_probability,realtime_confidence,leverage,entry_price,stop_loss,take_profit_1,take_profit_2,risk_reward,initial_risk_abs,spot_price,spot_timestamp,spot_latency_seconds,precision_score,anchor_bias,probability_source,notes,validation_outcome,validation_rr,max_favorable_excursion,max_adverse_excursion,time_to_outcome_minutes,slippage,execution_latency_ms,fill_timestamp,exit_timestamp,entry_kind,validation_source
7c4512a6-8d8f-48f7-9cd6-3a1a31322f8a,XAGUSD,2026-04-15T12:16:37Z,precision_arming,core,43,,1.0,20.0,,,,,,,78.82945,2026-04-15T12:16:09Z,27,,,rule,"Bias(4H→1H)=long (+15.0); Regime filter inaktív; 5M BOS trendirányba (+16.0); ATR erősség 0.95× küszöb (+10.7); Ár az intraday range alsó zónájában (+4.0); Range expanzió támogatja a momentumot (+3.0); XAG momentum override — stop tágítva erős trendnél; XAGUSD: momentum override — stop távolság 1.3×ATR-re tágítva; Ár 1h EMA21 zónában (+10.0); Order flow neutrális (−4.8); P-Score reduced by 4.0 due to regime CHOPPY; P-Score reduced by 2.1 due to ATR Soft Gate tolerance; XAGUSD: momentum kitörés — RR cél 1:1.45-re szűkítve; XAGUSD breakout-védelem: gyors BE + 20% giveback limit expanziós szakaszban; XAG momentum override — pozícióméret csökkentve; XAGUSD: ATR-alapú pozícióskálázás ×0.55; XAG: VWAP alatt — long setup türelmet igényel; ATR-floor override: rel_atr 0.0017 < 0.0018 → adaptív RR/TP küszöb; Regime kapu: CHOPPY miatt −10 P-score, pozícióskálázás csökkentve; Strukturális soft gate: 1/3 jel + ATR/spread OK (−6 P-score, size ×0.70); Strukturális kapu lazítva: momentum erős, BOS hiány engedve; Liquidity gate skipped (no volume proxy available); XAG stop lazítás: ATR1h alapú kockázat ×1.09; Precision trigger kész → limit figyelés; Precision limit belépő parkolva 12 percig",,,,,,,,,,,
245199e9-daca-445f-95d1-c5254bd453da,GOLD_CFD,2026-04-15T12:16:37Z,precision_arming,core,31,,1.0,20.0,,,,,,,4813.35526,2026-04-15T12:16:09Z,27,,,rule,"Bias(4H→1H)=long (+15.0); Regime filter inaktív; 5M BOS trendirányba (+16.0); ATR nincs rendben (relatív vagy abszolút küszöb); Alacsony realised vol → magasabb RR igény; Range expanzió támogatja a momentumot (+3.0); Fib zóna konfluencia (0.618–0.886) (+18.0); Order flow neutrális (−4.5); P-Score reduced by 4.0 due to regime CHOPPY; ATR-floor override: rel_atr 0.0007 < 0.0025 → adaptív RR/TP küszöb; Regime kapu: CHOPPY miatt −10 P-score, pozícióskálázás csökkentve; ATR soft gate: alacsony volatilitás −5 P-score, méret felezve; Strukturális kapu lazítva: momentum erős, BOS hiány engedve; Liquidity gate skipped (no volume proxy available); GOLD stop lazítás: ATR1h alapú kockázat ×1.09; Precision trigger kész → limit figyelés; Precision limit belépő parkolva 12 percig",,,,,,,,,,,
3170b010-bb1b-4ccb-850d-80fd071b8257,EURUSD,2026-04-15T12:16:37Z,no entry,core,0,,1.0,30.0,,,,,,,1.17786,2026-04-15T12:16:09Z,27,,,rule,"Intraday bias gate feltételek hiányosak — Micro BOS long  ATR rendben: 1m micro BOS long, ATR gate | Micro BOS short  ATR rendben: 1m micro BOS short, ATR gate; Bias neutrálsávban; Regime filter inaktív; ATR nincs rendben (relatív vagy abszolút küszöb); Alacsony realised vol → magasabb RR igény; Ár 1h EMA21 zónában (+10.0); Order flow neutrális (−4.4); P-Score reduced by 4.0 due to regime CHOPPY; EURUSD: ATR(1h) alacsony — P-score küszöb +6 pontra emelve; EURUSD: Visszafogott ATR — célok szűkítve, kockázat kontroll alatt; ATR-floor override: rel_atr 0.0002 < 0.0006 → adaptív RR/TP küszöb; Regime kapu: CHOPPY miatt −10 P-score, pozícióskálázás csökkentve; ATR soft gate: alacsony volatilitás −5 P-score, méret felezve; Liquidity gate skipped (no volume proxy available); missing: P_score>=44",,,,,,,,,,,
882b04d0-64b4-4d52-8dc4-1e0e842876d0,BTCUSD,2026-04-15T12:16:37Z,sell,core,60,,1.0,2.0,74233.36,74975.6936,72748.6928,72006.3592,3.0,,74233.36,2026-04-15T12:16:09Z,28,,,rule,"Mean reversion bias override (+19.5); Regime filter inaktív; 5M BOS trendirányba (+16.0); ATR erősség 1.11× küszöb (+11.6); Ár az intraday range felső zónájában (+4.0); Range expanzió támogatja a momentumot (+3.0); Fib zóna konfluencia (0.618–0.886) (+18.0); Order flow neutrális (−4.9); Order flow ellentétes irányba tolódik (−4); P-Score reduced by 4.0 due to regime CHOPPY; Mesterlövész mód: P-score minimum 35 érvényesítve; Regime kapu: CHOPPY miatt −10 P-score, pozícióskálázás csökkentve; Strukturális kapu lazítva: momentum erős, BOS hiány engedve; BTC ATR1h stop igazítás: kockázat ×1.15; TP1 nettó profit ≈ 0.60%; Precision plan: entry 74207.8–74284.7, SL 74361.6; Precision confidence medium (62.0); Precision limit belépő parkolva 20 percig; missing: tp1_net>=+0.6%",insufficient_data,,,,,,,,,market,auto
434837a4-73f8-4e3d-9c2a-3287d9587451,USOIL,2026-04-15T12:16:37Z,no entry,core_only,19,,1.0,20.0,,,,,,,92.23633,2026-04-15T12:16:09Z,28,,,rule,"Intraday bias gate feltételek hiányosak — USOIL retest long  ATR: 5m retest long | USOIL retest short  ATR: 5m retest short; Bias neutrálsávban; Regime filter inaktív; ATR erősség 1.46× küszöb (+13.8); Fib zóna konfluencia (0.618–0.886) (+18.0); Order flow neutrális (−3.7); P-Score reduced by 4.0 due to regime CHOPPY; USOIL: csökkenő volatilitás — RR cél 1:1.5-re igazítva; Regime kapu: CHOPPY miatt −10 P-score, pozícióskálázás csökkentve; Strukturális soft gate: 1/3 jel + ATR/spread OK (−6 P-score, size ×0.70); Strukturális kapu lazítva: momentum erős, BOS hiány engedve; Diagnosztika: k1m: utolsó zárt gyertya 10 perc késésben van; Diagnosztika: k1m: jelzés korlátozva 10 perc késés miatt; Diagnosztika: k5m: utolsó zárt gyertya 11 perc késésben van; missing: P_score>=36",,,,,,,,,,,
