journal_id,asset,analysis_timestamp,signal,mode,probability,model_probability,realtime_confidence,leverage,entry_price,stop_loss,take_profit_1,take_profit_2,risk_reward,initial_risk_abs,spot_price,spot_timestamp,spot_latency_seconds,precision_score,anchor_bias,probability_source,notes,validation_outcome,validation_rr,max_favorable_excursion,max_adverse_excursion,time_to_outcome_minutes,slippage,execution_latency_ms,fill_timestamp,exit_timestamp,entry_kind,validation_source
94f1e5fa-4a29-48d2-812b-f6fcd38a80ba,EURUSD,2026-04-02T10:01:24Z,no entry,core,0,,1.0,30.0,,,,,,,1.1525,2026-04-02T10:00:58Z,26,,,rule,"Intraday bias gate feltételek hiányosak — Micro BOS long  ATR rendben: 1m micro BOS long, ATR gate | Micro BOS short  ATR rendben: 1m micro BOS short, ATR gate; Bias neutrálsávban; Regime filter inaktív; ATR nincs rendben (relatív vagy abszolút küszöb); Alacsony realised vol → magasabb RR igény; Order flow neutrális (−4.3); P-Score reduced by 3.4 due to ATR Soft Gate tolerance; EURUSD: ATR(1h) alacsony — P-score küszöb +6 pontra emelve; EURUSD: Visszafogott ATR — célok szűkítve, kockázat kontroll alatt; ATR-floor override: rel_atr 0.0002 < 0.0006 → adaptív RR/TP küszöb; Regime kapu: CHOPPY miatt −10 P-score, pozícióskálázás csökkentve; ATR soft gate: alacsony volatilitás −5 P-score, méret felezve; Liquidity gate skipped (no volume proxy available); missing: P_score>=44",,,,,,,,,,,
e1ab2d36-58dd-4328-8c3d-73717ea41861,GOLD_CFD,2026-04-02T10:01:24Z,no entry,core,0,,1.0,20.0,,,,,,,4622.29516,2026-04-02T10:00:58Z,26,,,rule,"Intraday bias gate feltételek hiányosak — 5m retest long  ATR: 5m retest long, ATR gate | 5m retest short  ATR: 5m retest short, ATR gate; Bias neutrálsávban; Regime filter inaktív; ATR nincs rendben (relatív vagy abszolút küszöb); Order flow neutrális (−4.4); P-Score reduced by 4.0 due to regime CHOPPY; ATR-floor override: rel_atr 0.0013 < 0.0025 → adaptív RR/TP küszöb; Regime kapu: CHOPPY miatt −10 P-score, pozícióskálázás csökkentve; ATR soft gate: alacsony volatilitás −5 P-score, méret felezve; Liquidity gate skipped (no volume proxy available); missing: P_score>=30",,,,,,,,,,,
f5d6f419-97f0-4332-a145-6b4873428985,XAGUSD,2026-04-02T10:01:25Z,precision_arming,core,74,,1.0,20.0,,,,,,,71.05859,2026-04-02T10:00:58Z,26,,,rule,Bias override: Intraday Micro BOS short  ATR (ezüst) (+19.5); EMA21 slope 1.23× küszöb (+13.4); 5M BOS trendirányba (+16.0); ATR erősség 1.03× küszöb (+11.2); Range expanzió támogatja a momentumot (+3.0); XAG momentum override — stop tágítva erős trendnél; XAGUSD: momentum override — stop távolság 1.3×ATR-re tágítva; Order flow neutrális (−3.9); Intraday P-score lazítás: micro-bias short elsőbbséget kap (−2.2); Mesterlövész mód: P-score minimum 28 érvényesítve; XAGUSD: momentum kitörés — RR cél 1:1.45-re szűkítve; XAGUSD breakout-védelem: gyors BE + 20% giveback limit expanziós szakaszban; XAG momentum override — pozícióméret csökkentve; XAGUSD: ATR-alapú pozícióskálázás ×0.55; XAG: VWAP felett — short setup türelmet igényel; OFI z-score -2.18 támogatja az irányt; Liquidity gate skipped (no volume proxy available); XAG stop lazítás: ATR1h alapú kockázat ×1.09; Precision trigger kész → limit figyelés; Precision limit belépő parkolva 12 percig,,,,,,,,,,,
0fefd2a9-d9b5-4267-8b41-587a2ea7aa92,BTCUSD,2026-04-02T10:01:25Z,sell,core,45,,1.0,2.0,66443.9,67108.33899999999,65380.7976,64849.2464,2.4,,66443.9,2026-04-02T10:00:58Z,26,,,rule,"Bias(4H→1H)=short (+15.0); Regime filter inaktív; 5M BOS trendirányba (+16.0); ATR erősség 0.95× küszöb (+10.7); Range expanzió támogatja a momentumot (+3.0); Fib zóna konfluencia (0.618–0.886) (+18.0); Order flow neutrális (−3.9); Order flow ellentétes irányba tolódik (−4); OFI toxikus short irányra (−4.3); P-Score reduced by 4.0 due to regime CHOPPY; P-Score reduced by 2.1 due to ATR Soft Gate tolerance; Mesterlövész mód: P-score minimum 35 érvényesítve; Regime kapu: CHOPPY miatt −10 P-score, pozícióskálázás csökkentve; Strukturális kapu lazítva: momentum erős, BOS hiány engedve; BTC ATR1h stop igazítás: kockázat ×1.15; TP1 nettó profit ≈ 0.20%; Precision plan: entry 66421.0–66489.8, SL 66558.6; Precision confidence medium (62.0); Precision limit belépő parkolva 20 percig; missing: rr_min, tp1_net>=+0.6%",insufficient_data,,,,,,,,,market,auto
a3df9400-357b-4b30-9eb1-14ac18656c99,USOIL,2026-04-02T10:01:25Z,no entry,core_only,36,,1.0,20.0,108.028081,106.218724774,110.92305096159998,112.37053594239998,2.4,,108.028081,2026-04-02T10:00:58Z,27,,,rule,"Bias(4H→1H)=long (+15.0); EMA21 slope 1.54× küszöb (+15.2); 5M BOS trendirányba (+16.0); ATR nincs rendben (relatív vagy abszolút küszöb); Intraday range felső harmada telített (−7.0); Range expanzió támogatja a momentumot (+3.0); USOIL: erős momentum — invalid zóna 2.5×ATR(1h)-re tágítva; Order flow neutrális (−4.4); OFI toxikus long irányra (−4.0); USOIL: 1h ATR ≥1.5 USD — RR cél 1:2-re emelve; USOIL: európai délelőtt — pozícióméret ×0.85; ATR soft gate: alacsony volatilitás −5 P-score, méret felezve; Strukturális kapu lazítva: momentum erős, BOS hiány engedve; P-score soft gate: −0.2 pont tolerancia (size ×0.65, RR +0.15); USOIL stop lazítás: ATR1h alapú kockázat ×0.97; Diagnosztika: k1m: utolsó zárt gyertya 10 perc késésben van; Diagnosztika: k1m: jelzés korlátozva 10 perc késés miatt; Diagnosztika: k5m: utolsó zárt gyertya 11 perc késésben van",,,,,,,,,,,
