journal_id,asset,analysis_timestamp,signal,mode,probability,model_probability,realtime_confidence,leverage,entry_price,stop_loss,take_profit_1,take_profit_2,risk_reward,initial_risk_abs,spot_price,spot_timestamp,spot_latency_seconds,precision_score,anchor_bias,probability_source,notes,validation_outcome,validation_rr,max_favorable_excursion,max_adverse_excursion,time_to_outcome_minutes,slippage,execution_latency_ms
1da436f5-c20f-48ca-84c9-b8ac11c3fbd6,NVDA,2026-01-15T18:36:46Z,no entry,core,12,,1.0,5.0,,,,,,,189.17,2026-01-15T18:36:13Z,33,,,rule,"Bias(4H→1H)=long (+15.0); Regime filter inaktív; HTF sweep ok (+10.0); 5M BOS trendirányba (+16.0); ATR nincs rendben (relatív vagy abszolút küszöb); Intraday range felső harmada telített (−7.0); Range expanzió támogatja a momentumot (+3.0); Order flow neutrális (−3.5); OFI toxikus long irányra (−5.4); P-Score reduced by 4.0 due to regime CHOPPY; NVDA: magas napi ATR + momentum — P-score küszöb lazítva; Intraday P-score lazítás: micro-bias long elsőbbséget kap (−1.5); Regime kapu: CHOPPY miatt −10 P-score, pozícióskálázás csökkentve; ATR soft gate: alacsony volatilitás −5 P-score, méret felezve; missing: P_score>=15.5",,,,,,,
a97bac77-92db-427c-9352-9afbd3a9bb31,EURUSD,2026-01-15T18:36:46Z,precision_arming,core,57,,1.0,30.0,,,,,,,1.16125,2026-01-15T18:36:13Z,32,,,rule,"Bias(4H→1H)=short (+15.0); Regime filter inaktív; 5M BOS trendirányba (+16.0); ATR erősség 1.61× küszöb (+14.7); Alacsony realised vol → magasabb RR igény; Ár az intraday range felső zónájában (+4.0); Range expanzió támogatja a momentumot (+3.0); Fib zóna konfluencia (0.618–0.886) (+18.0); Order flow neutrális (−4.2); P-Score reduced by 4.0 due to regime CHOPPY; EURUSD: ATR(1h) alacsony — P-score küszöb +6 pontra emelve; EURUSD: Visszafogott ATR — célok szűkítve, kockázat kontroll alatt; EURUSD BOS aktív, de VWAP felett — várakozás; ATR-floor override: rel_atr 0.0002 < 0.0006 → adaptív RR/TP küszöb; Regime kapu: CHOPPY miatt −10 P-score, pozícióskálázás csökkentve; Strukturális soft gate: 1/3 jel + ATR/spread OK (−6 P-score, size ×0.70); Strukturális kapu lazítva: momentum erős, BOS hiány engedve; Liquidity gate skipped (no volume proxy available); Precision trigger kész → limit figyelés; Precision limit belépő parkolva 20 percig",,,,,,,
0865e2b9-f198-44c5-88e9-0f0daa41b5ab,GOLD_CFD,2026-01-15T18:36:46Z,precision_arming,core,25,,1.0,20.0,,,,,,,4616.87818,2026-01-15T18:36:13Z,33,,,rule,"Bias(4H→1H)=long (+15.0); Regime filter inaktív; 5M BOS trendirányba (+16.0); ATR nincs rendben (relatív vagy abszolút küszöb); Alacsony realised vol → magasabb RR igény; Intraday range felső harmada telített (−7.0); Range expanzió támogatja a momentumot (+3.0); Fib zóna konfluencia (0.618–0.886) (+18.0); Order flow neutrális (−3.7); P-Score reduced by 4.0 due to regime CHOPPY; VWAP alatt — GOLD long breakout késleltetve; ATR-floor override: rel_atr 0.0005 < 0.0025 → adaptív RR/TP küszöb; Regime kapu: CHOPPY miatt −10 P-score, pozícióskálázás csökkentve; ATR soft gate: alacsony volatilitás −5 P-score, méret felezve; Strukturális kapu lazítva: momentum erős, BOS hiány engedve; Liquidity gate skipped (no volume proxy available); GOLD stop lazítás: ATR alapú kockázat ×2.00; Precision trigger kész → limit figyelés; Precision limit belépő parkolva 20 percig",,,,,,,
bbcd5e4c-a62d-46a7-9dd7-471dbcf484f3,XAGUSD,2026-01-15T18:36:46Z,precision_arming,core,25,,1.0,20.0,,,,,,,92.56305,2026-01-15T18:36:13Z,33,,,rule,"Micro bias override: gyors struktúra dominál (+19.5); Regime filter inaktív; 5M BOS trendirányba (+16.0); ATR erősség 1.00× küszöb (+11.0); Intraday range felső harmada telített (−7.0); Range expanzió támogatja a momentumot (+3.0); XAG momentum override — stop tágítva erős trendnél; XAGUSD: momentum override — stop távolság 1.3×ATR-re tágítva; Order flow neutrális (−3.5); OFI toxikus long irányra (−5.4); P-Score reduced by 4.0 due to regime CHOPPY; Intraday P-score lazítás: micro-bias long elsőbbséget kap (−1.5); XAGUSD: momentum kitörés — RR cél 1:1.45-re szűkítve; XAG momentum override — pozícióméret csökkentve; XAGUSD: ATR-alapú pozícióskálázás ×0.55; XAG: VWAP alatt — long setup türelmet igényel; Regime kapu: CHOPPY miatt −10 P-score, pozícióskálázás csökkentve; Strukturális soft gate: 1/3 jel + ATR/spread OK (−6 P-score, size ×0.70); Strukturális kapu lazítva: momentum erős, BOS hiány engedve; Liquidity gate skipped (no volume proxy available); Precision trigger kész → limit figyelés; Precision limit belépő parkolva 20 percig",,,,,,,
aecf55fb-4ec2-4f71-bbb1-2a8a2ce140f5,USOIL,2026-01-15T18:36:46Z,no entry,core,21,,1.0,20.0,,,,,,,59.25,2026-01-15T18:36:13Z,33,,,rule,"Mean reversion bias override (+19.5); Regime filter inaktív; ATR nincs rendben (relatív vagy abszolút küszöb); Ár az intraday range felső zónájában (+4.0); Fib zóna konfluencia (0.618–0.886) (+18.0); Order flow neutrális (−4.7); P-Score reduced by 4.0 due to regime CHOPPY; USOIL: 1h ATR <1 USD — P-score küszöb emelve a zajos sáv miatt; USOIL: csökkenő volatilitás — RR cél 1:1.5-re igazítva; USOIL: US nyitás — pozícióméret ×0.75; USOIL: oldalazó szerkezet — 1h BOS nélkül nincs belépő; OFI z-score -1.26 támogatja az irányt; Regime kapu: CHOPPY miatt −10 P-score, pozícióskálázás csökkentve; ATR soft gate: alacsony volatilitás −5 P-score, méret felezve; Liquidity gate skipped (no volume proxy available); missing: P_score>=27, precision_flow_alignment, precision_trigger_sync",,,,,,,
0f2e8158-1a21-4f36-9ca6-2aa883a440a7,BTCUSD,2026-01-15T18:36:46Z,no entry,core,28,,1.0,2.0,,,,,,,96000.02,2026-01-15T18:36:13Z,33,,,rule,"Bias(4H→1H)=long (+15.0); Regime filter inaktív; ATR erősség 1.00× küszöb (+11.0); Ár az intraday range alsó zónájában (+4.0); Ár 1h EMA21 zónában (+10.0); Order flow neutrális (−4.6); Order flow ellentétes irányba tolódik (−4); P-Score reduced by 4.0 due to regime CHOPPY; P-Score reduced by 0.1 due to ATR Soft Gate tolerance; Regime kapu: CHOPPY miatt −10 P-score, pozícióskálázás csökkentve; Precision limit belépő parkolva 20 percig; missing: P_score>=34, precision_flow_alignment",,,,,,,
