journal_id,asset,analysis_timestamp,signal,mode,probability,model_probability,realtime_confidence,leverage,entry_price,stop_loss,take_profit_1,take_profit_2,risk_reward,initial_risk_abs,spot_price,spot_timestamp,spot_latency_seconds,precision_score,anchor_bias,probability_source,notes,validation_outcome,validation_rr,max_favorable_excursion,max_adverse_excursion,time_to_outcome_minutes,slippage,execution_latency_ms
08569d12-05cd-407d-942e-eff09120369c,GOLD_CFD,2026-03-12T00:51:49Z,precision_arming,core,31,,1.0,20.0,,,,,,,5153.94702,2026-03-12T00:51:22Z,27,,,rule,"Bias(4H→1H)=long (+15.0); Regime filter inaktív; HTF sweep ok (+10.0); 5M BOS trendirányba (+16.0); Nyitási illikviditás hatás (-2.0); ATR nincs rendben (relatív vagy abszolút küszöb); Range expanzió támogatja a momentumot (+3.0); Ár 1h EMA21 zónában (+10.0); Order flow neutrális (−4.6); P-Score reduced by 4.0 due to regime CHOPPY; ATR-floor override: rel_atr 0.0013 < 0.0025 → adaptív RR/TP küszöb; Regime kapu: CHOPPY miatt −10 P-score, pozícióskálázás csökkentve; ATR soft gate: alacsony volatilitás −5 P-score, méret felezve; Strukturális kapu lazítva: momentum erős, BOS hiány engedve; Liquidity gate skipped (no volume proxy available); GOLD stop lazítás: ATR1h alapú kockázat ×1.09; Precision trigger kész → limit figyelés; Precision limit belépő parkolva 12 percig",,,,,,,
e30e4599-9e36-4080-bf74-1526a8556e8a,XAGUSD,2026-03-12T00:51:49Z,no entry,core,24,,1.0,20.0,85.571,85.24568771428571,86.54693685714287,86.54693685714287,3.0,,85.51888,2026-03-12T00:51:22Z,27,,,rule,"Intraday bias gate feltételek hiányosak — Micro BOS long  ATR (ezüst): 1m micro BOS long | Micro BOS short  ATR (ezüst): 1m micro BOS short; Bias neutrálsávban; Regime filter inaktív; HTF sweep ok (+10.0); Nyitási illikviditás hatás (-2.0); ATR erősség 1.20× küszöb (+12.2); Fib zóna konfluencia (0.618–0.886) (+18.0); Order flow neutrális (−4.9); P-Score reduced by 4.0 due to regime CHOPPY; XAGUSD breakout-védelem: gyors BE + 20% giveback limit expanziós szakaszban; XAGUSD: ATR-alapú pozícióskálázás ×0.70; Regime kapu: CHOPPY miatt −10 P-score, pozícióskálázás csökkentve; Strukturális soft gate: 1/3 jel + ATR/spread OK (−6 P-score, size ×0.70); Strukturális kapu lazítva: momentum erős, BOS hiány engedve; Liquidity gate skipped (no volume proxy available); missing: P_score>=28; Pozíciómenedzsment: aktív long pozíció (opened_at: 2026-03-12T00:41:32Z, Entry: 85.571, SL: 85.24568771428571, TP2: 86.54693685714287)",,,,,,,
a6980694-bd70-4ae8-9b8d-ecb98926f1bb,EURUSD,2026-03-12T00:51:49Z,no entry,core,31,,1.0,30.0,,,,,,,1.15495,2026-03-12T00:51:22Z,27,,,rule,"Bias(4H→1H)=short (+15.0); Regime filter inaktív; HTF sweep ok (+10.0); Nyitási illikviditás hatás (-2.0); ATR erősség 1.07× küszöb (+11.4); Alacsony realised vol → magasabb RR igény; Ár az intraday range felső zónájában (+4.0); Order flow neutrális (−4.9); P-Score reduced by 4.0 due to regime CHOPPY; EURUSD BOS aktív, de VWAP felett — várakozás; ATR-floor override: rel_atr 0.0003 < 0.0006 → adaptív RR/TP küszöb; Regime kapu: CHOPPY miatt −10 P-score, pozícióskálázás csökkentve; Liquidity gate skipped (no volume proxy available); missing: P_score>=38",,,,,,,
227d5c00-c699-441a-9b41-dd1ed6c3c75f,BTCUSD,2026-03-12T00:51:49Z,no entry,core,21,,1.0,2.0,70596.4,70823.578,69914.866,69914.866,3.0,,70306.19,2026-03-12T00:51:22Z,27,,,rule,"Intraday bias gate feltételek hiányosak — Crypto momentum long: 1m micro BOS long, Momentum volume ráta | Crypto momentum short: 1m micro BOS short, Momentum volume ráta | 5m BOS long  ATR: 5m BOS long | 5m BOS short  ATR: 5m BOS short | Micro BOS short  ATR (momentum nélkül): 1m micro BOS short; Bias neutrálsávban; Regime filter inaktív; Nyitási illikviditás hatás (-2.0); ATR erősség 1.13× küszöb (+11.8); Fib zóna konfluencia (0.618–0.886) (+18.0); Order flow neutrális (−3.7); P-Score reduced by 4.0 due to regime CHOPPY; Mesterlövész mód: P-score minimum 35 érvényesítve; Regime kapu: CHOPPY miatt −10 P-score, pozícióskálázás csökkentve; missing: P_score>=35; Pozíciómenedzsment: aktív short pozíció (opened_at: 2026-03-11T19:06:42Z, Entry: 70596.4, SL: 70823.578, TP2: 69914.866)",,,,,,,
001af56b-7d08-4af5-886e-a4d754f5256f,USOIL,2026-03-12T00:51:49Z,no entry,core_only,44,,1.0,20.0,92.088932,90.49378125714286,96.87438422857142,96.87438422857142,2.4,,92.0098081,2026-03-12T00:51:22Z,27,,,rule,"Bias(4H→1H)=long (+15.0); EMA21 slope 1.43× küszöb (+14.6); 5M BOS trendirányba (+16.0); Nyitási illikviditás hatás (-2.0); ATR nincs rendben (relatív vagy abszolút küszöb); Range expanzió támogatja a momentumot (+3.0); USOIL: erős momentum — invalid zóna 2.5×ATR(1h)-re tágítva; Order flow neutrális (−4.5); USOIL: parabolikus lendület — RR cél 1:1.4 környékére szűkítve; USOIL: ázsiai sáv — pozícióméret ×0.70; ATR soft gate: alacsony volatilitás −5 P-score, méret felezve; Strukturális kapu lazítva: momentum erős, BOS hiány engedve; USOIL stop lazítás: ATR1h alapú kockázat ×0.97; Diagnosztika: k1m: utolsó zárt gyertya 7 perc késésben van; Diagnosztika: k1m: jelzés korlátozva 7 perc késés miatt; Diagnosztika: k5m: utolsó zárt gyertya 11 perc késésben van; Pozíciómenedzsment: aktív long pozíció (opened_at: 2026-03-12T00:01:41Z, Entry: 92.088932, SL: 90.49378125714286, TP2: 96.87438422857142)",,,,,,,
