journal_id,asset,analysis_timestamp,signal,mode,probability,model_probability,realtime_confidence,leverage,entry_price,stop_loss,take_profit_1,take_profit_2,risk_reward,initial_risk_abs,spot_price,spot_timestamp,spot_latency_seconds,precision_score,anchor_bias,probability_source,notes,validation_outcome,validation_rr,max_favorable_excursion,max_adverse_excursion,time_to_outcome_minutes,slippage,execution_latency_ms
c6c6259b-cf17-421e-92b9-947a310bc131,GOLD_CFD,2026-03-10T22:36:26Z,market closed,session_closed,0,,1.0,20.0,,,,,,,5189.26745,2026-03-10T22:36:06Z,20,,,rule,"Piac zárva (napi karbantartás 22:00–23:00 UTC); Bias(4H→1H)=long (+15.0); Regime filter inaktív; ATR nincs rendben (relatív vagy abszolút küszöb); Alacsony realised vol → magasabb RR igény; Ár az intraday range alsó zónájában (+4.0); Fib zóna konfluencia (0.618–0.886) (+18.0); Order flow neutrális (−4.1); P-Score reduced by 4.0 due to regime CHOPPY; ATR-floor override: rel_atr 0.0006 < 0.0025 → adaptív RR/TP küszöb; Regime kapu: CHOPPY miatt −10 P-score, pozícióskálázás csökkentve; ATR soft gate: alacsony volatilitás −5 P-score, méret felezve; Liquidity gate skipped (no volume proxy available); missing: session, P_score>=30",,,,,,,
2a6fc581-9879-4f56-bcee-c53de2240363,XAGUSD,2026-03-10T22:36:26Z,market closed,session_closed,0,,1.0,20.0,88.03044,87.57573599999999,89.394552,89.394552,2.999999999999969,,88.50188,2026-03-10T22:36:06Z,20,,,rule,"Piac zárva (napi karbantartás 22:00–23:00 UTC); Bias(4H→1H)=long (+15.0); Regime filter inaktív; 5M BOS trendirányba (+16.0); ATR erősség 0.97× küszöb (+10.8); Range expanzió támogatja a momentumot (+3.0); XAG momentum override — stop tágítva erős trendnél; XAGUSD: momentum override — stop távolság 1.3×ATR-re tágítva; Fib zóna konfluencia (0.618–0.886) (+18.0); Order flow neutrális (−4.4); P-Score reduced by 4.0 due to regime CHOPPY; P-Score reduced by 1.4 due to ATR Soft Gate tolerance; XAGUSD: momentum kitörés — RR cél 1:1.45-re szűkítve; XAGUSD breakout-védelem: gyors BE + 20% giveback limit expanziós szakaszban; XAG momentum override — pozícióméret csökkentve; XAGUSD: ATR-alapú pozícióskálázás ×0.55; XAG: VWAP alatt — long setup türelmet igényel; Regime kapu: CHOPPY miatt −10 P-score, pozícióskálázás csökkentve; Strukturális soft gate: 1/3 jel + ATR/spread OK (−6 P-score, size ×0.70); Strukturális kapu lazítva: momentum erős, BOS hiány engedve; Liquidity gate skipped (no volume proxy available); missing: session; Pozíciómenedzsment: aktív long pozíció (opened_at: 2026-03-10T18:41:42Z, Entry: 88.03044, SL: 87.57573599999999, TP2: 89.394552)",,,,,,,
e752c072-120a-48ff-a16a-254c3bbd616a,EURUSD,2026-03-10T22:36:26Z,no entry,core,1,,1.0,30.0,,,,,,,1.1606,2026-03-10T22:36:06Z,20,,,rule,"Intraday bias gate feltételek hiányosak — Micro BOS long  ATR rendben: 1m micro BOS long, ATR gate | Micro BOS short  ATR rendben: 1m micro BOS short, ATR gate; Bias neutrálsávban; Regime filter inaktív; ATR nincs rendben (relatív vagy abszolút küszöb); Alacsony realised vol → magasabb RR igény; Range expanzió támogatja a momentumot (+3.0); Fib zóna konfluencia (0.618–0.886) (+18.0); Order flow neutrális (−3.8); P-Score reduced by 4.0 due to regime CHOPPY; EURUSD: ATR-alapú pozícióskálázás ×0.72 — volatilitás kontroll; ATR-floor override: rel_atr 0.0002 < 0.0006 → adaptív RR/TP küszöb; Regime kapu: CHOPPY miatt −10 P-score, pozícióskálázás csökkentve; ATR soft gate: alacsony volatilitás −5 P-score, méret felezve; Strukturális kapu lazítva: momentum erős, BOS hiány engedve; Position size scale 0.0447 below floor 0.05 — entry blocked; Liquidity gate skipped (no volume proxy available); missing: position_sizing_floor, P_score>=38",,,,,,,
cbf750c2-6d96-4ab2-9c16-3fcd158f5a14,BTCUSD,2026-03-10T22:36:26Z,precision_arming,core,56,,1.0,2.0,70026.99,70330.9242857143,69115.18714285715,69115.18714285715,2.999999999999952,,69582.0,2026-03-10T22:36:06Z,20,,,rule,"Mean reversion bias override (+19.5); Regime filter inaktív; 5M BOS trendirányba (+16.0); ATR erősség 1.09× küszöb (+11.5); Ár az intraday range alsó zónájában (+4.0); Range expanzió támogatja a momentumot (+3.0); Ár 1h EMA21 zónában (+10.0); Order flow neutrális (−4.8); P-Score reduced by 4.0 due to regime CHOPPY; Mesterlövész mód: P-score minimum 35 érvényesítve; Regime kapu: CHOPPY miatt −10 P-score, pozícióskálázás csökkentve; Strukturális kapu lazítva: momentum erős, BOS hiány engedve; BTC ATR1h stop igazítás: kockázat ×1.15; Precision trigger kész → limit figyelés; Precision limit belépő parkolva 20 percig; Pozíciómenedzsment: aktív short pozíció (opened_at: 2026-03-10T19:01:39Z, Entry: 70026.99, SL: 70330.9242857143, TP2: 69115.18714285715)",,,,,,,
1caebe1b-da40-424d-ae0b-f9780a2ab3ca,USOIL,2026-03-10T22:36:26Z,market closed,session_closed,0,,1.0,20.0,82.39462,79.61564877142858,90.73153368571428,90.73153368571428,3.0000000000000053,,86.3297,2026-03-10T22:36:06Z,20,,,rule,"Piac zárva (napi karbantartás 22:00–23:00 UTC); Bias(4H→1H)=long (+15.0); EMA21 slope 2.06× küszöb (+18.3); 5M BOS trendirányba (+16.0); ATR nincs rendben (relatív vagy abszolút küszöb); Range expanzió támogatja a momentumot (+3.0); USOIL: erős momentum — invalid zóna 2.5×ATR(1h)-re tágítva; Fib zóna konfluencia (0.618–0.886) (+18.0); Order flow neutrális (−4.2); USOIL: parabolikus lendület — RR cél 1:1.4 környékére szűkítve; ATR soft gate: alacsony volatilitás −5 P-score, méret felezve; Liquidity gate skipped (no volume proxy available); missing: session; Pozíciómenedzsment: aktív long pozíció (opened_at: 2026-03-10T18:31:44Z, Entry: 82.39462, SL: 79.61564877142858, TP2: 90.73153368571428)",,,,,,,
