journal_id,asset,analysis_timestamp,signal,mode,probability,model_probability,realtime_confidence,leverage,entry_price,stop_loss,take_profit_1,take_profit_2,risk_reward,initial_risk_abs,spot_price,spot_timestamp,spot_latency_seconds,precision_score,anchor_bias,probability_source,notes,validation_outcome,validation_rr,max_favorable_excursion,max_adverse_excursion,time_to_outcome_minutes,slippage,execution_latency_ms
567abd18-190a-4252-817c-06f4204d5b9e,GOLD_CFD,2026-05-18T14:42:00Z,precision_arming,core,30,,1.0,20.0,,,,,,,4545.34385,2026-05-18T14:41:27Z,33,,,rule,"Bias(4H→1H)=short (+15.0); Regime filter inaktív; 5M BOS trendirányba (+16.0); London–NY overlap profil (-1.0); ATR nincs rendben (relatív vagy abszolút küszöb); Range expanzió támogatja a momentumot (+3.0); Fib zóna konfluencia (0.618–0.886) (+18.0); Order flow neutrális (−4.5); P-Score reduced by 4.0 due to regime CHOPPY; Intraday P-score lazítás: micro-bias short elsőbbséget kap (−2.2); Mesterlövész mód: P-score minimum 30 érvényesítve; VWAP felett — GOLD short breakout várakozik; ATR-floor override: rel_atr 0.0020 < 0.0025 → adaptív RR/TP küszöb; Regime kapu: CHOPPY miatt −10 P-score, pozícióskálázás csökkentve; ATR soft gate: alacsony volatilitás −5 P-score, méret felezve; Strukturális kapu lazítva: momentum erős, BOS hiány engedve; Liquidity gate skipped (no volume proxy available); GOLD stop lazítás: ATR1h alapú kockázat ×1.09; Precision trigger kész → limit figyelés; Precision limit belépő parkolva 12 percig",,,,,,,
342c95bd-03e9-4fa6-9d49-87b90327e146,EURUSD,2026-05-18T14:42:00Z,no entry,core,8,,1.0,30.0,,,,,,,1.16443,2026-05-18T14:41:27Z,33,,,rule,"Intraday bias gate feltételek hiányosak — Micro BOS long  ATR rendben: 1m micro BOS long | Micro BOS short  ATR rendben: 1m micro BOS short; Bias neutrálsávban; Regime filter inaktív; London–NY overlap profil (-1.0); ATR erősség 1.99× küszöb (+16.9); Alacsony realised vol → magasabb RR igény; Order flow neutrális (−4.7); P-Score reduced by 4.0 due to regime CHOPPY; EURUSD: ATR(1h) alacsony — P-score küszöb +6 pontra emelve; EURUSD: Visszafogott ATR — célok szűkítve, kockázat kontroll alatt; ATR-floor override: rel_atr 0.0004 < 0.0006 → adaptív RR/TP küszöb; Regime kapu: CHOPPY miatt −10 P-score, pozícióskálázás csökkentve; Liquidity gate skipped (no volume proxy available); missing: P_score>=44",,,,,,,
a1fbddba-d31b-4ec9-a70e-e77784f884b7,XAGUSD,2026-05-18T14:42:00Z,precision_arming,core,40,,1.0,20.0,,,,,,,76.57185,2026-05-18T14:41:27Z,33,,,rule,"Mean reversion bias override (+19.5); Regime filter inaktív; London–NY overlap profil (-1.0); ATR erősség 2.03× küszöb (+17.2); Fib zóna konfluencia (0.618–0.886) (+18.0); Order flow neutrális (−4.9); P-Score reduced by 4.0 due to regime CHOPPY; XAGUSD breakout-védelem: gyors BE + 20% giveback limit expanziós szakaszban; XAGUSD: ATR-alapú pozícióskálázás ×0.55; XAG: VWAP alatt — long setup türelmet igényel; Regime kapu: CHOPPY miatt −10 P-score, pozícióskálázás csökkentve; Strukturális soft gate: 1/3 jel + ATR/spread OK (−6 P-score, size ×0.70); Strukturális kapu lazítva: momentum erős, BOS hiány engedve; Liquidity gate skipped (no volume proxy available); XAG stop lazítás: ATR1h alapú kockázat ×1.03; Precision trigger kész → limit figyelés; Precision limit belépő parkolva 12 percig",,,,,,,
4e483245-6422-4e0f-a2e8-8e124a520f9f,NVDA,2026-05-18T14:42:00Z,precision_arming,core,36,,1.0,5.0,,,,,,,221.05,2026-05-18T14:41:27Z,33,,,rule,"Micro bias override: gyors struktúra dominál (+19.5); Regime filter inaktív; 5M BOS trendirányba (+16.0); London–NY overlap profil (-1.0); ATR erősség 1.56× küszöb (+14.4); WARNING: No Liquidity Structure (Nearest: 184.866953, Dist: 23.83ATR); Intraday range alsó harmada telített (−7.0); Range expanzió támogatja a momentumot (+3.0); Order flow neutrális (−1.8); OFI toxikus short irányra (−3.3); P-Score reduced by 4.0 due to regime CHOPPY; NVDA: magas napi ATR + momentum — P-score küszöb lazítva; Intraday P-score lazítás: micro-bias short elsőbbséget kap (−2.2); Mesterlövész mód: P-score minimum 35 érvényesítve; Regime kapu: CHOPPY miatt −10 P-score, pozícióskálázás csökkentve; NVDA ATR1h stop igazítás: kockázat ×1.03; Precision trigger kész → limit figyelés; Precision limit belépő parkolva 12 percig",,,,,,,
d27c9429-adf4-4c66-87ba-053d133b119a,USOIL,2026-05-18T14:42:00Z,no entry,core_only,10,,1.0,20.0,,,,,,,101.39683,2026-05-18T14:41:27Z,33,,,rule,"Mean reversion bias override (+19.5); Regime filter inaktív; London–NY overlap profil (-1.0); ATR nincs rendben (relatív vagy abszolút küszöb); Fib zóna konfluencia (0.618–0.886) (+18.0); Order flow neutrális (−4.5); OFI toxikus short irányra (−5.6); P-Score reduced by 4.0 due to regime CHOPPY; USOIL: parabolikus lendület — RR cél 1:1.4 környékére szűkítve; Regime kapu: CHOPPY miatt −10 P-score, pozícióskálázás csökkentve; ATR soft gate: alacsony volatilitás −5 P-score, méret felezve; USOIL belépés blokkolva: erős trend ellen (ADX≥22); Diagnosztika: k1m: utolsó zárt gyertya 11 perc késésben van; Diagnosztika: k1m: jelzés korlátozva 11 perc késés miatt; Diagnosztika: k5m: utolsó zárt gyertya 12 perc késésben van; missing: P_score>=36",,,,,,,
a608fae2-912e-420f-85e5-2c7241762cb1,BTCUSD,2026-05-18T14:42:00Z,precision_arming,core,44,,1.0,2.0,,,,,,,76471.03,2026-05-18T14:41:27Z,33,,,rule,"Mean reversion bias override (+19.5); Regime filter inaktív; London–NY overlap profil (-1.0); ATR erősség 3.80× küszöb (+23.0); Ár az intraday range alsó zónájában (+4.0); Order flow neutrális (−3.5); Buy pressure támogatja a setupot (+5); P-Score reduced by 4.0 due to regime CHOPPY; Mesterlövész mód: P-score minimum 35 érvényesítve; Regime kapu: CHOPPY miatt −10 P-score, pozícióskálázás csökkentve; BTC ATR1h stop igazítás: kockázat ×1.15; Precision trigger kész → limit figyelés; Precision limit belépő parkolva 20 percig",,,,,,,
