journal_id,asset,analysis_timestamp,signal,mode,probability,model_probability,realtime_confidence,leverage,entry_price,stop_loss,take_profit_1,take_profit_2,risk_reward,initial_risk_abs,spot_price,spot_timestamp,spot_latency_seconds,precision_score,anchor_bias,probability_source,notes,validation_outcome,validation_rr,max_favorable_excursion,max_adverse_excursion,time_to_outcome_minutes,slippage,execution_latency_ms
6c2e89cb-1c88-43a2-8cf4-006bd3edb66a,EURUSD,2025-12-29T11:51:16Z,no entry,core,14,,1.0,30.0,,,,,,,1.17687,2025-12-29T11:51:02Z,14,,,rule,"Intraday bias gate feltételek hiányosak — Micro BOS long  ATR rendben: 1m micro BOS long | Micro BOS short  ATR rendben: 1m micro BOS short; Bias neutrálsávban; Regime filter inaktív; ATR erősség 1.42× küszöb (+13.5); Alacsony realised vol → magasabb RR igény; Fib zóna konfluencia (0.618–0.886) (+18.0); P-Score reduced by 4.0 due to regime CHOPPY; EURUSD: ATR(1h) alacsony — P-score küszöb +6 pontra emelve; EURUSD: Visszafogott ATR — célok szűkítve, kockázat kontroll alatt; ATR-floor override: rel_atr 0.0003 < 0.0006 → adaptív RR/TP küszöb; Regime kapu: CHOPPY miatt −10 P-score, pozícióskálázás csökkentve; Bias eltérés: H1 trend ütközik az M5 belépéssel (−15 P-score); Liquidity gate skipped (no volume proxy available); Order-flow gates skipped (no tick/imbalance data); missing: P_score>=34",,,,,,,
27e57f20-7f34-42dd-a43a-7d2b352d0eee,GOLD_CFD,2025-12-29T11:51:16Z,no entry,core,13,,1.0,20.0,,,,,,,4451.53542,2025-12-29T11:50:48Z,28,,,rule,"Bias(4H→1H)=long (+15.0); Regime filter inaktív; HTF sweep ok (+10.0); ATR nincs rendben (relatív vagy abszolút küszöb); Alacsony realised vol → magasabb RR igény; Ár az intraday range alsó zónájában (+4.0); P-Score reduced by 4.0 due to regime CHOPPY; ATR-floor override: rel_atr 0.0011 < 0.0025 → adaptív RR/TP küszöb; Regime kapu: CHOPPY miatt −10 P-score, pozícióskálázás csökkentve; ATR soft gate: alacsony volatilitás −5 P-score, méret felezve; Liquidity gate skipped (no volume proxy available); Order-flow gates skipped (no tick/imbalance data); missing: P_score>=30",,,,,,,
a26639da-388c-4fd7-96c3-038edd150a27,XAGUSD,2025-12-29T11:51:16Z,no entry,core,87,,1.0,20.0,74.97515,74.2253985,76.474653,77.2244045,3.0,,74.97515,2025-12-29T11:50:35Z,41,,,rule,Bias(4H→1H)=long (+15.0); EMA21 slope 1.01× küszöb (+12.1); ATR erősség 53.41× küszöb (+23.0); Ár az intraday range alsó zónájában (+4.0); Fib zóna konfluencia (0.618–0.886) (+18.0); XAGUSD: ATR-alapú pozícióskálázás ×0.55; XAG: VWAP alatt — long setup türelmet igényel; Liquidity gate skipped (no volume proxy available); Order-flow gates skipped (no tick/imbalance data),,,,,,,
85b04fb4-4fb5-4a8d-8469-819976f348d7,BTCUSD,2025-12-29T11:51:16Z,no entry,core,8,,1.0,2.0,,,,,,,87519.99,2025-12-29T11:50:56Z,20,,,rule,"Mean reversion bias override (+19.5); Regime filter inaktív; ATR nincs rendben (relatív vagy abszolút küszöb); Ár az intraday range alsó zónájában (+4.0); P-Score reduced by 4.0 due to regime CHOPPY; ATR-floor override: rel_atr 0.0012 < 0.0012 → adaptív RR/TP küszöb; Regime kapu: CHOPPY miatt −10 P-score, pozícióskálázás csökkentve; ATR soft gate: alacsony volatilitás −5 P-score, méret felezve; Position size scale 0.0375 below floor 0.04 — entry blocked; Order-flow gates skipped (no tick/imbalance data); Precision limit belépő parkolva 16 percig; missing: position_sizing_floor, P_score>=34",,,,,,,
c32e9c97-f5ed-4ad4-bb81-7e4ef266ed11,USOIL,2025-12-29T11:51:16Z,no entry,core_only,0,,1.0,20.0,,,,,,,57.9,2025-12-29T11:50:36Z,40,,,rule,"Intraday bias gate feltételek hiányosak — USOIL retest long  ATR: 5m retest long, ATR gate | USOIL retest short  ATR: 5m retest short, ATR gate; Bias neutrálsávban; Regime filter inaktív; ATR nincs rendben (relatív vagy abszolút küszöb); P-Score reduced by 4.0 due to regime CHOPPY; USOIL: 1h ATR <1 USD — P-score küszöb emelve a zajos sáv miatt; USOIL: csökkenő volatilitás — RR cél 1:1.5-re igazítva; USOIL: európai délelőtt — pozícióméret ×0.75; Regime kapu: CHOPPY miatt −10 P-score, pozícióskálázás csökkentve; ATR soft gate: alacsony volatilitás −5 P-score, méret felezve; Bias eltérés: H1 trend ütközik az M5 belépéssel (−15 P-score); Diagnosztika: k1m: utolsó zárt gyertya 7 perc késésben van; Diagnosztika: k1m: jelzés korlátozva 7 perc késés miatt; Diagnosztika: k5m: utolsó zárt gyertya 11 perc késésben van; missing: P_score>=36",,,,,,,
