journal_id,asset,analysis_timestamp,signal,mode,probability,model_probability,realtime_confidence,leverage,entry_price,stop_loss,take_profit_1,take_profit_2,risk_reward,initial_risk_abs,spot_price,spot_timestamp,spot_latency_seconds,precision_score,anchor_bias,probability_source,notes,validation_outcome,validation_rr,max_favorable_excursion,max_adverse_excursion,time_to_outcome_minutes,slippage,execution_latency_ms
53c9ba58-189e-4b37-a361-7e3908b09b74,XAGUSD,2026-01-21T01:21:26Z,precision_arming,core,48,,0.9999999999999999,20.0,,,,,,,94.98109,2026-01-21T01:20:59Z,26,,,rule,"Bias(4H→1H)=long (+15.0); Regime filter inaktív; 5M BOS trendirányba (+16.0); ATR erősség 1.36× küszöb (+13.2); Range expanzió támogatja a momentumot (+3.0); XAG momentum override — stop tágítva erős trendnél; XAGUSD: momentum override — stop távolság 1.3×ATR-re tágítva; Fib zóna konfluencia (0.618–0.886) (+18.0); Order flow neutrális (−3.7); OFI toxikus long irányra (−4.6); P-Score reduced by 4.0 due to regime CHOPPY; XAGUSD: momentum kitörés — RR cél 1:1.45-re szűkítve; XAG momentum override — pozícióméret csökkentve; XAGUSD: ATR-alapú pozícióskálázás ×0.55; XAG: VWAP alatt — long setup türelmet igényel; Regime kapu: CHOPPY miatt −10 P-score, pozícióskálázás csökkentve; Strukturális soft gate: 1/3 jel + ATR/spread OK (−6 P-score, size ×0.70); Strukturális kapu lazítva: momentum erős, BOS hiány engedve; Liquidity gate skipped (no volume proxy available); Precision trigger kész → limit figyelés; Precision limit belépő parkolva 12 percig",,,,,,,
9cd157d1-70e0-4021-8521-4878161c8a92,GOLD_CFD,2026-01-21T01:21:26Z,precision_arming,core,29,,0.9999999999999999,20.0,,,,,,,4807.88184,2026-01-21T01:20:59Z,26,,,rule,"Mean reversion bias override (+19.5); Regime filter inaktív; ATR erősség 1.19× küszöb (+12.2); Alacsony realised vol → magasabb RR igény; Ár az intraday range felső zónájában (+4.0); Order flow neutrális (−3.2); P-Score reduced by 4.0 due to regime CHOPPY; ATR-floor override: rel_atr 0.0010 < 0.0025 → adaptív RR/TP küszöb; Regime kapu: CHOPPY miatt −10 P-score, pozícióskálázás csökkentve; Liquidity gate skipped (no volume proxy available); GOLD stop lazítás: ATR alapú kockázat ×2.00; Precision trigger kész → limit figyelés; Precision limit belépő parkolva 12 percig",,,,,,,
1e17b5de-7803-40f5-9a1f-849d7049535d,EURUSD,2026-01-21T01:21:26Z,no entry,core,20,,0.9999999999999999,30.0,,,,,,,1.17248,2026-01-21T01:20:59Z,26,,,rule,"Intraday bias gate feltételek hiányosak — Micro BOS long  ATR rendben: 1m micro BOS long | Micro BOS short  ATR rendben: 1m micro BOS short; Bias neutrálsávban; Regime filter inaktív; ATR erősség 1.39× küszöb (+13.4); Alacsony realised vol → magasabb RR igény; Range expanzió támogatja a momentumot (+3.0); Fib zóna konfluencia (0.618–0.886) (+18.0); Order flow neutrális (−4.9); P-Score reduced by 4.0 due to regime CHOPPY; EURUSD: ATR(1h) alacsony — P-score küszöb +6 pontra emelve; EURUSD: Visszafogott ATR — célok szűkítve, kockázat kontroll alatt; ATR-floor override: rel_atr 0.0002 < 0.0006 → adaptív RR/TP küszöb; Regime kapu: CHOPPY miatt −10 P-score, pozícióskálázás csökkentve; Strukturális soft gate: 1/3 jel + ATR/spread OK (−6 P-score, size ×0.70); Strukturális kapu lazítva: momentum erős, BOS hiány engedve; Liquidity gate skipped (no volume proxy available); missing: P_score>=26",,,,,,,
e25d6ba2-8461-40a3-a4ba-1bb87c050aa0,BTCUSD,2026-01-21T01:21:26Z,precision_arming,core,83,,0.9999999999999999,2.0,,,,,,,88916.28,2026-01-21T01:20:59Z,26,,,rule,"Bias override: Intraday 5m BOS long  ATR (+19.5); EMA21 slope 1.32× küszöb (+13.9); 5M BOS trendirányba (+16.0); ATR erősség 1.30× küszöb (+12.8); Intraday range felső harmada telített (−7.0); Range expanzió támogatja a momentumot (+3.0); Fib zóna konfluencia (0.618–0.886) (+18.0); Order flow neutrális (−4.0); Order flow ellentétes irányba tolódik (−4); Strukturális kapu lazítva: momentum erős, BOS hiány engedve; Precision trigger kész → limit figyelés; Precision limit belépő parkolva 20 percig",,,,,,,
aa3f9666-5ea0-4c3f-9878-8bec6f51d47b,USOIL,2026-01-21T01:21:26Z,no entry,core_only,16,,1.0,20.0,,,,,,,59.57249,2026-01-21T01:20:59Z,27,,,rule,"Bias(4H→1H)=long (+15.0); Regime filter inaktív; ATR nincs rendben (relatív vagy abszolút küszöb); Ár az intraday range alsó zónájában (+4.0); Fib zóna konfluencia (0.618–0.886) (+18.0); Order flow neutrális (−4.6); P-Score reduced by 4.0 due to regime CHOPPY; USOIL: 1h ATR <1 USD — P-score küszöb emelve a zajos sáv miatt; USOIL: csökkenő volatilitás — RR cél 1:1.5-re igazítva; USOIL: ázsiai sáv — pozícióméret ×0.70; USOIL: oldalazó szerkezet — 1h BOS nélkül nincs belépő; Regime kapu: CHOPPY miatt −10 P-score, pozícióskálázás csökkentve; ATR soft gate: alacsony volatilitás −5 P-score, méret felezve; Diagnosztika: k1m: utolsó zárt gyertya 11 perc késésben van; Diagnosztika: k1m: jelzés korlátozva 11 perc késés miatt; Diagnosztika: k5m: utolsó zárt gyertya 11 perc késésben van; missing: P_score>=27",,,,,,,
