journal_id,asset,analysis_timestamp,signal,mode,probability,model_probability,realtime_confidence,leverage,entry_price,stop_loss,take_profit_1,take_profit_2,risk_reward,initial_risk_abs,spot_price,spot_timestamp,spot_latency_seconds,precision_score,anchor_bias,probability_source,notes,validation_outcome,validation_rr,max_favorable_excursion,max_adverse_excursion,time_to_outcome_minutes,slippage,execution_latency_ms
31f43f50-b9e9-4df0-ade9-9bb9709e11ce,GOLD_CFD,2026-04-29T19:32:08Z,precision_arming,core,56,,1.0,20.0,,,,,,,4543.61434,2026-04-29T19:31:35Z,33,,,rule,"Bias(4H→1H)=short (+15.0); Regime filter inaktív; HTF sweep ok (+10.0); ATR erősség 16.68× küszöb (+23.0); Ár az intraday range felső zónájában (+4.0); Fib zóna konfluencia (0.618–0.886) (+18.0); Order flow neutrális (−4.9); P-Score reduced by 4.0 due to regime CHOPPY; VWAP felett — GOLD short breakout várakozik; Regime kapu: CHOPPY miatt −10 P-score, pozícióskálázás csökkentve; Strukturális soft gate: 1/3 jel + ATR/spread OK (−6 P-score, size ×0.70); Strukturális kapu lazítva: momentum erős, BOS hiány engedve; Liquidity gate skipped (no volume proxy available); GOLD stop lazítás: ATR1h alapú kockázat ×1.03; Precision trigger kész → limit figyelés; Precision limit belépő parkolva 12 percig",,,,,,,
f66cf101-2fb2-4895-a569-f81b321b2070,XAGUSD,2026-04-29T19:32:08Z,precision_arming,core,76,,1.0,20.0,,,,,,,71.69235,2026-04-29T19:31:35Z,33,,,rule,"Bias(4H→1H)=short (+15.0); Regime filter inaktív; HTF sweep ok (+10.0); 5M BOS trendirányba (+16.0); ATR erősség 78.30× küszöb (+23.0); Ár az intraday range felső zónájában (+4.0); Range expanzió támogatja a momentumot (+3.0); XAG momentum override — stop tágítva erős trendnél; XAGUSD: momentum override — stop távolság 1.3×ATR-re tágítva; Fib zóna konfluencia (0.618–0.886) (+18.0); Order flow neutrális (−4.2); P-Score reduced by 4.0 due to regime CHOPPY; XAGUSD: momentum kitörés — RR cél 1:1.45-re szűkítve; XAGUSD breakout-védelem: gyors BE + 20% giveback limit expanziós szakaszban; XAG momentum override — pozícióméret csökkentve; XAGUSD: ATR-alapú pozícióskálázás ×0.55; XAG: VWAP felett — short setup türelmet igényel; Regime kapu: CHOPPY miatt −10 P-score, pozícióskálázás csökkentve; Strukturális soft gate: 1/3 jel + ATR/spread OK (−6 P-score, size ×0.70); Strukturális kapu lazítva: momentum erős, BOS hiány engedve; Liquidity gate skipped (no volume proxy available); XAG stop lazítás: ATR1h alapú kockázat ×1.09; Precision trigger kész → limit figyelés; Precision limit belépő parkolva 12 percig",,,,,,,
1a10330e-5ab0-4abe-8be6-4561dadbb7f1,EURUSD,2026-04-29T19:32:08Z,no entry,core,27,,1.0,30.0,,,,,,,1.16748,2026-04-29T19:31:35Z,33,,,rule,"Intraday bias gate feltételek hiányosak — Micro BOS long  ATR rendben: 1m micro BOS long | Micro BOS short  ATR rendben: 1m micro BOS short; Bias neutrálsávban; Regime filter inaktív; ATR erősség 194.58× küszöb (+23.0); Alacsony realised vol → magasabb RR igény; Fib zóna konfluencia (0.618–0.886) (+18.0); Order flow neutrális (−4.9); P-Score reduced by 4.0 due to regime CHOPPY; EURUSD: Magas volatilitás → RR célok 1:2 környékére szélesítve; EURUSD: ATR-alapú pozícióskálázás ×0.40 — volatilitás kontroll; Regime kapu: CHOPPY miatt −10 P-score, pozícióskálázás csökkentve; Strukturális soft gate: 1/3 jel + ATR/spread OK (−6 P-score, size ×0.70); Strukturális kapu lazítva: momentum erős, BOS hiány engedve; Liquidity gate skipped (no volume proxy available); missing: P_score>=38",,,,,,,
1debb96f-7736-44e0-9a4c-b14feb81abef,NVDA,2026-04-29T19:32:08Z,no entry,core,35,,1.0,5.0,,,,,,,209.3,2026-04-29T19:31:35Z,33,,,rule,"Bias(4H→1H)=long (+15.0); Regime filter inaktív; 5M BOS trendirányba (+16.0); ATR nincs rendben (relatív vagy abszolút küszöb); WARNING: No Liquidity Structure (Nearest: 197.113756, Dist: 27.04ATR); Ár az intraday range alsó zónájában (+4.0); Range expanzió támogatja a momentumot (+3.0); Fib zóna konfluencia (0.618–0.886) (+18.0); Order flow neutrális (−4.8); P-Score reduced by 4.0 due to regime CHOPPY; NVDA: magas napi ATR + momentum — P-score küszöb lazítva; Mesterlövész mód: P-score minimum 35 érvényesítve; Mean-revert setup: méret ×0.70, RR +0.20; VWAP túlnyúlás → mean reversion setup; Regime kapu: CHOPPY miatt −10 P-score, pozícióskálázás csökkentve; ATR soft gate: alacsony volatilitás −5 P-score, méret felezve; P-score soft gate: −0.4 pont tolerancia (size ×0.65, RR +0.15); Position size scale 0.0284 below floor 0.05 — entry blocked; missing: position_sizing_floor",,,,,,,
5cce8c1e-0c45-4531-9065-2fd63c581b12,BTCUSD,2026-04-29T19:32:08Z,no entry,core,16,,1.0,2.0,,,,,,,75391.14,2026-04-29T19:31:35Z,33,,,rule,"Intraday bias gate feltételek hiányosak — Crypto momentum long: 1m micro BOS long, Momentum volume ráta | Crypto momentum short: 1m micro BOS short, Momentum volume ráta | 5m BOS long  ATR: 5m BOS long | 5m BOS short  ATR: 5m BOS short | Micro BOS short  ATR (momentum nélkül): 1m micro BOS short; Bias neutrálsávban; Regime filter inaktív; ATR erősség 1.92× küszöb (+16.5); Range expanzió támogatja a momentumot (+3.0); Order flow neutrális (−4.6); Mesterlövész mód: P-score minimum 35 érvényesítve; Regime kapu: CHOPPY miatt −10 P-score, pozícióskálázás csökkentve; Strukturális kapu lazítva: momentum erős, BOS hiány engedve; Likviditási kapu lazítva erős momentum miatt; missing: P_score>=35",,,,,,,
9136580f-baff-4a04-921e-608b3c85f362,USOIL,2026-04-29T19:32:08Z,no entry,core_only,65,,1.0,20.0,110.042041,106.26064761142857,117.60482777714286,121.38622116571429,3.0,,110.042041,2026-04-29T19:31:35Z,33,,,rule,Bias(4H→1H)=long (+15.0); EMA21 slope 1.80× küszöb (+16.8); 5M BOS trendirányba (+16.0); ATR erősség 1.11× küszöb (+11.6); Intraday range felső harmada telített (−7.0); Range expanzió támogatja a momentumot (+3.0); USOIL: erős momentum — invalid zóna 2.5×ATR(1h)-re tágítva; Order flow neutrális (−4.9); USOIL: parabolikus lendület — RR cél 1:1.4 környékére szűkítve; OFI z-score 1.01 támogatja az irányt; Diagnosztika: k1m: utolsó zárt gyertya 9 perc késésben van; Diagnosztika: k1m: jelzés korlátozva 9 perc késés miatt; Diagnosztika: k5m: utolsó zárt gyertya 12 perc késésben van,,,,,,,
