journal_id,asset,analysis_timestamp,signal,mode,probability,model_probability,realtime_confidence,leverage,entry_price,stop_loss,take_profit_1,take_profit_2,risk_reward,initial_risk_abs,spot_price,spot_timestamp,spot_latency_seconds,precision_score,anchor_bias,probability_source,notes,validation_outcome,validation_rr,max_favorable_excursion,max_adverse_excursion,time_to_outcome_minutes,slippage,execution_latency_ms
bcbd1b7f-a7e7-4c60-a21f-9aeabc9323cb,NVDA,2026-03-06T16:50:56Z,no entry,core,2,,1.0,5.0,,,,,,,182.09,2026-03-06T16:50:22Z,34,,,rule,"Intraday bias gate feltételek hiányosak — EMA9×21 long  magas ATR: Magas ATR megerősítés | EMA9×21 short  magas ATR: EMA9×21 short, Magas ATR megerősítés | 5m BOS short  ATR (momentum nélkül): 5m BOS short, ATR gate; Bias neutrálsávban; Regime filter inaktív; ATR nincs rendben (relatív vagy abszolút küszöb); WARNING: No Liquidity Structure (Nearest: 182.532879, Dist: 0.86ATR); Fib zóna konfluencia (0.618–0.886) (+18.0); Order flow neutrális (−4.0); Regime kapu: CHOPPY miatt −10 P-score, pozícióskálázás csökkentve; ATR soft gate: alacsony volatilitás −5 P-score, méret felezve; missing: P_score>=38",,,,,,,
38447a33-1be2-4dc2-bf6d-70b4c4ff0629,EURUSD,2026-03-06T16:50:56Z,precision_arming,core,54,,1.0,30.0,,,,,,,1.16092,2026-03-06T16:50:23Z,33,,,rule,"Micro bias override: gyors struktúra dominál (+19.5); Regime filter inaktív; 5M BOS trendirányba (+16.0); ATR erősség 2.15× küszöb (+17.9); Alacsony realised vol → magasabb RR igény; Intraday range felső harmada telített (−7.0); Range expanzió támogatja a momentumot (+3.0); Fib zóna konfluencia (0.618–0.886) (+18.0); Order flow neutrális (−4.7); P-Score reduced by 4.0 due to regime CHOPPY; Intraday P-score lazítás: micro-bias long elsőbbséget kap (−1.5); EURUSD: ATR-alapú pozícióskálázás ×0.71 — volatilitás kontroll; EURUSD BOS aktív, de VWAP alatt — türelem; Regime kapu: CHOPPY miatt −10 P-score, pozícióskálázás csökkentve; Strukturális soft gate: 1/3 jel + ATR/spread OK (−6 P-score, size ×0.70); Strukturális kapu lazítva: momentum erős, BOS hiány engedve; Liquidity gate skipped (no volume proxy available); Precision trigger kész → limit figyelés; Precision limit belépő parkolva 12 percig",,,,,,,
21cf00f8-8c59-422f-92c8-d6d3a557da07,XAGUSD,2026-03-06T16:50:56Z,no entry,core,17,,1.0,20.0,,,,,,,83.99356,2026-03-06T16:50:23Z,33,,,rule,"Intraday bias gate feltételek hiányosak — Micro BOS long  ATR (ezüst): 1m micro BOS long | Micro BOS short  ATR (ezüst): 1m micro BOS short; Bias neutrálsávban; Regime filter inaktív; ATR erősség 1.24× küszöb (+12.5); Fib zóna konfluencia (0.618–0.886) (+18.0); Order flow neutrális (−4.6); P-Score reduced by 4.0 due to regime CHOPPY; XAGUSD breakout-védelem: gyors BE + 20% giveback limit expanziós szakaszban; XAGUSD: ATR-alapú pozícióskálázás ×0.70; Regime kapu: CHOPPY miatt −10 P-score, pozícióskálázás csökkentve; Strukturális soft gate: 1/3 jel + ATR/spread OK (−6 P-score, size ×0.70); Strukturális kapu lazítva: momentum erős, BOS hiány engedve; Liquidity gate skipped (no volume proxy available); missing: P_score>=28",,,,,,,
fab336dd-486b-447a-97b3-cdb78c759a50,USOIL,2026-03-06T16:50:57Z,no entry,core_only,73,,1.0,20.0,89.26764,86.179566735,96.37020850950002,100.38470375400001,3.6,,89.26764,2026-03-06T16:50:22Z,35,,,rule,Bias(4H→1H)=long (+15.0); EMA21 slope 2.82× küszöb (+21.0); 5M BOS trendirányba (+16.0); ATR erősség 1.54× küszöb (+14.3); Intraday range felső harmada telített (−7.0); Range expanzió támogatja a momentumot (+3.0); USOIL: erős momentum — invalid zóna 2.5×ATR(1h)-re tágítva; Order flow neutrális (−4.2); USOIL: parabolikus lendület — RR cél 1:1.4 környékére szűkítve; Likviditási kapu lazítva erős momentum miatt; USOIL stop lazítás: ATR1h alapú kockázat ×0.97; Diagnosztika: k1m: utolsó zárt gyertya 10 perc késésben van; Diagnosztika: k1m: jelzés korlátozva 10 perc késés miatt; Diagnosztika: k5m: utolsó zárt gyertya 10 perc késésben van,,,,,,,
e19a3f3b-d34e-41d8-83ec-77c4fe83fca3,BTCUSD,2026-03-06T16:50:57Z,precision_arming,core,74,,1.0,2.0,,,,,,,68593.02,2026-03-06T16:50:22Z,35,,,rule,"Bias override: Intraday 5m BOS long  ATR (+19.5); EMA21 slope 1.19× küszöb (+13.1); 5M BOS trendirányba (+16.0); ATR erősség 1.43× küszöb (+13.6); Ár az intraday range alsó zónájában (+4.0); Range expanzió támogatja a momentumot (+3.0); Order flow neutrális (−4.6); Mesterlövész mód: P-score minimum 35 érvényesítve; OFI z-score 1.46 támogatja az irányt; Strukturális soft gate: 1/3 jel + ATR/spread OK (−6 P-score, size ×0.70); Likviditási kapu lazítva erős momentum miatt; BTC ATR1h stop igazítás: kockázat ×1.15; Precision trigger kész → limit figyelés; Precision limit belépő parkolva 20 percig",,,,,,,
