journal_id,asset,analysis_timestamp,signal,mode,probability,model_probability,realtime_confidence,leverage,entry_price,stop_loss,take_profit_1,take_profit_2,risk_reward,initial_risk_abs,spot_price,spot_timestamp,spot_latency_seconds,precision_score,anchor_bias,probability_source,notes,validation_outcome,validation_rr,max_favorable_excursion,max_adverse_excursion,time_to_outcome_minutes,slippage,execution_latency_ms
a6f0ce64-5a0e-4340-bfcf-31607804cbfb,EURUSD,2026-01-20T23:36:15Z,no entry,core,0,,1.0,30.0,,,,,,,1.17246,2026-01-20T23:35:56Z,19,,,rule,"Intraday bias gate feltételek hiányosak — Micro BOS long  ATR rendben: 1m micro BOS long, ATR gate | Micro BOS short  ATR rendben: 1m micro BOS short, ATR gate; Bias neutrálsávban; Regime filter inaktív; Zárási sáv likviditás büntetés (-2.0); ATR nincs rendben (relatív vagy abszolút küszöb); Alacsony realised vol → magasabb RR igény; Range expanzió támogatja a momentumot (+3.0); Fib zóna konfluencia (0.618–0.886) (+18.0); Order flow neutrális (−4.8); P-Score reduced by 4.0 due to regime CHOPPY; EURUSD: ATR(1h) alacsony — P-score küszöb +6 pontra emelve; EURUSD: Visszafogott ATR — célok szűkítve, kockázat kontroll alatt; ATR-floor override: rel_atr 0.0001 < 0.0006 → adaptív RR/TP küszöb; Regime kapu: CHOPPY miatt −10 P-score, pozícióskálázás csökkentve; ATR soft gate: alacsony volatilitás −5 P-score, méret felezve; Strukturális kapu lazítva: momentum erős, BOS hiány engedve; Liquidity gate skipped (no volume proxy available); missing: P_score>=26",,,,,,,
69e93dbe-8734-41ba-98f0-7d78d24b0ada,GOLD_CFD,2026-01-20T23:36:15Z,precision_arming,core,29,,1.0,20.0,,,,,,,4761.38626,2026-01-20T23:35:56Z,19,,,rule,"Bias(4H→1H)=long (+15.0); Regime filter inaktív; 5M BOS trendirányba (+16.0); Zárási sáv likviditás büntetés (-2.0); ATR nincs rendben (relatív vagy abszolút küszöb); Alacsony realised vol → magasabb RR igény; Range expanzió támogatja a momentumot (+3.0); Fib zóna konfluencia (0.618–0.886) (+18.0); Order flow neutrális (−4.9); P-Score reduced by 4.0 due to regime CHOPPY; VWAP alatt — GOLD long breakout késleltetve; ATR-floor override: rel_atr 0.0003 < 0.0025 → adaptív RR/TP küszöb; Regime kapu: CHOPPY miatt −10 P-score, pozícióskálázás csökkentve; ATR soft gate: alacsony volatilitás −5 P-score, méret felezve; Strukturális kapu lazítva: momentum erős, BOS hiány engedve; Liquidity gate skipped (no volume proxy available); GOLD stop lazítás: ATR alapú kockázat ×2.00; Precision trigger kész → limit figyelés; Precision limit belépő parkolva 12 percig",,,,,,,
82491f84-1cf8-47c0-9fb7-1f15f2a1f1cf,XAGUSD,2026-01-20T23:36:15Z,precision_arming,core,48,,1.0,20.0,,,,,,,94.46196,2026-01-20T23:35:56Z,19,,,rule,"Bias(4H→1H)=long (+15.0); Regime filter inaktív; 5M BOS trendirányba (+16.0); Zárási sáv likviditás büntetés (-2.0); ATR erősség 1.10× küszöb (+11.6); Alacsony realised vol → magasabb RR igény; Range expanzió támogatja a momentumot (+3.0); XAG momentum override — stop tágítva erős trendnél; XAGUSD: momentum override — stop távolság 1.3×ATR-re tágítva; Fib zóna konfluencia (0.618–0.886) (+18.0); Order flow neutrális (−4.5); P-Score reduced by 4.0 due to regime CHOPPY; XAGUSD: momentum kitörés — RR cél 1:1.45-re szűkítve; XAG momentum override — pozícióméret csökkentve; XAGUSD: ATR-alapú pozícióskálázás ×0.55; XAG: VWAP alatt — long setup türelmet igényel; ATR-floor override: rel_atr 0.0011 < 0.0018 → adaptív RR/TP küszöb; Regime kapu: CHOPPY miatt −10 P-score, pozícióskálázás csökkentve; Strukturális soft gate: 1/3 jel + ATR/spread OK (−6 P-score, size ×0.70); Strukturális kapu lazítva: momentum erős, BOS hiány engedve; Liquidity gate skipped (no volume proxy available); Precision trigger kész → limit figyelés; Precision limit belépő parkolva 12 percig",,,,,,,
8500d202-7344-4ec3-9369-2f5044970d3a,BTCUSD,2026-01-20T23:36:15Z,precision_arming,core,88,,1.0,2.0,,,,,,,88285.13,2026-01-20T23:35:56Z,19,,,rule,"Bias override: 1h trend short + momentum támogatás (+19.5); EMA21 slope 1.27× küszöb (+13.6); HTF sweep ok (+10.0); 5M BOS trendirányba (+16.0); Zárási sáv likviditás büntetés (-2.0); ATR erősség 3.75× küszöb (+23.0); Ár az intraday range felső zónájában (+4.0); Range expanzió támogatja a momentumot (+3.0); Order flow neutrális (−4.9); Order flow ellentétes irányba tolódik (−4); OFI toxikus short irányra (−5.5); Strukturális kapu lazítva: momentum erős, BOS hiány engedve; Likviditási kapu lazítva erős momentum miatt; BTC ATR stop igazítás: kockázat ×1.00; Precision trigger kész → limit figyelés; Precision limit belépő parkolva 20 percig",,,,,,,
72ea726d-c971-49e4-9e09-388368e6e532,USOIL,2026-01-20T23:36:16Z,market closed,session_closed,0,,1.0,20.0,,,,,,,59.56729,2026-01-20T23:35:56Z,20,,,rule,"Piac zárva (nyitáson kívül); Bias(4H→1H)=long (+15.0); Regime filter inaktív; Zárási sáv likviditás büntetés (-2.0); ATR nincs rendben (relatív vagy abszolút küszöb); Ár 1h EMA21 zónában (+10.0); Order flow neutrális (−4.8); P-Score reduced by 4.0 due to regime CHOPPY; USOIL: 1h ATR <1 USD — P-score küszöb emelve a zajos sáv miatt; USOIL: csökkenő volatilitás — RR cél 1:1.5-re igazítva; USOIL: nyitás előtti sáv — pozícióméret ×0.75; USOIL: oldalazó szerkezet — 1h BOS nélkül nincs belépő; Regime kapu: CHOPPY miatt −10 P-score, pozícióskálázás csökkentve; ATR soft gate: alacsony volatilitás −5 P-score, méret felezve; Liquidity gate skipped (no volume proxy available); missing: session, P_score>=27",,,,,,,
