journal_id,asset,analysis_timestamp,signal,mode,probability,model_probability,realtime_confidence,leverage,entry_price,stop_loss,take_profit_1,take_profit_2,risk_reward,initial_risk_abs,spot_price,spot_timestamp,spot_latency_seconds,precision_score,anchor_bias,probability_source,notes,validation_outcome,validation_rr,max_favorable_excursion,max_adverse_excursion,time_to_outcome_minutes,slippage,execution_latency_ms
5356f2da-2f18-47d1-ac99-d2bced0877d4,EURUSD,2026-06-10T20:56:27Z,no entry,core,18,,1.0,30.0,,,,,,,1.15359,2026-06-10T20:56:00Z,27,,,rule,"Micro bias override: gyors struktúra dominál (+19.5); Regime filter inaktív; 5M BOS trendirányba (+16.0); ATR nincs rendben (relatív vagy abszolút küszöb); Alacsony realised vol → magasabb RR igény; Intraday range alsó harmada telített (−7.0); Range expanzió támogatja a momentumot (+3.0); Ár 1h EMA21 zónában (+10.0); Order flow neutrális (−4.3); P-Score reduced by 4.0 due to regime CHOPPY; P-Score reduced by 3.2 due to ATR Soft Gate tolerance; EURUSD: ATR(1h) alacsony — P-score küszöb +6 pontra emelve; Intraday P-score lazítás: micro-bias short elsőbbséget kap (−2.2); EURUSD: Visszafogott ATR — célok szűkítve, kockázat kontroll alatt; EURUSD BOS aktív, de VWAP felett — várakozás; ATR-floor override: rel_atr 0.0002 < 0.0006 → adaptív RR/TP küszöb; Regime kapu: CHOPPY miatt −10 P-score, pozícióskálázás csökkentve; ATR soft gate: alacsony volatilitás −5 P-score, méret felezve; Strukturális kapu lazítva: momentum erős, BOS hiány engedve; Liquidity gate skipped (no volume proxy available); missing: P_score>=41.8",,,,,,,
61eccece-68b2-43d0-b4a5-475f668218f4,GOLD_CFD,2026-06-10T20:56:27Z,no entry,core,5,,1.0,20.0,,,,,,,4068.36052,2026-06-10T20:56:00Z,27,,,rule,"Bias(4H→1H)=short (+15.0); Regime filter inaktív; 5M BOS trendirányba (+16.0); ATR nincs rendben (relatív vagy abszolút küszöb); Alacsony realised vol → magasabb RR igény; Intraday range alsó harmada telített (−7.0); Range expanzió támogatja a momentumot (+3.0); Order flow neutrális (−3.1); OFI toxikus short irányra (−3.1); P-Score reduced by 4.0 due to regime CHOPPY; Intraday P-score lazítás: micro-bias short elsőbbséget kap (−2.2); Mesterlövész mód: P-score minimum 30 érvényesítve; VWAP felett — GOLD short breakout várakozik; ATR-floor override: rel_atr 0.0013 < 0.0025 → adaptív RR/TP küszöb; Regime kapu: CHOPPY miatt −10 P-score, pozícióskálázás csökkentve; ATR soft gate: alacsony volatilitás −5 P-score, méret felezve; Strukturális kapu lazítva: momentum erős, BOS hiány engedve; Liquidity gate skipped (no volume proxy available); missing: P_score>=30",,,,,,,
ccf92ed3-db1f-48e0-b425-3b452d4b4628,XAGUSD,2026-06-10T20:56:27Z,precision_arming,core,28,,1.0,20.0,,,,,,,63.37059,2026-06-10T20:56:00Z,27,,,rule,"Bias(4H→1H)=short (+15.0); Regime filter inaktív; 5M BOS trendirányba (+16.0); ATR erősség 1.12× küszöb (+11.7); Intraday range alsó harmada telített (−7.0); Range expanzió támogatja a momentumot (+3.0); XAG momentum override — stop tágítva erős trendnél; XAGUSD: momentum override — stop távolság 1.3×ATR-re tágítva; Order flow neutrális (−2.1); P-Score reduced by 4.0 due to regime CHOPPY; Intraday P-score lazítás: micro-bias short elsőbbséget kap (−2.2); Mesterlövész mód: P-score minimum 28 érvényesítve; XAGUSD: momentum kitörés — RR cél 1:1.45-re szűkítve; XAGUSD breakout-védelem: gyors BE + 20% giveback limit expanziós szakaszban; XAG momentum override — pozícióméret csökkentve; XAGUSD: ATR-alapú pozícióskálázás ×0.55; XAG: VWAP felett — short setup türelmet igényel; Regime kapu: CHOPPY miatt −10 P-score, pozícióskálázás csökkentve; Strukturális soft gate: 1/3 jel + ATR/spread OK (−6 P-score, size ×0.70); Strukturális kapu lazítva: momentum erős, BOS hiány engedve; P-score soft gate: −0.4 pont tolerancia (size ×0.65, RR +0.15); Liquidity gate skipped (no volume proxy available); XAG stop lazítás: ATR1h alapú kockázat ×1.09; Precision trigger kész → limit figyelés; Precision limit belépő parkolva 12 percig",,,,,,,
9bcb5dd3-cb7e-46a9-9cd8-521d2dc90af3,BTCUSD,2026-06-10T20:56:27Z,precision_arming,core,40,,1.0,2.0,,,,,,,61717.25,2026-06-10T20:56:00Z,27,,,rule,"Mean reversion bias override (+19.5); Regime filter inaktív; ATR erősség 0.90× küszöb (+10.4); Ár az intraday range alsó zónájában (+4.0); Fib zóna konfluencia (0.618–0.886) (+18.0); Order flow neutrális (−4.6); P-Score reduced by 4.0 due to regime CHOPPY; P-Score reduced by 4.1 due to ATR Soft Gate tolerance; Mesterlövész mód: P-score minimum 35 érvényesítve; Regime kapu: CHOPPY miatt −10 P-score, pozícióskálázás csökkentve; BTC ATR1h stop igazítás: kockázat ×1.15; Precision trigger kész → limit figyelés; Precision limit belépő parkolva 20 percig",,,,,,,
4b3ba29b-4b0d-4b44-80e9-97c3afe12ef1,USOIL,2026-06-10T20:56:27Z,no entry,core_only,45,,1.0,20.0,91.55277,93.43761533428571,87.21762573114285,84.76732679657142,3.6,,91.55277,2026-06-10T20:56:00Z,27,,,rule,"Bias(4H→1H)=short (+15.0); Regime filter inaktív; ATR erősség 3.26× küszöb (+23.0); Fib zóna konfluencia (0.618–0.886) (+18.0); Order flow neutrális (−4.2); OFI toxikus short irányra (−3.4); P-Score reduced by 4.0 due to regime CHOPPY; USOIL: 1h ATR ≥1.5 USD — RR cél 1:2-re emelve; Regime kapu: CHOPPY miatt −10 P-score, pozícióskálázás csökkentve; USOIL stop lazítás: ATR1h alapú kockázat ×0.92; Diagnosztika: k1m: utolsó zárt gyertya 10 perc késésben van; Diagnosztika: k1m: jelzés korlátozva 10 perc késés miatt; Diagnosztika: k5m: utolsó zárt gyertya 11 perc késésben van",,,,,,,
