journal_id,asset,analysis_timestamp,signal,mode,probability,model_probability,realtime_confidence,leverage,entry_price,stop_loss,take_profit_1,take_profit_2,risk_reward,initial_risk_abs,spot_price,spot_timestamp,spot_latency_seconds,precision_score,anchor_bias,probability_source,notes,validation_outcome,validation_rr,max_favorable_excursion,max_adverse_excursion,time_to_outcome_minutes,slippage,execution_latency_ms
46aed676-c4a7-4309-8384-243be815a77a,GOLD_CFD,2026-01-08T07:38:37Z,no entry,core,16,,1.0,20.0,,,,,,,4434.60341,2026-01-08T07:38:30Z,6,,,rule,"Bias(4H→1H)=long (+15.0); Regime filter inaktív; ATR nincs rendben (relatív vagy abszolút küszöb); Alacsony realised vol → magasabb RR igény; Fib zóna konfluencia (0.618–0.886) (+18.0); Order flow neutrális (−4.5); VWAP alatt — GOLD long breakout késleltetve; ATR-floor override: rel_atr 0.0008 < 0.0025 → adaptív RR/TP küszöb; Regime kapu: CHOPPY miatt −10 P-score, pozícióskálázás csökkentve; ATR soft gate: alacsony volatilitás −5 P-score, méret felezve; Liquidity gate skipped (no volume proxy available); missing: P_score>=28",,,,,,,
192ee0c5-ef75-457f-bca3-385902637ad1,EURUSD,2026-01-08T07:38:37Z,no entry,core,0,,0.9999999999999998,30.0,,,,,,,1.16819,2026-01-08T07:38:15Z,21,,,rule,"Intraday bias gate feltételek hiányosak — Micro BOS long  ATR rendben: 1m micro BOS long, ATR gate | Micro BOS short  ATR rendben: 1m micro BOS short, ATR gate; Bias neutrálsávban; Regime filter inaktív; ATR nincs rendben (relatív vagy abszolút küszöb); Alacsony realised vol → magasabb RR igény; Fib zóna konfluencia (0.618–0.886) (+18.0); Order flow neutrális (−4.9); P-Score reduced by 4.0 due to regime CHOPPY; EURUSD: ATR(1h) alacsony — P-score küszöb +6 pontra emelve; EURUSD: Visszafogott ATR — célok szűkítve, kockázat kontroll alatt; ATR-floor override: rel_atr 0.0002 < 0.0006 → adaptív RR/TP küszöb; Regime kapu: CHOPPY miatt −10 P-score, pozícióskálázás csökkentve; ATR soft gate: alacsony volatilitás −5 P-score, méret felezve; Bias eltérés: H1 trend ütközik az M5 belépéssel (−15 P-score); Liquidity gate skipped (no volume proxy available); missing: P_score>=32",,,,,,,
b804be30-df49-427a-b186-d3c3f5e58772,XAGUSD,2026-01-08T07:38:37Z,no entry,core,23,,1.0,20.0,,,,,,,76.04214,2026-01-08T07:38:02Z,34,,,rule,"Bias(4H→1H)=long (+15.0); Regime filter inaktív; ATR erősség 1.09× küszöb (+11.6); Ár az intraday range alsó zónájában (+4.0); Order flow neutrális (−4.9); P-Score reduced by 4.0 due to regime CHOPPY; XAGUSD: visszafogott ATR — RR cél 1:1.7-re emelve; XAGUSD: ATR-alapú pozícióskálázás ×0.70; XAG: VWAP alatt — long setup türelmet igényel; Regime kapu: CHOPPY miatt −10 P-score, pozícióskálázás csökkentve; Liquidity gate skipped (no volume proxy available); missing: P_score>=28, precision_flow_alignment",,,,,,,
2039784a-65e7-4f59-ac9e-07f86257a994,BTCUSD,2026-01-08T07:38:37Z,precision_ready,core,60,,0.9999999999999998,2.0,,,,,,,90264.02,2026-01-08T07:38:16Z,21,,,rule,"Bias override: Intraday 5m BOS long  ATR (+19.5); Regime filter inaktív; HTF sweep ok (+10.0); 5M BOS trendirányba (+16.0); ATR erősség 1.52× küszöb (+14.1); Range expanzió támogatja a momentumot (+3.0); Order flow neutrális (−4.2); Buy pressure támogatja a setupot (+5); P-Score reduced by 4.0 due to regime CHOPPY; OFI z-score 2.03 támogatja az irányt; Regime kapu: CHOPPY miatt −10 P-score, pozícióskálázás csökkentve; Likviditási kapu lazítva erős momentum miatt; TP1 nettó profit ≈ 0.60%; Precision belépő: order flow megerősítésre vár; Precision limit belépő parkolva 16 percig; missing: tp1_net>=+0.6%, precision_flow_alignment",,,,,,,
d09a1872-1b7a-4dcc-8ac6-c4a0f870689d,USOIL,2026-01-08T07:38:37Z,no entry,core,31,,1.0,20.0,,,,,,,56.13,2026-01-08T07:38:04Z,33,,,rule,"Bias(4H→1H)=short (+15.0); Regime filter inaktív; 5M BOS trendirányba (+16.0); ATR nincs rendben (relatív vagy abszolút küszöb); Range expanzió támogatja a momentumot (+3.0); USOIL: erős momentum — invalid zóna 2.5×ATR(1h)-re tágítva; Fib zóna konfluencia (0.618–0.886) (+18.0); Order flow neutrális (−4.9); P-Score reduced by 4.0 due to regime CHOPPY; USOIL: 1h ATR <1 USD — P-score küszöb emelve a zajos sáv miatt; USOIL: csökkenő volatilitás — RR cél 1:1.5-re igazítva; USOIL: európai délelőtt — pozícióméret ×0.75; Regime kapu: CHOPPY miatt −10 P-score, pozícióskálázás csökkentve; ATR soft gate: alacsony volatilitás −5 P-score, méret felezve; Liquidity gate skipped (no volume proxy available); missing: P_score>=34",,,,,,,
