journal_id,asset,analysis_timestamp,signal,mode,probability,model_probability,realtime_confidence,leverage,entry_price,stop_loss,take_profit_1,take_profit_2,risk_reward,initial_risk_abs,spot_price,spot_timestamp,spot_latency_seconds,precision_score,anchor_bias,probability_source,notes,validation_outcome,validation_rr,max_favorable_excursion,max_adverse_excursion,time_to_outcome_minutes,slippage,execution_latency_ms
d874e543-8e48-4b57-acad-9375ac64abdc,GOLD_CFD,2026-01-27T04:31:19Z,no entry,core,29,,1.0,20.0,,,,,,,5074.13622,2026-01-27T04:30:59Z,20,,,rule,"Bias(4H→1H)=long (+15.0); Regime filter inaktív; 5M BOS trendirányba (+16.0); ATR nincs rendben (relatív vagy abszolút küszöb); Alacsony realised vol → magasabb RR igény; Intraday range felső harmada telített (−7.0); Range expanzió támogatja a momentumot (+3.0); Fib zóna konfluencia (0.618–0.886) (+18.0); Order flow neutrális (−4.4); VWAP alatt — GOLD long breakout késleltetve; ATR-floor override: rel_atr 0.0009 < 0.0025 → adaptív RR/TP küszöb; Regime kapu: CHOPPY miatt −10 P-score, pozícióskálázás csökkentve; ATR soft gate: alacsony volatilitás −5 P-score, méret felezve; Strukturális kapu lazítva: momentum erős, BOS hiány engedve; Liquidity gate skipped (no volume proxy available); missing: P_score>=40",,,,,,,
a8019391-3f0c-43f0-9fc1-56cde50bd8e7,EURUSD,2026-01-27T04:31:19Z,no entry,core,17,,1.0,30.0,,,,,,,1.18726,2026-01-27T04:30:59Z,20,,,rule,"Bias(4H→1H)=long (+15.0); Regime filter inaktív; ATR nincs rendben (relatív vagy abszolút küszöb); Alacsony realised vol → magasabb RR igény; Ár az intraday range alsó zónájában (+4.0); Fib zóna konfluencia (0.618–0.886) (+18.0); Order flow neutrális (−3.2); P-Score reduced by 4.0 due to regime CHOPPY; P-Score reduced by 1.2 due to ATR Soft Gate tolerance; EURUSD: ATR(1h) alacsony — P-score küszöb +6 pontra emelve; EURUSD: Visszafogott ATR — célok szűkítve, kockázat kontroll alatt; EURUSD BOS aktív, de VWAP alatt — türelem; ATR-floor override: rel_atr 0.0002 < 0.0006 → adaptív RR/TP küszöb; Regime kapu: CHOPPY miatt −10 P-score, pozícióskálázás csökkentve; ATR soft gate: alacsony volatilitás −5 P-score, méret felezve; Liquidity gate skipped (no volume proxy available); missing: P_score>=44",,,,,,,
3f80b159-5f02-4aa7-9f82-803f990baf5c,XAGUSD,2026-01-27T04:31:19Z,precision_arming,momentum,26,,1.0,20.0,,,,,,,109.29104,2026-01-27T04:30:59Z,20,,,rule,"Bias(4H→1H)=long (+15.0); Regime filter inaktív; ATR erősség 1.66× küszöb (+15.0); Fib zóna konfluencia (0.618–0.886) (+18.0); Order flow neutrális (−4.8); P-Score reduced by 4.0 due to regime CHOPPY; XAGUSD: ATR-alapú pozícióskálázás ×0.62; XAG: VWAP alatt — long setup türelmet igényel; Regime kapu: CHOPPY miatt −10 P-score, pozícióskálázás csökkentve; Strukturális soft gate: 1/3 jel + ATR/spread OK (−6 P-score, size ×0.70); Strukturális kapu lazítva: momentum erős, BOS hiány engedve; Liquidity gate skipped (no volume proxy available); Momentum soft gate: liquidity, order_flow, order_flow_pressure, ofi (−8.0 P, size ×0.68); XAG stop lazítás: ATR1h alapú kockázat ×1.03; Precision trigger kész → limit figyelés; Precision limit belépő parkolva 12 percig",,,,,,,
03d8bb3c-ad86-4366-bc97-2399187debf9,BTCUSD,2026-01-27T04:31:19Z,no entry,core,32,,1.0,2.0,,,,,,,88729.32,2026-01-27T04:30:59Z,20,,,rule,"Mean reversion bias override (+19.5); Regime filter inaktív; HTF sweep ok (+10.0); 5M BOS trendirányba (+16.0); ATR nincs rendben (relatív vagy abszolút küszöb); Alacsony realised vol → magasabb RR igény; Ár az intraday range felső zónájában (+4.0); Range expanzió támogatja a momentumot (+3.0); Order flow neutrális (−4.2); P-Score reduced by 4.0 due to regime CHOPPY; Mesterlövész mód: P-score minimum 35 érvényesítve; OFI z-score -1.31 támogatja az irányt; ATR-floor override: rel_atr 0.0010 < 0.0012 → adaptív RR/TP küszöb; Regime kapu: CHOPPY miatt −10 P-score, pozícióskálázás csökkentve; ATR soft gate: alacsony volatilitás −5 P-score, méret felezve; Strukturális kapu lazítva: momentum erős, BOS hiány engedve; Precision limit belépő parkolva 20 percig; missing: P_score>=35",,,,,,,
05f663c6-fd4c-4beb-8070-abe72363ca5a,USOIL,2026-01-27T04:31:19Z,no entry,core,9,,1.0,20.0,,,,,,,60.20912,2026-01-27T04:30:59Z,20,,,rule,"Bias(4H→1H)=long (+15.0); Regime filter inaktív; ATR nincs rendben (relatív vagy abszolút küszöb); Ár az intraday range alsó zónájában (+4.0); Fib zóna konfluencia (0.618–0.886) (+18.0); Order flow neutrális (−4.8); OFI toxikus long irányra (−7.2); P-Score reduced by 4.0 due to regime CHOPPY; USOIL: 1h ATR <1 USD — P-score küszöb emelve a zajos sáv miatt; USOIL: csökkenő volatilitás — RR cél 1:1.5-re igazítva; USOIL: ázsiai sáv — pozícióméret ×0.70; USOIL: oldalazó szerkezet — 1h BOS nélkül nincs belépő; Regime kapu: CHOPPY miatt −10 P-score, pozícióskálázás csökkentve; ATR soft gate: alacsony volatilitás −5 P-score, méret felezve; Liquidity gate skipped (no volume proxy available); missing: P_score>=45",,,,,,,
