journal_id,asset,analysis_timestamp,signal,mode,probability,model_probability,realtime_confidence,leverage,entry_price,stop_loss,take_profit_1,take_profit_2,risk_reward,initial_risk_abs,spot_price,spot_timestamp,spot_latency_seconds,precision_score,anchor_bias,probability_source,notes,validation_outcome,validation_rr,max_favorable_excursion,max_adverse_excursion,time_to_outcome_minutes,slippage,execution_latency_ms
c4013c22-f2ef-4605-a212-6bed840f248e,GOLD_CFD,2026-03-04T00:31:12Z,no entry,core,27,,1.0,20.0,,,,,,,5124.47985,2026-03-04T00:30:53Z,19,,,rule,"Intraday bias gate feltételek hiányosak — 5m retest long  ATR: 5m retest long, ATR gate | 5m retest short  ATR: 5m retest short, ATR gate; Bias neutrálsávban; EMA21 slope 1.16× küszöb (+13.0); Nyitási illikviditás hatás (-2.0); ATR nincs rendben (relatív vagy abszolút küszöb); Fib zóna konfluencia (0.618–0.886) (+18.0); Order flow neutrális (−4.2); ATR-floor override: rel_atr 0.0016 < 0.0025 → adaptív RR/TP küszöb; ATR soft gate: alacsony volatilitás −5 P-score, méret felezve; Liquidity gate skipped (no volume proxy available); missing: P_score>=30",,,,,,,
65b55309-82e3-44a7-af6f-20291709c0fb,EURUSD,2026-03-04T00:31:12Z,precision_arming,core,54,,1.0,30.0,,,,,,,1.16038,2026-03-04T00:30:53Z,19,,,rule,"Micro bias override: gyors struktúra dominál (+19.5); Regime filter inaktív; 5M BOS trendirányba (+16.0); Nyitási illikviditás hatás (-2.0); ATR erősség 1.23× küszöb (+12.4); Alacsony realised vol → magasabb RR igény; Intraday range alsó harmada telített (−7.0); Range expanzió támogatja a momentumot (+3.0); Fib zóna konfluencia (0.618–0.886) (+18.0); Order flow neutrális (−3.1); P-Score reduced by 4.0 due to regime CHOPPY; EURUSD: Momentum override aktív — extra P-score követelmény (+2); Intraday P-score lazítás: micro-bias short elsőbbséget kap (−2.2); EURUSD: Magas volatilitás → RR célok 1:2 környékére szélesítve; EURUSD: ATR-alapú pozícióskálázás ×0.60 — volatilitás kontroll; EURUSD BOS aktív, de VWAP felett — várakozás; OFI z-score -1.08 támogatja az irányt; ATR-floor override: rel_atr 0.0003 < 0.0006 → adaptív RR/TP küszöb; Regime kapu: CHOPPY miatt −10 P-score, pozícióskálázás csökkentve; Liquidity gate skipped (no volume proxy available); EURUSD stop lazítás: ATR1h alapú kockázat ×0.72; Precision trigger kész → limit figyelés; Precision limit belépő parkolva 12 percig",,,,,,,
44553dac-bb0b-4d8b-8a1f-1d17a1eb3de1,XAGUSD,2026-03-04T00:31:12Z,precision_arming,core,81,,1.0,20.0,,,,,,,83.18191,2026-03-04T00:30:53Z,19,,,rule,"Bias override: Intraday Micro BOS long  ATR (ezüst) (+19.5); EMA21 slope 1.74× küszöb (+16.4); 5M BOS trendirányba (+16.0); Nyitási illikviditás hatás (-2.0); ATR erősség 1.20× küszöb (+12.2); Intraday range felső harmada telített (−7.0); Range expanzió támogatja a momentumot (+3.0); XAG momentum override — stop tágítva erős trendnél; XAGUSD: momentum override — stop távolság 1.3×ATR-re tágítva; Fib zóna konfluencia (0.618–0.886) (+18.0); Order flow neutrális (−3.9); Intraday P-score lazítás: micro-bias long elsőbbséget kap (−1.5); Mesterlövész mód: P-score minimum 28 érvényesítve; XAGUSD: momentum kitörés — RR cél 1:1.45-re szűkítve; XAGUSD breakout-védelem: gyors BE + 20% giveback limit expanziós szakaszban; XAG momentum override — pozícióméret csökkentve; XAGUSD: ATR-alapú pozícióskálázás ×0.55; XAG: VWAP alatt — long setup türelmet igényel; Strukturális soft gate: 1/3 jel + ATR/spread OK (−6 P-score, size ×0.70); Strukturális kapu lazítva: momentum erős, BOS hiány engedve; Liquidity gate skipped (no volume proxy available); XAG stop lazítás: ATR1h alapú kockázat ×1.09; Trend alignment: COUNTER — TP1 minimum szigorítva (+0.07%); Precision trigger kész → limit figyelés; Precision limit belépő parkolva 12 percig",,,,,,,
c8bf1b0c-5542-4a99-8bda-fe1413b60600,BTCUSD,2026-03-04T00:31:12Z,no entry,core,22,,1.0,2.0,,,,,,,68294.4,2026-03-04T00:30:53Z,19,,,rule,"Intraday bias gate feltételek hiányosak — Crypto momentum long: 1m micro BOS long, Momentum volume ráta | Crypto momentum short: 1m micro BOS short, Momentum volume ráta | 5m BOS long  ATR: 5m BOS long | 5m BOS short  ATR: 5m BOS short | Micro BOS short  ATR (momentum nélkül): 1m micro BOS short; Bias neutrálsávban; Regime filter inaktív; Nyitási illikviditás hatás (-2.0); ATR erősség 1.02× küszöb (+11.1); Range expanzió támogatja a momentumot (+3.0); Fib zóna konfluencia (0.618–0.886) (+18.0); Order flow neutrális (−4.9); P-Score reduced by 4.0 due to regime CHOPPY; Mesterlövész mód: P-score minimum 35 érvényesítve; Regime kapu: CHOPPY miatt −10 P-score, pozícióskálázás csökkentve; Strukturális kapu lazítva: momentum erős, BOS hiány engedve; missing: P_score>=35",,,,,,,
c338765d-4231-427d-aa2d-bffebeeca0c5,USOIL,2026-03-04T00:31:13Z,precision_arming,core,38,,1.0,20.0,,,,,,,73.95391,2026-03-04T00:30:53Z,20,,,rule,"Bias(4H→1H)=long (+15.0); Regime filter inaktív; Nyitási illikviditás hatás (-2.0); ATR erősség 0.99× küszöb (+10.9); Ár az intraday range alsó zónájában (+4.0); Fib zóna konfluencia (0.618–0.886) (+18.0); Order flow neutrális (−4.5); P-Score reduced by 4.0 due to regime CHOPPY; P-Score reduced by 0.5 due to ATR Soft Gate tolerance; USOIL: 1h ATR ≥1.5 USD — RR cél 1:2-re emelve; USOIL: ázsiai sáv — pozícióméret ×0.70; Regime kapu: CHOPPY miatt −10 P-score, pozícióskálázás csökkentve; Liquidity gate skipped (no volume proxy available); USOIL stop lazítás: ATR1h alapú kockázat ×0.92; Precision trigger kész → limit figyelés; Precision limit belépő parkolva 12 percig",,,,,,,
