journal_id,asset,analysis_timestamp,signal,mode,probability,model_probability,realtime_confidence,leverage,entry_price,stop_loss,take_profit_1,take_profit_2,risk_reward,initial_risk_abs,spot_price,spot_timestamp,spot_latency_seconds,precision_score,anchor_bias,probability_source,notes,validation_outcome,validation_rr,max_favorable_excursion,max_adverse_excursion,time_to_outcome_minutes,slippage,execution_latency_ms
516ecd16-9150-464a-ae71-bea8f9ca9377,XAGUSD,2026-03-31T16:26:30Z,no entry,core,4,,1.0,20.0,,,,,,,73.91461,2026-03-31T16:25:58Z,32,,,rule,"Intraday bias gate feltételek hiányosak — Micro BOS long  ATR (ezüst): 1m micro BOS long | Micro BOS short  ATR (ezüst): 1m micro BOS short; Bias neutrálsávban; Regime filter inaktív; ATR erősség 1.09× küszöb (+11.6); Order flow neutrális (−4.5); P-Score reduced by 4.0 due to regime CHOPPY; XAGUSD: visszafogott ATR — RR cél 1:1.7-re emelve; XAGUSD breakout-védelem: gyors BE + 20% giveback limit expanziós szakaszban; XAGUSD: ATR-alapú pozícióskálázás ×0.70; Regime kapu: CHOPPY miatt −10 P-score, pozícióskálázás csökkentve; Liquidity gate skipped (no volume proxy available); missing: P_score>=28",,,,,,,
50859968-b47f-4d5c-ab23-858e2a4ca776,EURUSD,2026-03-31T16:26:30Z,no entry,core,27,,1.0,30.0,,,,,,,1.15194,2026-03-31T16:25:57Z,33,,,rule,"Intraday bias gate feltételek hiányosak — Micro BOS long  ATR rendben: 1m micro BOS long | Micro BOS short  ATR rendben: 1m micro BOS short; Bias neutrálsávban; Regime filter inaktív; ATR erősség 2.21× küszöb (+18.2); Alacsony realised vol → magasabb RR igény; Fib zóna konfluencia (0.618–0.886) (+18.0); Order flow neutrális (−4.6); ATR-floor override: rel_atr 0.0005 < 0.0006 → adaptív RR/TP küszöb; Regime kapu: CHOPPY miatt −10 P-score, pozícióskálázás csökkentve; Strukturális soft gate: 1/3 jel + ATR/spread OK (−6 P-score, size ×0.70); Strukturális kapu lazítva: momentum erős, BOS hiány engedve; Liquidity gate skipped (no volume proxy available); missing: P_score>=38",,,,,,,
9db7f205-4ada-4dfa-993c-115b0fb4452b,GOLD_CFD,2026-03-31T16:26:30Z,no entry,core,0,,1.0,20.0,,,,,,,4615.27977,2026-03-31T16:25:57Z,33,,,rule,"Intraday bias gate feltételek hiányosak — 5m retest long  ATR: 5m retest long, ATR gate | 5m retest short  ATR: 5m retest short, ATR gate; Bias neutrálsávban; Regime filter inaktív; ATR nincs rendben (relatív vagy abszolút küszöb); Order flow neutrális (−4.2); P-Score reduced by 4.0 due to regime CHOPPY; ATR-floor override: rel_atr 0.0014 < 0.0025 → adaptív RR/TP küszöb; Regime kapu: CHOPPY miatt −10 P-score, pozícióskálázás csökkentve; ATR soft gate: alacsony volatilitás −5 P-score, méret felezve; Liquidity gate skipped (no volume proxy available); missing: P_score>=30",,,,,,,
dfa408d9-cb23-4f98-a47f-2761f5e32591,NVDA,2026-03-31T16:26:30Z,no entry,core,16,,1.0,5.0,,,,,,,171.215,2026-03-31T16:25:58Z,32,,,rule,"Bias(4H→1H)=short (+15.0); Regime filter inaktív; ATR nincs rendben (relatív vagy abszolút küszöb); WARNING: No Liquidity Structure (Nearest: 178.568830, Dist: 16.25ATR); Ár az intraday range felső zónájában (+4.0); Fib zóna konfluencia (0.618–0.886) (+18.0); Order flow neutrális (−4.9); P-Score reduced by 4.0 due to regime CHOPPY; Regime kapu: CHOPPY miatt −10 P-score, pozícióskálázás csökkentve; ATR soft gate: alacsony volatilitás −5 P-score, méret felezve; missing: P_score>=38, precision_flow_alignment",,,,,,,
0aa6b62c-858a-4535-9589-f5f05cfd8a61,USOIL,2026-03-31T16:26:30Z,precision_arming,core,41,,1.0,20.0,,,,,,,105.25982,2026-03-31T16:25:58Z,32,,,rule,"Mean reversion bias override (+19.5); Regime filter inaktív; ATR erősség 1.32× küszöb (+12.9); Ár az intraday range felső zónájában (+4.0); Fib zóna konfluencia (0.618–0.886) (+18.0); Order flow neutrális (−4.5); P-Score reduced by 4.0 due to regime CHOPPY; USOIL: 1h ATR ≥1.5 USD — RR cél 1:2-re emelve; USOIL: oldalazó szerkezet — H1/M5 BOS nélkül nincs belépő; Regime kapu: CHOPPY miatt −10 P-score, pozícióskálázás csökkentve; Strukturális soft gate: 1/3 jel + ATR/spread OK (−6 P-score, size ×0.70); Strukturális kapu lazítva: momentum erős, BOS hiány engedve; Liquidity gate skipped (no volume proxy available); USOIL belépés blokkolva: erős trend ellen (ADX≥22); Precision trigger kész → limit figyelés; Precision limit belépő parkolva 12 percig",,,,,,,
7f51fa24-83b8-4314-874f-1ddddd89b41c,BTCUSD,2026-03-31T16:26:30Z,precision_arming,core,37,,1.0,2.0,,,,,,,67121.82,2026-03-31T16:25:57Z,33,,,rule,"Bias(4H→1H)=short (+15.0); Regime filter inaktív; ATR erősség 1.78× küszöb (+15.7); Ár az intraday range felső zónájában (+4.0); ema9x21+ofi_z=-999.00; Ár 1h EMA21 zónában (+10.0); Order flow neutrális (−4.9); Order flow ellentétes irányba tolódik (−4); Mesterlövész mód: P-score minimum 35 érvényesítve; BTC momentum override — pozícióméret csökkentve; BTC momentum override — likviditási kapu lazítva; Regime kapu: CHOPPY miatt −10 P-score, pozícióskálázás csökkentve; Likviditási kapu lazítva erős momentum miatt; BTC ATR1h stop igazítás: kockázat ×1.03; Precision trigger kész → limit figyelés; Precision limit belépő parkolva 20 percig",,,,,,,
