journal_id,asset,analysis_timestamp,signal,mode,probability,model_probability,realtime_confidence,leverage,entry_price,stop_loss,take_profit_1,take_profit_2,risk_reward,initial_risk_abs,spot_price,spot_timestamp,spot_latency_seconds,precision_score,anchor_bias,probability_source,notes,validation_outcome,validation_rr,max_favorable_excursion,max_adverse_excursion,time_to_outcome_minutes,slippage,execution_latency_ms
d1b23633-4dd2-4a27-a098-bb867845856a,EURUSD,2026-03-19T08:11:07Z,precision_arming,core,43,,1.0,30.0,,,,,,,1.14464,2026-03-19T08:10:40Z,27,,,rule,"Bias(4H→1H)=short (+15.0); Regime filter inaktív; 5M BOS trendirányba (+16.0); ATR erősség 2.92× küszöb (+22.5); Alacsony realised vol → magasabb RR igény; Intraday range alsó harmada telített (−7.0); Range expanzió támogatja a momentumot (+3.0); Order flow neutrális (−3.1); P-Score reduced by 4.0 due to regime CHOPPY; EURUSD: ATR(1h) alacsony — P-score küszöb +6 pontra emelve; Intraday P-score lazítás: micro-bias short elsőbbséget kap (−2.2); EURUSD: Visszafogott ATR — célok szűkítve, kockázat kontroll alatt; EURUSD BOS aktív, de VWAP felett — várakozás; OFI z-score -1.30 támogatja az irányt; ATR-floor override: rel_atr 0.0006 < 0.0006 → adaptív RR/TP küszöb; Regime kapu: CHOPPY miatt −10 P-score, pozícióskálázás csökkentve; Likviditási kapu lazítva erős momentum miatt; Liquidity gate skipped (no volume proxy available); EURUSD stop lazítás: ATR1h alapú kockázat ×1.19; Precision trigger kész → limit figyelés; Precision limit belépő parkolva 12 percig",,,,,,,
2cf0ceb0-dbfc-4cf9-a342-7c4186466887,GOLD_CFD,2026-03-19T08:11:07Z,no entry,core,8,,1.0,20.0,,,,,,,4717.0281,2026-03-19T08:10:40Z,27,,,rule,"Bias(4H→1H)=short (+15.0); Regime filter inaktív; 5M BOS trendirányba (+16.0); ATR nincs rendben (relatív vagy abszolút küszöb); Intraday range alsó harmada telített (−7.0); Range expanzió támogatja a momentumot (+3.0); Order flow neutrális (−3.1); P-Score reduced by 4.0 due to regime CHOPPY; Intraday P-score lazítás: micro-bias short elsőbbséget kap (−2.2); Mesterlövész mód: P-score minimum 30 érvényesítve; VWAP felett — GOLD short breakout várakozik; OFI z-score -1.66 támogatja az irányt; Regime kapu: CHOPPY miatt −10 P-score, pozícióskálázás csökkentve; ATR soft gate: alacsony volatilitás −5 P-score, méret felezve; Liquidity gate skipped (no volume proxy available); missing: P_score>=30",,,,,,,
8205f370-adf7-4bc3-b6fb-77253fc7f174,BTCUSD,2026-03-19T08:11:07Z,no entry,core,43,,1.0,2.0,,,,,,,70168.79,2026-03-19T08:10:40Z,27,,,rule,"Intraday bias gate feltételek hiányosak — Crypto momentum long: 1m micro BOS long, Momentum volume ráta | Crypto momentum short: 1m micro BOS short, Momentum volume ráta | 5m BOS long  ATR: 5m BOS long | 5m BOS short  ATR: 5m BOS short | Micro BOS short  ATR (momentum nélkül): 1m micro BOS short; Bias neutrálsávban; EMA21 slope 1.13× küszöb (+12.8); ATR erősség 2.38× küszöb (+19.3); Order flow neutrális (−3.9); Mesterlövész mód: P-score minimum 35 érvényesítve",,,,,,,
d1eab8cf-d6c6-405d-922b-12e5bceafc17,XAGUSD,2026-03-19T08:11:07Z,precision_arming,core,74,,1.0,20.0,,,,,,,71.41568,2026-03-19T08:10:40Z,27,,,rule,"Bias(4H→1H)=short (+15.0); EMA21 slope 1.50× küszöb (+15.0); HTF sweep ok (+10.0); 5M BOS trendirányba (+16.0); ATR erősség 1.89× küszöb (+16.4); Intraday range alsó harmada telített (−7.0); Range expanzió támogatja a momentumot (+3.0); XAG momentum override — stop tágítva erős trendnél; XAGUSD: momentum override — stop távolság 1.3×ATR-re tágítva; Order flow neutrális (−3.7); XAGUSD: momentum kitörés — RR cél 1:1.45-re szűkítve; XAGUSD breakout-védelem: gyors BE + 20% giveback limit expanziós szakaszban; XAG momentum override — pozícióméret csökkentve; XAGUSD: ATR-alapú pozícióskálázás ×0.55; XAG: VWAP felett — short setup türelmet igényel; Strukturális soft gate: 1/3 jel + ATR/spread OK (−6 P-score, size ×0.70); Strukturális kapu lazítva: momentum erős, BOS hiány engedve; Liquidity gate skipped (no volume proxy available); XAG stop lazítás: ATR1h alapú kockázat ×1.09; Precision trigger kész → limit figyelés; Precision limit belépő parkolva 12 percig",,,,,,,
42d483ca-a69d-4828-823a-716b92986c8f,USOIL,2026-03-19T08:11:07Z,no entry,core_only,52,,1.0,20.0,96.64741,95.12953723599999,100.1385173572,102.1117519504,3.6,,96.64741,2026-03-19T08:10:40Z,27,,,rule,"Bias(4H→1H)=long (+15.0); Regime filter inaktív; 5M BOS trendirányba (+16.0); ATR erősség 1.55× küszöb (+14.3); Range expanzió támogatja a momentumot (+3.0); USOIL: erős momentum — invalid zóna 2.5×ATR(1h)-re tágítva; Fib zóna konfluencia (0.618–0.886) (+18.0); Order flow neutrális (−4.9); OFI toxikus long irányra (−4.6); USOIL: 1h ATR ≥1.5 USD — RR cél 1:2-re emelve; USOIL: oldalazó szerkezet — H1/M5 BOS nélkül nincs belépő; Regime kapu: CHOPPY miatt −10 P-score, pozícióskálázás csökkentve; Strukturális soft gate: 1/3 jel + ATR/spread OK (−6 P-score, size ×0.70); Strukturális kapu lazítva: momentum erős, BOS hiány engedve; USOIL stop lazítás: ATR1h alapú kockázat ×0.97; Diagnosztika: k1m: utolsó zárt gyertya 11 perc késésben van; Diagnosztika: k1m: jelzés korlátozva 11 perc késés miatt; Diagnosztika: k5m: utolsó zárt gyertya 11 perc késésben van",,,,,,,
