journal_id,asset,analysis_timestamp,signal,mode,probability,model_probability,realtime_confidence,leverage,entry_price,stop_loss,take_profit_1,take_profit_2,risk_reward,initial_risk_abs,spot_price,spot_timestamp,spot_latency_seconds,precision_score,anchor_bias,probability_source,notes,validation_outcome,validation_rr,max_favorable_excursion,max_adverse_excursion,time_to_outcome_minutes,slippage,execution_latency_ms
1f61dac8-7229-4317-b55a-14160236b498,XAGUSD,2026-05-01T18:56:51Z,no entry,core,0,,1.0,20.0,,,,,,,75.78871,2026-05-01T18:56:18Z,33,,,rule,"Intraday bias gate feltételek hiányosak — Micro BOS long  ATR (ezüst): 1m micro BOS long, ATR gate | Micro BOS short  ATR (ezüst): 1m micro BOS short, ATR gate; Bias neutrálsávban; Regime filter inaktív; ATR nincs rendben (relatív vagy abszolút küszöb); Alacsony realised vol → magasabb RR igény; Fib zóna konfluencia (0.618–0.886) (+18.0); Order flow neutrális (−3.5); P-Score reduced by 4.0 due to regime CHOPPY; P-Score reduced by 5.9 due to ATR Soft Gate tolerance; XAGUSD: visszafogott ATR — RR cél 1:1.7-re emelve; XAGUSD breakout-védelem: gyors BE + 20% giveback limit expanziós szakaszban; XAGUSD: ATR-alapú pozícióskálázás ×0.70; ATR-floor override: rel_atr 0.0016 < 0.0018 → adaptív RR/TP küszöb; Regime kapu: CHOPPY miatt −10 P-score, pozícióskálázás csökkentve; ATR soft gate: alacsony volatilitás −5 P-score, méret felezve; Liquidity gate skipped (no volume proxy available); missing: P_score>=28",,,,,,,
347a712c-2d72-4eab-8273-b3793d5736bb,EURUSD,2026-05-01T18:56:51Z,precision_arming,core,52,,1.0,30.0,,,,,,,1.17252,2026-05-01T18:56:18Z,33,,,rule,"Bias(4H→1H)=long (+15.0); Regime filter inaktív; 5M BOS trendirányba (+16.0); ATR erősség 1.65× küszöb (+14.9); Alacsony realised vol → magasabb RR igény; Ár az intraday range alsó zónájában (+4.0); Range expanzió támogatja a momentumot (+3.0); Ár 1h EMA21 zónában (+10.0); Order flow neutrális (−4.1); OFI toxikus long irányra (−3.7); P-Score reduced by 4.0 due to regime CHOPPY; EURUSD BOS aktív, de VWAP alatt — türelem; ATR-floor override: rel_atr 0.0003 < 0.0006 → adaptív RR/TP küszöb; Regime kapu: CHOPPY miatt −10 P-score, pozícióskálázás csökkentve; Strukturális kapu lazítva: momentum erős, BOS hiány engedve; Liquidity gate skipped (no volume proxy available); EURUSD stop lazítás: ATR1h alapú kockázat ×0.72; Precision trigger kész → limit figyelés; Precision limit belépő parkolva 12 percig",,,,,,,
2b762bbc-6d60-4b55-9715-c8af6278c880,GOLD_CFD,2026-05-01T18:56:51Z,no entry,core,13,,1.0,20.0,,,,,,,4624.12305,2026-05-01T18:56:18Z,33,,,rule,"Bias(4H→1H)=short (+15.0); Regime filter inaktív; ATR nincs rendben (relatív vagy abszolút küszöb); Alacsony realised vol → magasabb RR igény; Fib zóna konfluencia (0.618–0.886) (+18.0); Order flow neutrális (−3.8); P-Score reduced by 4.0 due to regime CHOPPY; VWAP felett — GOLD short breakout várakozik; ATR-floor override: rel_atr 0.0010 < 0.0025 → adaptív RR/TP küszöb; Regime kapu: CHOPPY miatt −10 P-score, pozícióskálázás csökkentve; ATR soft gate: alacsony volatilitás −5 P-score, méret felezve; Liquidity gate skipped (no volume proxy available); missing: P_score>=30",,,,,,,
a5137627-4c83-4170-8439-a8b4a980a863,NVDA,2026-05-01T18:56:51Z,no entry,core,27,,1.0,5.0,,,,,,,198.58,2026-05-01T18:56:18Z,33,,,rule,"Intraday bias gate feltételek hiányosak — EMA9×21 long  magas ATR: EMA9×21 long, Magas ATR megerősítés | EMA9×21 short  magas ATR: EMA9×21 short, Magas ATR megerősítés | 5m BOS short  ATR (momentum nélkül): ATR gate; Bias neutrálsávban; EMA21 slope 1.09× küszöb (+12.5); ATR nincs rendben (relatív vagy abszolút küszöb); WARNING: No Liquidity Structure (Nearest: 197.113756, Dist: 4.15ATR); Fib zóna konfluencia (0.618–0.886) (+18.0); Order flow neutrális (−4.7); ATR soft gate: alacsony volatilitás −5 P-score, méret felezve; missing: P_score>=38",,,,,,,
72db9d99-bdd6-41ce-82ce-d28661119e6a,USOIL,2026-05-01T18:56:51Z,precision_arming,core,53,,1.0,20.0,,,,,,,104.4274,2026-05-01T18:56:18Z,33,,,rule,"Bias(4H→1H)=long (+15.0); Regime filter inaktív; 5M BOS trendirányba (+16.0); ATR erősség 0.95× küszöb (+10.7); Range expanzió támogatja a momentumot (+3.0); USOIL: erős momentum — invalid zóna 2.5×ATR(1h)-re tágítva; Fib zóna konfluencia (0.618–0.886) (+18.0); Order flow neutrális (−4.6); P-Score reduced by 4.0 due to regime CHOPPY; P-Score reduced by 2.2 due to ATR Soft Gate tolerance; USOIL: parabolikus lendület — RR cél 1:1.4 környékére szűkítve; Regime kapu: CHOPPY miatt −10 P-score, pozícióskálázás csökkentve; Liquidity gate skipped (no volume proxy available); USOIL stop lazítás: ATR1h alapú kockázat ×0.97; Precision trigger kész → limit figyelés; Precision limit belépő parkolva 12 percig",,,,,,,
3c4f210a-5c77-4e71-9086-15c9d4165500,BTCUSD,2026-05-01T18:56:51Z,precision_arming,core,38,,1.0,2.0,,,,,,,78450.34,2026-05-01T18:56:18Z,33,,,rule,"Bias(4H→1H)=long (+15.0); Regime filter inaktív; ATR erősség 1.23× küszöb (+12.4); Fib zóna konfluencia (0.618–0.886) (+18.0); Order flow neutrális (−4.3); P-Score reduced by 4.0 due to regime CHOPPY; Mesterlövész mód: P-score minimum 35 érvényesítve; Regime kapu: CHOPPY miatt −10 P-score, pozícióskálázás csökkentve; BTC ATR1h stop igazítás: kockázat ×1.15; Precision trigger kész → limit figyelés; Precision limit belépő parkolva 20 percig",,,,,,,
