journal_id,asset,analysis_timestamp,signal,mode,probability,model_probability,realtime_confidence,leverage,entry_price,stop_loss,take_profit_1,take_profit_2,risk_reward,initial_risk_abs,spot_price,spot_timestamp,spot_latency_seconds,precision_score,anchor_bias,probability_source,notes,validation_outcome,validation_rr,max_favorable_excursion,max_adverse_excursion,time_to_outcome_minutes,slippage,execution_latency_ms
27f528ba-7396-4217-baf5-28f9c8b28952,NVDA,2026-06-09T18:31:19Z,precision_arming,core,54,,1.0,5.0,,,,,,,206.46,2026-06-09T18:30:46Z,32,,,rule,"Micro bias override: gyors struktúra dominál (+19.5); Regime filter inaktív; 5M BOS trendirányba (+16.0); ATR erősség 0.87× küszöb (+10.2); WARNING: No Liquidity Structure (Nearest: 184.866953, Dist: 27.44ATR); Range expanzió támogatja a momentumot (+3.0); Fib zóna konfluencia (0.618–0.886) (+18.0); Order flow neutrális (−3.8); P-Score reduced by 4.0 due to regime CHOPPY; P-Score reduced by 5.4 due to ATR Soft Gate tolerance; NVDA: magas napi ATR + momentum — P-score küszöb lazítva; Intraday P-score lazítás: micro-bias long elsőbbséget kap (−1.5); Mesterlövész mód: P-score minimum 35 érvényesítve; Regime kapu: CHOPPY miatt −10 P-score, pozícióskálázás csökkentve; NVDA ATR1h stop igazítás: kockázat ×1.03; Precision trigger kész → limit figyelés; Precision limit belépő parkolva 12 percig",,,,,,,
4d8e8d6b-c416-450d-ba21-b5b50875e08c,EURUSD,2026-06-09T18:31:19Z,no entry,core,24,,1.0,30.0,,,,,,,1.15517,2026-06-09T18:30:46Z,32,,,rule,"Intraday bias gate feltételek hiányosak — Micro BOS long  ATR rendben: 1m micro BOS long | Micro BOS short  ATR rendben: 1m micro BOS short; Bias neutrálsávban; Regime filter inaktív; ATR erősség 1.46× küszöb (+13.8); Alacsony realised vol → magasabb RR igény; Fib zóna konfluencia (0.618–0.886) (+18.0); Order flow neutrális (−2.5); EURUSD: ATR(1h) alacsony — P-score küszöb +6 pontra emelve; EURUSD: Visszafogott ATR — célok szűkítve, kockázat kontroll alatt; ATR-floor override: rel_atr 0.0003 < 0.0006 → adaptív RR/TP küszöb; Regime kapu: CHOPPY miatt −10 P-score, pozícióskálázás csökkentve; Strukturális soft gate: 1/3 jel + ATR/spread OK (−6 P-score, size ×0.70); Strukturális kapu lazítva: momentum erős, BOS hiány engedve; Liquidity gate skipped (no volume proxy available); missing: P_score>=44",,,,,,,
5cc5cc0d-a0fd-4180-a082-44d18649e850,GOLD_CFD,2026-06-09T18:31:19Z,no entry,core,0,,1.0,20.0,,,,,,,4270.6128,2026-06-09T18:30:46Z,32,,,rule,"Bias(4H→1H)=short (+15.0); Regime filter inaktív; ATR nincs rendben (relatív vagy abszolút küszöb); Order flow neutrális (−3.7); P-Score reduced by 4.0 due to regime CHOPPY; VWAP felett — GOLD short breakout várakozik; ATR-floor override: rel_atr 0.0012 < 0.0025 → adaptív RR/TP küszöb; Regime kapu: CHOPPY miatt −10 P-score, pozícióskálázás csökkentve; ATR soft gate: alacsony volatilitás −5 P-score, méret felezve; Liquidity gate skipped (no volume proxy available); missing: P_score>=30",,,,,,,
662e37a4-c06a-4413-a593-cd450c5bbe51,XAGUSD,2026-06-09T18:31:19Z,precision_arming,core,35,,1.0,20.0,,,,,,,65.50826,2026-06-09T18:30:46Z,32,,,rule,"Bias(4H→1H)=short (+15.0); Regime filter inaktív; ATR erősség 1.57× küszöb (+14.4); Fib zóna konfluencia (0.618–0.886) (+18.0); Order flow neutrális (−3.1); P-Score reduced by 4.0 due to regime CHOPPY; XAGUSD breakout-védelem: gyors BE + 20% giveback limit expanziós szakaszban; XAGUSD: ATR-alapú pozícióskálázás ×0.62; XAG: VWAP felett — short setup türelmet igényel; Regime kapu: CHOPPY miatt −10 P-score, pozícióskálázás csökkentve; Strukturális soft gate: 1/3 jel + ATR/spread OK (−6 P-score, size ×0.70); Strukturális kapu lazítva: momentum erős, BOS hiány engedve; Liquidity gate skipped (no volume proxy available); XAG stop lazítás: ATR1h alapú kockázat ×1.03; Precision trigger kész → limit figyelés; Precision limit belépő parkolva 12 percig",,,,,,,
e853a351-c5eb-42df-a8ae-07157c52e063,USOIL,2026-06-09T18:31:19Z,no entry,core_only,83,,1.0,20.0,88.29943,90.037531306,84.82322738799999,83.08512608199999,3.0,,88.29943,2026-06-09T18:30:46Z,33,,,rule,Bias(4H→1H)=short (+15.0); EMA21 slope 1.21× küszöb (+13.3); 5M BOS trendirányba (+16.0); ATR erősség 1.68× küszöb (+15.1); Range expanzió támogatja a momentumot (+3.0); USOIL: erős momentum — invalid zóna 2.5×ATR(1h)-re tágítva; Ár 1h EMA21 zónában (+10.0); Order flow neutrális (−4.6); USOIL: 1h ATR ≥1.5 USD — RR cél 1:2-re emelve; USOIL stop lazítás: ATR1h alapú kockázat ×0.97; Diagnosztika: k1m: utolsó zárt gyertya 11 perc késésben van; Diagnosztika: k1m: jelzés korlátozva 11 perc késés miatt; Diagnosztika: k5m: utolsó zárt gyertya 11 perc késésben van,,,,,,,
7ea39db6-151e-4e0b-9952-87f70cad2205,BTCUSD,2026-06-09T18:31:19Z,precision_arming,core,62,,1.0,2.0,,,,,,,61677.81,2026-06-09T18:30:46Z,33,,,rule,"Bias(4H→1H)=short (+15.0); Regime filter inaktív; 5M BOS trendirányba (+16.0); ATR erősség 1.27× küszöb (+12.6); Range expanzió támogatja a momentumot (+3.0); Fib zóna konfluencia (0.618–0.886) (+18.0); Order flow neutrális (−4.4); Sell pressure támogatja a setupot (+5); P-Score reduced by 4.0 due to regime CHOPPY; Mesterlövész mód: P-score minimum 35 érvényesítve; Regime kapu: CHOPPY miatt −10 P-score, pozícióskálázás csökkentve; Strukturális kapu lazítva: momentum erős, BOS hiány engedve; BTC ATR1h stop igazítás: kockázat ×1.15; Precision trigger kész → limit figyelés; Precision limit belépő parkolva 20 percig",,,,,,,
