journal_id,asset,analysis_timestamp,signal,mode,probability,model_probability,realtime_confidence,leverage,entry_price,stop_loss,take_profit_1,take_profit_2,risk_reward,initial_risk_abs,spot_price,spot_timestamp,spot_latency_seconds,precision_score,anchor_bias,probability_source,notes,validation_outcome,validation_rr,max_favorable_excursion,max_adverse_excursion,time_to_outcome_minutes,slippage,execution_latency_ms
5da90d87-9146-4432-84f3-f4a0600f6a7c,GOLD_CFD,2026-04-07T01:36:49Z,no entry,core,12,,1.0,20.0,,,,,,,4657.76865,2026-04-07T01:36:21Z,28,,,rule,"Bias(4H→1H)=short (+15.0); Regime filter inaktív; ATR nincs rendben (relatív vagy abszolút küszöb); Fib zóna konfluencia (0.618–0.886) (+18.0); Order flow neutrális (−4.9); P-Score reduced by 4.0 due to regime CHOPPY; VWAP felett — GOLD short breakout várakozik; ATR-floor override: rel_atr 0.0015 < 0.0025 → adaptív RR/TP küszöb; Regime kapu: CHOPPY miatt −10 P-score, pozícióskálázás csökkentve; ATR soft gate: alacsony volatilitás −5 P-score, méret felezve; Liquidity gate skipped (no volume proxy available); missing: P_score>=30",,,,,,,
fa2c57c9-5995-4769-bd8f-435e1899fd59,XAGUSD,2026-04-07T01:36:49Z,no entry,core,21,,1.0,20.0,,,,,,,72.96743,2026-04-07T01:36:21Z,28,,,rule,"Intraday bias gate feltételek hiányosak — Micro BOS long  ATR (ezüst): 1m micro BOS long | Micro BOS short  ATR (ezüst): 1m micro BOS short; Bias neutrálsávban; Regime filter inaktív; ATR erősség 1.41× küszöb (+13.5); Range expanzió támogatja a momentumot (+3.0); XAG momentum override — stop tágítva erős trendnél; XAGUSD: momentum override — stop távolság 1.3×ATR-re tágítva; Fib zóna konfluencia (0.618–0.886) (+18.0); Order flow neutrális (−4.6); P-Score reduced by 4.0 due to regime CHOPPY; XAGUSD: momentum kitörés — RR cél 1:1.45-re szűkítve; XAGUSD breakout-védelem: gyors BE + 20% giveback limit expanziós szakaszban; XAG momentum override — pozícióméret csökkentve; XAGUSD: ATR-alapú pozícióskálázás ×0.55; Regime kapu: CHOPPY miatt −10 P-score, pozícióskálázás csökkentve; Strukturális soft gate: 1/3 jel + ATR/spread OK (−6 P-score, size ×0.70); Strukturális kapu lazítva: momentum erős, BOS hiány engedve; Liquidity gate skipped (no volume proxy available); missing: P_score>=28",,,,,,,
f7c39bd4-74f1-4fdb-8a54-89ea218d975a,EURUSD,2026-04-07T01:36:49Z,no entry,core,0,,1.0,30.0,,,,,,,1.15362,2026-04-07T01:36:21Z,28,,,rule,"Intraday bias gate feltételek hiányosak — Micro BOS long  ATR rendben: 1m micro BOS long, ATR gate | Micro BOS short  ATR rendben: 1m micro BOS short, ATR gate; Bias neutrálsávban; Regime filter inaktív; ATR nincs rendben (relatív vagy abszolút küszöb); Alacsony realised vol → magasabb RR igény; Fib zóna konfluencia (0.618–0.886) (+18.0); Order flow neutrális (−4.8); P-Score reduced by 4.0 due to regime CHOPPY; EURUSD: ATR(1h) alacsony — P-score küszöb +6 pontra emelve; EURUSD: Visszafogott ATR — célok szűkítve, kockázat kontroll alatt; ATR-floor override: rel_atr 0.0001 < 0.0006 → adaptív RR/TP küszöb; Regime kapu: CHOPPY miatt −10 P-score, pozícióskálázás csökkentve; ATR soft gate: alacsony volatilitás −5 P-score, méret felezve; Liquidity gate skipped (no volume proxy available); missing: P_score>=44",,,,,,,
0a2a4f93-fa2f-4b00-9119-daa01a3bb9df,BTCUSD,2026-04-07T01:36:49Z,precision_arming,core,60,,1.0,2.0,,,,,,,68780.89,2026-04-07T01:36:21Z,28,,,rule,"Bias override: Intraday 5m BOS long  ATR (+19.5); Regime filter inaktív; 5M BOS trendirányba (+16.0); ATR erősség 1.26× küszöb (+12.5); Range expanzió támogatja a momentumot (+3.0); Fib zóna konfluencia (0.618–0.886) (+18.0); Order flow neutrális (−5.0); Buy pressure támogatja a setupot (+5); P-Score reduced by 4.0 due to regime CHOPPY; Mesterlövész mód: P-score minimum 35 érvényesítve; OFI z-score 1.30 támogatja az irányt; Regime kapu: CHOPPY miatt −10 P-score, pozícióskálázás csökkentve; Strukturális soft gate: 1/3 jel + ATR/spread OK (−6 P-score, size ×0.70); BTC ATR1h stop igazítás: kockázat ×1.15; Precision trigger kész → limit figyelés; Precision limit belépő parkolva 20 percig",,,,,,,
1e1348c1-bee4-4924-a7cb-997f21db2a36,USOIL,2026-04-07T01:36:49Z,no entry,core_only,56,,1.0,20.0,113.69461,111.91671121899999,117.250407562,119.02830634300001,3.0,,113.69461,2026-04-07T01:36:21Z,28,,,rule,"Bias(4H→1H)=long (+15.0); Regime filter inaktív; 5M BOS trendirányba (+16.0); ATR erősség 1.12× küszöb (+11.7); Range expanzió támogatja a momentumot (+3.0); USOIL: erős momentum — invalid zóna 2.5×ATR(1h)-re tágítva; Fib zóna konfluencia (0.618–0.886) (+18.0); Order flow neutrális (−4.6); P-Score reduced by 4.0 due to regime CHOPPY; USOIL: 1h ATR ≥1.5 USD — RR cél 1:2-re emelve; USOIL: ázsiai sáv — pozícióméret ×0.70; OFI z-score 1.22 támogatja az irányt; Regime kapu: CHOPPY miatt −10 P-score, pozícióskálázás csökkentve; USOIL stop lazítás: ATR1h alapú kockázat ×0.97; Diagnosztika: k1m: utolsó zárt gyertya 10 perc késésben van; Diagnosztika: k1m: jelzés korlátozva 10 perc késés miatt; Diagnosztika: k5m: utolsó zárt gyertya 11 perc késésben van",,,,,,,
