journal_id,asset,analysis_timestamp,signal,mode,probability,model_probability,realtime_confidence,leverage,entry_price,stop_loss,take_profit_1,take_profit_2,risk_reward,initial_risk_abs,spot_price,spot_timestamp,spot_latency_seconds,precision_score,anchor_bias,probability_source,notes,validation_outcome,validation_rr,max_favorable_excursion,max_adverse_excursion,time_to_outcome_minutes,slippage,execution_latency_ms
6153c530-45e6-4033-8ee0-9b1b3be6ba68,XAGUSD,2026-01-30T19:41:18Z,no entry,core,52,,1.0,20.0,,,,,,,84.62353,2026-01-30T19:40:45Z,32,,,rule,Intraday bias gate feltételek hiányosak — Micro BOS long  ATR (ezüst): 1m micro BOS long | Micro BOS short  ATR (ezüst): 1m micro BOS short; Bias neutrálsávban; EMA21 slope 7.07× küszöb (+21.0); ATR erősség 2.64× küszöb (+20.9); Order flow neutrális (−4.5); Mesterlövész mód: P-score minimum 35 érvényesítve; XAGUSD: ATR-alapú pozícióskálázás ×0.55; Liquidity gate skipped (no volume proxy available),,,,,,,
06b1bbe7-211c-447e-b3e2-3b552733bd5b,GOLD_CFD,2026-01-30T19:41:18Z,no entry,core,38,,1.0,20.0,,,,,,,4909.35235,2026-01-30T19:40:45Z,32,,,rule,Intraday bias gate feltételek hiányosak — 5m retest long  ATR: 5m retest long | 5m retest short  ATR: 5m retest short; Bias neutrálsávban; EMA21 slope 2.01× küszöb (+18.1); ATR erősség 0.97× küszöb (+10.8); Order flow neutrális (−4.9); P-Score reduced by 1.0 due to ATR Soft Gate tolerance; Mesterlövész mód: P-score minimum 35 érvényesítve; Liquidity gate skipped (no volume proxy available),,,,,,,
c5527d8b-37fb-4477-bae0-e7f86f57f39d,EURUSD,2026-01-30T19:41:18Z,no entry,core,21,,1.0,30.0,,,,,,,1.18761,2026-01-30T19:40:45Z,32,,,rule,"Intraday bias gate feltételek hiányosak — Micro BOS long  ATR rendben: 1m micro BOS long | Micro BOS short  ATR rendben: 1m micro BOS short; Bias neutrálsávban; Regime filter inaktív; ATR erősség 1.91× küszöb (+16.4); Alacsony realised vol → magasabb RR igény; Fib zóna konfluencia (0.618–0.886) (+18.0); Order flow neutrális (−4.6); P-Score reduced by 4.0 due to regime CHOPPY; EURUSD: Magas volatilitás → RR célok 1:2 környékére szélesítve; EURUSD: ATR-alapú pozícióskálázás ×0.53 — volatilitás kontroll; ATR-floor override: rel_atr 0.0005 < 0.0006 → adaptív RR/TP küszöb; Regime kapu: CHOPPY miatt −10 P-score, pozícióskálázás csökkentve; Strukturális soft gate: 1/3 jel + ATR/spread OK (−6 P-score, size ×0.70); Strukturális kapu lazítva: momentum erős, BOS hiány engedve; Liquidity gate skipped (no volume proxy available); missing: P_score>=38",,,,,,,
c8d4d07f-384d-4d97-a97a-4e86dad9df07,NVDA,2026-01-30T19:41:18Z,no entry,core,31,,1.0,5.0,,,,,,,191.27,2026-01-30T19:40:45Z,32,,,rule,"Bias(4H→1H)=long (+15.0); Regime filter inaktív; 5M BOS trendirányba (+16.0); ATR nincs rendben (relatív vagy abszolút küszöb); WARNING: No Liquidity Structure (Nearest: 187.671958, Dist: 8.66ATR); Ár az intraday range alsó zónájában (+4.0); Range expanzió támogatja a momentumot (+3.0); Fib zóna konfluencia (0.618–0.886) (+18.0); Order flow neutrális (−4.9); OFI toxikus long irányra (−3.9); P-Score reduced by 4.0 due to regime CHOPPY; NVDA: magas napi ATR + momentum — P-score küszöb lazítva; Mesterlövész mód: P-score minimum 35 érvényesítve; NVDA: zárási VWAP felett stabilizáció — long likviditás; Regime kapu: CHOPPY miatt −10 P-score, pozícióskálázás csökkentve; ATR soft gate: alacsony volatilitás −5 P-score, méret felezve; missing: P_score>=35, precision_flow_alignment",,,,,,,
3369f24d-47b8-4d3a-8baf-1b7d528ad302,USOIL,2026-01-30T19:41:18Z,no entry,core_only,29,,1.0,20.0,,,,,,,65.21477,2026-01-30T19:40:45Z,33,,,rule,"Mean reversion bias override (+19.5); Regime filter inaktív; ATR erősség 0.95× küszöb (+10.7); Fib zóna konfluencia (0.618–0.886) (+18.0); Order flow neutrális (−4.6); OFI toxikus short irányra (−3.8); P-Score reduced by 4.0 due to regime CHOPPY; P-Score reduced by 2.1 due to ATR Soft Gate tolerance; USOIL: 1h ATR <1 USD — P-score küszöb emelve a zajos sáv miatt; USOIL: csökkenő volatilitás — RR cél 1:1.5-re igazítva; USOIL: US nyitás — pozícióméret ×0.75; Regime kapu: CHOPPY miatt −10 P-score, pozícióskálázás csökkentve; Strukturális soft gate: 1/3 jel + ATR/spread OK (−6 P-score, size ×0.70); Strukturális kapu lazítva: momentum erős, BOS hiány engedve; Diagnosztika: k1m: utolsó zárt gyertya 7 perc késésben van; Diagnosztika: k1m: jelzés korlátozva 7 perc késés miatt; Diagnosztika: k5m: utolsó zárt gyertya 11 perc késésben van; missing: P_score>=42",,,,,,,
477e0910-f418-47e7-a27a-278526beffe7,BTCUSD,2026-01-30T19:41:18Z,precision_arming,core,35,,1.0,2.0,,,,,,,84243.13,2026-01-30T19:40:45Z,33,,,rule,"Bias(4H→1H)=short (+15.0); Regime filter inaktív; ATR erősség 1.64× küszöb (+14.8); Ár az intraday range felső zónájában (+4.0); Ár 1h EMA21 zónában (+10.0); Order flow neutrális (−4.5); Sell pressure támogatja a setupot (+5); P-Score reduced by 4.0 due to regime CHOPPY; Mesterlövész mód: P-score minimum 35 érvényesítve; OFI z-score -1.30 támogatja az irányt; Regime kapu: CHOPPY miatt −10 P-score, pozícióskálázás csökkentve; Strukturális soft gate: 1/3 jel + ATR/spread OK (−6 P-score, size ×0.70); BTC ATR1h stop igazítás: kockázat ×1.15; Precision trigger kész → limit figyelés; Precision limit belépő parkolva 20 percig",,,,,,,
